id,link_id,parent_id,subreddit,author,created_utc,score,body,hurricane,keyword_hit
lrb1jyy,t3_1fz7y6v,t1_lrakkzy,Georgia,reggers20,2024-10-10T20:19:07+00:00,2,Just found out you can totally eat them! They have a hunting season lol,helene,hurricane
lrb9jxp,t3_1fz7y6v,t3_1fz7y6v,Georgia,Careless-Sundae3353,2024-10-10T21:01:15+00:00,-2,They let the folks in NC down.,helene,hurricane
lrbgwcl,t3_1fz7y6v,t1_lrb1jyy,Georgia,strumpster,2024-10-10T21:43:02+00:00,2,I'll get the truck,helene,hurricane
lrbmhvl,t3_1fz7y6v,t1_lr8h5wk,Georgia,[deleted],2024-10-10T22:16:34+00:00,1,[removed],helene,hurricane
lrbv767,t3_1fz7y6v,t1_lr910sr,Georgia,geologyhunter,2024-10-10T23:11:09+00:00,2,"They need to call the number or visit with FEMA at one of their tents/trailers in the area. They should have a number associated with their denial decision. Here is a number for questions related to applications: 1-800-745-0243

Give that a try and hopefully they can get things straightened out.",helene,hurricane
lrc9ige,t3_1fz7y6v,t3_1fz7y6v,Georgia,kavika411,2024-10-11T00:40:56+00:00,-2,Harris 100% gonna clean up what the current admin can’t do!!!,helene,hurricane
lrcalx7,t3_1fz7y6v,t1_lr8h5wk,Georgia,ceilingfansuperpower,2024-10-11T00:47:40+00:00,-3,$750 per household lol yay!,helene,hurricane
lrcdx6y,t3_1fz7y6v,t1_lrc9ige,Georgia,Cautious-Debt6902,2024-10-11T01:08:04+00:00,0,She IS the current administration lol,helene,hurricane
lrcenum,t3_1fz7y6v,t1_lr5d0ix,Georgia,jjones3918,2024-10-11T01:12:44+00:00,-1,Ignorant,helene,hurricane
lrcex6t,t3_1fz7y6v,t1_lr6qphl,Georgia,jjones3918,2024-10-11T01:14:23+00:00,0,Exactly. And it’s the liberal policies to outsource to these polluters that exacerbate the problem and put the U.S. further behind as well as the world. The best thing for the climate would be to support US energy production and manufacturing. Cleanest there is,helene,hurricane
lrclww2,t3_1fz7y6v,t1_lrb9jxp,Georgia,Jetboots_Rule,2024-10-11T01:58:53+00:00,5,"Hi, NC here; no. 

The damage was just that bad.",helene,hurricane
lrcm3qt,t3_1fz7y6v,t3_1fz7y6v,Georgia,JoeBookerTestes,2024-10-11T02:00:03+00:00,-6,"48,000,000 sounds big until you divide that by the 59,000 survivors.

That’s only $813.00+/- per survivor. They are on record for giving more to immigrants in New York. Absolute bullshit",helene,hurricane
lrcr40q,t3_1fz7y6v,t1_lrcm3qt,Georgia,PalpatineForEmperor,2024-10-11T02:32:27+00:00,-7,Considering that the Democrats created this hurricane to send to Florida. They have no shame.,helene,hurricane
lrcwzov,t3_1fz7y6v,t1_lrcr40q,Georgia,Due-Gold-6093,2024-10-11T03:12:20+00:00,5,What a stupid fucking comment. No one made this hurricane,helene,hurricane
lrcz3xd,t3_1fz7y6v,t1_lr8h5wk,Georgia,Expert_Novel_3761,2024-10-11T03:27:32+00:00,5,"Congress controls the money. The current Speaker of the House belongs to what party, now? The failure to get Congress back to Washington & vote on approval for more aid falls in Mike Johnson's lap. This is a corny attempt at an October surprise against (D)'s & a way to play politics with storm victims' lives! But the people of the 4th District of Louisiana will send him back to DC when he's up for reelection. A LARGE majority of today's (R) party doesn't care about the everyday American. They just want wins to get power they use to enrich themselves. Then, tell lies about the opposition. Check the person's platform & record.You guys will escape the con one day. As a registered (I), we & Democrats aren't your enemies. We're your fellow countrymen!",helene,hurricane
lrczn3t,t3_1fz7y6v,t1_lr6kep5,Georgia,Expert_Novel_3761,2024-10-11T03:31:29+00:00,2,I guess Mr. Recession-year-four-Trump is the cure for what ails us.🤣🤣🤣,helene,hurricane
lrd1jms,t3_1fz7y6v,t1_lrcm3qt,Georgia,DVGower,2024-10-11T03:46:18+00:00,7,"Tell that to the Republicans, who keep voting NO to increase funding for FEMA…and then go on break until AFTER the election. Tell them with your VOTE.",helene,hurricane
lrd4jj1,t3_1fz7y6v,t1_lrcwzov,Georgia,PalpatineForEmperor,2024-10-11T04:10:36+00:00,0,"I've been hearing Republican say this all week. There's no way they would lie. Can you image if Trump or his crew actually lied like Democrats? That's just ridiculous to even suggest. They warned us about the Jewish space lasers, but only the smart Republicans believed it. Look where we are now. 

It's a good thing that Trump actually won the election and he's pulling the strings of the real government behind the scenes. Otherwise this hurricane would have hit Texas as well. It's absolutely shameful that Harris unleashed this on the poor folks from Florida to help her chances of getting elected. 

She sent this hurricane to cause all this destruction and immediatelly unleashed the full force of the federal government to ""help"".  They're making everyone think that her and Biden are strong and competent leaders, but we know better. Their plan is to make Trump look like an old weird idiot while they interfere with the elections by calling Trump a coward for not debating her again. she should be put in prison for doing that 60 minutes interview.  

Well her plan isn't going to work. Even if she wins she will continue to pretend to do a good job leading the country and acting like she's making the world a better place, but we know she secretly hates America. 

She hates America so much that I can bet you she will trick everyone into thinking she's such a great president just to steal four more years from Trump after that. Those second four years are where she will show her true colors and raise our gas prices and allow abortions years after babies are born. 

Democrats want abortions up to the fourth grade; it's disgusting. They want raise the minimum wage and give everyone free healthcare. She's the biggest communist, socialist, fascist, Marxist and doesn't even care that rich people will have to pay like a lot of taxes. 

But yeah, I'm the one that's fucking stupid. You probably didn't even drink bleach when you got Covid. Fucking Idiot.",helene,hurricane
lrd8jvv,t3_1fz7y6v,t1_lrd4jj1,Georgia,Glittering-Bat353,2024-10-11T04:45:24+00:00,3,Dude...imagine what your life could be like if you had a personality of your own again.,helene,hurricane
lrdbmdi,t3_1fz7y6v,t1_lrcm3qt,Georgia,Kingcrackerjap,2024-10-11T05:13:41+00:00,6,This was a limit imposed by Republicans. Democrats wanted it to be higher.,helene,hurricane
lrdfsnr,t3_1fz7y6v,t1_lrcm3qt,Georgia,koryglenn,2024-10-11T05:54:35+00:00,9,This assistance is for immediate needs. This is not the result of a final claim. Stop listening to people who are actively trying to hurt our country.,helene,hurricane
lrdfzp0,t3_1fz7y6v,t1_lra65d5,Georgia,lewissassell,2024-10-11T05:56:38+00:00,0,That’d be hilarious,helene,hurricane
lre4fx6,t3_1fz7y6v,t1_lr1kmni,Georgia,spo0kyaction,2024-10-11T10:35:24+00:00,0,"No, it’s functionally true when you’re trying to secure funding for most things on a federal level as well. Many issues are treated as zero sum within the context of the federal budget in practice. 

Politicians are constantly asking “Where are we going to get the money for this? Are we spending too much?” and use it as a reason to deny resources all the time. This line of thinking was used to deny additional funding for FEMA right before Helene hit. 

The conversation of Gaza is related because the funds approved and provided by the same entity. It’s a question of how federal spending is allocated. It’s about our priorities and moral character as a society. 

Our government spends money enabling harm when it should be only be helping. Claiming that this is “distracting from hurricane relief” is in bad faith and flat out wrong. I’m literally asking for MORE resources for hurricane relief. 

“God forbid we talk about something else” 

please LMAO no one is forcing you to engage with every random comment you see mentioning Gaza online. I don’t care what personal issues you seem to have with the pro-Palestine movement either.",helene,hurricane
lrebla2,t3_1fz7y6v,t1_lrc9ige,Georgia,Danimin420,2024-10-11T11:41:20+00:00,0,"Uhhhhhh, she’s already Acting VP for the past 3.5 years…",helene,hurricane
lrebpko,t3_1fz7y6v,t1_lrebla2,Georgia,kavika411,2024-10-11T11:42:20+00:00,0,😉,helene,hurricane
lrehs5t,t3_1fz7y6v,t1_lrbgwcl,Georgia,reggers20,2024-10-11T12:29:14+00:00,1,Imagine pulling the Thanksgiving goose out of the oven haha,helene,hurricane
lrel96s,t3_1fz7y6v,t1_lr7klih,Georgia,wotantx,2024-10-11T12:53:33+00:00,2,That's the initial amount. It's the same that we got for Beryl.,helene,hurricane
lrepzk9,t3_1fz7y6v,t1_lrb9jxp,Georgia,friscoforrest,2024-10-11T13:24:27+00:00,0,No they didn’t. Stop licking walls,helene,hurricane
lreq0qc,t3_1fz7y6v,t1_lrcwzov,Georgia,daemon_panda,2024-10-11T13:24:40+00:00,2,Read the user name,helene,hurricane
lreq2aq,t3_1fz7y6v,t1_lrd4jj1,Georgia,PleestaMeecha,2024-10-11T13:24:57+00:00,3,Pretty good shitpost. I think a lot of people are missing that this is sarcastic.,helene,hurricane
lreqb4b,t3_1fz7y6v,t1_lrcalx7,Georgia,friscoforrest,2024-10-11T13:26:30+00:00,2,They will get more. Simple economic reasoning- if you give tons of ppl lotsa money all at once then they spend it all at once thus inflation occurs. Trump did the same thing with the free covid money. It’s simple and more money will come,helene,hurricane
lreqi10,t3_1fz7y6v,t1_lr7klih,Georgia,friscoforrest,2024-10-11T13:27:44+00:00,1,If you understood simple economics then you’d know that lotsa free money all at once causes inflation and demand > supply. More money is coming. This if standard practice for every disaster,helene,hurricane
lresorg,t3_1fz7y6v,t1_lreq2aq,Georgia,PalpatineForEmperor,2024-10-11T13:41:33+00:00,0,"To be fair, it hard to tell with all the crazy shit MAGAs post.",helene,hurricane
lretmto,t3_1fz7y6v,t1_lrcdx6y,Georgia,SubstantialRain21,2024-10-11T13:47:17+00:00,2,"Do tell us what power the VP has that the president can't overrule, that directly affects policy?",helene,hurricane
lrf6yns,t3_1fz7y6v,t3_1fz7y6v,Georgia,OddRefrigerator6532,2024-10-11T15:03:57+00:00,-2,"I want someone to explain to me how the victims are supposed to use their $750 if the stores are closed, flooded, or empty. Roads are washed away. Thank you!",helene,hurricane
lrfgtlr,t3_1fz7y6v,t3_1fz7y6v,Georgia,thisismyusername1178,2024-10-11T15:57:44+00:00,2,"Lots of russian bots in these comments…lots, save yourselves some time by clicking the username and checking post and comment karma. Then block and report as spam/misinformation.",helene,hurricane
lrfw9r7,t3_1fz7y6v,t1_lrf6yns,Georgia,shiftyyo101,2024-10-11T17:21:22+00:00,4,Hey Fridge - the stores will eventually open and then they can spend the money. Happy to help. Anytime.,helene,hurricane
lrfxuhd,t3_1fz7y6v,t1_lrfw9r7,Georgia,OddRefrigerator6532,2024-10-11T17:29:49+00:00,1,"I figured as much. I just hope that they’re getting stuff like formula & diapers for babies, etc.",helene,hurricane
lrg5qaq,t3_1fz7y6v,t1_lrepzk9,Georgia,YamEnvironmental3723,2024-10-11T18:12:23+00:00,0,You spelled balls wrong. 🤣🤣,helene,hurricane
lrga8gm,t3_1fz7y6v,t1_lreq2aq,Georgia,ReallyFancyPants,2024-10-11T18:37:11+00:00,0,It took that second long ass screed for me to get but quality shitposting is quality shitposting,helene,hurricane
lrhwkqa,t3_1fz7y6v,t3_1fz7y6v,Georgia,Public_Ad_9257,2024-10-12T00:31:48+00:00,-6,BILLIONS AND BILLIONS TO NON CITIZENS & OTHER COUNTRIES WAKE UP PEOPLE. YOU PEOPLE ARE HAPPY WITH THEIR CRUMBS AND ITS PATHETIC,helene,hurricane
lrhyx27,t3_1fz7y6v,t1_lr5a1au,Georgia,queefaqueefer,2024-10-12T00:47:52+00:00,1,"starlink is “free,” except the part where you still need to pay for the starter kit, which costs $398.68. elon didn’t do jack shit except make himself look good.

additionally, those satellites are causing problems in the ozone. satellite internet comes at a cost of more destructive solar radiation. i think not getting skin cancer and killing crops is a bit more important than connectivity. so, what were you saying about “poor vision?”",helene,hurricane
lri61gg,t3_1fz7y6v,t1_lrfxuhd,Georgia,Walkeronthewindows,2024-10-12T01:38:28+00:00,1,"Hell, find a movie house and see something.  Their lives will be hell for months so if they can get a meal and see a movie and forget how crappy things are for two hours then money well spent.",helene,hurricane
lri6fqv,t3_1fz7y6v,t1_lrf6yns,Georgia,Busdriver92,2024-10-12T01:41:17+00:00,-2,And No cars,helene,hurricane
lrj4pv4,t3_1fz7y6v,t1_lrbv767,Georgia,confusedguy1221,2024-10-12T06:36:50+00:00,1,And DON'T SAY THE WORD 'FLOOD'.,helene,hurricane
lrj9rng,t3_1fz7y6v,t3_1fz7y6v,Georgia,downwiththeherp453w,2024-10-12T07:35:09+00:00,5,"Florida insurance carriers used altered hurricane damage reports, whistleblowers say

https://youtu.be/j5re7zBzrJk?si=N4S1vHVIN9J_4CDs",helene,hurricane
lrjeduq,t3_1fz7y6v,t1_lrj4pv4,Georgia,geologyhunter,2024-10-12T08:30:00+00:00,1,"This is true. Always want wind and rain damage first as it will cover most damages. If they put flood caused initial damage, pretty much everything will get denied unless there is specific flood insurance.",helene,hurricane
lrji54q,t3_1fz7y6v,t1_lr4ejgs,Georgia,Any_Mechanic_2619,2024-10-12T09:15:19+00:00,1,https://www.tiktok.com/t/ZP88FYM6R/,helene,hurricane
lrjksvr,t3_1fz7y6v,t1_lrhwkqa,Georgia,elinormarianne,2024-10-12T09:47:20+00:00,6,Trump spent billions in foreign aid as well. This has been common since Truman in 1948.,helene,hurricane
lrjrtk6,t3_1fz7y6v,t1_lrjksvr,Georgia,Public_Ad_9257,2024-10-12T11:05:34+00:00,-5,Not in a time and NOT on the SAME DAY that the American citizens needed disaster relief. The fact that you think that was a logical response is comical.,helene,hurricane
lrjrw06,t3_1fz7y6v,t1_lrjksvr,Georgia,[deleted],2024-10-12T11:06:14+00:00,1,[deleted],helene,hurricane
lrjrxbo,t3_1fz7y6v,t3_1fz7y6v,Georgia,Public_Ad_9257,2024-10-12T11:06:36+00:00,-1,BILLIONS AND BILLIONS TO NON CITIZENS & OTHER COUNTRIES WAKE UP PEOPLE. YOU PEOPLE ARE HAPPY WITH THEIR CRUMBS AND ITS PATHETIC,helene,hurricane
lrjy825,t3_1fz7y6v,t1_lrjrtk6,Georgia,Main-Street-6075,2024-10-12T12:03:43+00:00,3,Oh you're right. There were no storms or other emergencies during trumps presidency lol,helene,hurricane
lrk1091,t3_1fz7y6v,t1_lrjrtk6,Georgia,elinormarianne,2024-10-12T12:25:53+00:00,2,"It’s not comical; it’s true. And yes, during disaster relief as well. ",helene,hurricane
lrk5521,t3_1fz7y6v,t1_lrjrtk6,Georgia,dialguy86,2024-10-12T12:56:50+00:00,5,"This is so easily fact checked 
https://www.kgw.com/article/news/verify/donald-trump/trump-administration-diverted-fema-disaster-funds-immigration-ice-fact-check/536-814bb634-4d14-4463-a77f-b2f304320d33",helene,hurricane
lrk6cuq,t3_1fz7y6v,t3_1fz7y6v,Georgia,Fullthrottle-,2024-10-12T13:05:29+00:00,-2,"It has now become imperative for them to fulfill obligations.
Where were they when Hawaii burned to the ground?
🤪 silly me, Oprah’s estates were just fine.",helene,hurricane
lrk9grm,t3_1fz7y6v,t1_lr1kmni,Georgia,Prize-Boot1703,2024-10-12T13:27:00+00:00,1,This is reddit hun. It's a leftist shit hole. Any voice of reason right of Stalin is immediately hated here.,helene,hurricane
lrkhcp0,t3_1fz7y6v,t1_lrfgtlr,Georgia,[deleted],2024-10-12T14:18:07+00:00,1,[removed],helene,hurricane
lrkmilm,t3_1fz7y6v,t1_lrji54q,Georgia,Roriborialus,2024-10-12T14:48:55+00:00,1,Using social media as your source of news is why you believe what you do,helene,hurricane
lrks71c,t3_1fz7y6v,t3_1fz7y6v,Georgia,Horror-Layer-8178,2024-10-12T15:21:45+00:00,1,"Just a reminder Ronald Reagan is a piece of shit. He said this ""the scariest words a person can say is I am from the government and I am here to help"":",helene,hurricane
lrlopfm,t3_1fz7y6v,t1_lrf6yns,Georgia,guru42101,2024-10-12T18:22:48+00:00,3,"There are various groups responsible for handling other needs. FEMA specifically handles money. They will reimburse the National Guard for purchasing and delivering supplies. They will provide the ACoE and states funds to help get roads traversable. They will reimburse churches and other orgs for doing the same things. They will reimburse you for some of the costs of rebuilding or provide you with loans more quickly and at a lower interest rate than the bank. They will provide money to help businesses to get back on their feet. But in the end, FEMA only deals with money.",helene,hurricane
lrmkupa,t3_1fz7y6v,t1_lrlopfm,Georgia,OddRefrigerator6532,2024-10-12T21:27:37+00:00,1,Thanks! Your answer was really comprehensive & helpful!,helene,hurricane
lrmrnal,t3_1fz7y6v,t1_lretmto,Georgia,OhTHATKayKay,2024-10-12T22:09:55+00:00,1,Crickets.,helene,hurricane
lrn8ogb,t3_1fz7y6v,t1_lrb9jxp,Georgia,MyCrowdSizeIsBigger,2024-10-12T23:59:41+00:00,1,Pathetic Republican liar,helene,hurricane
lrnnpqa,t3_1fz7y6v,t1_lrn8ogb,Georgia,Careless-Sundae3353,2024-10-13T01:40:03+00:00,1,Please. Thats all you people have is insults.,helene,hurricane
lrnnt1x,t3_1fz7y6v,t1_lrnnpqa,Georgia,[deleted],2024-10-13T01:40:41+00:00,1,[removed],helene,hurricane
lroeev9,t3_1fz7y6v,t1_lrjrxbo,Georgia,samfrench_,2024-10-13T05:01:36+00:00,3,Ok buddy,helene,hurricane
lromk74,t3_1fz7y6v,t3_1fz7y6v,Georgia,Betterthanyou715,2024-10-13T06:22:18+00:00,-2,"Cool, how come you aren’t helping East Tn?",helene,hurricane
lrpwhzf,t3_1fz7y6v,t1_lrk6cuq,Georgia,Beginning_Fault8948,2024-10-13T13:54:50+00:00,3,FEMA is spending billions of dollars on Maui recovery.  https://www.fema.gov/fact-sheet/one-year-later-maui-wildfire-recovery-continues-nearly-3-billion-federal-support,helene,hurricane
lrq5o8r,t3_1fz7y6v,t1_lrd4jj1,Georgia,Massive-Chef-7092,2024-10-13T14:50:01+00:00,1,"Man, if you only knew how many people have been in my inbox saying this and being serious.

https://preview.redd.it/l75tgqc6ejud1.jpeg?width=1080&format=pjpg&auto=webp&s=e16e5c042835756030fd326d9a397ede9cf41b49",helene,hurricane
lrr6d19,t3_1fz7y6v,t1_lrq5o8r,Georgia,PalpatineForEmperor,2024-10-13T18:09:26+00:00,1,Wow! This is just crazy. It scares me that the polls are so close because of people like that.,helene,hurricane
lrsh1s2,t3_1fz7y6v,t1_lretmto,Georgia,Cautious-Debt6902,2024-10-13T22:26:46+00:00,0,"According to ole Joe, she’s been involved in EVERY decision so yea that’d include the slow NC response and per Mayorkas, fema outta money.  Of course we all know joes senile and thus Kamala (with Obama) been running the show.",helene,hurricane
lrsljh4,t3_1fz7y6v,t1_lrsh1s2,Georgia,SubstantialRain21,2024-10-13T22:54:23+00:00,1,"He's so senile he can't function, so Kamala has to run the show, but also he's a credible source also. Bad bot.",helene,hurricane
lttbar9,t3_1fz7y6v,t1_lrjrxbo,Georgia,Careless_Document_79,2024-10-26T06:47:47+00:00,1,"Trump diverted FEMA funds to ICE
(Source)[https://www.kgw.com/article/news/verify/donald-trump/trump-administration-diverted-fema-disaster-funds-immigration-ice-fact-check/536-814bb634-4d14-4463-a77f-b2f304320d33]",helene,hurricane
lu4810f,t3_1fz7y6v,t3_1fz7y6v,Georgia,Lazy-Payment-171,2024-10-28T02:37:31+00:00,1,So from Ga first I heard about any type of assistance was a week ago via text a month an half after Helene,helene,hurricane
lzch2x0,t3_1fz7y6v,t1_lr6kep5,Georgia,OpeningZebra1670,2024-11-28T02:33:03+00:00,1,"I’ve never seen so many people out of touch with a comment; however, thank you all for expressing your opinion! Even so, you all were wrong and in the end, Kamala wasn’t needed after all, I was right! 🤣",helene,hurricane
lr38ecu,t3_1fzrgqt,t3_1fzrgqt,HurricaneHelene,mayormeekers,2024-10-09T13:39:42+00:00,22,"Thank you for sharing, we need the FACTS more than ever with Milton approaching.",helene,hurricane
lr38u6z,t3_1fzrgqt,t3_1fzrgqt,HurricaneHelene,MightyCaseyStruckOut,2024-10-09T13:42:26+00:00,13,"I would say that I can't believe people believe #3, but then I thought of my wife's MAGA relatives and realized that, yes, they absolutely would (and do, if they've heard the falsehood).",helene,hurricane
lr39jsc,t3_1fzrgqt,t3_1fzrgqt,HurricaneHelene,mrbang69,2024-10-09T13:46:51+00:00,4,If you've been there you might have a different opinion eyewitnessed other things,helene,hurricane
lr39juj,t3_1fzrgqt,t3_1fzrgqt,HurricaneHelene,Away_Possibility_465,2024-10-09T13:46:52+00:00,-7,"#2 is false! It’s 💯 fact FEMA has been moving funds to provide for immigrants! 

And bottom line! FEMA is nowhere to be found there!  This coming from residents as well as reporters on the ground who say they see private groups and citizens help but FEMA is nowhere to be found! 

So say your lies/misinformation somewhere else!!!!

Bet they won’t allow this post to stand!!!!",helene,hurricane
lr3a6sc,t3_1fzrgqt,t1_lr39juj,HurricaneHelene,Senior_Ganache_6298,2024-10-09T13:50:46+00:00,1,Seems like it's still here but your content is nothing but pus dripping from compromised minds.,helene,hurricane
lr3a878,t3_1fzrgqt,t1_lr39juj,HurricaneHelene,MightyCaseyStruckOut,2024-10-09T13:51:00+00:00,2,What is your proof of this? And FEMA is nowhere to be found where?,helene,hurricane
lr3accp,t3_1fzrgqt,t3_1fzrgqt,HurricaneHelene,Referralsforcrack,2024-10-09T13:51:42+00:00,2,I’m upset. FEMA wants my Id for the $750 but I lost everything. I could get my ID if it was for the $750,helene,hurricane
lr3ahjs,t3_1fzrgqt,t1_lr3a878,HurricaneHelene,Zealousideal-Sink273,2024-10-09T13:52:35+00:00,1,Their source is that they made it up.,helene,hurricane
lr3apry,t3_1fzrgqt,t3_1fzrgqt,HurricaneHelene,Away_Possibility_465,2024-10-09T13:53:58+00:00,4,Literally just watched a news cast with reporter and multiple citizens saying no fema in sight but they have seen private organizations,helene,hurricane
lr3avfn,t3_1fzrgqt,t3_1fzrgqt,HurricaneHelene,Fellow-Worker,2024-10-09T13:54:55+00:00,7,"Wow, the white house has arrived. That’s actually pretty dope. Kudos.",helene,hurricane
lr3b1no,t3_1fzrgqt,t1_lr3ahjs,HurricaneHelene,MightyCaseyStruckOut,2024-10-09T13:55:56+00:00,1,"Yep, or that they read some article on a bullshit site like The Epoch Times or something.

I'm pretty sure they aren't going to respond to me at all, though.",helene,hurricane
lr3b92l,t3_1fzrgqt,t3_1fzrgqt,HurricaneHelene,RicochetRandall,2024-10-09T13:57:08+00:00,3,"Ok now let’s talk about all the locals in smaller towns on Youtube & social media saying they’ve seen no federal response in 7 days. It took army Chinooks 2-3 days to land in Asheville after the storm too when they were already all over the region. Local private pilots were doing DIY search and rescue missions. The chinooks are being used for selective airdrops but mostly body recovery,",helene,hurricane
lr3bffb,t3_1fzrgqt,t1_lr39juj,HurricaneHelene,_dark_beaver,2024-10-09T13:58:10+00:00,1,Bold face shitpost lie!,helene,hurricane
lr3bfee,t3_1fzrgqt,t3_1fzrgqt,HurricaneHelene,Away_Possibility_465,2024-10-09T13:58:10+00:00,2,"Also, look at the fema website.  They are distributing money to migrants.  They say the money comes from this or that but they just move it from here or there but it’s federal tax money they are giving to people who are not citizens and have not given a dime to the system.  While people who have paid in their whole lives are left to deal on their own and grow to despise their own government.",helene,hurricane
lr3bht1,t3_1fzrgqt,t1_lr39juj,HurricaneHelene,Oobroobdoob,2024-10-09T13:58:35+00:00,1,"I think a lot of this thinking is coming from a genuine misunderstanding of how government agency budgets work. FEMA has separate funds earmarked for shelters and services, which have been partially allocated to vulnerable migrants. That pot of money has nothing to do with the money set aside for disaster relief. The government is very strict budget lines that are approved before the government fiscal year via the Congressional Budget Justification. Check it out here: [https://www.dhs.gov/sites/default/files/2024-04/2024\_0320\_federal\_emergency\_management\_agency.pdf](https://www.dhs.gov/sites/default/files/2024-04/2024_0320_federal_emergency_management_agency.pdf)",helene,hurricane
lr3bi7y,t3_1fzrgqt,t1_lr3apry,HurricaneHelene,faerybones,2024-10-09T13:58:39+00:00,5,Link?,helene,hurricane
lr3bkff,t3_1fzrgqt,t3_1fzrgqt,HurricaneHelene,Silent-Strain6964,2024-10-09T13:59:01+00:00,-4,"Another marketing mistruth in the hurricane areas. Seems like a way to grab that $750.00 FEMA money. 
 https://www.theregister.com/2024/10/08/free_starlink_hurricane_helene/",helene,hurricane
lr3btz9,t3_1fzrgqt,t1_lr3bi7y,HurricaneHelene,PizzaSammy,2024-10-09T14:00:37+00:00,8,Trust me bro,helene,hurricane
lr3c2hp,t3_1fzrgqt,t3_1fzrgqt,HurricaneHelene,Away_Possibility_465,2024-10-09T14:02:02+00:00,-7,Just like the debates!  Dems and our current government lies and do not care about American citizens.,helene,hurricane
lr3c3p6,t3_1fzrgqt,t3_1fzrgqt,HurricaneHelene,2016TRDPro,2024-10-09T14:02:14+00:00,-2,https://preview.redd.it/r2i06a70mqtd1.jpeg?width=1321&format=pjpg&auto=webp&s=41f3eed9a2a3d220193cf1630275f7019b7eff5f,helene,hurricane
lr3c53z,t3_1fzrgqt,t3_1fzrgqt,HurricaneHelene,disdkatster,2024-10-09T14:02:29+00:00,2,It took me jumping through hoops to finally find you. Now following.,helene,hurricane
lr3cc4n,t3_1fzrgqt,t1_lr3c3p6,HurricaneHelene,2016TRDPro,2024-10-09T14:03:39+00:00,1,"The $750 is what people in Tennessee and North Carolina have been having to sign a loan agreement to get, unlike any situation prior to Hurricane Helene.",helene,hurricane
