id,link_id,parent_id,subreddit,author,created_utc,score,body,hurricane,keyword_hit
lr05yqh,t3_1fz6m28,t1_lqzux7h,NorthCarolina,flaginorout,2024-10-08T21:41:49+00:00,17,"It’s been a week. Most of that money is the $750 individual assistance grants. As the dust settles, other forms of assistance will kick in. 

People seem to think there is a giant ‘easy button’ at FEMA headquarters that someone is just refusing to push. 

Sorry that your exceedingly high expectations aren’t being met overnight. Maybe if you were in charge?",helene,hurricane
lr067a9,t3_1fz6m28,t3_1fz6m28,NorthCarolina,cardiganmimi,2024-10-08T21:43:15+00:00,7,I live in Winston-Salem and have seen the chinooks flying overhead. 🫡,helene,hurricane
lr068rd,t3_1fz6m28,t1_lqzqjxx,NorthCarolina,MonkeyKing984,2024-10-08T21:43:30+00:00,4,"Maybe Reddit can give you a special 'Super Admin' color for your user account name, so everyone can see quickly you're a legitimate account relaying official messages from the White House. (Also thank you for all you do to make this country a safe, prosperous one for all Americans.)",helene,hurricane
lr06xf9,t3_1fz6m28,t3_1fz6m28,NorthCarolina,stormygirl378,2024-10-08T21:47:48+00:00,7,You guys are doing amazing work!,helene,hurricane
lr07k9l,t3_1fz6m28,t1_lqzoms3,NorthCarolina,AgreeableGravy,2024-10-08T21:51:47+00:00,25,WOW. Then they take to twitter etc about how the Biden Admin has abandoned the people. These folks actually VOTED to abandon the people and their constituents will still fall on their sword for them. Like this is proof that they actively tried to block support so they could spin the disaster to campaign on it. I don't get how people can be undecided at this point.,helene,hurricane
lr07pe4,t3_1fz6m28,t1_lqzcmyd,NorthCarolina,ghjm,2024-10-08T21:52:41+00:00,34,"I have 270 times more karma than the White House.

270 is the number of Electoral College votes needed to win the White House.

Am I the next President?",helene,hurricane
lr07yjt,t3_1fz6m28,t1_lqzqjxx,NorthCarolina,Malpractice57,2024-10-08T21:54:17+00:00,1,"Quick question: is it true that Matt Miller is a vampire?

His smirk when answering questions about Gaza and Lebanon is really, really unsettling. And that‘s not even considering the content of what he says.

Are there particular workplace policies around working with vampires? Just between the two of us… the guy is creepy af, right?",helene,hurricane
lr0803t,t3_1fz6m28,t1_lqzdb72,NorthCarolina,ghjm,2024-10-08T21:54:33+00:00,7,I wonder what happened to whatever narwhal bacon eating redditor who already had /u/whitehouse.  Presumably they just got ejected into space five minutes after spez got the call from the White House Press Office.,helene,hurricane
lr08o4t,t3_1fz6m28,t1_lqzmlvt,NorthCarolina,SadPanthersFan,2024-10-08T21:58:49+00:00,12,Then call Speaker Johnson and other Republicans and ask them why they aren’t demand Congress be called back.,helene,hurricane
lr08tdc,t3_1fz6m28,t1_lqzqlqt,NorthCarolina,SadPanthersFan,2024-10-08T21:59:45+00:00,13,Then call Speaker Johnson and other Republicans and ask why they’re refusing to call Congress back to vote on additional relief funding.,helene,hurricane
lr08urx,t3_1fz6m28,t1_lqzqjxx,NorthCarolina,Th3TruthIs0utTh3r3,2024-10-08T22:00:00+00:00,2,"Welcome to Reddit, thank you for coming over here so we didn't have to get information 3rd hand off twitter.",helene,hurricane
lr098kw,t3_1fz6m28,t1_lqzcmyd,NorthCarolina,peterst28,2024-10-08T22:02:30+00:00,2,They just got started on Reddit.,helene,hurricane
lr0998b,t3_1fz6m28,t3_1fz6m28,NorthCarolina,Th3TruthIs0utTh3r3,2024-10-08T22:02:37+00:00,7,"Thank you for everything you are doing and for being a calm, sane, voice during these emergencies.",helene,hurricane
lr09i3t,t3_1fz6m28,t1_lr02tfp,NorthCarolina,zoobird13,2024-10-08T22:04:14+00:00,5,I was gonna say....,helene,hurricane
lr09y24,t3_1fz6m28,t1_lr07pe4,NorthCarolina,LenniLanape,2024-10-08T22:07:08+00:00,-21,You should send in your resume. I think the position is currently vacant.,helene,hurricane
lr0alpk,t3_1fz6m28,t3_1fz6m28,NorthCarolina,Crafty_Moment2483,2024-10-08T22:11:28+00:00,8,I never thought I would see the day when the White House would actually create and use a Reddit account.,helene,hurricane
lr0am31,t3_1fz6m28,t1_lqzxbel,NorthCarolina,BayonettaBasher,2024-10-08T22:11:33+00:00,9,Guess what? And by the way…,helene,hurricane
lr0azds,t3_1fz6m28,t1_lqzh9pf,NorthCarolina,freebytes,2024-10-08T22:13:58+00:00,20,We really need people from parts of North Carolina actually affected calling out liars for saying that the government (local and federal) is not doing anything.,helene,hurricane
lr0bhqm,t3_1fz6m28,t1_lr05yqh,NorthCarolina,Far-prophet,2024-10-08T22:17:17+00:00,-8,"We don't know where that money is being spent. Even if it was each of the 28,000 households getting $750, where is the remaining $16 million being spent? 

  
These are normal questions.",helene,hurricane
lr0bpd7,t3_1fz6m28,t1_lr0azds,NorthCarolina,TrueTimmy,2024-10-08T22:18:41+00:00,23,"I’ve tried to do my part. My GF has been working with FEMA since last Monday, and on Twitter I was met with a bunch of comments that say she’s cheating on me or I’m lying about it. It has put into perspective how much of social media news is fake and more about selling narratives for clout / engagement.",helene,hurricane
lr0bra6,t3_1fz6m28,t1_lr01cnh,NorthCarolina,Far-prophet,2024-10-08T22:19:02+00:00,-9,"None of those tell us how $37 million is being distributed.

  
Or are you one of those people that thinks there is no such thing as corruption?",helene,hurricane
lr0cd8c,t3_1fz6m28,t1_lqzqjxx,NorthCarolina,biznatch11,2024-10-08T22:23:01+00:00,2,https://i.imgur.com/zJvs9Kt.gif,helene,hurricane
lr0ctol,t3_1fz6m28,t1_lr07k9l,NorthCarolina,Jmauld,2024-10-08T22:26:09+00:00,14,They did the exact same thing with immigration,helene,hurricane
lr0d05n,t3_1fz6m28,t1_lqzfxjp,NorthCarolina,Public-Eagle6992,2024-10-08T22:27:22+00:00,8,"On Reddit, if an account has the name of something big, be it a company or a government its most likely real since I think Reddit automatically creates accounts for those (for example there’s also u/Bundesregierung for the German government)",helene,hurricane
lr0ffpl,t3_1fz6m28,t1_lqztv8a,NorthCarolina,alligatorterror,2024-10-08T22:43:59+00:00,20,Reddit forgotten? Nah.  They bringing in the big guns now to combat misinformation.  Redditors… Assemble!,helene,hurricane
lr0fhq2,t3_1fz6m28,t1_lr0bhqm,NorthCarolina,flaginorout,2024-10-08T22:44:22+00:00,12,"Hotel vouchers, commodity purchases, etc. 

You can file a FOIA request in 90-120 days if you’re really convinced that something is afoul.",helene,hurricane
lr0fhw7,t3_1fz6m28,t1_lqzslze,NorthCarolina,WhatTheNothingWorks,2024-10-08T22:44:24+00:00,2,$157 million is a good amount to start with.,helene,hurricane
lr0fzzu,t3_1fz6m28,t3_1fz6m28,NorthCarolina,thewaybaseballgo,2024-10-08T22:47:50+00:00,7,I’m just in awe that the White House is able to post fact check threads to reddit.,helene,hurricane
lr0juhm,t3_1fz6m28,t3_1fz6m28,NorthCarolina,PreparationOver2310,2024-10-08T23:14:31+00:00,8,Twitter is such a dumpster fire of misinformation the white house had to resort to using it's reddit account,helene,hurricane
lr0ky46,t3_1fz6m28,t1_lr0bpd7,NorthCarolina,Jimbomcdeans,2024-10-08T23:22:21+00:00,8,I mean its twitter. Its been proven that some of that user base are just Russian assets and will turn on you quickly if you use the wrong keywords.,helene,hurricane
lr0l6bh,t3_1fz6m28,t1_lr07k9l,NorthCarolina,Jimbomcdeans,2024-10-08T23:23:56+00:00,10,Thats their playbook. Look at what they are raging about today and then review what they just voted against last week to make up a story that the other side of the aisle is the problem.,helene,hurricane
lr0lgbw,t3_1fz6m28,t3_1fz6m28,NorthCarolina,putoriuse,2024-10-08T23:25:52+00:00,-22,Ratio,helene,hurricane
lr0lphc,t3_1fz6m28,t1_lqzcr6q,NorthCarolina,SkankinSweet,2024-10-08T23:27:39+00:00,41,"Signed,

Some dude in ENC.  

Usually, we are the ones to deal with the hurricanes.  Sending much love to you all.",helene,hurricane
lr0lr5a,t3_1fz6m28,t3_1fz6m28,NorthCarolina,cbeme,2024-10-08T23:27:58+00:00,4,"Yes, my many friends are on the ground and though the needs are great all are working together. What many people don’t understand is that FEMA, National Guard and samaritans purse do is also work through local community groups.",helene,hurricane
lr0lxjn,t3_1fz6m28,t1_lqzcmyd,NorthCarolina,youcancallmeE,2024-10-08T23:29:12+00:00,1,How did they get the name?!?,helene,hurricane
lr0m1yo,t3_1fz6m28,t3_1fz6m28,NorthCarolina,barkeepbill,2024-10-08T23:30:03+00:00,-25,Biden is still President?,helene,hurricane
lr0msah,t3_1fz6m28,t3_1fz6m28,NorthCarolina,Kragkin,2024-10-08T23:35:17+00:00,-15,"FEMA has also been shutting down mobile clinics, trashing supplies, and unreliably communicating to teams since they've arrived. I wouldn't be so excited about the White House pushing claims like these.

Source: being there.",helene,hurricane
lr0nbvq,t3_1fz6m28,t1_lqzuqqh,NorthCarolina,men_love_twerkin_too,2024-10-08T23:39:13+00:00,8,No it’s Dwayne Elizondo Mountain Dew Herbert Camacho.,helene,hurricane
lr0nceq,t3_1fz6m28,t1_lr0bra6,NorthCarolina,SpecificMacaroon,2024-10-08T23:39:20+00:00,13,"Right now it’s mostly people applying for the emergency $750 grant and getting it. 

That tracks with the amount distributed and the number of households. 

It’s not that big brained.",helene,hurricane
lr0nf5k,t3_1fz6m28,t1_lr0bhqm,NorthCarolina,SpecificMacaroon,2024-10-08T23:39:53+00:00,3,“Households” can have more than 1 adult applying for the emergency grant.,helene,hurricane
lr0nk90,t3_1fz6m28,t1_lr0m1yo,NorthCarolina,md_dc,2024-10-08T23:40:55+00:00,4,You must be new here,helene,hurricane
lr0nt4p,t3_1fz6m28,t1_lr039sw,NorthCarolina,SpecificMacaroon,2024-10-08T23:42:40+00:00,10,"The NC national guard was literally on the road to WNC the morning after the Hurricane. And Fort Bragg troops were readying up in the late hours last Wednesday night to be able to “deploy” out there. 

They are in areas where people literally can’t be right now to rescue and recover. So obviously they aren’t going to be “seen” as publicly as churches in the main town square handing out hotdogs.",helene,hurricane
lr0oro4,t3_1fz6m28,t1_lqzqjxx,NorthCarolina,Jay-Money90,2024-10-08T23:49:26+00:00,-5,Enjoy your last few months,helene,hurricane
lr0ouh3,t3_1fz6m28,t1_lr00yxa,NorthCarolina,Jay-Money90,2024-10-08T23:50:00+00:00,-13,Misinformation 🤣,helene,hurricane
lr0pcvm,t3_1fz6m28,t1_lqzls5h,NorthCarolina,freebytes,2024-10-08T23:53:37+00:00,2,"North Carolina has a large number of people from New York, Ohio, and Florida, though, and they do not know the history of the state.",helene,hurricane
lr0pp99,t3_1fz6m28,t1_lqzqjxx,NorthCarolina,SouthwesternEagle,2024-10-08T23:56:05+00:00,3,Hello White House! :),helene,hurricane
lr0pqoz,t3_1fz6m28,t3_1fz6m28,NorthCarolina,Moneyspreader400,2024-10-08T23:56:22+00:00,1,Hello Joe biden,helene,hurricane
lr0q4r4,t3_1fz6m28,t1_lqzqjxx,NorthCarolina,Vegetable-Werewolf-8,2024-10-08T23:59:10+00:00,2,"Good, everyone needs start moving away from X with it's owner literally campaigning for one candidate. You guys are on the ball.",helene,hurricane
lr0q53j,t3_1fz6m28,t1_lr0ctol,NorthCarolina,roguewarriorpriest,2024-10-08T23:59:14+00:00,1,Trump did the same thing for his Covid response,helene,hurricane
lr0qhsh,t3_1fz6m28,t1_lr07k9l,NorthCarolina,Alfphe99,2024-10-09T00:01:48+00:00,9,"These people have no idea how the government works, how logistics works, how the Internet works, how science works, how a woman's anatomy works. They basically know less and believe more fantasy than my eight year old at this point.",helene,hurricane
lr0r2b2,t3_1fz6m28,t1_lr0nceq,NorthCarolina,Alfphe99,2024-10-09T00:05:56+00:00,8,"I feel like these people try to make it complicated just for the excuse to have a problem with things.  They want to have an issue with this, so they find an issue with this.",helene,hurricane
lr0rcq6,t3_1fz6m28,t3_1fz6m28,NorthCarolina,AdPlus232,2024-10-09T00:07:58+00:00,-21,Smoke and mirrors,helene,hurricane
lr0rk01,t3_1fz6m28,t3_1fz6m28,NorthCarolina,tuttut97,2024-10-09T00:09:24+00:00,-4,"For clarity, are you referring North Carolina when you say ""There are More than 1,000 FEMA staff are on the ground, with more arriving daily"" ?",helene,hurricane
lr0rqn7,t3_1fz6m28,t1_lr0rcq6,NorthCarolina,stainedglass333,2024-10-09T00:10:44+00:00,11,Prove it.,helene,hurricane
lr0swy6,t3_1fz6m28,t3_1fz6m28,NorthCarolina,prizepig,2024-10-09T00:19:12+00:00,3,"How much of the FEMA paranoia traces back to the X-Files franchise? 

Also, FEMA agents ate my cat.   How can I send them a thank you card?

I'll take my answer off the air.",helene,hurricane
lr0t6q7,t3_1fz6m28,t1_lr0r2b2,NorthCarolina,waynes_pet_youngin,2024-10-09T00:21:08+00:00,7,I made myself confused on purpose and now I'm angry about it!,helene,hurricane
lr0tmr4,t3_1fz6m28,t3_1fz6m28,NorthCarolina,madding_crowd_,2024-10-09T00:24:22+00:00,2,So glad to see this! Thank you!,helene,hurricane
lr0to6x,t3_1fz6m28,t1_lr0nt4p,NorthCarolina,waynes_pet_youngin,2024-10-09T00:24:39+00:00,7,My dad is in the middle of nowhere and they basically have an entire grocery store set up that's all donations you can take for free. He said the fema workers wouldn't even take water from them because it would make news if anyone happened to take a photo,helene,hurricane
lr0u7xu,t3_1fz6m28,t1_lr02tfp,NorthCarolina,_-Smoke-_,2024-10-09T00:28:44+00:00,5,"Probably because of the sheer volume of misinformation. There's been several posts ***today*** on r/all about tweets and other social media posts ranging from posting about killing FEMA agents to reinterating land grab claims among other things.

It's first post was also 6 hours ago and if the account runner has regular hours they got about 3 hours of work among who knows how many other higher-engagement activities they had.",helene,hurricane
lr0uujj,t3_1fz6m28,t1_lr0ffpl,NorthCarolina,Amaruq93,2024-10-09T00:33:19+00:00,8,"Not many human Redditors left to assemble, compared to 3 years ago.",helene,hurricane
lr0vguk,t3_1fz6m28,t3_1fz6m28,NorthCarolina,kwantsu-dudes,2024-10-09T00:37:54+00:00,-7,"Does FEMA operate differently under various presidents? Is there a reason why the Whitehouse and the President take ""ownership"" of a federal agency that already exists to which they then simply authorize? Or to what extent does Biden have in actually determining what FEMA does? Never really understood the focus being on the president when a federal agency acts in ways that rely on their expertise. Is there oversight the President has to actually prevent FEMA from acting in certain ways or can mandate that they act? Or does FEMA have the discretion?

Should praise or blame of FEMA's response be praise/blame toward the President?",helene,hurricane
lr0vuax,t3_1fz6m28,t1_lqzuqqh,NorthCarolina,i-dont-kneel,2024-10-09T00:40:35+00:00,1,"Man i read the whole thing in joe's voice, anyway",helene,hurricane
lr0w1pb,t3_1fz6m28,t1_lqzlcma,NorthCarolina,Wildcard311,2024-10-09T00:42:07+00:00,-13,"Dems don't like you questioning them. They hate it when you point out facts, too.

Just say ""orange man bad"" and you are usually safe on this sub.",helene,hurricane
lr0whji,t3_1fz6m28,t1_lr08tdc,NorthCarolina,Wildcard311,2024-10-09T00:45:19+00:00,-5,What would the funding go to?,helene,hurricane
lr0wq6o,t3_1fz6m28,t1_lr0msah,NorthCarolina,Uisce-beatha,2024-10-09T00:47:04+00:00,13,Cursory glance over your posts puts you in the Charlotte area. Any pictures or videos of your volunteer work you'd like to share?,helene,hurricane
lr0x25p,t3_1fz6m28,t1_lqzqjxx,NorthCarolina,KubelsKitchen,2024-10-09T00:49:32+00:00,1,[View GIF](https://i.imgur.com/GeGzxxG.gif),helene,hurricane
lr0x2qm,t3_1fz6m28,t1_lr0msah,NorthCarolina,Wildcard311,2024-10-09T00:49:39+00:00,1,">FEMA has also been shutting down mobile clinics,

I was pretty upset and have stated before that I thought how wrong it was that it took them so long just to activate the mobile hospitals. (Tuesday or Wednesday after the storm) Then today I saw 4 on highway and definitely heading away from WNC. I thought maybe a coincidence. Do you have any source other than you were there?

As far as comms... it's FEMA, and it's a disaster zone. While that should be a priority, it's a difficult task in a difficult area for sure. 

Sorry for your suffering.",helene,hurricane
lr0ya3o,t3_1fz6m28,t3_1fz6m28,NorthCarolina,HalfRich1744,2024-10-09T00:58:39+00:00,-12,"Y’all do know that $37 million spread over 28,000 health hold is only about $1300 each",helene,hurricane
lr0yoyr,t3_1fz6m28,t1_lr0vguk,NorthCarolina,makatakz,2024-10-09T01:01:49+00:00,6,"It’s something where doing it right is expected, but a President has the ability to fuck it up. Trump fucked it up at least twice, with Hurricane Maria in Puerto Rico and the California wildfires that hit Orange County.",helene,hurricane
lr0ypxq,t3_1fz6m28,t1_lr0vuax,NorthCarolina,Mental-Cupcake9750,2024-10-09T01:02:01+00:00,-4,I hope you stuttered and mumbled intermittently throughout the comment,helene,hurricane
lr0yv6m,t3_1fz6m28,t1_lr0wq6o,NorthCarolina,makatakz,2024-10-09T01:03:07+00:00,5,Charlotte is what? Over an hour away from that area?,helene,hurricane
lr0z1pn,t3_1fz6m28,t1_lqzz5n5,NorthCarolina,lolthai,2024-10-09T01:04:29+00:00,5,The social team working for the White House is serious goals.,helene,hurricane
lr0zaag,t3_1fz6m28,t1_lr0fhq2,NorthCarolina,Wsweg,2024-10-09T01:06:17+00:00,1,"I'm sure u/flaginorout will actually go back and look at the DRF monthly report when it actually comes out this month and next month, since they are interesting in being well informed!",helene,hurricane
lr0zbpp,t3_1fz6m28,t1_lr0pcvm,NorthCarolina,makatakz,2024-10-09T01:06:35+00:00,8,But they aren’t living in the mountains west of Asheville in big numbers. Must of the more recent transplants are moving to the Piedmont or coastal regions,helene,hurricane
lr101fk,t3_1fz6m28,t1_lqzz5n5,NorthCarolina,SuperSpecialAwesome-,2024-10-09T01:11:57+00:00,19,"> Also, this place is a hellhole, WH intern. I'm so so sorry...

They use Twitter everyday.",helene,hurricane
lr1046i,t3_1fz6m28,t1_lr02tfp,NorthCarolina,SuperSpecialAwesome-,2024-10-09T01:12:31+00:00,5,"Yeah, Florida definitely needs a post.",helene,hurricane
lr10acv,t3_1fz6m28,t1_lr0x2qm,NorthCarolina,Wsweg,2024-10-09T01:13:48+00:00,12,Their source is they are lying.,helene,hurricane
lr10kai,t3_1fz6m28,t1_lqzruyu,NorthCarolina,Lil_SpazJoekp,2024-10-09T01:15:52+00:00,13,"On the mobile Reddit app, the account is marked as official",helene,hurricane
lr10ll0,t3_1fz6m28,t3_1fz6m28,NorthCarolina,FlyingwithSanta,2024-10-09T01:16:07+00:00,6,THANK YOU!!!,helene,hurricane
lr11ef3,t3_1fz6m28,t1_lqzeg64,NorthCarolina,Wsweg,2024-10-09T01:22:07+00:00,5,"I think the sad reality is that most of the stupid takes/misinformation on here aren't bots, but rather people that actually hold those thoughts and vote in our state.",helene,hurricane
lr123py,t3_1fz6m28,t1_lr0bra6,NorthCarolina,FirstAttemptsFailed,2024-10-09T01:27:25+00:00,4,Haha... bless your heart.,helene,hurricane
lr15gfw,t3_1fz6m28,t3_1fz6m28,NorthCarolina,Far_Recommendation82,2024-10-09T01:51:53+00:00,9,"Thank you for combating misinformation, we are trying our hardest in NC!",helene,hurricane
lr15xod,t3_1fz6m28,t1_lr0ouh3,NorthCarolina,Sythic_,2024-10-09T01:55:23+00:00,2,"You're right best to call it what it really is, ""lies"".",helene,hurricane
lr1624k,t3_1fz6m28,t3_1fz6m28,NorthCarolina,rubey419,2024-10-09T01:56:17+00:00,11,I commend the current administration for reaching out to socials to stop misinformation and share  resources.,helene,hurricane
lr165yw,t3_1fz6m28,t3_1fz6m28,NorthCarolina,im_intj,2024-10-09T01:57:05+00:00,-19,Love how they only posted on Georgia and NC subs because those are the swing states they need to win.,helene,hurricane
lr167a6,t3_1fz6m28,t1_lqztv8a,NorthCarolina,psychohistorian8,2024-10-09T01:57:21+00:00,5,Jan 7th 2021 to be exact...,helene,hurricane
lr16fd0,t3_1fz6m28,t1_lqzfxjp,NorthCarolina,viperabyss,2024-10-09T01:59:00+00:00,8,It'd be hilarious if WH also signed up for an OF account to combat disinformation about Helene...,helene,hurricane
lr184rb,t3_1fz6m28,t1_lqzxbel,NorthCarolina,MightyCaseyStruckOut,2024-10-09T02:11:29+00:00,17,I really want /u/whitehouse to post at /r/darkbrandon now.,helene,hurricane
lr18ctn,t3_1fz6m28,t3_1fz6m28,NorthCarolina,CoolCommieCat,2024-10-09T02:13:10+00:00,0,"> FEMA has approved more than $37 million in assistance for over 28,000 households

Why is this less than 1% of the money given to bombing civilians in Gaza and Lebanon? Fucking pathetic. Our people are drowning and the US government would rather spend money on weapons and warfare. The audacity to come in and use this as a flex on an official propaganda account... ",helene,hurricane
lr1ae67,t3_1fz6m28,t3_1fz6m28,NorthCarolina,Niguelito,2024-10-09T02:28:11+00:00,3,I WAS HEEEEEEERRRREEE,helene,hurricane
lr1axy5,t3_1fz6m28,t1_lqzqjxx,NorthCarolina,Ruby_Throated_Hummer,2024-10-09T02:32:11+00:00,1,"Thank you for your active support in this developing situation! As contrasted with Trump, who wants to end the organization responsible for collecting weather data, and withholds aid depending on who people vote for, your administration is a much needed breath of fresh air. It’s good to have a steady hand at the helm.",helene,hurricane
lr1bvmm,t3_1fz6m28,t1_lqzmekd,NorthCarolina,MistyMtn421,2024-10-09T02:39:12+00:00,1,Lol .... Wait are you serious?,helene,hurricane
lr1c53k,t3_1fz6m28,t1_lr11ef3,NorthCarolina,MistyMtn421,2024-10-09T02:41:12+00:00,6,"People were talking earlier about how Facebook is all bots, and I know there are probably a ton of them on there, but I happen to know way too many people in real life and who are on there too and are posting all kinds of stupid crazy conspiracy stuff. At this point I almost feel like it's a coping skill. It's much easier to believe it is bots. It's a lot scarier when you realize it's most of your neighbors",helene,hurricane
lr1cf0e,t3_1fz6m28,t1_lqzxheq,NorthCarolina,BagOnuts,2024-10-09T02:43:26+00:00,18,Hats off to them. The problem is MAGA will still think it’s “propaganda fake news”.,helene,hurricane
lr1cj4t,t3_1fz6m28,t1_lr0u7xu,NorthCarolina,NoPoet3982,2024-10-09T02:44:21+00:00,2,"That really does nothing to explain why they posted to 2 subs instead of 6. It's the same text. It would literally take less than 40 seconds to get this info out to the people who need it. I wouldn't vote for Trump for dog catcher, but it's not a good look to post only on the swing state subs.",helene,hurricane
lr1cl8q,t3_1fz6m28,t1_lr165yw,NorthCarolina,NoG00dUsernamesLeft,2024-10-09T02:44:49+00:00,13,Orrrr they're the ones most impacted by the storm? You're hitting new lows for ignorance these days.,helene,hurricane
lr1cpjz,t3_1fz6m28,t1_lr09y24,NorthCarolina,JudasPwndJesus666,2024-10-09T02:45:46+00:00,5,At least they aren't advocating shooting or nuking the hurricane.  So this is a major step-up.,helene,hurricane
lr1ctue,t3_1fz6m28,t1_lqzqjxx,NorthCarolina,ActuallyYeah,2024-10-09T02:46:43+00:00,3,Cool cool. When are you gonna delete your r/gonewild posts?,helene,hurricane
lr1dy52,t3_1fz6m28,t3_1fz6m28,NorthCarolina,grownadult,2024-10-09T02:55:21+00:00,4,"Well hello there, Joe! 😂",helene,hurricane
lr1e6zp,t3_1fz6m28,t1_lqzuqqh,NorthCarolina,ct0,2024-10-09T02:57:15+00:00,1,"yes its joe  
-Karine",helene,hurricane
lr1e9cs,t3_1fz6m28,t1_lqzqjxx,NorthCarolina,nondescriptun,2024-10-09T02:57:44+00:00,2,"You started this account on Jan 7, 2021, but haven't used it until today? Classic Reddit move.",helene,hurricane
lr1f3kj,t3_1fz6m28,t3_1fz6m28,NorthCarolina,L0NZ0BALL,2024-10-09T03:04:13+00:00,6,/u/whitehouse : what can North Carolinians do to help your response? Obviously you’re going to be stretched thin with Milton coming in tomorrow.  How can we come together?,helene,hurricane
lr1g457,t3_1fz6m28,t3_1fz6m28,NorthCarolina,Thatscool820,2024-10-09T03:12:09+00:00,5,"Damn the actual White House, 


I know for a fact bro has some snow on him lol",helene,hurricane
lr1gkxf,t3_1fz6m28,t1_lqzlcma,NorthCarolina,Flimsy-Math-8476,2024-10-09T03:15:51+00:00,2,"It's a LOT for immediate, no qualification responses.  There are plenty of other assistance programs for rebuilding that actually require application and vetting process.




Not to mention all the other FEMA support you seem to have glossed over in the post ...",helene,hurricane
lr1gv7f,t3_1fz6m28,t1_lr01cnh,NorthCarolina,Flimsy-Math-8476,2024-10-09T03:18:09+00:00,7,"Narrator: He won't find that interesting for his opinion is already etched in stone, based on misinformation and ignorance of how tracking processes work.",helene,hurricane
lr1h2t6,t3_1fz6m28,t1_lqzmlvt,NorthCarolina,Flimsy-Math-8476,2024-10-09T03:19:51+00:00,2,"Which is why there is a list of all the other resources FEMA is providing....


Or are you being fooled by the right-wing propaganda that cash-in-pocket is the only important thing that should be done in the immediate days after a disaster?",helene,hurricane
lr1hfl8,t3_1fz6m28,t1_lr167a6,NorthCarolina,zunyata,2024-10-09T03:22:41+00:00,2,*cue twilight zone music*,helene,hurricane
lr1hlmq,t3_1fz6m28,t1_lqzqjxx,NorthCarolina,aliceisasleeeeep,2024-10-09T03:24:02+00:00,1,Hell Yes!,helene,hurricane
lr1hmg0,t3_1fz6m28,t1_lqzqjxx,NorthCarolina,HungryHAP,2024-10-09T03:24:15+00:00,2,"Hi, can you guys please spread your information to other Hurricane affected areas. Thus far, only Georgia and NC have been reached out to.",helene,hurricane
