id,link_id,parent_id,subreddit,author,created_utc,score,body,hurricane,keyword_hit
lr61s7r,t3_1fzv2y0,t1_lr5ykee,southcarolina,southcarolina-ModTeam,2024-10-09T22:56:40+00:00,1,This content was removed for  misinformation or unsubstantiated claims. Please backup factual claims with legitimate sources.,helene,hurricane
lr61vim,t3_1fzv2y0,t1_lr5ozqd,southcarolina,southcarolina-ModTeam,2024-10-09T22:57:14+00:00,13,This content was removed for  misinformation or unsubstantiated claims. Please backup factual claims with legitimate sources.,helene,hurricane
lr622au,t3_1fzv2y0,t1_lr4wgve,southcarolina,southcarolina-ModTeam,2024-10-09T22:58:23+00:00,1,"Your content was removed for not being civil. Content not allowed includes, but is not limited to: insults, personal attacks, incivility, trolling, bigotry, racism, and excessive profanity.",helene,hurricane
lr62f5k,t3_1fzv2y0,t1_lr528ff,southcarolina,southcarolina-ModTeam,2024-10-09T23:00:37+00:00,1,"Your content was removed for not being civil. Content not allowed includes, but is not limited to: insults, personal attacks, incivility, trolling, bigotry, racism, and excessive profanity.",helene,hurricane
lr62gro,t3_1fzv2y0,t1_lr51bqn,southcarolina,southcarolina-ModTeam,2024-10-09T23:00:54+00:00,1,"Your content was removed for not being civil. Content not allowed includes, but is not limited to: insults, personal attacks, incivility, trolling, bigotry, racism, and excessive profanity.",helene,hurricane
lr654ea,t3_1fzv2y0,t1_lr5a50l,southcarolina,southcarolina-ModTeam,2024-10-09T23:17:49+00:00,1,This content was removed for  misinformation or unsubstantiated claims. Please backup factual claims with legitimate sources.,helene,hurricane
lr66cb6,t3_1fzv2y0,t3_1fzv2y0,southcarolina,Dramatic_Skill_67,2024-10-09T23:25:22+00:00,1,"Hey u/whitehouse, maybe educate people about the responsibility of FEMA, like FEMA’s job is not passing around supplies at sites and why you have to coordinate with multiple organizations",helene,hurricane
lr66hqu,t3_1fzv2y0,t1_lr3znxz,southcarolina,thejournalizer,2024-10-09T23:26:19+00:00,5,"If it was for the initial amount, the rejection email is just worded poorly. So much so that it’s not a rejection.",helene,hurricane
lr68hdx,t3_1fzv2y0,t3_1fzv2y0,southcarolina,Blackant71,2024-10-09T23:38:39+00:00,8,If you were one of those folks always talking about how the federal gubment is your enemy I hope that you won't accept anything from Fema. Let your neighbors deal with the dirty money.,helene,hurricane
lr6bfh2,t3_1fzv2y0,t3_1fzv2y0,southcarolina,GolfArgh,2024-10-09T23:56:51+00:00,2,So FEMA doing what FEMA does not matter who is the President.,helene,hurricane
lr6bk0v,t3_1fzv2y0,t1_lr4cchl,southcarolina,Chillguy3333,2024-10-09T23:57:39+00:00,3,I was coming to say the same as someone who has been through numerous hurricanes including Katrina. The $750 is just an initial payment for things like food losses to get you on your feet. More relief needs to be voted on by congress.,helene,hurricane
lr6dka0,t3_1fzv2y0,t3_1fzv2y0,southcarolina,[deleted],2024-10-10T00:10:19+00:00,1,[removed],helene,hurricane
lr6jhiy,t3_1fzv2y0,t3_1fzv2y0,southcarolina,teeje_mahal,2024-10-10T00:47:10+00:00,-8,"Working around the clock, in between bidens trips to the beach and kamala's podcast interviews",helene,hurricane
lr6l2yl,t3_1fzv2y0,t3_1fzv2y0,southcarolina,[deleted],2024-10-10T00:57:18+00:00,0,[removed],helene,hurricane
lr6mnmu,t3_1fzv2y0,t1_lr6dka0,southcarolina,southcarolina-ModTeam,2024-10-10T01:07:23+00:00,1,This content was removed for  misinformation or unsubstantiated claims. Please backup factual claims with legitimate sources.,helene,hurricane
lr6n3cb,t3_1fzv2y0,t1_lr66cb6,southcarolina,southcarolina-ModTeam,2024-10-10T01:10:12+00:00,1,This content was removed for  misinformation or unsubstantiated claims. Please backup factual claims with legitimate sources.,helene,hurricane
lr6nm4c,t3_1fzv2y0,t1_lr4h0se,southcarolina,motiontosuppress,2024-10-10T01:13:36+00:00,1,It’s usually hanging out on r/furry.,helene,hurricane
lr6nnbs,t3_1fzv2y0,t1_lr6nm4c,southcarolina,sneakpeekbot,2024-10-10T01:13:49+00:00,3,"Here's a sneak peek of /r/furry using the [top posts](https://np.reddit.com/r/furry/top/?sort=top&t=year) of the year!

\#1: [My first fursuit! :3](https://i.redd.it/uir71x0lv9jd1.jpeg) | [400 comments](https://np.reddit.com/r/furry/comments/1eupan1/my_first_fursuit_3/)  
\#2: [Who is this? I love the style of the suit, slim and all.](https://v.redd.it/pe73nky6d8od1) | [80 comments](https://np.reddit.com/r/furry/comments/1feimud/who_is_this_i_love_the_style_of_the_suit_slim_and/)  
\#3: [Not safe to come out… (art by me)](https://i.redd.it/ndqguhbpcy3d1.jpeg) | [298 comments](https://np.reddit.com/r/furry/comments/1d5lp86/not_safe_to_come_out_art_by_me/)

----
^^I'm ^^a ^^bot, ^^beep ^^boop ^^| ^^Downvote ^^to ^^remove ^^| ^^[Contact](https://www.reddit.com/message/compose/?to=sneakpeekbot) ^^| ^^[Info](https://np.reddit.com/r/sneakpeekbot/) ^^| ^^[Opt-out](https://np.reddit.com/r/sneakpeekbot/comments/o8wk1r/blacklist_ix/) ^^| ^^[GitHub](https://github.com/ghnr/sneakpeekbot)",helene,hurricane
lr6ochz,t3_1fzv2y0,t1_lr46ovl,southcarolina,JimBeam823,2024-10-10T01:18:19+00:00,18,"I’m generally not a fan of Henry McMaster, but he seems to have been on top of things with the storm. 

Maybe I missed something, but I haven’t seen him play politics with it either. ",helene,hurricane
lr6p40v,t3_1fzv2y0,t3_1fzv2y0,southcarolina,mntlover,2024-10-10T01:23:17+00:00,-3,"How about NC, TN, VA?",helene,hurricane
lr6p6t6,t3_1fzv2y0,t1_lr5nc68,southcarolina,Nervous-Zone-2681,2024-10-10T01:23:46+00:00,6,If...if they can post to reddit they can apply for assitance....,helene,hurricane
lr6pcro,t3_1fzv2y0,t3_1fzv2y0,southcarolina,[deleted],2024-10-10T01:24:50+00:00,0,[removed],helene,hurricane
lr6rzxu,t3_1fzv2y0,t1_lr4fgpw,southcarolina,Competitive_Remote40,2024-10-10T01:41:57+00:00,2,"It probably has more to do with under staffed and underfunded departments relying on computer systems that aren't robust enough to handke that many claims at once. Just a guess. 

But I have enough friends in government jobs to feel reasonably confident it us more likely to be the limitations of the systems and procedures than the people.",helene,hurricane
lr6saxt,t3_1fzv2y0,t1_lr5ankl,southcarolina,MrStealYoWeimy,2024-10-10T01:43:55+00:00,4,Wait so fema does cover food losses? can we do this rather than go thru home owners insurance ?,helene,hurricane
lr6t24o,t3_1fzv2y0,t1_lr6p6t6,southcarolina,MustangEater82,2024-10-10T01:48:49+00:00,-7,"Ahh yes....   the true litmus test if you need disaster relief.


Can you post on social media and say you are not getting any and make politicians look bad?




No?    Well then you get no relief.


Yes?   You just had a lawn chair blowover?   Full releif don't want you getting the word out on what is happening.",helene,hurricane
lr6t4yc,t3_1fzv2y0,t1_lr4tfti,southcarolina,hi_im_haley,2024-10-10T01:49:20+00:00,5,"*you damn kids get off my lawn*
  
     - you probably",helene,hurricane
lr6tw4z,t3_1fzv2y0,t1_lr6t24o,southcarolina,Nervous-Zone-2681,2024-10-10T01:54:13+00:00,5,"I actually cant tell of you are being sarcastic or not.
If he has the capability to post on social media, he has the ability to fill out the forms for aid.
The only politicians who look bad are the ones who voted against fema/are trying to push it off till later.
Its not hard to get approval and by using very basic critical thinking skills, it seems the system is auto denying the rather large amount claims, and the human works are going through and approving them, as shown above with the dozens of post of people getting denied and then having money deposited 1-3 days later",helene,hurricane
lr6uzto,t3_1fzv2y0,t3_1fzv2y0,southcarolina,SmallDongQuixote,2024-10-10T02:01:20+00:00,-3,Lol,helene,hurricane
lr6v5um,t3_1fzv2y0,t1_lr6tw4z,southcarolina,MustangEater82,2024-10-10T02:02:25+00:00,-4,So people without power/internet/ability to leave without a helicopter opter do not need aid? Even if they got it...  what good is an atm with no power/internet? Some might argue they need it most.,helene,hurricane
lr6vcrs,t3_1fzv2y0,t1_lr6v5um,southcarolina,Nervous-Zone-2681,2024-10-10T02:03:39+00:00,3,"Ah, got it, obtuse on purpose, enjoy your night.",helene,hurricane
lr6vm07,t3_1fzv2y0,t1_lr6nm4c,southcarolina,mmmmpisghetti,2024-10-10T02:05:18+00:00,4,That would be funny if true. It's not.,helene,hurricane
lr6wnzv,t3_1fzv2y0,t3_1fzv2y0,southcarolina,Illustrious_Entry614,2024-10-10T02:12:17+00:00,-6,What response?,helene,hurricane
lr6wxd3,t3_1fzv2y0,t3_1fzv2y0,southcarolina,[deleted],2024-10-10T02:14:00+00:00,-9,[removed],helene,hurricane
lr704ps,t3_1fzv2y0,t1_lr6vm07,southcarolina,motiontosuppress,2024-10-10T02:35:24+00:00,2,It would be hilarious. Everybody vote to keep things freaky.,helene,hurricane
lr72jcm,t3_1fzv2y0,t3_1fzv2y0,southcarolina,Rvplace,2024-10-10T02:52:03+00:00,-8,6 days late but better late than never,helene,hurricane
lr72k5m,t3_1fzv2y0,t1_lr48nw5,southcarolina,ProudPatriot07,2024-10-10T02:52:12+00:00,3,I have heard this story from several folks. I would encourage anyone who was initially denied to reapply.,helene,hurricane
lr72l4i,t3_1fzv2y0,t1_lr6pcro,southcarolina,southcarolina-ModTeam,2024-10-10T02:52:24+00:00,1,"Your content was removed for one of the following reasons:
* Being disruptive, designed to start fights, or otherwise cause issues in the sub
* Low-quality content, trolling, etc.
* Posts from bots
* Posts posted to multiple subreddits",helene,hurricane
lr72sal,t3_1fzv2y0,t1_lr6ochz,southcarolina,ProudPatriot07,2024-10-10T02:53:48+00:00,13,"I'm not a fan of him or his legislation, but he's done a good job in this state in regards to disaster response at least.",helene,hurricane
lr72so3,t3_1fzv2y0,t1_lr704ps,southcarolina,mmmmpisghetti,2024-10-10T02:53:52+00:00,3,"I mean...one of the people involved really appreciates soft, easy to clean upholstery.

His counterpart has a deep love of dairy and extreme cold.

One of the other ones really appreciates the Late, Great Hannibam Lecter.

And then there's the one who just admitted to killing an ENTIRE FAMILY ^(size bag of doritos after Biden asked her to be his VP)",helene,hurricane
lr734jg,t3_1fzv2y0,t3_1fzv2y0,southcarolina,fineyou112,2024-10-10T02:56:12+00:00,0,We know it’s a complete failure just like the entire Biden Harris administration has been since day one.  Just like today when Harris admitted she helped make most of the decisions with Biden and wouldn’t change anything but also is going to fix everything on day one.,helene,hurricane
lr736z3,t3_1fzv2y0,t1_lr4dkfc,southcarolina,southcarolina-ModTeam,2024-10-10T02:56:42+00:00,1,This content was removed for  misinformation or unsubstantiated claims. Please backup factual claims with legitimate sources.,helene,hurricane
lr77ofi,t3_1fzv2y0,t1_lr4vamn,southcarolina,tripzydeezy,2024-10-10T03:29:42+00:00,4,Perhaps you should look a little harder. They're certainly in my area.,helene,hurricane
lr7cpwd,t3_1fzv2y0,t3_1fzv2y0,southcarolina,_Treesapp,2024-10-10T04:09:41+00:00,1,White House got some balls coming to the Reddit world,helene,hurricane
lr7jvi2,t3_1fzv2y0,t3_1fzv2y0,southcarolina,creditease,2024-10-10T05:12:56+00:00,2,Everything about Trump is fake https://www.reddit.com/r/the_everything_bubble/s/QZ0rysDpnA,helene,hurricane
lr7kw7k,t3_1fzv2y0,t1_lr4zzt6,southcarolina,tracyinge,2024-10-10T05:22:37+00:00,1,$300 for what?,helene,hurricane
lr7l754,t3_1fzv2y0,t1_lr68hdx,southcarolina,tracyinge,2024-10-10T05:25:33+00:00,5,and shout out to everyone who hates social programs....Fema money may leave you with a bad taste in your mouth.,helene,hurricane
lr7lcke,t3_1fzv2y0,t1_lr6p40v,southcarolina,tracyinge,2024-10-10T05:27:02+00:00,5,"For TN check with the TEMA East Region office , they have info centers set up",helene,hurricane
lr7mr49,t3_1fzv2y0,t1_lr4cl08,southcarolina,nutfac,2024-10-10T05:41:00+00:00,2,"Agreed, unfortunately $750 isn’t even a drop in the bucket. But don’t the states who are most likely to need FEMA assistance the least likely to be represented by congress members who are friendly to the idea of government assistance?",helene,hurricane
lr7n45v,t3_1fzv2y0,t1_lr6tw4z,southcarolina,nutfac,2024-10-10T05:44:39+00:00,3,(He’s not being sarcastic just bail on this one my guy),helene,hurricane
lr8h0z8,t3_1fzv2y0,t1_lr7jvi2,southcarolina,southcarolina-ModTeam,2024-10-10T11:16:43+00:00,1,This content was removed for  misinformation or unsubstantiated claims. Please backup factual claims with legitimate sources.,helene,hurricane
lr8vb71,t3_1fzv2y0,t3_1fzv2y0,southcarolina,Speakingfacts200,2024-10-10T13:05:36+00:00,-3,Lies,helene,hurricane
lr903wv,t3_1fzv2y0,t3_1fzv2y0,southcarolina,Equivalent_Gate_9984,2024-10-10T13:36:40+00:00,-4,Lmao sure,helene,hurricane
lr926xr,t3_1fzv2y0,t3_1fzv2y0,southcarolina,biggulp66,2024-10-10T13:49:40+00:00,1,To bad we sent all our money overseas response time terrible to help people,helene,hurricane
lr96er5,t3_1fzv2y0,t1_lr4h0se,southcarolina,KrazyMoose,2024-10-10T14:14:54+00:00,1,TIL this account is a day old,helene,hurricane
lr99ao8,t3_1fzv2y0,t1_lr734jg,southcarolina,southcarolina-ModTeam,2024-10-10T14:31:24+00:00,1,This content was removed for  misinformation or unsubstantiated claims. Please backup factual claims with legitimate sources.,helene,hurricane
lr9gdnl,t3_1fzv2y0,t1_lr926xr,southcarolina,southcarolina-ModTeam,2024-10-10T15:11:15+00:00,2,This content was removed for  misinformation or unsubstantiated claims. Please backup factual claims with legitimate sources.,helene,hurricane
lr9hl8k,t3_1fzv2y0,t1_lr6jhiy,southcarolina,theninetyninthstraw,2024-10-10T15:17:56+00:00,2,Would you rather they had golfed once every 5.6 days in office?,helene,hurricane
lr9hujw,t3_1fzv2y0,t3_1fzv2y0,southcarolina,[deleted],2024-10-10T15:19:22+00:00,1,[removed],helene,hurricane
lr9i162,t3_1fzv2y0,t1_lr9hl8k,southcarolina,teeje_mahal,2024-10-10T15:20:22+00:00,-2,Yes?,helene,hurricane
lr9x7mm,t3_1fzv2y0,t3_1fzv2y0,southcarolina,Greensmechanic88,2024-10-10T16:43:23+00:00,-1,Fema wants itemized receipts and a note from your doctor saying your medication has to be refrigerated if you want money back for the generator.,helene,hurricane
lr9xc0a,t3_1fzv2y0,t1_lr4fa8m,southcarolina,slickd3aler,2024-10-10T16:44:03+00:00,2,Don't they have to come to your house to check the damage?,helene,hurricane
lra74fp,t3_1fzv2y0,t1_lr6t24o,southcarolina,[deleted],2024-10-10T17:36:20+00:00,1,[deleted],helene,hurricane
lrabi2h,t3_1fzv2y0,t3_1fzv2y0,southcarolina,Itchy_Good_8003,2024-10-10T17:59:40+00:00,0,"This is a fake account impersonating the White House, this is fake news you found it.",helene,hurricane
lrabuh1,t3_1fzv2y0,t3_1fzv2y0,southcarolina,[deleted],2024-10-10T18:01:30+00:00,1,[removed],helene,hurricane
lrae0l7,t3_1fzv2y0,t1_lrabuh1,southcarolina,southcarolina-ModTeam,2024-10-10T18:13:15+00:00,2,"Your content was removed for not being civil. Content not allowed includes, but is not limited to: insults, personal attacks, incivility, trolling, bigotry, racism, and excessive profanity.",helene,hurricane
lraml3z,t3_1fzv2y0,t1_lr9x7mm,southcarolina,UralRider53,2024-10-10T18:59:18+00:00,2,Post it.,helene,hurricane
lran36k,t3_1fzv2y0,t1_lrabi2h,southcarolina,UralRider53,2024-10-10T19:01:59+00:00,4,"Bot, just look up FEMA phone number. trump hates that the Government is actually working as it should.",helene,hurricane
lranv2q,t3_1fzv2y0,t1_lr7cpwd,southcarolina,UralRider53,2024-10-10T19:06:13+00:00,3,Something the Orange Coward/Sexual Abuser doesn’t have.,helene,hurricane
lrar8cj,t3_1fzv2y0,t3_1fzv2y0,southcarolina,Glad_Assistance_9155,2024-10-10T19:24:20+00:00,0,Not bad...Lebanon got $157 million without a hurricane.,helene,hurricane
lratq6y,t3_1fzv2y0,t1_lrar8cj,southcarolina,southcarolina-ModTeam,2024-10-10T19:37:44+00:00,2,"Your content was removed for one of the following reasons:
* Being disruptive, designed to start fights, or otherwise cause issues in the sub
* Low-quality content, trolling, etc.
* Posts from bots
* Posts posted to multiple subreddits",helene,hurricane
lratsb7,t3_1fzv2y0,t1_lrabi2h,southcarolina,southcarolina-ModTeam,2024-10-10T19:38:03+00:00,2,This content was removed for  misinformation or unsubstantiated claims. Please backup factual claims with legitimate sources.,helene,hurricane
lratu91,t3_1fzv2y0,t1_lr9x7mm,southcarolina,southcarolina-ModTeam,2024-10-10T19:38:20+00:00,1,This content was removed for  misinformation or unsubstantiated claims. Please backup factual claims with legitimate sources.,helene,hurricane
lraunz9,t3_1fzv2y0,t1_lr4sq5k,southcarolina,16F33,2024-10-10T19:42:42+00:00,1,The questions are written by lawyers for a reason.,helene,hurricane
lravnx0,t3_1fzv2y0,t1_lr6ochz,southcarolina,Prestigious-Joke-479,2024-10-10T19:47:57+00:00,1,Agree.,helene,hurricane
lrayklx,t3_1fzv2y0,t1_lr4sq5k,southcarolina,ItsJust_ME,2024-10-10T20:03:24+00:00,2,"Call in and talk to a human being. Any online forms can be confusing at times. The FEMA Helpline has been really helpful (npi) in these situations. May take some time to get through, but they can usually answer these questions for you and clear up the confusion.",helene,hurricane
lrb75ya,t3_1fzv2y0,t3_1fzv2y0,southcarolina,Glad_Assistance_9155,2024-10-10T20:48:35+00:00,-2,This will be deleted too. I was unable to comment on the censorship on the page. It's disguised bit it's censorship.,helene,hurricane
lrbe1v7,t3_1fzv2y0,t1_lrae0l7,southcarolina,[deleted],2024-10-10T21:26:29+00:00,1,[removed],helene,hurricane
lrbgw23,t3_1fzv2y0,t1_lrbe1v7,southcarolina,southcarolina-ModTeam,2024-10-10T21:42:59+00:00,2,"Yes, you're right. Your comment was more misinformation than incivil. Consider it removed for ""misinformation""",helene,hurricane
lrbnsrw,t3_1fzv2y0,t1_lr6wnzv,southcarolina,Guilty-Pin3836,2024-10-10T22:24:41+00:00,1,The one multiple republican governors are praising.,helene,hurricane
lrbxoex,t3_1fzv2y0,t1_lrae0l7,southcarolina,[deleted],2024-10-10T23:26:39+00:00,0,[removed],helene,hurricane
lrc04ue,t3_1fzv2y0,t1_lrbxoex,southcarolina,southcarolina-ModTeam,2024-10-10T23:42:06+00:00,1,"Your content was removed for not being civil. Content not allowed includes, but is not limited to: insults, personal attacks, incivility, trolling, bigotry, racism, and excessive profanity.",helene,hurricane
lrciq7f,t3_1fzv2y0,t1_lr72sal,southcarolina,Tangent_Odyssey,2024-10-11T01:38:37+00:00,1,"Same with DeSantis to be honest. He’s an absolute ghoul, even worse than McMaster, but credit where it’s due.

Now if we could only get their side of the aisle to agree that the feds/FEMA are working just as hard.",helene,hurricane
lrcjgs4,t3_1fzv2y0,t1_lrciq7f,southcarolina,ProudPatriot07,2024-10-11T01:43:18+00:00,4,"Oh I'm so sick of the FEMA hate and misinformation. People are getting approved each day and receiving the funds. The people who were initially denied are reapplying and getting the $750. 

The folks who are saying the government should be doing ALL THE WORK of clearing the roads and debris and damage in small towns, are also of the party that says they are for smaller government. 

So they think the government is doing a terrible job, but also believe FEMA shouldn't be funded so that they can do the job they are already doing. Hmmm... 

I'm in Charleston and we've had our share of evacuations during McMaster's term, and everything has gone smoothly. Yes they have been very early evacuations, and maybe folks argue they are not necessary. But I'd rather him be too cautious than botch them and people get hurt or killed.",helene,hurricane
lrd9pym,t3_1fzv2y0,t1_lr96er5,southcarolina,southcarolina-ModTeam,2024-10-11T04:55:56+00:00,0,This content was removed for  misinformation or unsubstantiated claims. Please backup factual claims with legitimate sources.,helene,hurricane
lrdakko,t3_1fzv2y0,t1_lr4h0se,southcarolina,Top_Front7552,2024-10-11T05:03:49+00:00,1,77.2 million compared to Ukraine hundred billions sound they loved  Ukraine more than their own country.,helene,hurricane
lrdy1dk,t3_1fzv2y0,t1_lrdakko,southcarolina,AcrobaticLadder4959,2024-10-11T09:23:18+00:00,7,"Remember, these states also have their own resources. If they need more, they will get more. Look up the number of republican politicians who voted against funding FEMA.",helene,hurricane
lre1pxu,t3_1fzv2y0,t1_lrdakko,southcarolina,AdventureTiger,2024-10-11T10:06:09+00:00,6,We sent Ukraine arms… that have a dollar value (not dollars),helene,hurricane
lrek7h4,t3_1fzv2y0,t1_lrdakko,southcarolina,Fantastic-Cricket705,2024-10-11T12:46:24+00:00,-1,This has been debunked.  Maybe stop listening to idiots,helene,hurricane
lreo9hk,t3_1fzv2y0,t1_lre1pxu,southcarolina,Top_Front7552,2024-10-11T13:13:24+00:00,-1,Cost nothing to make weapons?,helene,hurricane
lreopbz,t3_1fzv2y0,t1_lreo9hk,southcarolina,Top_Front7552,2024-10-11T13:16:15+00:00,-2,It costs nothing to make weapons?,helene,hurricane
lreow7n,t3_1fzv2y0,t1_lre1pxu,southcarolina,Top_Front7552,2024-10-11T13:17:28+00:00,1,It costs nothing to make weapons?,helene,hurricane
lreprti,t3_1fzv2y0,t1_lreow7n,southcarolina,AdventureTiger,2024-10-11T13:23:06+00:00,8,"Stockpile weapons we have already made years ago ;)

New weapons contracts are part of the annual military budget and creation of them creates jobs in America. Those weapons will update our military stockpiles. 

Also, this is a thread about hurricane recovery (which republicans have consistently voted against)

You argue in bad faith.",helene,hurricane
lrez5q9,t3_1fzv2y0,t3_1fzv2y0,southcarolina,No_Bandicoot_994,2024-10-11T14:19:56+00:00,2,Wanna see what this administration is doing?  Watch the real story from the real guys there. [https://youtu.be/KgPYPEnmYnc?si=kwEYlz9i1\_c\_bmN9](https://youtu.be/KgPYPEnmYnc?si=kwEYlz9i1_c_bmN9)  Shawn Ryan with the real story.,helene,hurricane
lrf9w2z,t3_1fzv2y0,t3_1fzv2y0,southcarolina,Aggressive-Try-5506,2024-10-11T15:20:09+00:00,-3,"Lost your home? Here's $750!

Oh Mr. Zelenskyy, here is your next billion dollar payment for that ""war"" \*wink\* \*wink\*",helene,hurricane
lrfd8zz,t3_1fzv2y0,t1_lreprti,southcarolina,Top_Front7552,2024-10-11T15:38:31+00:00,0,"Okay, you are right. That is why we have a war every 20 years.",helene,hurricane
lrfkux2,t3_1fzv2y0,t1_lrfd8zz,southcarolina,AdventureTiger,2024-10-11T16:19:48+00:00,6,"Sure! and we could talk about that… in a conversation about the military industrial complex. 

This one’s about disaster relief.",helene,hurricane
lrfyhfl,t3_1fzv2y0,t1_lrek7h4,southcarolina,Mysterious-Wasabi103,2024-10-11T17:33:17+00:00,1,Ya like how many times do they get to outright lie to you before you realize maybe don't listen to them in the first place?,helene,hurricane
lrg2dfg,t3_1fzv2y0,t1_lrdakko,southcarolina,Specialist_Ad9073,2024-10-11T17:54:10+00:00,6,"Well, tell your reps to get their asses back to work and fund FEMA.",helene,hurricane
lrg2k5j,t3_1fzv2y0,t1_lreprti,southcarolina,Specialist_Ad9073,2024-10-11T17:55:12+00:00,2,Look at their profile. You are the longest conversation they’ve had on Reddit.,helene,hurricane
lrga6qz,t3_1fzv2y0,t1_lrfd8zz,southcarolina,Boring_Vanilla4024,2024-10-11T18:36:55+00:00,5,Why are Trump supports so anti-military these days? Defunding the US military like Trump wants to do is a horrible idea.,helene,hurricane
lrgfezm,t3_1fzv2y0,t3_1fzv2y0,southcarolina,Greensmechanic88,2024-10-11T19:05:42+00:00,1,"My last comment was deleted for misinformation . This is a screenshot from fema. They will not cover the cost of a generator unless you have a medical reason. Here is your proof…

https://preview.redd.it/z3on6i8rd6ud1.png?width=1334&format=png&auto=webp&s=5c9dacf820129449c453530b05efc1db22087f0b",helene,hurricane
lrgjjil,t3_1fzv2y0,t1_lreprti,southcarolina,No-Refrigerator-7184,2024-10-11T19:28:54+00:00,1,Your argument makes no sense.  There is an opportunity cost of that money.  Instead of starting new projects you are replacing inventory.  There are finite resources within the budget.,helene,hurricane
lrgrgua,t3_1fzv2y0,t3_1fzv2y0,southcarolina,CSA1864,2024-10-11T20:13:18+00:00,0,Worst disaster response ever.,helene,hurricane
lrgrvje,t3_1fzv2y0,t1_lrez5q9,southcarolina,CSA1864,2024-10-11T20:15:36+00:00,1,That was great. Kamala made them load up a truck full of supplies for a photo op and then the truck never delivered the supplies anywhere.,helene,hurricane
lrgvp8n,t3_1fzv2y0,t1_lrg2k5j,southcarolina,AdventureTiger,2024-10-11T20:36:58+00:00,3,Honestly why I stopped responding years ago… trolls never change,helene,hurricane
lrgxpc2,t3_1fzv2y0,t3_1fzv2y0,southcarolina,[deleted],2024-10-11T20:48:12+00:00,1,[removed],helene,hurricane
lrh3d9f,t3_1fzv2y0,t1_lrfd8zz,southcarolina,Honest-Yogurt4126,2024-10-11T21:21:03+00:00,1,And a Bush started the last 3 wars,helene,hurricane
lrh56f6,t3_1fzv2y0,t1_lrgxpc2,southcarolina,southcarolina-ModTeam,2024-10-11T21:31:52+00:00,1,This content was removed for  misinformation or unsubstantiated claims. Please backup factual claims with legitimate sources.,helene,hurricane
lrhnhit,t3_1fzv2y0,t1_lr9xc0a,southcarolina,superfly355,2024-10-11T23:29:24+00:00,1,"For damage to structure, yes. Thsi initial payments they're making just to get people money to live are quickly approved. I received the $300 check today. I was expecting a loaded debit card, happy to see a check. Still wish I could have gone back and changed it to direct deposit, but I was exhausted when I applied and wasn't thinking. They're not going to come out to look at rotten food. A hole in the roof or flooded house, yes. Most people in our area don't have flood insurance, that's where FEMA comes in.",helene,hurricane
lriu4cl,t3_1fzv2y0,t1_lrf9w2z,southcarolina,VoteforWomensRights,2024-10-12T04:48:24+00:00,2,Congress sets the dollar amount for the first initial cash grant. They raised it from the 500.00 it was under trump.,helene,hurricane
