id,link_id,parent_id,subreddit,author,created_utc,score,body,hurricane,keyword_hit
lqzllmb,t3_1fz6k4f,t3_1fz6k4f,pics,RamsesThePigeon,2024-10-08T19:45:54+00:00,1,"Before we get any accusations of impersonation, /u/whitehouse is indeed the official Reddit account for a now-defunct website featuring softcore pornogr... no, wait, sorry. No, it actually is the official Reddit account for the White House.

All things considered, it's probably reassuring that the account has so little activity.

On another note, Rule 1 is not being violated here, as the *focus* of the image is not the screen.

Finally – and as always – consider this a friendly reminder that vitriol, bigotry, misinformation, taunting of Happy Fun Ball, and other such incivility will result in immediate and permanent bans.",helene,milton
lqzmrt6,t3_1fz6k4f,t3_1fz6k4f,pics,dupontnw,2024-10-08T19:52:22+00:00,-19,Is anything being done to help people in the Tampa area evacuate that are unable to do it on their own?,helene,milton
lqznxkh,t3_1fz6k4f,t3_1fz6k4f,pics,max,2024-10-08T19:58:46+00:00,741,that is a nice painting.,helene,milton
lqzooh0,t3_1fz6k4f,t3_1fz6k4f,pics,expellyamos,2024-10-08T20:02:54+00:00,0,Official white house account's first post on a >2 year old account being a photo op to farm karma is the most reddit thing I've ever seen,helene,milton
lqzqh5a,t3_1fz6k4f,t3_1fz6k4f,pics,Option420s,2024-10-08T20:12:54+00:00,-92,Lol nice post nerds you only got 54 upvotes,helene,milton
lqzr74x,t3_1fz6k4f,t3_1fz6k4f,pics,processedmeat,2024-10-08T20:16:54+00:00,160,Could they use mar a Lago as a fema camp?,helene,milton
lqzrbb2,t3_1fz6k4f,t1_lqzmrt6,pics,Blitzking11,2024-10-08T20:17:33+00:00,47,"As much as is possible with DeSantis refusing to communicate and collaborate with the federal resources being offered.

Blood will be on DeSantis' hands, but what else is new.",helene,milton
lqzs5wd,t3_1fz6k4f,t1_lqznxkh,pics,backpackwayne,2024-10-08T20:22:17+00:00,243,Teddy Roosevelt,helene,milton
lqzsnnq,t3_1fz6k4f,t3_1fz6k4f,pics,[deleted],2024-10-08T20:25:01+00:00,1,[deleted],helene,milton
lqzsp78,t3_1fz6k4f,t3_1fz6k4f,pics,SlugmaMugma,2024-10-08T20:25:15+00:00,6,nice,helene,milton
lqzswfy,t3_1fz6k4f,t3_1fz6k4f,pics,valt10,2024-10-08T20:26:22+00:00,8210,"If these people don’t need to turn the camera on during their Zoom with the president, I’m not turning mine on.",helene,milton
lqzt6sn,t3_1fz6k4f,t3_1fz6k4f,pics,Bigmatt72401,2024-10-08T20:27:57+00:00,359,Why is there no McDonalds strewn everywhere?!,helene,milton
lqztok4,t3_1fz6k4f,t3_1fz6k4f,pics,MajorLazy,2024-10-08T20:30:42+00:00,9,"God bless America, competency and organization never looked so good",helene,milton
lqztzb2,t3_1fz6k4f,t3_1fz6k4f,pics,GMEN999,2024-10-08T20:32:23+00:00,219,"Mr President, all we need is a bunch of paper towels.",helene,milton
lqzu8dq,t3_1fz6k4f,t3_1fz6k4f,pics,mobert_roses,2024-10-08T20:33:50+00:00,2,Okay very specific question but why are there little white caps on top of the water glasses?? Do they have a purpose?,helene,milton
lqzua81,t3_1fz6k4f,t1_lqzrbb2,pics,xiconic,2024-10-08T20:34:07+00:00,15,"This is where social could actually do some good by helping to spread awareness to people of the aid that is available to them even if DeSantis doesn't want you to know about it. Unfortunately the MAGA misinformation machine is probably in full swing to try get people to ignore the warnings and not seek help. Anyone spreading lies about the relief efforts or the severity of hurricane Milton have as much blood on their hands as DeSantis. But Republicans would rather cause a pile corpses they can point to and blame Democrats over working to help the victims and stand side by side with people they could help save.

To anyone out there in the path of hurricane Milton: No matter what you party alignment is, let's all come together to ensure peoaple can come out of this alive and safe. Politics can wait until every life can be saved is saved. If there is a reason for the two sides to come together in unity for something, saving lives is something I think both sides can agree on.",helene,milton
lqzukwu,t3_1fz6k4f,t3_1fz6k4f,pics,ATXKLIPHURD,2024-10-08T20:35:46+00:00,415,What?! No Sharpie!?,helene,milton
lqzuojn,t3_1fz6k4f,t3_1fz6k4f,pics,Decorus_Somes,2024-10-08T20:36:20+00:00,2,Does anyone know who all those people are? Or even some of them. I'd love to see how President Biden handles meetings like this VS how we have grown used to seeing him in front of a camera.,helene,milton
lqzux1v,t3_1fz6k4f,t1_lqzu8dq,pics,katfromjersey,2024-10-08T20:37:39+00:00,11,To keep dust out until someone is ready to use them.,helene,milton
lqzuy0c,t3_1fz6k4f,t1_lqzrbb2,pics,pingmachine,2024-10-08T20:37:48+00:00,-5,"It has been said by DeSantis during a press briefing, and repeated during subsequent questioning. DeSantis has stated Florida is getting everything they have requested, and has spoken with the President and FEMA director, and also reminded folks during a press conference that this is not the time for politics, and instead a time to prepare and take care of ALL Floridians.

I appreciate all the extra communication channels, and this is not the time to get political, and we need to get back to a state of civility for the country. (here's looking at both sides) We are all Americans, and need to take care of all Americans.  Thank you, Mr. President.

Praying for Florida, and all those affected.",helene,milton
lqzv5lr,t3_1fz6k4f,t3_1fz6k4f,pics,Sunkisty,2024-10-08T20:38:58+00:00,532,It’s nice to see the White House stepping in to disseminate important information about the Hurricane,helene,milton
lqzv8z4,t3_1fz6k4f,t3_1fz6k4f,pics,Humans_Suck-,2024-10-08T20:39:29+00:00,-42,I thought he quit,helene,milton
lqzvgzs,t3_1fz6k4f,t1_lqzs5wd,pics,THE-BS,2024-10-08T20:40:43+00:00,115,it's actually Tony & Pie-Oh-My,helene,milton
lqzvhi2,t3_1fz6k4f,t3_1fz6k4f,pics,heels_n_skirt,2024-10-08T20:40:48+00:00,5,It's better than a golfing meeting during a crisis,helene,milton
lqzviu9,t3_1fz6k4f,t3_1fz6k4f,pics,FandomMenace,2024-10-08T20:41:00+00:00,0,"They're trying to decide how hard to control the weather this time. They can't make it too obvious, or Republicans will catch on and try to stop them.",helene,milton
lqzvk0b,t3_1fz6k4f,t1_lqzswfy,pics,TheDrummerMB,2024-10-08T20:41:12+00:00,8,"**Dawn Myers O'Connell** is an American attorney and health advisor who currently serves as the [Assistant Secretary of Health and Human Services for Preparedness and Response](https://en.wikipedia.org/wiki/Office_of_the_Assistant_Secretary_for_Preparedness_and_Response).[^(\[1\])](https://en.wikipedia.org/wiki/Dawn_O%27Connell#cite_note-1)

**Thomas Edward Perez** (born October 7, 1961) is an American politician and attorney currently serving as [senior advisor to the president of the United States](https://en.wikipedia.org/wiki/Senior_advisor_to_the_president_of_the_United_States) and director of the [White House Office of Intergovernmental Affairs](https://en.wikipedia.org/wiki/White_House_Office_of_Intergovernmental_Affairs), holding both positions since June 2023.

The **White House** is the [official residence](https://en.wikipedia.org/wiki/Official_residence) and workplace of the [president of the United States](https://en.wikipedia.org/wiki/President_of_the_United_States). Located at 1600 [Pennsylvania Avenue](https://en.wikipedia.org/wiki/Pennsylvania_Avenue) [NW](https://en.wikipedia.org/wiki/Northwest_(Washington,_D.C.)) in [Washington, D.C.](https://en.wikipedia.org/wiki/Washington,_D.C.)",helene,milton
lqzvttp,t3_1fz6k4f,t1_lqzs5wd,pics,lyon810,2024-10-08T20:42:43+00:00,18,Robin Williams,helene,milton
lqzw0jb,t3_1fz6k4f,t1_lqzvgzs,pics,backpackwayne,2024-10-08T20:43:46+00:00,1,Bully! Bully!,helene,milton
lqzw5ao,t3_1fz6k4f,t3_1fz6k4f,pics,Island_Groooovies,2024-10-08T20:44:30+00:00,108,"Seems like a great time to declare a climate emergency to me. Back to back hurricanes, and it’s only gonna get worse until we stop burning fossil fuels.",helene,milton
lqzw91r,t3_1fz6k4f,t3_1fz6k4f,pics,cwk415,2024-10-08T20:45:05+00:00,0,I was told he was at the beach!!,helene,milton
lqzwijm,t3_1fz6k4f,t3_1fz6k4f,pics,[deleted],2024-10-08T20:46:34+00:00,1,[removed],helene,milton
lqzx8q1,t3_1fz6k4f,t3_1fz6k4f,pics,WearsTheLAMsauce,2024-10-08T20:50:40+00:00,1,Why’s this guy even show up to work anymore?  ,helene,milton
lqzxfmd,t3_1fz6k4f,t3_1fz6k4f,pics,IcyShoes,2024-10-08T20:51:43+00:00,1,They are deliberating on where to deploy the weather machine next,helene,milton
lqzxir6,t3_1fz6k4f,t3_1fz6k4f,pics,[deleted],2024-10-08T20:52:13+00:00,1,[removed],helene,milton
lqzxpys,t3_1fz6k4f,t1_lqzllmb,pics,[deleted],2024-10-08T20:53:21+00:00,1,[deleted],helene,milton
lqzxqyg,t3_1fz6k4f,t3_1fz6k4f,pics,Proper-Salamander-84,2024-10-08T20:53:30+00:00,21,I am not seeing a sharpie in sight to allow Biden as President to chart the path of the hurricane…weird,helene,milton
lqzxz5a,t3_1fz6k4f,t3_1fz6k4f,pics,Mediumish_Trashpanda,2024-10-08T20:54:46+00:00,69,I like the Teddy Roosevelt painting in the background,helene,milton
lqzy7nr,t3_1fz6k4f,t3_1fz6k4f,pics,Tacomaguy24,2024-10-08T20:56:07+00:00,-4,Did he stay awake the whole time?,helene,milton
lqzy8wt,t3_1fz6k4f,t3_1fz6k4f,pics,gruss_gott,2024-10-08T20:56:18+00:00,1,Where are the controls to generate & target the hurricane?,helene,milton
lqzyb9q,t3_1fz6k4f,t1_lqzuojn,pics,Swimming_Farm_1340,2024-10-08T20:56:40+00:00,-17,Holy shit give it a rest,helene,milton
lqzydzi,t3_1fz6k4f,t1_lqzqh5a,pics,Swimming_Farm_1340,2024-10-08T20:57:06+00:00,15,"I’m seeing 500, little guy.",helene,milton
lqzyhhp,t3_1fz6k4f,t3_1fz6k4f,pics,epikdollar,2024-10-08T20:57:40+00:00,-4,Hello Whitehouse,helene,milton
lqzymma,t3_1fz6k4f,t1_lqzvgzs,pics,Doctor1337,2024-10-08T20:58:28+00:00,26,"Heh heh, taken from Paulie Walnuts",helene,milton
lqzymzk,t3_1fz6k4f,t1_lqzrbb2,pics,bigbadwolf90,2024-10-08T20:58:32+00:00,-8,"Biden commended desantis on his communication and collaboration but go off girl. 

(It helps to have more than just reddit as your information source 😉)",helene,milton
lqzynug,t3_1fz6k4f,t3_1fz6k4f,pics,MolassesSubstantial,2024-10-08T20:58:39+00:00,1,Total incompetence… can’t wait for Trump to take control again!,helene,milton
lqzys25,t3_1fz6k4f,t1_lqzswfy,pics,gaffs82,2024-10-08T20:59:18+00:00,1191,😂 Dawn and Thomas were in their PJs!,helene,milton
lqzyzpc,t3_1fz6k4f,t1_lqzydzi,pics,Option420s,2024-10-08T21:00:29+00:00,-26,man I wish you were here 47 minutes ago!!,helene,milton
lqzz110,t3_1fz6k4f,t3_1fz6k4f,pics,Holiday_Sense_4842,2024-10-08T21:00:42+00:00,1,Thursday morning. De santis or however you spell his name will complain that the government did nothing,helene,milton
lqzzp94,t3_1fz6k4f,t1_lqzyb9q,pics,Decorus_Somes,2024-10-08T21:04:37+00:00,13,Give what a rest? If you don't think President Biden can handle a scenario like this he has a track record of doing just that. You trumpers are wild,helene,milton
lqzzr88,t3_1fz6k4f,t1_lqzuojn,pics,MonseigneurChocolat,2024-10-08T21:04:57+00:00,14,"The guy sitting next to Biden looks like the Secretary of Agriculture, but I’m not entirely sure.

I have no clue who anyone else is, but I’m pretty sure there aren’t any cabinet members (other than, maybe, the Secretary of Agriculture).

The names given on the screen are Dawn O’Connell, the Assistant Secretary of Health and Human Services for Preparedness and Response and Thomas Perez (aka Tom Perez), the Senior Advisor to the President for Intergovernmental Affairs and the Director of the White House Office of Intergovernmental Affairs.

I’d say most of the others in attendance are in similar positions (either a senior appointee in a government department or in the Executive Office of the President).",helene,milton
lqzzwp8,t3_1fz6k4f,t3_1fz6k4f,pics,prrosey,2024-10-08T21:05:50+00:00,1,Can anyone tell me who's all in this room and on screen?,helene,milton
lr000qy,t3_1fz6k4f,t1_lqzt6sn,pics,distorted_kiwi,2024-10-08T21:06:29+00:00,143,"Not even Goya beans.

Does this guy even know how to market himself to corporations??",helene,milton
lr003ta,t3_1fz6k4f,t1_lqzswfy,pics,Abracadaver14,2024-10-08T21:06:59+00:00,80,Maybe they're in an Helene-hit area and have a poor internet connection.,helene,milton
lr003z5,t3_1fz6k4f,t3_1fz6k4f,pics,Keltoigael,2024-10-08T21:07:00+00:00,32,Can he override DeSantis and work with someone else to help the people of Flordia? At what point is it abuse to ignore aid?,helene,milton
lr004m6,t3_1fz6k4f,t3_1fz6k4f,pics,IUpVoteIronically,2024-10-08T21:07:06+00:00,1872,"Oh shit the Roosevelt room. 

The Roosevelt Room is located in the West Wing of the White House and was originally President Theodore Roosevelt’s office when the West Wing was built in 1902. In 1969, President Richard Nixon named the room after both Roosevelts, honoring Theodore for building the West Wing and Franklin D. for expanding it. The room features portraits of both presidents",helene,milton
lr006my,t3_1fz6k4f,t1_lqzswfy,pics,red4jjdrums5,2024-10-08T21:07:27+00:00,588,"They don’t make us IT people turn ours on. Because it’s accepted we won’t unless there’s a need. Besides, who wants to see unwashed, unkempt, ragged looking people in a meeting?

Sorry, Mr President, sir, I can’t let you see my lack of sleep and state of disarray.",helene,milton
lr0075p,t3_1fz6k4f,t1_lqzyzpc,pics,Swimming_Farm_1340,2024-10-08T21:07:32+00:00,11,Now it’s at 650. Does that upset you?,helene,milton
lr00b3o,t3_1fz6k4f,t1_lqzzr88,pics,Decorus_Somes,2024-10-08T21:08:09+00:00,1,Thank you!,helene,milton
lr00jca,t3_1fz6k4f,t1_lqzy7nr,pics,SmithersLoanInc,2024-10-08T21:09:28+00:00,0,Da comrade.,helene,milton
lr00nxs,t3_1fz6k4f,t1_lqzqh5a,pics,SmithersLoanInc,2024-10-08T21:10:13+00:00,11,What did your dad do to you?,helene,milton
lr00wfl,t3_1fz6k4f,t1_lqzv8z4,pics,Shiftymennoknight,2024-10-08T21:11:37+00:00,7,"do you really think not seeking reelection means he quit being President?

![gif](giphy|gj0QdZ9FgqGhOBNlFS|downsized)",helene,milton
lr014kk,t3_1fz6k4f,t1_lqzllmb,pics,myredditthrowaway201,2024-10-08T21:12:56+00:00,1,"lol, they should post in r/conservative. I want chaos",helene,milton
lr01a5r,t3_1fz6k4f,t1_lqztzb2,pics,WeBornToHula,2024-10-08T21:13:51+00:00,21,Please bring a T-shirt cannon for delivery,helene,milton
lr01fvl,t3_1fz6k4f,t1_lqzukwu,pics,WeBornToHula,2024-10-08T21:14:47+00:00,114,And that sure looks like a lot more than one page of briefing...,helene,milton
lr01tt8,t3_1fz6k4f,t1_lqzswfy,pics,VESUVlUS,2024-10-08T21:17:02+00:00,17,They probably can't figure out how to turn the cameras on in the first place. I bet they don't mute their mics when they're done talking either.,helene,milton
lr01zac,t3_1fz6k4f,t1_lqzvgzs,pics,myredditthrowaway201,2024-10-08T21:17:56+00:00,9,"What are you, a vegetarian? You eat beef and sausage by the fuckin carload.",helene,milton
lr0233h,t3_1fz6k4f,t1_lr006my,pics,RamsesThePigeon,2024-10-08T21:18:33+00:00,51,"This is going to sound like an exceptionally strange request, but would you mind editing your comment so that the necessary hyphen in ""ragged-looking"" is present?

I almost never see comments that include completely correct punctuation, and yours would be perfect if it included one tiny line.",helene,milton
lr02he0,t3_1fz6k4f,t1_lr00nxs,pics,Option420s,2024-10-08T21:20:55+00:00,-9,He told me it'd be funny to rule up people on reddit.com,helene,milton
lr02mmt,t3_1fz6k4f,t1_lqzzp94,pics,MAKE_PIZZA_NOT_WAR,2024-10-08T21:21:46+00:00,19,"His account is 7 days old, boring name, no posts, only political comments. He's gotta be fluent in either binary or Russian.",helene,milton
lr02vrj,t3_1fz6k4f,t1_lr006my,pics,Ok-disaster2022,2024-10-08T21:23:17+00:00,109,Only need is to maybe show a screen if youre presenting something.,helene,milton
lr0358d,t3_1fz6k4f,t3_1fz6k4f,pics,Redivivus,2024-10-08T21:24:51+00:00,1,Fake! AI generated! Nuke the hurricanes!,helene,milton
lr03cr2,t3_1fz6k4f,t1_lqzymzk,pics,Diarygirl,2024-10-08T21:26:06+00:00,8,I admire his tact in not telling DeSantis he's an idiot. I'm sure that wasn't easy.,helene,milton
lr03fc2,t3_1fz6k4f,t1_lqzvgzs,pics,ThisKidErrt,2024-10-08T21:26:33+00:00,13,mmmboy are you fat!,helene,milton
lr043wk,t3_1fz6k4f,t1_lqzs5wd,pics,jimmy__jazz,2024-10-08T21:30:39+00:00,7,"I believe this picture was taken in the Roosevelt Room at the White House. Depending which party the current president belongs to, they keep the Roosevelt of the same party hanging in the room. If a republican becomes president, they change to the other Roosevelt.",helene,milton
lr04eqb,t3_1fz6k4f,t1_lqztzb2,pics,Boring_Vanilla4024,2024-10-08T21:32:28+00:00,20,"This is going to be the wettest hurricane ever, in terms of water. Might even hit Alabama",helene,milton
lr04rr1,t3_1fz6k4f,t1_lqzqh5a,pics,rraattbbooyy,2024-10-08T21:34:39+00:00,3,"992 now. It’s gonna roll over any second. I can’t wait!!

![gif](giphy|uWzS6ZLs0AaVOJlgRd|downsized)",helene,milton
lr04tez,t3_1fz6k4f,t1_lr0233h,pics,red4jjdrums5,2024-10-08T21:34:55+00:00,37,Got it! I try to be correct most of the time. Thank you.,helene,milton
lr04wg8,t3_1fz6k4f,t3_1fz6k4f,pics,voxpopper,2024-10-08T21:35:26+00:00,5,"Funny, I've seen this posted both as, ""President Biden holds a briefing on Hurricane Milton...""   
and, """"VP Harris holds a briefing on Hurricane Milton...""   
Par for the Reddit course",helene,milton
lr053ze,t3_1fz6k4f,t1_lr04tez,pics,RamsesThePigeon,2024-10-08T21:36:42+00:00,22,"No, no, thank *you*.

Like I said, I know that it was a strange request, but I'm one of those bizarre individuals [who really, *really* appreciate punctuation](https://www.youtube.com/watch?v=zJQKrrhdnsU).",helene,milton
lr05595,t3_1fz6k4f,t1_lr03cr2,pics,bigbadwolf90,2024-10-08T21:36:54+00:00,-4,"Trust me, it’s very hard",helene,milton
lr05k7z,t3_1fz6k4f,t3_1fz6k4f,pics,RarityZ,2024-10-08T21:39:23+00:00,1,You'll literally never see a picture like this with Republicans,helene,milton
lr05prc,t3_1fz6k4f,t1_lqztzb2,pics,ThePopDaddy,2024-10-08T21:40:19+00:00,61,"""I need the biggest roll of paper towels you have...no, that's too big """,helene,milton
lr05x4v,t3_1fz6k4f,t3_1fz6k4f,pics,cocokronen,2024-10-08T21:41:33+00:00,19,A meeting about the impending worst us disaster ever.  Of course the governor of the state that will be impacted won't show up.,helene,milton
lr06jfr,t3_1fz6k4f,t3_1fz6k4f,pics,HungryHAP,2024-10-08T21:45:22+00:00,452,"U/Whitehouse also gave a FEMA update in the North Carolina Sub:

https://www.reddit.com/r/NorthCarolina/s/0IkEELUBO5

The r/Georgia sub mods BLOCKED it:",helene,milton
lr06o3v,t3_1fz6k4f,t1_lqzw5ao,pics,Key-Cranberry-1875,2024-10-08T21:46:11+00:00,-18,It will actually get worse if we stop burning fossil fuels.  You will have to look up global dimming to understand why.,helene,milton
lr06u8l,t3_1fz6k4f,t1_lr0075p,pics,Option420s,2024-10-08T21:47:15+00:00,-15,"No it doesn't upset me at all, I remember Obama getting like 100k updoots on his posts. 1k is pathetic lol",helene,milton
lr078ev,t3_1fz6k4f,t1_lr000qy,pics,BigLan2,2024-10-08T21:49:42+00:00,1,"To be fair, he ended the call with a ""Don't forget to buy a 'Hunter Biden' brand tarp to help with cleanup"" reminder, but most folks had already dropped off when he said it.",helene,milton
lr07jn5,t3_1fz6k4f,t1_lr043wk,pics,backpackwayne,2024-10-08T21:51:39+00:00,3,TIL,helene,milton
lr07kjz,t3_1fz6k4f,t3_1fz6k4f,pics,BigLan2,2024-10-08T21:51:50+00:00,39,"Biden should have been handed a blank map and then used a sharpie to draw the real weather service cone on it, turned to the camera and given a smirk.


Oh wait, weather emergencies aren't the right time for presidents to be joking around.",helene,milton
lr07lc3,t3_1fz6k4f,t3_1fz6k4f,pics,SpiritualAd8998,2024-10-08T21:51:58+00:00,-14,Trump is golfing or on the can tweeting.,helene,milton
lr08cvd,t3_1fz6k4f,t3_1fz6k4f,pics,chaossushi,2024-10-08T21:56:48+00:00,-1,Biden doesn’t even know where he is,helene,milton
lr08df9,t3_1fz6k4f,t1_lr004m6,pics,PaulsRedditUsername,2024-10-08T21:56:54+00:00,681,And it's right across the hall from the Oval Office which I learned from watching The West Wing.,helene,milton
lr08nca,t3_1fz6k4f,t1_lqzt6sn,pics,Soapbox,2024-10-08T21:58:41+00:00,-8,Have you seen the price of a McDonald's meal under Biden? Unaffordable.,helene,milton
lr08ty0,t3_1fz6k4f,t1_lr08df9,pics,IUpVoteIronically,2024-10-08T21:59:51+00:00,263,Fucking love the West Wing,helene,milton
lr090ye,t3_1fz6k4f,t1_lqzzr88,pics,CatchyUserNameHere,2024-10-08T22:01:07+00:00,13,"Lady to Biden’s left is Jennifer Granholm, Secretary of Energy.",helene,milton
lr094lw,t3_1fz6k4f,t1_lr000qy,pics,Soapbox,2024-10-08T22:01:47+00:00,25,"Biden beat Trump in wall street support in 2020 lol

https://www.cnbc.com/2020/10/28/wall-street-spends-74-million-to-support-joe-biden.html",helene,milton
lr094qt,t3_1fz6k4f,t3_1fz6k4f,pics,ternera,2024-10-08T22:01:48+00:00,1,"Hello, White House!",helene,milton
lr09h9z,t3_1fz6k4f,t3_1fz6k4f,pics,Th3TruthIs0utTh3r3,2024-10-08T22:04:05+00:00,22,Thank you for calm and sane response to these emergencies.  It's appreciated.,helene,milton
lr09tcc,t3_1fz6k4f,t3_1fz6k4f,pics,[deleted],2024-10-08T22:06:16+00:00,1,[removed],helene,milton
lr09zlz,t3_1fz6k4f,t1_lqzukwu,pics,gumbercules6,2024-10-08T22:07:26+00:00,24,No meatball Ron?,helene,milton
lr0aj6f,t3_1fz6k4f,t3_1fz6k4f,pics,BarrBiKyoo,2024-10-08T22:11:00+00:00,-1,"It was in here when Biden raved at the job DeSantis is doing, absolutely destroying kamals political narrative.",helene,milton
lr0ar1a,t3_1fz6k4f,t1_lqzt6sn,pics,AmishAvenger,2024-10-08T22:12:27+00:00,24,"Why are we talking about McDonald’s when we’re about to see one of the biggest hurricanes anyone has ever seen, one of the wettest, in terms of water?",helene,milton
lr0atbk,t3_1fz6k4f,t3_1fz6k4f,pics,ProtectUrNeckWU,2024-10-08T22:12:52+00:00,-6,Where is Desantis?,helene,milton
lr0awwu,t3_1fz6k4f,t3_1fz6k4f,pics,mancho98,2024-10-08T22:13:32+00:00,-10,Serious question... this is just for show right? It's not like the federal government can do anything at this point. Or are they sending the navy or ... to save people? ,helene,milton
lr0aycd,t3_1fz6k4f,t3_1fz6k4f,pics,Empty_Ad_1589,2024-10-08T22:13:47+00:00,0,"Why does this look like the most incompetent group of people? 

Clearly they made sure to have “one of each color” there.",helene,milton
lr0aypb,t3_1fz6k4f,t1_lqzzr88,pics,AmishAvenger,2024-10-08T22:13:51+00:00,4,Yes that’s Tom Vilsack.,helene,milton
lr0b02v,t3_1fz6k4f,t3_1fz6k4f,pics,Serialfornicator,2024-10-08T22:14:05+00:00,4,Why isn’t anyone throwing paper towels?,helene,milton
lr0b12n,t3_1fz6k4f,t3_1fz6k4f,pics,mybotanyaccount,2024-10-08T22:14:15+00:00,1,"Wait, you don't just throw rolls of towels? 
/S",helene,milton
lr0b4lu,t3_1fz6k4f,t3_1fz6k4f,pics,BigClitMcphee,2024-10-08T22:14:53+00:00,3,"If Trump was in this position, he'd be playing golf or something, not taking the biggest hurricane in decades seriously",helene,milton
lr0b575,t3_1fz6k4f,t3_1fz6k4f,pics,Superfly_McTurbo,2024-10-08T22:15:00+00:00,-10,Hes gotta be saying some crazy shit,helene,milton
lr0b5yp,t3_1fz6k4f,t3_1fz6k4f,pics,jmulldome,2024-10-08T22:15:08+00:00,1,"Surprised he's running this, and not Jill.",helene,milton
lr0b8ju,t3_1fz6k4f,t1_lqzt6sn,pics,Serialfornicator,2024-10-08T22:15:37+00:00,16,I was looking at the walls for ketchup stains,helene,milton
lr0b93s,t3_1fz6k4f,t3_1fz6k4f,pics,[deleted],2024-10-08T22:15:42+00:00,1,[removed],helene,milton
lr0bisf,t3_1fz6k4f,t1_lr006my,pics,zombie_overlord,2024-10-08T22:17:29+00:00,17,">unwashed, unkempt, ragged-looking people

I force them to look.",helene,milton
lr0blzx,t3_1fz6k4f,t3_1fz6k4f,pics,carlos2127,2024-10-08T22:18:05+00:00,1,West Wing really got that room right,helene,milton
lr0brke,t3_1fz6k4f,t1_lqztok4,pics,wirefog,2024-10-08T22:19:05+00:00,-13,I doubt Biden even knows what room he’s in he’s probably rambling off about ice cream and hair sniffing.,helene,milton
lr0brq0,t3_1fz6k4f,t3_1fz6k4f,pics,glibbertarian,2024-10-08T22:19:07+00:00,-21,Wheres Kamala?,helene,milton
lr0c1zd,t3_1fz6k4f,t3_1fz6k4f,pics,enfuego138,2024-10-08T22:20:58+00:00,99,"This is fine and all, but why isn’t he golfing and telling lies about the Federal Response like REAL LEADERS should? /s",helene,milton
lr0c2b4,t3_1fz6k4f,t3_1fz6k4f,pics,FoxyInTheSnow,2024-10-08T22:21:01+00:00,2,"I can’t tell if this is a real photo: their hands aren’t all deformed and weird, and Biden isn’t rescuing toddlers and their puppies from flood zones.",helene,milton
lr0c7yl,t3_1fz6k4f,t3_1fz6k4f,pics,Midwest_Dutch_Dude,2024-10-08T22:22:03+00:00,-20,"After that, they discuss how much more money they’ll send to Israel to fund their genocide of Palestine",helene,milton
lr0cc0y,t3_1fz6k4f,t1_lr0brke,pics,Castle-Fire,2024-10-08T22:22:47+00:00,8,What a sad world you live in where you think this could possibly be true or taken seriously in any way.,helene,milton
lr0ccwi,t3_1fz6k4f,t1_lr0atbk,pics,Benzosx,2024-10-08T22:22:57+00:00,10,In Florida?,helene,milton
lr0cf0l,t3_1fz6k4f,t3_1fz6k4f,pics,AggravatingQuality83,2024-10-08T22:23:21+00:00,1,u/admin,helene,milton
lr0cltz,t3_1fz6k4f,t1_lqzllmb,pics,Public-Eagle6992,2024-10-08T22:24:40+00:00,63,"Replying with that first half to the official Reddit account of the White House… that’s the one reason we all become moderators, isn’t it?",helene,milton
lr0cnik,t3_1fz6k4f,t3_1fz6k4f,pics,[deleted],2024-10-08T22:24:59+00:00,1,[removed],helene,milton
lr0csqu,t3_1fz6k4f,t3_1fz6k4f,pics,fuckyoudsshb,2024-10-08T22:25:58+00:00,1,Can you imagine turning off your camera in a meeting with the president…,helene,milton
lr0cvvr,t3_1fz6k4f,t1_lr0ccwi,pics,ProtectUrNeckWU,2024-10-08T22:26:34+00:00,-6,Sarcasm isn’t for everyone.,helene,milton
