id,link_id,parent_id,subreddit,author,created_utc,created_date,score,body,hurricane,source_type,keyword_hit
lorq4ow,t3_1foputk,t3_1foputk,sarasota,bshine,1727219076,2024-09-24 23:04,10,"Tri tips are $23 a lb now? Holyyyy

I’ve been shopping at the Hispanic marts for meat (bravo, key foods etc) can usually score some good deals. For instance They usually have choice picanha for $6-8 a lb",helene,community_discussion,
lorqm6s,t3_1foputk,t1_lorq4ow,sarasota,i_heart_kermit,1727219253,2024-09-24 23:07,0,Admittedly I shop for flavor not budget,helene,community_discussion,
lorqr0p,t3_1foputk,t1_lorqm6s,sarasota,bshine,1727219302,2024-09-24 23:08,1,"I hope to get there lolol 

Have you had picanha tho? I honestly prefer it to tri tip, although I will tear up either one!",helene,community_discussion,
lorv3c7,t3_1foputk,t1_lorqm6s,sarasota,UnecessaryCensorship,1727220864,2024-09-24 23:34,1,"Picanha can be quite tasty when cooked and eaten properly.  That is to say, you need to learn to eat it with the slab of fat.",helene,community_discussion,
lorw8x3,t3_1foputk,t3_1foputk,sarasota,23skidoobbq,1727221289,2024-09-24 23:41,1,$23/lb for scrap lol.,helene,community_discussion,
lorweyk,t3_1foputk,t1_lorw8x3,sarasota,i_heart_kermit,1727221350,2024-09-24 23:42,4,Marinated scrap that I didn't have to wait for,helene,community_discussion,
lorxg21,t3_1foputk,t1_lorv3c7,sarasota,i_heart_kermit,1727221727,2024-09-24 23:48,2,"Yeah I trimmed meat once for a living, it's nice to have someone do it for me",helene,community_discussion,
lorxrvm,t3_1foputk,t3_1foputk,sarasota,Internal_Load9332,1727221848,2024-09-24 23:50,4,I believe the tri tips are “tumbled”? Whatever that process is it makes the meat pretty amazing and although pricey it’s more than just marinade poured over some meat. So I justify the price to myself. Customer service there is always great too. Showed up 45 mins before they opened one day and the employee saw me try the door and let me in and happily helped me out.,helene,community_discussion,
loryit0,t3_1foputk,t1_lorxg21,sarasota,UnecessaryCensorship,1727222127,2024-09-24 23:55,2,"What I meant was, if you grew up in a household where you were taught to cut the fat away from any steak you were served and not eat it then you'll want to unlearn that habit.",helene,community_discussion,
los0mwp,t3_1foputk,t1_lorxrvm,sarasota,i_heart_kermit,1727222917,2024-09-25 00:08,1,Yeah when I pulled my 3 tri tips out of the bag it had whole mustard seed whole peppercorns obviously some soy sauce and definitely some sugar.  They know how to brine.,helene,community_discussion,
los43q8,t3_1foputk,t3_1foputk,sarasota,[deleted],1727224212,2024-09-25 00:30,1,[deleted],helene,community_discussion,
los46ee,t3_1foputk,t3_1foputk,sarasota,i_heart_kermit,1727224240,2024-09-25 00:30,6,"https://preview.redd.it/7dau5p6gouqd1.jpeg?width=1080&format=pjpg&auto=webp&s=98db2ed22638736dc9f93302694c3c0384714851

Behold my meat!",helene,community_discussion,
los4n1d,t3_1foputk,t1_los46ee,sarasota,i_heart_kermit,1727224411,2024-09-25 00:33,5,"Here are 2 of the 3 tri tips in my wildly-overpriced-as-voted-by-reddit pound of meat.   Sorry I didn't take a fancy Pic.  The red on the bottom is the reflection of my sweet under-cabinet lighting on the delicious, glistening, perfectly ratioed fat to protein ratio beef.",helene,community_discussion,
los4uso,t3_1foputk,t1_loryit0,sarasota,i_heart_kermit,1727224491,2024-09-25 00:34,5,I'm old and too much fat makes my stomach unhappy,helene,community_discussion,
los7e34,t3_1foputk,t1_los4uso,sarasota,UnecessaryCensorship,1727225426,2024-09-25 00:50,1,"You'll get just as much fat in a heavily marbled steak.  The thing with Picanha is there is so little fat in the meat, so it is much more difficult to cook and have it remain tender.",helene,community_discussion,
los9t00,t3_1foputk,t1_los46ee,sarasota,aew76,1727226345,2024-09-25 01:05,1,"Looks lovely, minus the paper plate",helene,community_discussion,
losa16a,t3_1foputk,t1_los9t00,sarasota,i_heart_kermit,1727226433,2024-09-25 01:07,2,I didn't eat it off that lol,helene,community_discussion,
losa56u,t3_1foputk,t1_lorv3c7,sarasota,cabesa-balbesa,1727226475,2024-09-25 01:07,2,What’s the proper way to cook a picanha?,helene,community_discussion,
losbv88,t3_1foputk,t3_1foputk,sarasota,Fltrashplant,1727227134,2024-09-25 01:18,3,"Southern steer is great! I’ll gladly pay for well trimmed tritips, getting one that needs to be trimmed puts me in a bad mood. Not trying to yuck anyone’s yum. Butcher block also has some really nice meat..",helene,community_discussion,
losckh0,t3_1foputk,t1_losa16a,sarasota,aew76,1727227404,2024-09-25 01:23,1,Thank goodness! 😅,helene,community_discussion,
losgops,t3_1foputk,t3_1foputk,sarasota,Legomybonsai,1727228979,2024-09-25 01:49,2,#Team steak tips / have been to SS a few times bit will give them a go.,helene,community_discussion,
losrdpv,t3_1foputk,t3_1foputk,sarasota,Smiling_Frog55,1727233229,2024-09-25 03:00,2,"These people don’t know what they’re missing! Your post is not about “here’s advice about budget meat!” A great post about a deserving product and company! That’s it, I need to go get some tips soon, thanks for reminding me!",helene,community_discussion,
losvcbp,t3_1foputk,t1_losa56u,sarasota,UnecessaryCensorship,1727234947,2024-09-25 03:29,1,"The proper way is making use of the fat cap.  You want to make sure that each bite has roughly the same proportions of fat cap and meat.  And because the rest of the meat is relatively lean, you need to be careful not to overcook it.

There are many different ways to do this, I think this is the easiest way to achieve great results:

https://www.bonappeteach.com/reverse-seared-picanha/",helene,community_discussion,
lou0vyh,t3_1foputk,t3_1foputk,sarasota,SwanOk6327,1727260378,2024-09-25 10:32,2,Alpine will do tri tip and pinch the holes in it.,helene,community_discussion,
lou75lp,t3_1foputk,t3_1foputk,sarasota,strplayr,1727263704,2024-09-25 11:28,1,Their prices are insane… it’s great but damn!!,helene,community_discussion,
lou9tfu,t3_1foputk,t3_1foputk,sarasota,Trx120217,1727264971,2024-09-25 11:49,3,My favorite cut is the wagyu sirloin @ 20 a lb.,helene,community_discussion,
loubmb1,t3_1foputk,t1_lou9tfu,sarasota,fredfly22,1727265785,2024-09-25 12:03,2,Yep i cook this in a sous vide and reverse sear on cast iron. Will rival most filets on tenderness and a better flavor,helene,community_discussion,
louc4sa,t3_1foputk,t1_loubmb1,sarasota,Trx120217,1727266013,2024-09-25 12:06,4,The flavor is fantastic. And you’re right. It’s basically filet. Sometimes they have the warface black garlic rub in stock there. It is phenomenal!,helene,community_discussion,
loud714,t3_1foputk,t1_louc4sa,sarasota,fredfly22,1727266480,2024-09-25 12:14,2,"Thanks for advise, I’ll try it",helene,community_discussion,
loula6h,t3_1foputk,t3_1foputk,sarasota,Maine302,1727269713,2024-09-25 13:08,2,"I'm from Massachusetts, where steak tips are very popular, unlike here. Doesn't $22.99/lb. seem awfully expensive for that cut of meat, or is it a different cut than used in New England?",helene,community_discussion,
loun1sw,t3_1foputk,t1_loula6h,sarasota,FLmanAppears,1727270378,2024-09-25 13:19,2,"Steak tips from the Hilltop in Saugus, mmmmm.  RIP Hilltop",helene,community_discussion,
louoihq,t3_1foputk,t1_loun1sw,sarasota,Maine302,1727270918,2024-09-25 13:28,2,"I preferred The Quiet Man, in Southie, myself. They really are a delicious cut.",helene,community_discussion,
louw5qb,t3_1foputk,t3_1foputk,sarasota,StillRope3479,1727273596,2024-09-25 14:13,1,Agreed these are so good!,helene,community_discussion,
louzksa,t3_1foputk,t3_1foputk,sarasota,Independent_Stick135,1727274727,2024-09-25 14:32,1,"Want to try quality products?  Stop by for lunch.

Focaccia Sandwich + Bakery
(941) 924-2268

 https://g.co/kgs/ULXSb8X",helene,community_discussion,
lovom5k,t3_1foputk,t1_los4n1d,sarasota,bshine,1727282620,2024-09-25 16:43,1,It’s looks really good,helene,community_discussion,
lowowok,t3_1foputk,t3_1foputk,sarasota,ithinkimlost69,1727293850,2024-09-25 19:50,3,Go on Tuesdays and they are $15.99 a lb. All of their chicken products are great as well and they are $3.99 a lb on Tuesday's as well,helene,community_discussion,
lp0ceop,t3_1foputk,t1_lou9tfu,sarasota,Tweedle59,1727353515,2024-09-26 12:25,1,Where do you buy this? Thank you.,helene,community_discussion,
lp0jng7,t3_1foputk,t1_lp0ceop,sarasota,Trx120217,1727356382,2024-09-26 13:13,2,Southern steer butcher over on bee ridge rd. I’d recommend getting them in baseball cuts.,helene,community_discussion,
los3ysy,t3_1foqeht,t3_1foqeht,sarasota,Luxemode,1727224162,2024-09-25 00:29,4,"Good for you enjoying your solitude before the storm. I wish I could adapt to that mindset! I have spent most of the day taking every single thing off of my lanai on my front porch like a crazy woman checking me spaghetti models every 15 minutes, oh, I’ll be honest every five minutes…",helene,community_discussion,storm
los7293,t3_1foqeht,t3_1foqeht,sarasota,i_heart_kermit,1727225303,2024-09-25 00:48,1,Where do seagulls roost during hurricanes?  Probably low lying ground versus trees I'd imagine..,helene,community_discussion,
losixnf,t3_1foqeht,t3_1foqeht,sarasota,seadpray27,1727229841,2024-09-25 02:04,3,The birds left my neighborhood shortly before noon today. It got so creepy silent. They know what's coming...,helene,community_discussion,
losrvif,t3_1foqeht,t3_1foqeht,sarasota,Particular_Savings60,1727233440,2024-09-25 03:04,1,They’ll head inland before the storm hits.,helene,community_discussion,storm
losilgz,t3_1fot3j6,t3_1fot3j6,sarasota,True_Dimension4344,1727229710,2024-09-25 02:01,7,Just left turtle beach and it was glorious.,helene,community_discussion,
losqvxd,t3_1fot3j6,t3_1fot3j6,sarasota,whatnowyouask,1727233023,2024-09-25 02:57,1,Was out tonight- nothing!,helene,community_discussion,
losnbni,t3_1fotbwo,t3_1fotbwo,sarasota,LittleRedB2300,1727231564,2024-09-25 02:32,2,What is your question?,helene,community_discussion,
louc987,t3_1fotbwo,t3_1fotbwo,sarasota,JonLGT,1727266068,2024-09-25 12:07,1,"So I do HVAC on mobile homes, probably ones in your neighborhood, and I can tell you that there is not much there to protect you. The standards for construction were not meant to withstand major hurricanes and while the forecast is taking the worst parts of the storm past us, I would still find a more safe place to be. There will still be plenty strong enough winds to peel back a roof on a mobile home, I guarantee you will find some with this damage or worse after the storm passes. Find a safe place to be now, there will be nobody to help you for hours if you do get trapped.",helene,community_discussion,storm
louza33,t3_1fotbwo,t1_losnbni,sarasota,Ok-Rhubarb-5774,1727274628,2024-09-25 14:30,1,And why ask it in Sarasota,helene,community_discussion,
loswelo,t3_1fov757,t3_1fov757,sarasota,Ruby_Red_34236,1727235428,2024-09-25 03:37,40,"https://preview.redd.it/8oy1miuplvqd1.jpeg?width=1080&format=pjpg&auto=webp&s=c4636303b85ee573a8c7fb9f30c34d603f024f9b

like this? lol 😆",helene,community_discussion,
loswr3k,t3_1fov757,t1_loswelo,sarasota,gunzrcool,1727235589,2024-09-25 03:39,3,"ugh, no.",helene,community_discussion,
losx07w,t3_1fov757,t3_1fov757,sarasota,destickl,1727235707,2024-09-25 03:41,29,"nice try, not telling you my local secrets, tourist.",helene,community_discussion,
losx9op,t3_1fov757,t1_losx07w,sarasota,gunzrcool,1727235827,2024-09-25 03:43,-11,"i forgot, only you live in srq. how silly of me.",helene,community_discussion,
losxc11,t3_1fov757,t1_losx9op,sarasota,destickl,1727235858,2024-09-25 03:44,14,it’s my world. everyone else is just visiting in it.,helene,community_discussion,
losz1w6,t3_1fov757,t1_losx9op,sarasota,MisterEinc,1727236676,2024-09-25 03:57,2,"Man, this is rough because I totally understand both sides...",helene,community_discussion,
lot0o2h,t3_1fov757,t3_1fov757,sarasota,2trnthmismycaus,1727237478,2024-09-25 04:11,1,This is a good question. Following,helene,community_discussion,
lot16uy,t3_1fov757,t3_1fov757,sarasota,Pubsubforpresident,1727237743,2024-09-25 04:15,156,"Drum circle people
Mennonite 3 wheel biker gang, with or without the motor. 
50cc scooter gang
$5,000 road bike, tight riding onesie wearing, no regard for traffic, Saturday morning ride gang. 
Actual motorcycle gang at stragglers
Everyone fighting over 2 ft. Waves surfing community. 
Disc golf on Tuesdays and Thursdays, skypilots rule!
Super pretentious trust fund baby artists on st. Amands circle art show people. Some art is cool until the artist start talking About problems that aren't real problems. (This is probably just one person but I'm willing to call it a a community because I like to put people into boxes)
Farmers market people
Running club at Big top brewing 
Homeless people community ironically outside the salvation army
Sarasota word of mouth fb group is like a community with some of the best roasting you will ever see
I've heard of the ""are we dating the same guy"" community on FB only available for Sarasota women
Restaurant worker community. You don't even have to know each other to know the struggle and #respect
Redneck community 
Wannabe redneck community (somehow bigger than the redneck community)
Gulf gate bar area people. You know the type. 
BNI people. Each group is like their own community and some are way less in your face about it than others.
Free manson communities. There a lot. 
Church people. Their mostly nice people.  Usually keep to their own church community. Bayside probably the biggest. 

I could go on...",helene,community_discussion,
lot1j15,t3_1fov757,t1_lot16uy,sarasota,gunzrcool,1727237915,2024-09-25 04:18,15,"This is amazing, thank you so much!",helene,community_discussion,
lot2dce,t3_1fov757,t1_lot1j15,sarasota,Pubsubforpresident,1727238347,2024-09-25 04:25,10,Motors are for alphas and their lineage. Or the opposite. I can't keep up with all the intricate rules of the many community options available in Sarasota,helene,community_discussion,
lot3gnt,t3_1fov757,t3_1fov757,sarasota,Antique-Respect8746,1727238918,2024-09-25 04:35,11,"All the 40-somethings getting into polyamory and/or psychedelics. It's a bit of a trope at this point, and slightly disturbing given the average local BMI.",helene,community_discussion,
lot3yqh,t3_1fov757,t1_lot2dce,sarasota,gunzrcool,1727239181,2024-09-25 04:39,7,I almost got ran over by a mennonite on a three wheeler on the sidewalk downtown so im very curious about this!,helene,community_discussion,
lotfuee,t3_1fov757,t3_1fov757,sarasota,jimthewhale1,1727246091,2024-09-25 06:34,22,I’m in a local metal detecting club,helene,community_discussion,
lotnmxl,t3_1fov757,t1_lot16uy,sarasota,dabrosch,1727251389,2024-09-25 08:03,20,Nailed it!,helene,community_discussion,
lotu1x7,t3_1fov757,t1_lot16uy,sarasota,TheRealRollestonian,1727255946,2024-09-25 09:19,9,Good reminder to check out the surfers tonight before Helene rolls in.,helene,community_discussion,helene
lotu49l,t3_1fov757,t3_1fov757,sarasota,Iamstu,1727255992,2024-09-25 09:19,21,Srq spotters that hang out by the airport and watch planes.,helene,community_discussion,
lotznqa,t3_1fov757,t3_1fov757,sarasota,Larbear06,1727259641,2024-09-25 10:20,10,"The BJJ scene is cool there. Gustavo Machado has a great gym, with lots of cool people.",helene,community_discussion,
lou19nt,t3_1fov757,t1_lot16uy,sarasota,EyeDontSeeAnything,1727260601,2024-09-25 10:36,2,This is very accurate.,helene,community_discussion,
lou1b9t,t3_1fov757,t3_1fov757,sarasota,skewh1989,1727260627,2024-09-25 10:37,29,"The Deadheads. You don't know they're around, but if a Grateful Dead family band, or even a GD cover band comes anywhere near Sarasota, they all crawl out of the woodwork, donning their tie-dyes and floppy-brimmed hats to dance like cats in heat.",helene,community_discussion,
lou1jag,t3_1fov757,t3_1fov757,sarasota,Warm-Patience-5002,1727260756,2024-09-25 10:39,4,"The lifeguard community is more like a mafia , It’s all about crazy workouts and the ocasional rescue or medical call . Bunch of maniacs.",helene,community_discussion,
lou2cmq,t3_1fov757,t3_1fov757,sarasota,oldyawker,1727261215,2024-09-25 10:46,7,"The Pickle Ball Community, and its subsets, the folks that hope to go Pro and everyone else.",helene,community_discussion,
lou2ful,t3_1fov757,t1_lot16uy,sarasota,Husker_Dad,1727261265,2024-09-25 10:47,5,My god. This is complete.,helene,community_discussion,
lou2k4u,t3_1fov757,t1_lot16uy,sarasota,Semi-Passable-Hyena,1727261331,2024-09-25 10:48,45,"My guy, I have lived here my entire life and I know everybody you just listed off. I love you.",helene,community_discussion,
lou35it,t3_1fov757,t1_lou2k4u,sarasota,Pubsubforpresident,1727261658,2024-09-25 10:54,12,"Hi, I love you too",helene,community_discussion,
lou75yp,t3_1fov757,t1_lou2cmq,sarasota,doubting_thomaseena,1727263709,2024-09-25 11:28,5,Came here to say the Pickle Ball community. SO much drama!,helene,community_discussion,
lou80a8,t3_1fov757,t1_lot3gnt,sarasota,Thanos_Stomps,1727264120,2024-09-25 11:35,13,“Not well known” probably doesn’t apply here after a certain school board member made national headlines.,helene,community_discussion,
lou8607,t3_1fov757,t1_lot16uy,sarasota,Which-Association211,1727264196,2024-09-25 11:36,-11,"DEI is alive and well in SRQ... 
We don't need any more talk, literature, policy around something that is already flourishing
Thank God that's over",helene,community_discussion,
lou8c2q,t3_1fov757,t1_lot16uy,sarasota,Bendzo,1727264277,2024-09-25 11:37,2,"Just an FYI, $5,000 is very cheap for a high quality road bike. Most of the ones you see run 8-14k.",helene,community_discussion,
lou8nw1,t3_1fov757,t1_lou8c2q,sarasota,Pubsubforpresident,1727264436,2024-09-25 11:40,16,"Lol, so Sarasota",helene,community_discussion,
loubwkc,t3_1fov757,t1_lot16uy,sarasota,gagekelly,1727265912,2024-09-25 12:05,2,wannabe redneck sheeeeesh🎯,helene,community_discussion,
loud6jp,t3_1fov757,t3_1fov757,sarasota,Nordy941,1727266474,2024-09-25 12:14,3,"Lots cool people in the boating world around here. 

As long as the winds are good the kitesurfing people are out on the north end of the skyway causeway most days.",helene,community_discussion,
loufdu5,t3_1fov757,t1_lot16uy,sarasota,what_whaaaat,1727267398,2024-09-25 12:29,5,"Oh my gosh...that was so good. Spot on 👌

Just had to reply to say thank you. Gave me a nice morning laugh 😂",helene,community_discussion,
loufsd6,t3_1fov757,t1_lot16uy,sarasota,Interesting-Fly-6891,1727267566,2024-09-25 12:32,5,"Golfing community

Pickleball groups",helene,community_discussion,
louhhpp,t3_1fov757,t1_loufdu5,sarasota,Pubsubforpresident,1727268253,2024-09-25 12:44,3,Hahaha thank you,helene,community_discussion,
louo10u,t3_1fov757,t3_1fov757,sarasota,HeuristicEnigma,1727270741,2024-09-25 13:25,3,[Sarasota Hash Hound Harriers](http://www.circushash.com),helene,community_discussion,
louo1xg,t3_1fov757,t1_loswelo,sarasota,inquisitivegent,1727270750,2024-09-25 13:25,3,Bahahaha,helene,community_discussion,
louohqw,t3_1fov757,t3_1fov757,sarasota,FloridaManArrives,1727270910,2024-09-25 13:28,11,Darkside hosts fighting game tournaments and Motoneko hosts a Smash Bros Ultimate tournament,helene,community_discussion,
louomvy,t3_1fov757,t1_lot16uy,sarasota,zone_eater,1727270963,2024-09-25 13:29,4,I'll add the hog hunters you see at the RaceTrac on fruitville in the early morning hours,helene,community_discussion,
lousx8v,t3_1fov757,t1_lot16uy,sarasota,Desperate-Injury3692,1727272494,2024-09-25 13:54,2,"Excellent list, hard to add to it...",helene,community_discussion,
louxaru,t3_1fov757,t1_lot3gnt,sarasota,shipwreckedpiano,1727273977,2024-09-25 14:19,5,I’d like to see that Venn diagram.,helene,community_discussion,
lov1pqh,t3_1fov757,t3_1fov757,sarasota,woohhaa,1727275421,2024-09-25 14:43,4,"F3 is a pretty cool fitness group if you like working out in parking lots at 5 am with a bunch of sweaty dudes. 

Village Idiots is a cycling club already mentioned. 

Sarasota Manatee Bicycling Club is another cycling group. 

Sarasota Storm is a local triathlon club.",helene,community_discussion,storm
lov3lz9,t3_1fov757,t3_1fov757,sarasota,hicksmomma3,1727276027,2024-09-25 14:53,0,NA,helene,community_discussion,
lov3sxn,t3_1fov757,t1_lotfuee,sarasota,hicksmomma3,1727276086,2024-09-25 14:54,3,"That’s pretty awesome, I would actually enjoy that.",helene,community_discussion,
lov5t1n,t3_1fov757,t3_1fov757,sarasota,SpaceBonez,1727276725,2024-09-25 15:05,4,"https://www.sarasota.tech
Just started and growing fast.",helene,community_discussion,
lov8he8,t3_1fov757,t3_1fov757,sarasota,VlcVic,1727277572,2024-09-25 15:19,11,"The Sho Fu Bonsai society is actually so awesome. If you have ever had an interest in the design and care of Bonsai Trees they have meetings, workshops, exhibits, competitions that they go to as a group, it’s so fun. The section of Bonsai’s at Selby is actually a collection from the society and they maintain them. Bonsai’s can be sort of intimidating to get into, they can be expensive to buy and hard to keep alive, but the group is super passionate and have lots of tips and tricks to help you. My Husband and I haven’t been able to attend in a while, but if we hope to have the time soon to start attending meetings again!",helene,community_discussion,
lovamcb,t3_1fov757,t1_lot16uy,sarasota,AnyInvestigator1859,1727278240,2024-09-25 15:30,2,"Well, done.",helene,community_discussion,
lovdy52,t3_1fov757,t1_lot16uy,sarasota,EarthDwellant,1727279284,2024-09-25 15:48,8,You left out Stoners but I forgot it's 2024 and we have taken over the world.,helene,community_discussion,
lovkq4x,t3_1fov757,t1_lot16uy,sarasota,br0zo,1727281405,2024-09-25 16:23,3,My god. A commenting master class. Thorough. Concise. Accurate. Phenomenal work. 👏,helene,community_discussion,
lovosfm,t3_1fov757,t1_lov8he8,sarasota,gunzrcool,1727282673,2024-09-25 16:44,2,They are cool! I attended a seminar they put on at selby a while back!,helene,community_discussion,
lovp1pi,t3_1fov757,t1_loubwkc,sarasota,gunzrcool,1727282753,2024-09-25 16:45,10,Larping as working class in a $100k pickup. Never understood that one.,helene,community_discussion,
lovpfr3,t3_1fov757,t1_lotfuee,sarasota,gunzrcool,1727282872,2024-09-25 16:47,3,What’s the coolest thing you’ve found?,helene,community_discussion,
lovpl6s,t3_1fov757,t1_lou75yp,sarasota,gunzrcool,1727282919,2024-09-25 16:48,2,Drama you say?? Talk!,helene,community_discussion,
lovqsaf,t3_1fov757,t1_lovpfr3,sarasota,jimthewhale1,1727283289,2024-09-25 16:54,5,"I’ve found tons of rings and jewelry, but my favorite finds are ones I recover for people or that I can return. But I’d say the craziest thing I’ve found was three buried bottles of wine on Holmes Beach last summer. I posted it awhile back. https://www.reddit.com/r/metaldetecting/s/dCkQpkAOnF",helene,community_discussion,
lovr7ra,t3_1fov757,t1_lovqsaf,sarasota,gunzrcool,1727283419,2024-09-25 16:56,1,"Wow, that’s wild… I have a detector as well (cheap one from dicks) and the only thing I found was a dead buried bird tangled up in fishing tackle. 😬",helene,community_discussion,
lovrb33,t3_1fov757,t1_lov3sxn,sarasota,jimthewhale1,1727283447,2024-09-25 16:57,4,"It’s a really fun hobby. Everytime you get a ping on the detector you never know what you’re gonna dig up. Plus, you get to clean the beaches! You would not believe how much trash we dig and clean up out of the water and sand.",helene,community_discussion,
lovrki0,t3_1fov757,t1_lovr7ra,sarasota,jimthewhale1,1727283525,2024-09-25 16:58,1,Oof 😞 luckily I’ve never dug up a dead animal before… but my advice would be to wait till next summer and just take it out over the dry sand. Unfortunately this year our season got kinda ruined due to the sewage leak after Debby,helene,community_discussion,
lovs1v4,t3_1fov757,t1_lot16uy,sarasota,captain_ked,1727283671,2024-09-25 17:01,2,Hahaha all this is accurate,helene,community_discussion,
lovxulx,t3_1fov757,t3_1fov757,sarasota,LycheeAppropriate315,1727285464,2024-09-25 17:31,2,"I’ll add Comicon type people, Scottish games people, Strongman people, Vespa Club of Sarasota….",helene,community_discussion,
lovxy2m,t3_1fov757,t1_lou35it,sarasota,LycheeAppropriate315,1727285493,2024-09-25 17:31,3,Omg the username…pristine 😂,helene,community_discussion,
low0nrb,t3_1fov757,t1_lot16uy,sarasota,elf25,1727286326,2024-09-25 17:45,5,Show cars and car club people. Ask at the museum near new college.,helene,community_discussion,
low6blu,t3_1fov757,t1_lot16uy,sarasota,Sir_FrancisCake,1727288073,2024-09-25 18:14,4,I am a member of the surf gang making the best out of shit breaks,helene,community_discussion,
lowegha,t3_1fov757,t1_lou2k4u,sarasota,Wysical_,1727290615,2024-09-25 18:56,5,Should I love him too?,helene,community_discussion,
lowex59,t3_1fov757,t1_loud6jp,sarasota,herecomesbeccanina9,1727290761,2024-09-25 18:59,1,They are today I drove past em twice.,helene,community_discussion,
lowgqwb,t3_1fov757,t1_loswelo,sarasota,herecomesbeccanina9,1727291335,2024-09-25 19:08,1,I need serious help cause wtaf even is this HELP ME🤣,helene,community_discussion,
lows9nz,t3_1fov757,t1_lowgqwb,sarasota,Ruby_Red_34236,1727294882,2024-09-25 20:08,4,"Have you ever seen different colored loofas on top of people's cars... roofcracks, antennas, etc?",helene,community_discussion,
lowtk1y,t3_1fov757,t1_lows9nz,sarasota,herecomesbeccanina9,1727295278,2024-09-25 20:14,3,Omg you're dead ass serious aren't you?! I was hoping this wasn't real! 😂,helene,community_discussion,
lox63wx,t3_1fov757,t3_1fov757,sarasota,mrsbaltar,1727299183,2024-09-25 21:19,3,The telescope people! Very cool group to see when a planet is in view.,helene,community_discussion,
