id,link_id,parent_id,subreddit,author,created_utc,created_date,score,body,hurricane,source_type,keyword_hit
logjtst,t3_1fn8wki,t3_1fn8wki,sarasota,SasquatchInFlipflops,1727054772,2024-09-23 01:26,5,Harley rider here.  I wave at everything except rental mopeds.,helene,community_discussion,
logju9t,t3_1fn8wki,t3_1fn8wki,sarasota,cabesa-balbesa,1727054776,2024-09-23 01:26,8,"Hey, bro, I know. Me and my homies are hard core Schwinn enthusiasts and these old fart here don’t ride like we do",helene,community_discussion,
loglu4f,t3_1fn8wki,t1_logju9t,sarasota,mindyluuuu,1727055556,2024-09-23 01:39,1,I'd ask to ride with you guys but I might have a hard time keeping up.,helene,community_discussion,
logm19q,t3_1fn8wki,t1_logjtst,sarasota,mindyluuuu,1727055633,2024-09-23 01:40,2,I dig this,helene,community_discussion,
logmb94,t3_1fn8wki,t1_loglu4f,sarasota,cabesa-balbesa,1727055741,2024-09-23 01:42,1, 🤪,helene,community_discussion,
logmkq7,t3_1fn8wki,t3_1fn8wki,sarasota,seraphofdark,1727055844,2024-09-23 01:44,3,We've lost a few while they were lane splitting.,helene,community_discussion,
logpbmp,t3_1fn8wki,t1_logmkq7,sarasota,Samtertriads,1727056944,2024-09-23 02:02,4,For real.  “Share the road” then drives 80 between cars in a traffic jam.,helene,community_discussion,
logqh44,t3_1fn8wki,t3_1fn8wki,sarasota,koolnube48,1727057415,2024-09-23 02:10,3,Sarasota bike life on Facebook 👍,helene,community_discussion,
logs75v,t3_1fn8wki,t3_1fn8wki,sarasota,Docto-Phibes-MD-PhD,1727058115,2024-09-23 02:21,-3,You know what we Harley riders say. I’ll wave when your bike grows up and becomes American made,helene,community_discussion,
logtiku,t3_1fn8wki,t1_logs75v,sarasota,mindyluuuu,1727058653,2024-09-23 02:30,3,Hey American made or not we're all just here for a good ride,helene,community_discussion,
loh9wir,t3_1fn8wki,t3_1fn8wki,sarasota,iKnowRobbie,1727066179,2024-09-23 04:36,3,"Sportbike rider here, we usually ride up to OCC every Thursday. Used to do Quaker Steak and Lube on wednesdays. That got lame once OCC opened up. Groups leave from Mobile on Fruitville around 6:30-7:00, and Racetrack in Palmetto at 7:30. Facebook group is ""941 area riders""

VFR1200 here, I go too damn fast to wave.",helene,community_discussion,
lohecgi,t3_1fn8wki,t1_loh9wir,sarasota,mindyluuuu,1727068669,2024-09-23 05:17,1,I'd love to ride with anyone I can. I only saw 941 riders and it's a pretty big group,helene,community_discussion,
loheeku,t3_1fn8wki,t1_loh9wir,sarasota,mindyluuuu,1727068703,2024-09-23 05:18,1,When's the next ride?,helene,community_discussion,
lojsevf,t3_1fn8wki,t1_logs75v,sarasota,UnecessaryCensorship,1727109850,2024-09-23 16:44,1,"Most of those guys have died of old age.

Also, those guys are turning over in their grave at the current state of the company.",helene,community_discussion,
lolf10n,t3_1fn8wki,t3_1fn8wki,sarasota,Bright-Swing1788,1727128252,2024-09-23 21:50,-1,Most of them are dead or sold their bike if they were smart,helene,community_discussion,
los6asb,t3_1fn8wki,t1_lolf10n,sarasota,mindyluuuu,1727225019,2024-09-25 00:43,1,Here for a good time not a long time,helene,community_discussion,
logyi2f,t3_1fn9yia,t3_1fn9yia,sarasota,skewh1989,1727060718,2024-09-23 03:05,2,Dr Romero at Palm Aire medical clinic is really good imo.,helene,community_discussion,
loh0t60,t3_1fn9yia,t3_1fn9yia,sarasota,kzupan,1727061682,2024-09-23 03:21,1,We've had really good care with Blue Pearl for emergencies. It will be expensive most likely bit they have helped in really dire times with our share pei. Our regular vet is Gulf Gate Animal Hospital and the Doctos there do seem to care but a second opinion is always good to have if you're ever on the fence.,helene,community_discussion,
loheatn,t3_1fn9yia,t1_logyi2f,sarasota,Rincewind4281,1727068641,2024-09-23 05:17,1,This is who I’ve gone to in the area as well. Highly recommend him.,helene,community_discussion,
lohqeuj,t3_1fn9yia,t1_loh0t60,sarasota,Boomshtick414,1727076481,2024-09-23 07:28,3,"I've spent enough money at BluePearl ($12k surgeries for each of my dogs) that I should have my own wing there. They do great work but for OP, I'd *highly* recommend that they're the trick up your sleeve and not the first card out of your deck.",helene,community_discussion,
lohr1vx,t3_1fn9yia,t3_1fn9yia,sarasota,Boomshtick414,1727076938,2024-09-23 07:35,2,"I've used Bay Road Animal Hospital (Dr. Tisdale @ East - 17th/Honore) as my primary for 8 years. Even when my dog was hit by a car, she saved me probably $3k in initial triage than if I had taken him directly to BluePearl. They've been very candid when to get outside consults/specialists as well as in helping prioritizing treatments. (e.g. when it's worthwhile to spend the money and when it would be just setting cash on fire)

One of the upcoming adventures will be similar to yours in that my dog has 5 masses, 3 of which are high priority (two near left eye, one on right ear). Been monitoring them for a couple years but it's time to do something about them. We've got a gameplan for the next month, did some cytology to asses that they're *probably* benign but still need to be dealt with. Also combining the procedure with a dental so we can maximize the value of the anesthetic.

With both of my dogs having their own issues (one's a lumpy boy and the other's in heart failure), the ""healthy pet club"" is also nice. For something like $100/yr, general exam fees are waived. Even though that doesn't cover vaccinations, medications, or tests, the savings really add up (at least in my case) because my boys are older and have become frequent flyers. Whenever you start talking surgeries, this is worth taking into account because there is *always* follow-up.",helene,community_discussion,
loih7x1,t3_1fn9yia,t3_1fn9yia,sarasota,Rusl21,1727093211,2024-09-23 12:06,2,Ellenton Animal Hospital. Removed a growth on my dogs leg and they did a fantastic job. It was pretty gross and they made it look like it was never there. Plus they are way more reasonably priced than anything Sarasota/lakewood ranch that I’ve found. Just have to look past the beat up/dingy look of the place. The people were great to us.,helene,community_discussion,
loixvwp,t3_1fn9yia,t3_1fn9yia,sarasota,GnearlTheRogue,1727099820,2024-09-23 13:57,1,Sarasota Animal Hospital off Bee Ridge cared for my dog and two cats for over a decade until I moved to Venice. They are all really great but usually pretty busy.,helene,community_discussion,
loj01de,t3_1fn9yia,t3_1fn9yia,sarasota,Fresh-Ad7925,1727100573,2024-09-23 14:09,2,"I’ve had great experiences with Dr. Hamilton at Burns Court Vet. Very knowledgeable and very, very kind staff",helene,community_discussion,
lojc9wr,t3_1fn9yia,t1_lohqeuj,sarasota,kzupan,1727104646,2024-09-23 15:17,1,"100% - OP posted on the weekend and sometimes they are the only option. Blue Pearl will not be cheap by any means, but they do have a lot of specialists if your emergency happens after hours or on the weekend.",helene,community_discussion,
lopm7pi,t3_1fn9yia,t1_lohr1vx,sarasota,Runaway2332,1727194674,2024-09-24 16:17,1,"Bay Road Animal Hospital killed my bunny, Fur'ocious. They literally *forgot he was there* and in an *emergency condition* . It was when they were moving from the other location downtown. I will never forgive Dr Smith or his desk people that put him somewhere and then forgot him. I was stuck waiting in the parking lot (COVID days) and asked everyone that came out who worked there how he was and they'd say he was doing great and being taken care of. I finally CALLED the office after 3 hours of not hearing from Dr Smith and *they didn't even know they had a bunny in the office* . All that time in a strange place full of awful smells and noises and in extreme pain...my poor baby.

https://preview.redd.it/c7hpcqry7sqd1.jpeg?width=1021&format=pjpg&auto=webp&s=a81cc8ca28ae78e9468f7573cf57ac3f9ac4977a",helene,community_discussion,
lopmcva,t3_1fn9yia,t1_lopm7pi,sarasota,Runaway2332,1727194720,2024-09-24 16:18,1,"https://preview.redd.it/pu85swnl8sqd1.jpeg?width=1171&format=pjpg&auto=webp&s=264069f41b3e5de6d369b3f8b3514068bc5f61bb

This is/was his girlfriend, Bumble Chunga.",helene,community_discussion,
lopmhoe,t3_1fn9yia,t1_lopmcva,sarasota,Runaway2332,1727194762,2024-09-24 16:19,1,"https://preview.redd.it/nk8qwytq8sqd1.jpeg?width=4032&format=pjpg&auto=webp&s=3ecb9a876604442c09431ff10cee2d1dd095d98a

This is Bumble saying goodbye to Fur'o.",helene,community_discussion,
lopmn65,t3_1fn9yia,t1_lopmhoe,sarasota,Runaway2332,1727194811,2024-09-24 16:20,1,"https://preview.redd.it/19mxxaru8sqd1.jpeg?width=2780&format=pjpg&auto=webp&s=75664a2d89be415ed6b3b4dc2773160863be6109

His sweet paws... 😭",helene,community_discussion,
lopn296,t3_1fn9yia,t1_lopmn65,sarasota,Runaway2332,1727194943,2024-09-24 16:22,1,"Bumble missing Fur'o...in the spot they used to lay together. I didn't vacuum there for weeks afterward...

https://preview.redd.it/uhe7m2v79sqd1.jpeg?width=2048&format=pjpg&auto=webp&s=3bf7170747db6f0c09552acb420e398338623c6d",helene,community_discussion,
m4sqq2n,t3_1fn9yia,t1_loj01de,sarasota,coolresearcher87,1735701966,2025-01-01 03:26,1,I know this is old but if anyone is looking: we LOVE Dr. Hamilton at Burns Court. They are fear free which is why we chose them!,helene,community_discussion,
lohb7nw,t3_1fnbzs7,t3_1fnbzs7,sarasota,iKnowRobbie,1727066895,2024-09-23 04:48,6,"https://yelp.to/DH1ATel8Xf A&H Fabricstions, Nokomis, FL. Tell Adam that Robbie sent you.",helene,community_discussion,
lohdnao,t3_1fnbzs7,t3_1fnbzs7,sarasota,PorkyMcRib,1727068264,2024-09-23 05:11,2,Is it the same diameter as a common pipe size? You might be able to solder on a threaded fitting.,helene,community_discussion,
lohm7xd,t3_1fnbzs7,t3_1fnbzs7,sarasota,Portlander,1727073619,2024-09-23 06:40,4,Buy a ratchet threader. It'll cost you the same amount and you can have it delivered overnight,helene,community_discussion,
lomvf18,t3_1fnbzs7,t3_1fnbzs7,sarasota,SomeoneUkno,1727147207,2024-09-24 03:06,1,"Give these guys a call. They threaded a pipe for us and didn't charge much. Sorry, I don't remember the exact details, as I just went to pick the pipe up for my company, but no complaints.

Dang Welding Shop LLC.
(941) 366-3914

 https://g.co/kgs/dfv4vpL",helene,community_discussion,
lomxog6,t3_1fnbzs7,t1_lohb7nw,sarasota,PasswordABC123XYZ,1727148171,2024-09-24 03:22,1,"Thanks, I give him a try",helene,community_discussion,
lomxx4e,t3_1fnbzs7,t1_lohm7xd,sarasota,PasswordABC123XYZ,1727148276,2024-09-24 03:24,1,It's not a standard NPT.   Some weird fine thread...,helene,community_discussion,
lors6ew,t3_1fnbzs7,t3_1fnbzs7,sarasota,undergroundnoises,1727219813,2024-09-24 23:16,1,We can cut threads onto or into a pipe at our auto shop.,helene,community_discussion,
lpfrnuq,t3_1fnbzs7,t1_lors6ew,sarasota,PasswordABC123XYZ,1727578497,2024-09-29 02:54,1,Which auto shop is that?,helene,community_discussion,
lpl89jh,t3_1fnbzs7,t1_lpfrnuq,sarasota,undergroundnoises,1727661695,2024-09-30 02:01,1,"Sorry love, we don't advertise, but I can send you a dm to contact us. We're in Venice.",helene,community_discussion,
loja3z1,t3_1fnm4wl,t3_1fnm4wl,sarasota,Cetophile,1727103931,2024-09-23 15:05,26,I would trust his word about as much as I would trust a cornered rattlesnake.,helene,community_discussion,
lojb2al,t3_1fnm4wl,t3_1fnm4wl,sarasota,Ok-Rhubarb-5774,1727104247,2024-09-23 15:10,-15,Sure seems relevant to r/sarasota.,helene,community_discussion,
lojd500,t3_1fnm4wl,t1_lojb2al,sarasota,iguessjustdont,1727104928,2024-09-23 15:22,17,Truth social is headquartered in Sarasota. I think a company with a $2.7Bn market cap based here is relevant.,helene,community_discussion,
lojdroz,t3_1fnm4wl,t1_lojd500,sarasota,[deleted],1727105132,2024-09-23 15:25,1,[deleted],helene,community_discussion,
lojeg15,t3_1fnm4wl,t1_lojd500,sarasota,Ok-Rhubarb-5774,1727105351,2024-09-23 15:29,-15,The selling (or not selling) of stocks is not relevant.,helene,community_discussion,
lojeh8t,t3_1fnm4wl,t1_lojb2al,sarasota,CivilizedGuy123,1727105362,2024-09-23 15:29,6,The company is headquartered in Sarasota and r/sarasota allows business news to be posted. There’s even flair for business news. How is it not relevant?,helene,community_discussion,
lojf1i3,t3_1fnm4wl,t1_lojd500,sarasota,[deleted],1727105544,2024-09-23 15:32,1,[removed],helene,community_discussion,
lojgohj,t3_1fnm4wl,t3_1fnm4wl,sarasota,oobbyb_61,1727106076,2024-09-23 15:41,3,"https://preview.redd.it/ogr1vq4ywkqd1.png?width=2192&format=png&auto=webp&s=f5610463b9d67bfaad47b7b93f889a0f4ae13c05

This could change, but current trend is not posiive.  All the insiders are bailing out too.",helene,community_discussion,
lojh865,t3_1fnm4wl,t3_1fnm4wl,sarasota,Hattrick42,1727106251,2024-09-23 15:44,14,Even if it was legally binding… do you believe he would be held accountable for it????,helene,community_discussion,
lojhpe3,t3_1fnm4wl,t3_1fnm4wl,sarasota,SalzigHund,1727106405,2024-09-23 15:46,9,Paywall. Not “legally binding” but he could get sued for misleading shareholders.,helene,community_discussion,
lojilnp,t3_1fnm4wl,t1_lojb2al,sarasota,Ok-Mousse-2687,1727106693,2024-09-23 15:51,-4,"Since the company is based in Sarasota, it gives the OP reason to display his TDS. That way, he can feel superior when he receives up-votes from the Reddit hive mind. It is really a stretch to claim this to be Sarasota news related, but the afflicted use the smallest of reasons to spew their nonsense. Plus, he must not be too intelligent because he posted a paywall article that hardly anyone can read.",helene,community_discussion,
lojnlv1,t3_1fnm4wl,t3_1fnm4wl,sarasota,video-engineer,1727108314,2024-09-23 16:18,7,"Like anything legal has any care at all for Dolt-45, his lawyers, or his cult.",helene,community_discussion,
lojp74b,t3_1fnm4wl,t3_1fnm4wl,sarasota,Shaakti,1727108827,2024-09-23 16:27,-2,Isn't it just so lovely that Sarasota became the MAGA capital of the country,helene,community_discussion,
lojpcgf,t3_1fnm4wl,t3_1fnm4wl,sarasota,loumf,1727108876,2024-09-23 16:27,3,"Is he considered a shareholder that needs to declare selling before doing it? (Insider sales). If so, it is legally binding.",helene,community_discussion,
lojpgbj,t3_1fnm4wl,t1_lojeh8t,sarasota,Shaakti,1727108909,2024-09-23 16:28,0,Just because it's headquartered in Sarasota doesn't mean it's relevant content in a city-subreddit imo,helene,community_discussion,
lojpshc,t3_1fnm4wl,t3_1fnm4wl,sarasota,[deleted],1727109017,2024-09-23 16:30,1,[removed],helene,community_discussion,
lojpyy6,t3_1fnm4wl,t1_lojp74b,sarasota,studioSev,1727109074,2024-09-23 16:31,0,we already had the biggest cult next door in clearwater. just get in your pool like I am and keep enjoying life.,helene,community_discussion,
lojq3un,t3_1fnm4wl,t1_lojgohj,sarasota,studioSev,1727109117,2024-09-23 16:31,2,ouchies. delisting coming this year?,helene,community_discussion,
lojq7pw,t3_1fnm4wl,t1_lojpyy6,sarasota,Shaakti,1727109152,2024-09-23 16:32,4,"I don't have a pool, nor do I enjoy life in Sarasota anymore. This place has gone to shit.",helene,community_discussion,
lojsuoj,t3_1fnm4wl,t1_lojgohj,sarasota,rpgnymhush,1727109988,2024-09-23 16:46,1,I can't wait till it hits less than five cents a share. That will be hilarious ![gif](emote|free_emotes_pack|joy),helene,community_discussion,
lojvkiu,t3_1fnm4wl,t1_lojsuoj,sarasota,UnecessaryCensorship,1727110838,2024-09-23 17:00,0,Even selling at five cents Donald will still have a net profit of roughly $5.5 million.,helene,community_discussion,
lojzrgb,t3_1fnm4wl,t1_loja3z1,sarasota,Solid-Friendship-524,1727112146,2024-09-23 17:22,-1,Or as much as I'd trust a fart after eating Indian food.,helene,community_discussion,
lok0est,t3_1fnm4wl,t1_lojpgbj,sarasota,CivilizedGuy123,1727112346,2024-09-23 17:25,3,"What is your criteria for being Sarasota business news? If being physically located in Sarasota isn’t legitimate criteria, then nothing is.",helene,community_discussion,
lok2zfw,t3_1fnm4wl,t1_lojeh8t,sarasota,Ok-Rhubarb-5774,1727113138,2024-09-23 17:38,0,The story isn’t really about the Sarasota based company.  Doesn’t mention its employees or their physical location or even the word “Sarasota” Only mentions Trump selling his stocks and if that would be considered fraud or not. But keep posting daily updates about every little thing trump does I guess. The mods don’t seem to mind,helene,community_discussion,
lok8aig,t3_1fnm4wl,t3_1fnm4wl,sarasota,[deleted],1727114779,2024-09-23 18:06,-2,[removed],helene,community_discussion,
lok9pqb,t3_1fnm4wl,t1_lojd500,sarasota,firsthomeFL,1727115226,2024-09-23 18:13,2,that market cap value is incredibly depressing.,helene,community_discussion,
lokqhkg,t3_1fnm4wl,t1_lojhpe3,sarasota,Zestyclose_Pickle511,1727120413,2024-09-23 19:40,1,SEC is already on him for making the initial statement.,helene,community_discussion,
lokz3ni,t3_1fnm4wl,t3_1fnm4wl,sarasota,GenoPlay67,1727123088,2024-09-23 20:24,2,You're asking if Donald is a man of his word?,helene,community_discussion,
lol2lez,t3_1fnm4wl,t3_1fnm4wl,sarasota,Strong-Educator2390,1727124180,2024-09-23 20:43,0,He’s already dumped it😂 only suckers left holding the bag,helene,community_discussion,
lol3fuo,t3_1fnm4wl,t1_lok2zfw,sarasota,CivilizedGuy123,1727124444,2024-09-23 20:47,1,"If Trump sells out the company goes belly up and Sarasota loses jobs, revenue and the panache of saying Trump Media is HQ’d here. The people of SRQ deserve to know what is happening and they clearly want to discuss it on Reddit. These business news posts he a lot of attention on here because it’s a big news story.",helene,community_discussion,
lol4re0,t3_1fnm4wl,t1_lol2lez,sarasota,CivilizedGuy123,1727124857,2024-09-23 20:54,-1,"So far he claims he won’t sell. And while the stock continues to drift downward, it hasn’t tanked as I expect it would if he sold out. On Monday it was down more than 10% or $1.40 to $12.12, its 52 week low, and lowest since the SPAC. 

Do you know something we don’t know r/Strong-Educator2390 ?",helene,community_discussion,
lolqr93,t3_1fnm4wl,t3_1fnm4wl,sarasota,FiveHole23,1727132432,2024-09-23 23:00,2,"I fully expect him to pump it one more time before he sells. Legally binding doesn't really matter to Trump. Especially, if he believes he will be reelected.

Mark my words he will pump it right before he sells it. I am shorting it when he is able to sell and he pumps it.",helene,community_discussion,
lom597s,t3_1fnm4wl,t1_lojzrgb,sarasota,hiptobecubic,1727137376,2024-09-24 00:22,2,"Every time people make analogies like this they always misunderstand what ""trust"" means. You're saying the opposite of what you think. You can rely on cornered rattlesnakes and farts behaving how you expect them to. What you can't trust are the neutrals.",helene,community_discussion,
lomd9rv,t3_1fnm4wl,t1_lom597s,sarasota,GizmodoDragon92,1727140240,2024-09-24 01:10,1,And you’re misunderstanding that they can rely on trumps actions being exactly the opposite of what he says,helene,community_discussion,
lomhqja,t3_1fnm4wl,t1_lol3fuo,sarasota,Ok-Mousse-2687,1727141919,2024-09-24 01:38,2,"How are people supposed to discuss the article that you posted when it is hidden behind a paywall? Next time you decide to provide the ""people of SRQ"" the news that they ""deserve to know,"" perhaps you could be smart enough  to post a link that people can actually access.",helene,community_discussion,
lommxwe,t3_1fnm4wl,t1_lokqhkg,sarasota,Vitamin_J94,1727143890,2024-09-24 02:11,2,Because he had met justice so many times. Forgive my low expectations,helene,community_discussion,
lomn9b8,t3_1fnm4wl,t1_lojvkiu,sarasota,Vitamin_J94,1727144012,2024-09-24 02:13,1,"At that price, that's an equity swap. Unless he has preferred shares, which I doubt with a shell, he won't see a dime. Creditors will fleece it. For what, I didn't know because it has zero value",helene,community_discussion,
lomneb7,t3_1fnm4wl,t1_lojq7pw,sarasota,Vitamin_J94,1727144067,2024-09-24 02:14,0,"And onto you Felicia, we bid farewell",helene,community_discussion,
lomnyhn,t3_1fnm4wl,t1_lojilnp,sarasota,Vitamin_J94,1727144284,2024-09-24 02:18,2,"It's okay. You'll seethe and use names like Peekaboo or demoRAT. 

But you'll be fine. You'll still worship at the altar of the grift, but be okay",helene,community_discussion,
lomqyvm,t3_1fnm4wl,t1_lomn9b8,sarasota,UnecessaryCensorship,1727145456,2024-09-24 02:37,1,You're missing the real point: Donald didn't pay anything for his shares so he has nothing to lose here.  Getting *anything* for his shares will result in a profit.,helene,community_discussion,
lopoe88,t3_1fnm4wl,t1_lomd9rv,sarasota,hiptobecubic,1727195364,2024-09-24 16:29,0,"No that's my point. I'm _not_ misunderstanding that. They can _rely_ on it. That's the point. It is predictable. You can trust in your understanding of what he will do because it's going to be 1) shitty, 2) selfish, 3) unrelated to whatever he promised.

Similarly, you can rely on my farts stinking and you can rely on the sun coming up in the morning. These are all things you can trust will happen.",helene,community_discussion,
loq9xwh,t3_1fnm4wl,t1_lol4re0,sarasota,Strong-Educator2390,1727202040,2024-09-24 18:20,2,He’s dumped it! Wait to everyone finds out what he pulled. This man is a total crook,helene,community_discussion,
lou8x7f,t3_1fnm4wl,t3_1fnm4wl,sarasota,hmethtr36,1727264559,2024-09-25 11:42,1,When your rich nothing is legally binding,helene,community_discussion,
louzjlj,t3_1fnm4wl,t1_lopoe88,sarasota,NudeCeleryMan,1727274716,2024-09-25 14:31,1,You've misunderstood the use of farts here. It's not about being stinky. It's about sharting. You really can't know if the fart will be a shart so the fart is untrustworthy. I believe the OP did in fact use Indian food fart correctly.,helene,community_discussion,
lovfrvs,t3_1fnm4wl,t1_louzjlj,sarasota,hiptobecubic,1727279851,2024-09-25 15:57,1,"You're right! I was assuming smell. I think the fast example is fine then, although the Trump analogy, which was the point of it, still is not.",helene,community_discussion,
lojcnbd,t3_1fnmto0,t3_1fnmto0,sarasota,Lolol265,1727104768,2024-09-23 15:19,5,"https://preview.redd.it/0ldozkf5tkqd1.jpeg?width=1170&format=pjpg&auto=webp&s=904a97fba38eabf77fd81e7b6c5e8b453a6070ca

Meh",helene,community_discussion,
lojghqa,t3_1fnmto0,t3_1fnmto0,sarasota,SitdownCupcake,1727106016,2024-09-23 15:40,-1,im slump,helene,community_discussion,
loq3crm,t3_1fnmto0,t1_lojcnbd,sarasota,Thanos_Stomps,1727199996,2024-09-24 17:46,-1,Just wait til the streets are flooded the entire weekend and you can’t get anywhere. Then you won’t be sleep.,helene,community_discussion,
loqdfan,t3_1fnmto0,t3_1fnmto0,sarasota,AdmirableLow,1727203126,2024-09-24 18:38,4,"There will be significant flooding (again). Sandbags are available here:

• Twin Lakes Park, 6700 Clark Road
• Ed Smith Stadium (parking lot), 2700 12th St.
• South County Fleet Services, 4571 State Road 776/Englewood Road



The winds will be strong out of the east and then shift to out of the south. The winds out of the south are what seem to be the most concerning, so be sure the south-facing sides of your homes are ready. 

Oh, and get your bourbon, beer, and bud while there's still time! Godspeed nerds.",helene,community_discussion,
lor6h45,t3_1fnmto0,t3_1fnmto0,sarasota,i_heart_kermit,1727212219,2024-09-24 21:10,1,"https://preview.redd.it/u6ki7ifpotqd1.jpeg?width=1080&format=pjpg&auto=webp&s=b90a4980613817f5f9db38594a1dc656f8b5fadf

5 pm cone",helene,community_discussion,
loxjg83,t3_1fnmto0,t3_1fnmto0,sarasota,[deleted],1727303792,2024-09-25 22:36,1,[removed],helene,community_discussion,
lp1o4wo,t3_1fnmto0,t3_1fnmto0,sarasota,pelletgun,1727369498,2024-09-26 16:51,2,Just lost power off Proctor.  Sounded like a transformer might have bit the big bazooka,helene,community_discussion,power
lojgv6l,t3_1fnn0jf,t3_1fnn0jf,sarasota,meothe,1727106136,2024-09-23 15:42,23,Fuck developers. They’ve ruined this town and this state.,helene,community_discussion,
lojnfv2,t3_1fnn0jf,t3_1fnn0jf,sarasota,Loobyloos,1727108259,2024-09-23 16:17,2,😔,helene,community_discussion,
lojoo5s,t3_1fnn0jf,t3_1fnn0jf,sarasota,AdmirableLow,1727108657,2024-09-23 16:24,50,"**The majority of Floridians**: We need to preserve this area as it's a vital part of the local ecosystem and a natural floodplain.



**Developer**: Best I can do is 6,500 units stacked on top of each other with zero infrastructure to support new residents.



**Local politician**: This seems like a fair compromise.",helene,community_discussion,
lojp7tb,t3_1fnn0jf,t3_1fnn0jf,sarasota,m00n8eamfae,1727108834,2024-09-23 16:27,12,The environment is a zero cost to them. It's sad that economics supports this theory.,helene,community_discussion,
lojrqui,t3_1fnn0jf,t3_1fnn0jf,sarasota,Spiritual-Morning176,1727109640,2024-09-23 16:40,2,Developers or locals who are selling to developers?,helene,community_discussion,
lojwnvp,t3_1fnn0jf,t3_1fnn0jf,sarasota,Devincc,1727111186,2024-09-23 17:06,5,"Who’s really at fault? The developers are within their legal right to do what they want with the land they purchased as long as it’s zoned correctly, etc. Stop blaming it on them and start looking at your elected officials",helene,community_discussion,
lok4lq4,t3_1fnn0jf,t1_lojoo5s,sarasota,bshine,1727113638,2024-09-23 17:47,12,"It sucks. The infrastructure is so true. My friends in Lakewood ranch can barely get a bar of cell service, and it takes 30 mins to get out of the university bottle neck. Fruitville is next",helene,community_discussion,
