id,link_id,parent_id,subreddit,author,created_utc,created_date,score,body,hurricane,source_type,keyword_hit
lp6cxls,t3_1fqfnt5,t1_lp5h0wz,sarasota,PorkyMcRib,1727441047,2024-09-27 12:44,21,Poop soup.,helene,community_discussion,
lp6hprv,t3_1fqfnt5,t1_lp5h0wz,sarasota,DrLeoMarvin,1727442914,2024-09-27 13:15,8,"Bobandy headin' to the cheeseburger picnic, no hurricane slowing him down!",helene,community_discussion,hurricane
lp6ht15,t3_1fqfnt5,t1_lp6bv3l,sarasota,DrLeoMarvin,1727442947,2024-09-27 13:15,10,![gif](giphy|nj257YL538Gdy|downsized),helene,community_discussion,
lp6poii,t3_1fqfnt5,t3_1fqfnt5,sarasota,Maine302,1727445802,2024-09-27 14:03,3,What are the conditions now? Does anyone know impassable areas within the county?,helene,community_discussion,
lp6s6zl,t3_1fqfnt5,t3_1fqfnt5,sarasota,Imaginary_Land1919,1727446667,2024-09-27 14:17,2,Bert Kreisher?,helene,community_discussion,
lp6wgid,t3_1fqfnt5,t1_lp59ix1,sarasota,ajgarvin,1727448089,2024-09-27 14:41,4,"My family has owned a house in Lido Shores (on Lido Key) for over 30 years and know the history of the house, which was built in 1953, extremely well. As far as I know or can tell, storm surge water has never come in through the front doors (or any other way)... until last night. At about the time of the midnight high tide, the level rose to about 4 inches at the doorway.

https://preview.redd.it/cy0jg7b26drd1.jpeg?width=4080&format=pjpg&auto=webp&s=ee1532ccf1228a24e71cc7d01fe0f59b48badaa5

View looking across the ""street"" at the house that has a natural-gas-powered generator.",helene,community_discussion,storm
lp6wr6h,t3_1fqfnt5,t3_1fqfnt5,sarasota,Mattyou1966,1727448185,2024-09-27 14:43,1,May be some flooding huh. 🤔,helene,community_discussion,
lp72suz,t3_1fqfnt5,t3_1fqfnt5,sarasota,SnooStrawberries3391,1727450152,2024-09-27 15:15,3,"This is just the beginning of the trouble coastal areas are going to see in the coming years. Florida Gubner Desensed has struck global warming and its effects from official state policy. But the planet’s atmosphere and oceans don’t really give a damn.  

Deniers are mostly oil money driven and don’t care or have no clue what is going to happen. Reality will eventually hit them, as well. Head in the sand won’t protect them. 

Study the science. Might be surprised to see these unfortunate events have been predicted for years. We’re doing this to ourselves. 

The atmosphere and the oceans have definitely been giving us a heads up for years.  As a whole, we have not responded to this slow boiling emergency.",helene,community_discussion,
lp7308h,t3_1fqfnt5,t1_lp5w1ij,sarasota,ajgarvin,1727450218,2024-09-27 15:16,2,Um... yeah.,helene,community_discussion,
lp76o4u,t3_1fqfnt5,t3_1fqfnt5,sarasota,perroair,1727451399,2024-09-27 15:36,1,Needs a Man Can,helene,community_discussion,
lp7i9y3,t3_1fqfnt5,t1_lp6bv3l,sarasota,Greenemcg,1727455134,2024-09-27 16:38,3,A man gots to eat - you wanna party,helene,community_discussion,
lp7o7nx,t3_1fqfnt5,t3_1fqfnt5,sarasota,TrackFickle6385,1727457052,2024-09-27 17:10,1,"https://preview.redd.it/981g2pkowdrd1.jpeg?width=828&format=pjpg&auto=webp&s=7c38651a20236affed55bc842e323ae08113bd22

L’Elegance on Lido",helene,community_discussion,
lp7obkt,t3_1fqfnt5,t3_1fqfnt5,sarasota,TrackFickle6385,1727457087,2024-09-27 17:11,1,"https://preview.redd.it/v8u80berwdrd1.jpeg?width=960&format=pjpg&auto=webp&s=f9d40e7ffd12c088e45d06fa8ca4f6b93e55a15c

Limetree pool deck on Lido",helene,community_discussion,
lp7ozqx,t3_1fqfnt5,t1_lp6poii,sarasota,RuffledPidgeon,1727457302,2024-09-27 17:15,3,"I drove through the 301/41 area at about 5am heading to work, I wouldn't have known it had even flooded there.",helene,community_discussion,
lp7p71i,t3_1fqfnt5,t3_1fqfnt5,sarasota,TrackFickle6385,1727457366,2024-09-27 17:16,1,"https://preview.redd.it/svkyabaixdrd1.jpeg?width=960&format=pjpg&auto=webp&s=ce47eaf5f8c9e53c38bde092700e2a5d338f53f7

Lido Surf & Sand gate from pool to the beach under several feet of sand. The whole pool deck area has sand over it.",helene,community_discussion,
lp7qcm6,t3_1fqfnt5,t3_1fqfnt5,sarasota,426203,1727457736,2024-09-27 17:22,1,Looks normal,helene,community_discussion,
lp9didk,t3_1fqfnt5,t3_1fqfnt5,sarasota,Inkyadinka,1727477947,2024-09-27 22:59,1,A good time to be living in a high rise I guess.,helene,community_discussion,
lpakrve,t3_1fqfnt5,t1_lp6hprv,sarasota,Beardsman805,1727496424,2024-09-28 04:07,2,That's a Shitticaine Randy. ,helene,community_discussion,
lpdjx0j,t3_1fqfnt5,t1_lp5h0wz,sarasota,GaryTheSoulReaper,1727548077,2024-09-28 18:27,2,Also potential shock hazards,helene,community_discussion,
lpdmeh0,t3_1fqfnt5,t3_1fqfnt5,sarasota,Perenially_behind,1727548930,2024-09-28 18:42,1,"Wading out into that contaminated water is not the smartest thing this person has ever done, but it makes for a great photo. Thanks anonymous Dude, and get your shots up to date stat!",helene,community_discussion,
lpfi1qw,t3_1fqfnt5,t1_lp5h0wz,sarasota,DrPolarBearMD,1727574414,2024-09-29 01:46,2,"Waste, poop, sharks, confused alligators, etc",helene,community_discussion,
lpgt3r8,t3_1fqfnt5,t1_lpfi1qw,sarasota,Buckys_Butt_Buddy,1727600265,2024-09-29 08:57,1,Who doesn’t like contracting a minor case of hepatitis?,helene,community_discussion,
lp5a5n3,t3_1fqh87k,t3_1fqh87k,sarasota,UnecessaryCensorship,1727417939,2024-09-27 06:18,19,"> should just wait and see for now? 

Yes.  You'll get a much better answer a few days from now.",helene,community_discussion,
lp5chaj,t3_1fqh87k,t3_1fqh87k,sarasota,Appropriate-Idea5281,1727419424,2024-09-27 06:43,1,You will be fine,helene,community_discussion,
lp5cq7r,t3_1fqh87k,t3_1fqh87k,sarasota,meothe,1727419585,2024-09-27 06:46,66,Would you let the daylight come on so we can asses our own damage before you worry about your vacation.,helene,community_discussion,
lp5dvcb,t3_1fqh87k,t1_lp5cq7r,sarasota,NonyaFugginBidness,1727420322,2024-09-27 06:58,20,"No.  Humanity is gone, it's all about money and tourists equal money.  That's why the airport will be fine but the homes of residents who have lived here over 50 years will be flooded and ignored.",helene,community_discussion,
lp5fm50,t3_1fqh87k,t3_1fqh87k,sarasota,Twitch_HighMiZe,1727421490,2024-09-27 07:18,-11,"Same here, we arrive in 12 days, I'm just waiting for now",helene,community_discussion,
lp5g1hr,t3_1fqh87k,t3_1fqh87k,sarasota,Shaakti,1727421785,2024-09-27 07:23,10,Should probably cancel because when I look outside I can't see anything at all,helene,community_discussion,
lp5gztx,t3_1fqh87k,t3_1fqh87k,sarasota,glasshalffoo,1727422450,2024-09-27 07:34,-2,LOL piss off,helene,community_discussion,
lp5mwcx,t3_1fqh87k,t1_lp5dvcb,sarasota,Tuout1911,1727426601,2024-09-27 08:43,7,"Bruh is from Asia, there is likely a 11-13 hour time difference no one thinks about",helene,community_discussion,
lp5wiqf,t3_1fqh87k,t3_1fqh87k,sarasota,LYSG18,1727433040,2024-09-27 10:30,-22,So much unnecessary hate in this post lol. I hope it's just an Flordian thing and not an American thing,helene,community_discussion,
lp5y0k9,t3_1fqh87k,t1_lp5wiqf,sarasota,loumf,1727433914,2024-09-27 10:45,2,"It’s a Reddit thing :). In two weeks we’ll be over this one. But it’s hurricane season. There’s already another one coming. We can’t really predict them or what will happen that far out. 

Historically, it’s a pain for a couple of days. Beach might not be open for part of it. If your hotel is on the islands, I would think about changing that — those areas are hardest hit. 

Also, in two weeks it could be totally fine. There is no way to know.",helene,community_discussion,hurricane
lp5y3we,t3_1fqh87k,t1_lp5fm50,sarasota,loumf,1727433968,2024-09-27 10:46,7,Supposedly another one brewing to go on a similar path.,helene,community_discussion,
lp602z7,t3_1fqh87k,t1_lp5y0k9,sarasota,LYSG18,1727435060,2024-09-27 11:04,-7,Thank you for such a constructive and sensible reply.  I wish you guys all the best with the weather ahead. And oh I hope it's just a reddit thing too lol,helene,community_discussion,weather
lp602zv,t3_1fqh87k,t3_1fqh87k,sarasota,Maleficent727,1727435061,2024-09-27 11:04,1,You will be fine,helene,community_discussion,
lp61pyk,t3_1fqh87k,t1_lp5wiqf,sarasota,Inquisitive33,1727435928,2024-09-27 11:18,14,"There are many kind and good people all over the planet, including Sarasota and Florida. Unless you have experienced all of the storm preparations, the waiting to see if your residence is going to blow away, then the clean up and repair if either you can afford it or if your insurance will pay the claim, don't call them haters. Have a little empathy for the human condition. It may be insensitive to ask such a question before people can assess the damages.

My condo complex only recently received insurance settlement from Hurricane Ian two years ago. And they are just now in the process of finishing the new roof. Plus, in Florida it rains at least five days a week in August and September which slows the construction. Then you worry about insurance companies canceling your policy or leaving the state. Lots to worry about.

Monitor the next storm and see where it is heading. There is a reason that many ""so called"" snowbirds are only in the state November - April.",helene,community_discussion,hurricane|storm
lp66b8i,t3_1fqh87k,t3_1fqh87k,sarasota,_momosaurus,1727438170,2024-09-27 11:56,11,Honestly the influx of wahh my vacation on here due to a major hurricane are super obnoxious. We don’t care about your vacation.,helene,community_discussion,hurricane
lp67m8l,t3_1fqh87k,t1_lp602z7,sarasota,Icy_Location,1727438766,2024-09-27 12:06,1,Debatable.,helene,community_discussion,
lp6970c,t3_1fqh87k,t1_lp5g1hr,sarasota,Kamata-,1727439464,2024-09-27 12:17,1,Same! 😂,helene,community_discussion,
lp6c0dl,t3_1fqh87k,t1_lp602z7,sarasota,mel060,1727440666,2024-09-27 12:37,3,Nope - it’s a YOU thing,helene,community_discussion,
lp6g457,t3_1fqh87k,t3_1fqh87k,sarasota,RafintheWraith,1727442302,2024-09-27 13:05,-1,No. You’ll be fine,helene,community_discussion,
lp6iplt,t3_1fqh87k,t3_1fqh87k,sarasota,SherbetOutside1850,1727443290,2024-09-27 13:21,0,You'll be alright.,helene,community_discussion,
lp6ubx6,t3_1fqh87k,t3_1fqh87k,sarasota,[deleted],1727447391,2024-09-27 14:29,-1,[removed],helene,community_discussion,
lp9oefc,t3_1fqh87k,t1_lp5dvcb,sarasota,cardinalkgb,1727482289,2024-09-28 00:11,1,Quit giving him shit.  80% of the area is fine.,helene,community_discussion,
lpcxjt0,t3_1fqh87k,t1_lp602z7,sarasota,Narrow-Bumblebee-624,1727540512,2024-09-28 16:21,2,Read the room buddy,helene,community_discussion,
lp6i80g,t3_1fqkfka,t3_1fqkfka,sarasota,BigJohnsBeenDrinkin,1727443105,2024-09-27 13:18,2,"Sarasota Springs is close, and we're high and dry.",helene,community_discussion,
lp6ic8j,t3_1fqkfka,t1_lp6i80g,sarasota,ImpressiveLink8953,1727443150,2024-09-27 13:19,1,Wonderful news!,helene,community_discussion,
lp6zahz,t3_1fqkfka,t3_1fqkfka,sarasota,ElegantGrapefruit626,1727449010,2024-09-27 14:56,5,I’m on Bee Ridge and Honore and we’re dry.,helene,community_discussion,
lp7fzdy,t3_1fqkfka,t3_1fqkfka,sarasota,Ace198537,1727454390,2024-09-27 16:26,3,We really didn’t get the rain this time but the flooding was awful from storm surge on the islands and along the bay.,helene,community_discussion,storm
lp82735,t3_1fqkfka,t3_1fqkfka,sarasota,flossinfrenzy,1727461547,2024-09-27 18:25,1,Drove by there earlier and it was high and dry,helene,community_discussion,
lp6g8ti,t3_1fqmj49,t3_1fqmj49,sarasota,Cultural_Actuary_994,1727442353,2024-09-27 13:05,17,"We manage to pull through on this storms. Amen.   Except for those poor folks out in LWR from last TS.  Either way, let’s try to keep Sarasota a secret for a little while longer 🤫",helene,community_discussion,
lp6lqk1,t3_1fqmj49,t1_lp6g8ti,sarasota,newest_reddit_user,1727444412,2024-09-27 13:40,30,you can come back down to reality whenever — many many others beyond lwr were affected last ts. and sarasota is not a secret any longer in any way.,helene,community_discussion,
lp6pr7o,t3_1fqmj49,t1_lp6lqk1,sarasota,Kdoubleaa,1727445828,2024-09-27 14:03,14,"The “blessing” (really geography) only protects us from direct hits, not poor infrastructure and leadership.",helene,community_discussion,
lp74ki4,t3_1fqmj49,t1_lp6lqk1,sarasota,BloodGradeBPlus,1727450722,2024-09-27 15:25,0,"While I agree there were many others that got affected beyond lwr, I would argue that this place is still very much a secret. We have 58k residents, and are considered a ""small city"" by the census bureau, though it is contested a bit. We have a significant snowbird population of 15k, and it's difficult for anybody to tell how many of those snowbird are considered in the residents number or not. See, you don't have to live here to claim to be a resident. So we can have anywhere from 43k residents (no longer a city but a micropoliton area) up to 58k, and during November thru April at max between 58k and 73k.

We have an astonishing 25 sq mi area those folks are in. Much MUCH farther less population per square mile than the average city. It's difficult to get a figure for what would fit a ""secret"" to compare to, but figure places like Santa Monica, CA has 8.4 sq mi and 92k people. Burbank has 17.4 sq mi with 106k people. Cambridge MA (beautiful this time of year) is just 6.4 sq mi with 118k people.

I've lived in a number of highly populated cities, and I can't describe just how much of a ghost town this place is in comparison. It only takes 2 hours to get from home to beach by car, and that's the worst of it. I can be in almost any part of Sarasota to any other part in an hour unless it's the beach. The lines at any store is like under 30 minutes... it's just remarkable.

Anyway, I guess it's a matter of perspective. Compared to the rest of the country, nobody lives here. I guess if you grew up here, maybe it might feel different. But if that's the case, I really feel bad then because by my estimate it could hold at least 3 times as many people.",helene,community_discussion,
lp7i8ts,t3_1fqmj49,t3_1fqmj49,sarasota,Lesmiscat24601,1727455125,2024-09-27 16:38,2,"Anybody in the Desoto Acres area (near University Parkway) know how bad it is out there?
I got friends and my dad who lives out there and can’t reach them.",helene,community_discussion,
lp7lxi0,t3_1fqmj49,t1_lp7i8ts,sarasota,SecretSloth810,1727456315,2024-09-27 16:58,3,"Saw desoto acres this morning. It’s overall not too bad, no flooding just some down branches and debris but nothing major. A lot of houses out of power but didn’t see any major damage to the houses or roads.",helene,community_discussion,power
lp7maf4,t3_1fqmj49,t1_lp7lxi0,sarasota,Lesmiscat24601,1727456429,2024-09-27 17:00,2,Ah okay thank you dude.,helene,community_discussion,
lp7ptnh,t3_1fqmj49,t1_lp7maf4,sarasota,SecretSloth810,1727457567,2024-09-27 17:19,2,No problem! Hope you hear from them soon,helene,community_discussion,
lp7rm6v,t3_1fqmj49,t3_1fqmj49,sarasota,mrtoddw,1727458137,2024-09-27 17:28,15,"I enjoy doing the hurricane tracking. I'm glad we could help you at your time of need.

![gif](giphy|YYfEjWVqZ6NDG|downsized)",helene,community_discussion,hurricane
lp7siql,t3_1fqmj49,t1_lp7rm6v,sarasota,memeraths,1727458426,2024-09-27 17:33,6,That was f***ing funny.,helene,community_discussion,
lp8ygio,t3_1fqmj49,t3_1fqmj49,sarasota,moonrvrking,1727472289,2024-09-27 21:24,0,I wanna know how with all the places in Florida @FLP has the largest power outages by far……,helene,community_discussion,power
lp9296i,t3_1fqmj49,t1_lp8ygio,sarasota,mrtoddw,1727473657,2024-09-27 21:47,2,"Uh, they're the largest provider of electricity in the county.

[https://poweroutage.us/area/county/339](https://poweroutage.us/area/county/339)",helene,community_discussion,
lpbwopi,t3_1fqmj49,t3_1fqmj49,sarasota,grapefruitmakmesalty,1727526518,2024-09-28 12:28,1,"Anyone on Longboat? We were coming down on the 10th but thats probably not going to happen now, hope its not too bad for the residents.",helene,community_discussion,
lpc7e3k,t3_1fqmj49,t3_1fqmj49,sarasota,Bugsly55,1727531174,2024-09-28 13:46,2,Ahhh the Dennys on 41. Spent many a late night there in high school drinking endless cups of coffee and smoking packs of cigarettes in that place.,helene,community_discussion,
lpe8ayu,t3_1fqmj49,t1_lp7i8ts,sarasota,Ace198537,1727556612,2024-09-28 20:50,2,"I live in desoto acres. We didn’t lose power, no flooding just some limbs down but had those all picked up yesterday.",helene,community_discussion,power
lpe8gus,t3_1fqmj49,t1_lpbwopi,sarasota,Ace198537,1727556668,2024-09-28 20:51,1,Prob will be sometime before you will want to vacation here. Longboat and anywhere on or around the water are a mess.,helene,community_discussion,
lpen64u,t3_1fqmj49,t1_lp7i8ts,sarasota,buck746,1727562140,2024-09-28 22:22,3,"Live in desoto  acres, no flooding here, lost power for less than an hour. Internet connection was out for about 15 hours. Local network storage proved its superiority to streaming again.",helene,community_discussion,power
lpesfx6,t3_1fqmj49,t3_1fqmj49,sarasota,HarvardCricket,1727564172,2024-09-28 22:56,2,"So nice. I’m a lurker too, and live out of state right now, but am from FL. My dad (who lived in central Fla) and I were planning to buy him a condo on LBK for his retirement, but he sadly passed unexpectedly last year. Which is still devastating. I’m still planning to do this in a few years in memory of him, but it’s been good to follow along with what’s happening. Praying that everyone can get back on their feet, strength in these hard days, and sunshine ahead.",helene,community_discussion,
lphocdi,t3_1fqmj49,t1_lp74ki4,sarasota,drunzae,1727617781,2024-09-29 13:49,1,You do realize there ar many more people outside the extremely small city limits here and they seem to be growing at an outrageous rate. The city is the smallest part of Sarasota.,helene,community_discussion,
lpi32ig,t3_1fqmj49,t1_lphocdi,sarasota,BloodGradeBPlus,1727623155,2024-09-29 15:19,1,"I realize there is growth. It's just never met the national average, which doesn't make it outrageous in that sense. I do sense you are outraged, so I can't say it outrageous altogether, but also I know that growth does have an affect on this small city that shouldn't be ignored.

Some 10 years ago or so, Austin, TX had felt they hit their cap. They had a saying, ""keep Austin weird"" with all sorts of bizarre things you can do or see that they felt would fall into obscurity from their crowded new population. They had no idea that their town was so small, or how big it could become. Tech companies discovered Austin, built skyscrapers, rebuilt down town, and now you can't even recognize the city. That growth is outrageous. 

Sarasota is never going to attract the likes of those big Tech companies. Our economy depends on traffic. Getting people to an attraction, and to have as much stuff jam-packed at the attraction to keep them there and paying. It's not ideal for a business that wants to trap its workers all day in the office to move to a place that has so much to do. That's why places like Seattle or Boston where weather works in the favor of keeping these folks working at their deals see a rise in Tech companies.

I mean, for Christ sake, look at the schools here. New College has like 700 students. That's unimaginable by any metric. The amount of area on campus, the amount they pay, thee number of staff, the programs that are offered. It's incredible. But there's so much of that here. I can go to just about any shop here and find a place to sit, drink coffee or eat, without issue. On the busiest nights, wait time for a restaurant is under 2 hours lol but realistically there's very few places where it's even 30 minutes.

When I was in Highschool roughly 20 years ago in a different city, I used to make reservations, collect buzzers and wait at restaurants from 6 PM to 10 PM, trading my buzzers for cash. People would then cut their wait time from 2 hours to 15 minutes. Something like that is impossible here because there just aren't enough people that live here.

When the parking meters say there's a 2 hour limit, when it's less money to get a parking ticket than paying for a parking garage, or every bike rack is completely full then those are the first signs the city recognizes it can't sustain its own growth. Not when you have a city you can go to the airport less than an hour before takeoff and get mad because you got through security so fast you're stuck waiting a half hour before they start boarding lol. An airport mind you that had so much land they didn't know what to do with it. The airport was going to give its land away in a deal they worked out years ago, only for the FAA to tell them they couldn't. Some 3rd party that probably nobody from ever visited our airport just explained to them how ridiculous it was, because our own city can't imagine itself growing fast enough in their lifetime. The amount of land available here and all the construction going on, and it's just too slow a process.

Again if you haven't lived in many cities, or if you've only grown up here, I can sympathize that it seems like it's getting crowded. It almost breaks my heart anyone could feel that here... for those folks, you just cannot imagine what cities are like elsewhere. Take a quick trip to Tampa, not a big city but it's closer. They have 33% higher population density to us, at 3.4k/sq mi. still much lower than national average but I wouldn't want anybody to be uncomfortable. Something realistic would be Miami, over 12k/sq mi. That is just where walking down the street you'll be shoulder to shoulder with your neighbors.",helene,community_discussion,weather
lpql9c1,t3_1fqmj49,t1_lp6lqk1,sarasota,Cultural_Actuary_994,1727742760,2024-10-01 00:32,1,22 years and so far so good.,helene,community_discussion,
lqvbdjp,t3_1fqmj49,t1_lp8ygio,sarasota,e36m31995,1728349137,2024-10-08 00:58,1,"Can you provide some specific? If you are out more than average you can request data from the power company.  If it’s really bad, you can file a law suit for your losses.  Also I believe there is state commerce commission that could bring light to your issues.",helene,community_discussion,power
lp6evp1,t3_1fqmu3q,t3_1fqmu3q,sarasota,LycheeAppropriate315,1727441820,2024-09-27 12:57,5,"My partner works out there, yes there is lots of flooding. Roads impassable as of now, bridges out to the Key are closed and responders still doing rescues of people there.",helene,community_discussion,
lp6iixn,t3_1fqmu3q,t3_1fqmu3q,sarasota,Ace198537,1727443221,2024-09-27 13:20,13,Surge was really bad. Friends house on the canal on siesta had 4 feet of water in it so it came up quite a bit. All of our islands and downtown along the waterfront are not good right now.,helene,community_discussion,
lp6mh2r,t3_1fqmu3q,t3_1fqmu3q,sarasota,RafintheWraith,1727444676,2024-09-27 13:44,1,"I’m signed up for the alerts, a message went out yesterday that the surge flooded the area near midnight pass and stickney point",helene,community_discussion,
lp6tmoa,t3_1fqmu3q,t3_1fqmu3q,sarasota,CartographerFew3538,1727447154,2024-09-27 14:25,7,just drove around the key and they’re not letting anyone in by the south bridge. it was flooding by the beach and they blocked off the road to get to the village. flooding is the worst i’ve seen since living here,helene,community_discussion,
lp6vr5f,t3_1fqmu3q,t3_1fqmu3q,sarasota,ensoniq0902,1727447861,2024-09-27 14:37,4,Not sure about the village but I'm half way down Midnight Pass backing onto the Intracoastal. We had a river flowing into the car park and out to the back last night about 9pm  - about 2 to 3 feet of water. Luckily it stopped rising at about a couple of feet in the underground  garage for the cars etc but I would imagine the whole island was flooded with the storm surge. Power still up but internet down and I'm sure water will be off for quite a while. Really bad flooding everywhere on Siesta last night,helene,community_discussion,storm|power
lp745fu,t3_1fqmu3q,t3_1fqmu3q,sarasota,retromullet,1727450587,2024-09-27 15:23,1,My friend has a place on Longboat Key. I'm sure it's not pretty.,helene,community_discussion,
lp7i4z1,t3_1fqmu3q,t3_1fqmu3q,sarasota,pqitpa,1727455091,2024-09-27 16:38,1,Friend out at gulf and bay said the parking lot flooded but the units/occupants are ok,helene,community_discussion,
lp7i5dd,t3_1fqmu3q,t3_1fqmu3q,sarasota,mrtoddw,1727455094,2024-09-27 16:38,9,"Here's an idea. Someone did a video out there.

[https://www.youtube.com/watch?v=oS-TPxYfV5w](https://www.youtube.com/watch?v=oS-TPxYfV5w)",helene,community_discussion,
lp7jclj,t3_1fqmu3q,t3_1fqmu3q,sarasota,whorledstar,1727455482,2024-09-27 16:44,1,Everything is flooded,helene,community_discussion,
lp7utnr,t3_1fqmu3q,t1_lp6vr5f,sarasota,atla7007,1727459158,2024-09-27 17:45,2,"Not sure if this is the same area, but that little strip that has Captain Curt’s, Daiquiri Deck, Spearfish Grille and condos house of sun and seashell. Is that place ruined?",helene,community_discussion,
lp8gj7q,t3_1fqmu3q,t1_lp7i5dd,sarasota,Individual_Break6067,1727466250,2024-09-27 19:44,2,"Wow, thanks! This is awful :( Do you know the situation north of Stickney Point?",helene,community_discussion,
lp8nm60,t3_1fqmu3q,t1_lp8gj7q,sarasota,mrtoddw,1727468595,2024-09-27 20:23,2,I would imagine it’s much the same as it’s a disaster all the way up the barrier islands.,helene,community_discussion,
lp9flha,t3_1fqmu3q,t3_1fqmu3q,sarasota,Dizzy-Craft7329,1727478763,2024-09-27 23:12,1,"Yes everything is fuck, grandparents have a house there and the wife aunt, and is all flooded plus we can't go and help because we are no residents of that area.",helene,community_discussion,
