id,link_id,parent_id,subreddit,author,created_utc,created_date,score,body,hurricane,source_type,keyword_hit
lp08m2o,t3_1fpgelm,t1_lp06e30,sarasota,Striking-Sympathy-16,1727351840,2024-09-26 11:57,4,"Yeah, I didn't realize how incredibly misleading it was(obviously). I was prepared for a $370 increase based on the loan, but not for them to somehow triple my tax assessment on top of that. I also figured there was some sort of lien that would be placed, but I didn't realize that it was a priority lien that would make it harder to sell.

I got a 2 part plan to get out from under all this, though. 

Part 1: Pull cash out refi and pay off the loan and get rid of the lien(and some other dept since my hand is being forced). Might have to pay a fee, but the way I see it, I have plenty of equity, and it's worth getting out from under this. It's going to suck to lose my 2.35% interest, but oh well. 

Part 2: Finally, apply to get my VA disability rating to 100% and be exempted from property tax altogether.  Getting professional help with this and my rep seems to think I have a good chance. 

Hopefully, it all works out. Kinda wishing I just did the cash out refi for the project to begin with, but I was really attached to my interest rate, and when we did this I was planning on selling before our first tax assesment, but that changed due to unforseen circumstances.",helene,community_discussion,
lp09c20,t3_1fpgelm,t1_lp06qlc,sarasota,Striking-Sympathy-16,1727352167,2024-09-26 12:02,2,"I thought about that, but even that doesn't add up(at least not to me). The project was about 40k, and typically, you only see about a 75%roi on hurricane windows, so assesment increase for that should have only brought it up 30k on a previously roughly 200k assessment value. Even if you worked around the homestead cap for the whole house, the value doesn't triple, so I don't understand how the tax assessment does. I have a plan moving forward, though, that I posted in another reply. I'll dm you in a minute anyway though.",helene,community_discussion,hurricane
lp09o0w,t3_1fpgelm,t1_loxqz04,sarasota,Striking-Sympathy-16,1727352316,2024-09-26 12:05,3,"Thanks for this. Wish I did more thorough research sooner. I have a plan laid out in another reply, so hopefully, it works out in the long run.",helene,community_discussion,
lp0jne6,t3_1fpgelm,t1_loxqz04,sarasota,Forward_Cranberry_82,1727356382,2024-09-26 13:13,3,I'm too dumb to understand this,helene,community_discussion,
lp0nu19,t3_1fpgelm,t1_loxqz04,sarasota,NonyaFugginBidness,1727357914,2024-09-26 13:38,5,"Here's a link without the paywall

https://archive.md/Dmcba",helene,community_discussion,
lp0yixa,t3_1fpgelm,t3_1fpgelm,sarasota,Ystebad,1727361522,2024-09-26 14:38,2,"Why would you take a loan but not expect to pay it back. 

Do people really just borrow money and not understand what the terms of the loan are??",helene,community_discussion,
lp0zc5l,t3_1fpgelm,t1_lp08m2o,sarasota,meothe,1727361782,2024-09-26 14:43,11,"Remember, the director of the PACE program and our current County Commission Chair, Mike Moran, who used $36,000 [of our taxpayer dollars](https://news.wgcu.org/government-politics/2024-07-29/public-official-moran-spent-36-000-in-taxpayers-money-on-lavish-travel-steak-dinners-and-booze) for fancy dinners and travel to Las Vegas, is asking to be our Tax Collector. VOTE BARBARA FORD COATES.",helene,community_discussion,
lp0zkwl,t3_1fpgelm,t3_1fpgelm,sarasota,meothe,1727361860,2024-09-26 14:44,3,"Remember, the director of the PACE program and our current County Commission Chair, Mike Moran, who used $36,000 [of our taxpayer dollars](https://news.wgcu.org/government-politics/2024-07-29/public-official-moran-spent-36-000-in-taxpayers-money-on-lavish-travel-steak-dinners-and-booze) for fancy dinners and travel to Las Vegas, is asking to be our Tax Collector. VOTE BARBARA FORD COATES.",helene,community_discussion,
lp14xrs,t3_1fpgelm,t3_1fpgelm,sarasota,Nordy941,1727363562,2024-09-26 15:12,3,Don’t you just live the government always helping people,helene,community_discussion,
lp1bwdd,t3_1fpgelm,t1_lp0yixa,sarasota,Striking-Sympathy-16,1727365733,2024-09-26 15:48,1,"That's not at all what I said. Did you actually read the entire post and responses? I fully expected and prepared for the monthly loan payment to be added to my escrow. What I didn't expect, nor was I informed of, was for this process to somehow trigger my tax assessment to triple overnight on top of that, which still doesn't make total sense to me. so instead of paying the extra $370 a mo. which is the monthly loan payment terms, I am also now having to pay another $300 and change on top of that because of the 300% tax assessment increase.",helene,community_discussion,
lp1c32s,t3_1fpgelm,t1_lp14xrs,sarasota,Striking-Sympathy-16,1727365789,2024-09-26 15:49,1,Yeah it's the best.... and people wonder why literally nobody has faith in gov. entities.,helene,community_discussion,
lp1f25t,t3_1fpgelm,t3_1fpgelm,sarasota,iKnowRobbie,1727366710,2024-09-26 16:05,3,"For anyone still not aware, PACE loans DIRECTLY ATTACH TO YOUR TAX LIEN. So it's a loan in the sense of Tommy Whiteknuckles loaning you some cash...

As Florida’s insurance crisis makes hurricane hardening more important than ever, consumer advocates have pressed to reign in a popular — but controversial — loan program that allows homeowners to pay for new roofs or impact windows through their property tax bills.
Some counties and tax collectors across the state have pushed for clearer disclosures for a program that has generated hundreds of complaints from people who say they were misled on costs or didn’t understand that the loan amounts to a long-term tax lien on their home.
Now, one agency that bankrolls construction projects for the Property Assessed Clean Energy program, known commonly as PACE, is pushing back — arguing that individual counties have no legal right to force it to follow additional rules or even decide where it can operate.",helene,community_discussion,hurricane
lp1q35u,t3_1fpgelm,t3_1fpgelm,sarasota,Narrow_Coffee_2483,1727370098,2024-09-26 17:01,2,"Here's an interesting video that may shed some light on property tax issues

https://youtu.be/uy3vsw30yYw?si=1uJ3tdJdGzqkpzrf",helene,community_discussion,
lp1yhwu,t3_1fpgelm,t3_1fpgelm,sarasota,Voyayer2022-2025,1727372708,2024-09-26 17:45,0,Scientology controled county,helene,community_discussion,
lp2652n,t3_1fpgelm,t1_lp1q35u,sarasota,Striking-Sympathy-16,1727375086,2024-09-26 18:24,2,Some very interesting and infuriating info here. Thank you.,helene,community_discussion,
lp29re6,t3_1fpgelm,t1_lp0zc5l,sarasota,meeeep-meeeep,1727376223,2024-09-26 18:43,5,YES! Barbara does an amazing job !,helene,community_discussion,
lp3z839,t3_1fpgelm,t1_lp1bwdd,sarasota,Ystebad,1727397053,2024-09-27 00:30,1,That is not what has happened. You still don’t understand what you signed mate.,helene,community_discussion,
lp460k3,t3_1fpgelm,t3_1fpgelm,sarasota,mushyspider,1727399542,2024-09-27 01:12,1,"I learned the hard way that Sarasota County now increases taxable value over 3% on homesteaded properties when you replace your windows. I replaced all but 2 windows and they increased my value $60k plus the 3%. I was able to get it reduced 66% of that (to the amount I actually paid to replace the 1960s broken windows. It wasn’t like this before. Maintaining one’s home shouldn’t increase homestead property over the 3%. We have a bunch of developer friendly elected officials. 
Moran is one of the worst. 

Register to vote if you aren’t already. October 7th is the deadline. https://www.sarasotavotes.gov

Research candidates online. Here is one site https://www.vote411.org",helene,community_discussion,
lp4riam,t3_1fpgelm,t1_lp1yhwu,sarasota,Docto-Phibes-MD-PhD,1727408055,2024-09-27 03:34,1,Please tell me that’s unfounded,helene,community_discussion,
lpn44im,t3_1fpgelm,t1_lp4riam,sarasota,Voyayer2022-2025,1727700330,2024-09-30 12:45,1,Headquarters in Clearwater,helene,community_discussion,
loxh5hi,t3_1fpglwu,t3_1fpglwu,sarasota,skewh1989,1727302965,2024-09-25 22:22,21,"I can understand why business owners/managers might have the attitude of, ""it's Florida, tropical storms/hurricanes are no big deal."" But, practically speaking, I doubt these businesses that choose to stay open are going to get much traffic on a day where most people who are able to will be sheltering at home. I know several doctors offices are closing. Why does the bar down the street from them need to stay open? It's silly in my opinion.",helene,community_discussion,
loxivt3,t3_1fpglwu,t3_1fpglwu,sarasota,Boomshtick414,1727303586,2024-09-25 22:33,28,"Wouldn't be shocked if some places are open in the morning and call it around noon Though hopefully they're being lenient and if people say they need to be somewhere else they let them. By 5pm the power will be probably be out in many places...so....not much point in being open at that point, and internet could go out as well.

FWIW -- during Debby, the rainfall potential wasn't anything remarkable but we were just unlucky enough to have 3-4 rain bands stack on top of each other. That gentleman who went missing for a week before his car was found 1/3 of a mile down Phillipi creek from the bridge he was washed off of -- he was on his way to work during a storm that wasn't expected to be that bad.

Remember, about like 35mph, EMS generally won't roll trucks if someone gets into trouble because their own trucks start to be put at risk. We should start to see that amount of wind by mid-morning.",helene,community_discussion,storm|power
loxoidw,t3_1fpglwu,t1_loxh5hi,sarasota,23skidoobbq,1727305630,2024-09-25 23:07,13,Doctors offices closed and you cannot understand why the bars aren’t??? Lol,helene,community_discussion,
loxpt2m,t3_1fpglwu,t3_1fpglwu,sarasota,4-me,1727306102,2024-09-25 23:15,4,I saw one pet store saying they were open until 2pm.,helene,community_discussion,
loxxa4o,t3_1fpglwu,t3_1fpglwu,sarasota,Cetophile,1727308845,2024-09-26 00:00,11,Veterinarian here.  We're going to be closed tomorrow.  I think a lot of other small businesses are doing the same.  The big guys should be open.,helene,community_discussion,
loy1tis,t3_1fpglwu,t3_1fpglwu,sarasota,ButterShave2663,1727310516,2024-09-26 00:28,4,I haven’t spoken to many people about it but just about everyone I know is working business as usual tomorrow,helene,community_discussion,
loy4pos,t3_1fpglwu,t3_1fpglwu,sarasota,clevrhandle,1727311580,2024-09-26 00:46,4,Batteries plus bulbs should be open tomorrow. I stopped by there today.,helene,community_discussion,
loy5czo,t3_1fpglwu,t3_1fpglwu,sarasota,nevertrustalumpyfart,1727311819,2024-09-26 00:50,13,"I work for a local dispensary and we’re open regular business hours tomorrow as of now. they haven’t even announced closures for our panhandle locations. 

why we are open is beyond me. folks had 3-4 days to prepare to get all supplies/medicinals. but hey, let’s value the dollar over the saftey of employees!",helene,community_discussion,
loy7znc,t3_1fpglwu,t3_1fpglwu,sarasota,Impossible-Taro-2330,1727312806,2024-09-26 01:06,36,"Employers who make their employees come in for anything non-essential during a hurricane.do NOT care about their employees.

Find a new job.

I remember being forced to also work a non-essential job years ago during hurricanes.  It was horrible driving in, worse driving home.  Such unnecessary danger.

I swore I'd get a new job and never do that again.

So I did!",helene,community_discussion,hurricane
loy9e4d,t3_1fpglwu,t3_1fpglwu,sarasota,Additional_Ideal3819,1727313334,2024-09-26 01:15,11,"it's ridiculous. i can understand the ""it's florida, this happens all the time"" bit, but you're still putting your employees at risk by making them travel through the storm instead of staying put. like pls fix your priorities",helene,community_discussion,storm
loy9y8k,t3_1fpglwu,t3_1fpglwu,sarasota,Shamboozled85,1727313545,2024-09-26 01:19,5,New construction. We are closed tomorrow. Plan on returning Friday.,helene,community_discussion,
loyf2so,t3_1fpglwu,t3_1fpglwu,sarasota,Short-Scratch4517,1727315513,2024-09-26 01:51,8,Lol Outback Steakhouse doesn’t close unless the power goes out. I know from personal experience.,helene,community_discussion,power
loyj6vl,t3_1fpglwu,t3_1fpglwu,sarasota,FederalAd6011,1727317113,2024-09-26 02:18,14,Name and shame,helene,community_discussion,
loyohr8,t3_1fpglwu,t3_1fpglwu,sarasota,noodles724,1727319252,2024-09-26 02:54,3,Mechanic at a major chain and we are playing it by ear.,helene,community_discussion,
loyuwuq,t3_1fpglwu,t3_1fpglwu,sarasota,LoudKoala3376,1727322079,2024-09-26 03:41,3,"i work at a nonessential medical lab, my boss is trying to get everyone in tomorrow. i absolutely will not be going, even if conditions are okay in the morning there’s a good chance we’ll be stranded trying to leave. a natural disaster is a good reason to call in sick imo.",helene,community_discussion,
loyw157,t3_1fpglwu,t3_1fpglwu,sarasota,Ruffian-70,1727322603,2024-09-26 03:50,3,All Publix’s are open.,helene,community_discussion,
loz6573,t3_1fpglwu,t3_1fpglwu,sarasota,ahssponie,1727327819,2024-09-26 05:16,1,Maybe stay home and don’t force the demand of minimum wage workers because you’re bored and didn’t plan well,helene,community_discussion,
lozhyg2,t3_1fpglwu,t3_1fpglwu,sarasota,dawnzig,1727335180,2024-09-26 07:19,2,"Oddly, the USPS on Ashton will be closed...",helene,community_discussion,
lozoybf,t3_1fpglwu,t1_loyj6vl,sarasota,Lilbooplantthang,1727340139,2024-09-26 08:42,1,No but for real.,helene,community_discussion,
lozy07t,t3_1fpglwu,t3_1fpglwu,sarasota,whatnowyouask,1727346287,2024-09-26 10:24,2,Guessing they will be paid to be there….?!  Minimal storm- I am grateful to have a job.    Guessing others are too….,helene,community_discussion,storm
lp03xew,t3_1fpglwu,t3_1fpglwu,sarasota,Hot-Steak7145,1727349610,2024-09-26 11:20,2,My GF sells retirement plans and insurance and works today (Thursday). I do carpet cleaning and am closed,helene,community_discussion,
lp053x2,t3_1fpglwu,t1_loy5czo,sarasota,FiftyKFlip,1727350197,2024-09-26 11:29,2,Which one?!,helene,community_discussion,
lp085in,t3_1fpglwu,t3_1fpglwu,sarasota,Valley_FourC,1727351635,2024-09-26 11:53,4,"Not gonna name my restaurant but we are gonna be open, luckily they did tell all the staff if they don't feel safe coming in they don't have to 🙏🏼. Only way they'll close is if they lose power....",helene,community_discussion,power
lp0dso2,t3_1fpglwu,t1_lp053x2,sarasota,nevertrustalumpyfart,1727354093,2024-09-26 12:34,3,"müv. open 11-7 all day today with no sign of early closure or opening, despite stores around us being closed or having early closures.",helene,community_discussion,
lp0ixos,t3_1fpglwu,t3_1fpglwu,sarasota,AlchemistMustang,1727356114,2024-09-26 13:08,1,"If Waffle House is open, other places will be too.

https://en.m.wikipedia.org/wiki/Waffle_House_Index",helene,community_discussion,
lp0kb92,t3_1fpglwu,t3_1fpglwu,sarasota,Irishfireclaw88,1727356628,2024-09-26 13:17,3,"UPS, USPS and FedEx are all closed on Thursday",helene,community_discussion,
lp0njdn,t3_1fpglwu,t3_1fpglwu,sarasota,Alchemyrrh,1727357806,2024-09-26 13:36,-1,Ridiculous to go and do your job?,helene,community_discussion,
lp0rjsw,t3_1fpglwu,t1_lp0dso2,sarasota,FiftyKFlip,1727359210,2024-09-26 14:00,5,"Oh that’s pretty wild…

https://muvfl.com/post/severe-weather

Looks like Sarasota just said fuck it",helene,community_discussion,weather
lp0u9ot,t3_1fpglwu,t1_lp0njdn,sarasota,Lilbooplantthang,1727360127,2024-09-26 14:15,6,In a hurricane😭 literally yes what are you talking about,helene,community_discussion,hurricane
lp11mx5,t3_1fpglwu,t1_lp0rjsw,sarasota,nevertrustalumpyfart,1727362510,2024-09-26 14:55,3,pretty on brand from a corporation based in a state (IL) that doesn’t get hurricanes lmao,helene,community_discussion,
lp12yei,t3_1fpglwu,t1_lp0ixos,sarasota,SlowIntroduction6756,1727362928,2024-09-26 15:02,3,That’s the last place to close,helene,community_discussion,
lp13eyq,t3_1fpglwu,t1_loyw157,sarasota,SlowIntroduction6756,1727363076,2024-09-26 15:04,1,"It hurricane cakening, just a little treat. Don’t be mad PJ.",helene,community_discussion,hurricane
lp162nu,t3_1fpglwu,t1_loxoidw,sarasota,Nordy941,1727363922,2024-09-26 15:18,2,🇺🇸 opportunism,helene,community_discussion,
lp1dly9,t3_1fpglwu,t1_lp0dso2,sarasota,Psychological-Dot929,1727366261,2024-09-26 15:57,-1,Do you have Miracle Fruit in stock? Asking for a friend. Thanks!,helene,community_discussion,
lp1h3dx,t3_1fpglwu,t3_1fpglwu,sarasota,JasperinWaynesville,1727367342,2024-09-26 16:15,2,Local Publix (#555 @ Bee Ridge and 41) open now as is Trader Joe's. Just went to both. Morton's did close for the day. Not sure about anything else. Lots of businesses with lots of cars parked outside. We're not experiencing Helene that much because it's well out in the gulf.,helene,community_discussion,helene
lp2fexx,t3_1fpglwu,t1_lp12yei,sarasota,Siestatime46,1727378010,2024-09-26 19:13,0,That’s the last place I’d go to! 😂,helene,community_discussion,
lp2ktj5,t3_1fpglwu,t3_1fpglwu,sarasota,[deleted],1727379714,2024-09-26 19:41,1,[removed],helene,community_discussion,
lp2nq27,t3_1fpglwu,t1_lp2ktj5,sarasota,sarasota-ModTeam,1727380596,2024-09-26 19:56,2,This post is spam.,helene,community_discussion,
lp2u0hl,t3_1fpglwu,t1_lp0u9ot,sarasota,spyder7723,1727382599,2024-09-26 20:29,0,The hurricane will be in Georgia tomorrow....,helene,community_discussion,hurricane
lp2yy8o,t3_1fpglwu,t3_1fpglwu,sarasota,eppy1973,1727384167,2024-09-26 20:56,1,This is done by 10pm tonight here in Sarasota.  I would think most everything will be open tommorrow.,helene,community_discussion,
lp3ouex,t3_1fpglwu,t1_lp2u0hl,sarasota,Lilbooplantthang,1727393157,2024-09-26 23:25,2,Yes good job!,helene,community_discussion,
lp49myw,t3_1fpglwu,t1_lp03xew,sarasota,FederalAd6011,1727400894,2024-09-27 01:34,1,"I work for a major ins co and the offices are closed Thursday and Friday, you can chose to wfh if weather permits.",helene,community_discussion,weather
lp8kjjf,t3_1fpglwu,t1_lp03xew,sarasota,Relevant-Ad3572,1727467571,2024-09-27 20:06,1,Oh your business is going to be booming this weekend and next week.,helene,community_discussion,
lpyj4m0,t3_1fpglwu,t1_lp8kjjf,sarasota,Hot-Steak7145,1727867819,2024-10-02 11:16,1,"Your correct. Im just checking social media for the first time since helene, working 12 hour shifts no breaks and my body is sore everywhere but these people legit have it bad and I'm helping. Doing lots of free work for repeat clients. Im grateful they are grateful it makes it all worth it",helene,community_discussion,helene
loyg225,t3_1fpkzxj,t3_1fpkzxj,sarasota,LycheeAppropriate315,1727315891,2024-09-26 01:58,35,"In the midst of an actual hurricane, I have to assume this is a joke right?? 😂",helene,community_discussion,hurricane
loygdtt,t3_1fpkzxj,t1_loyg225,sarasota,[deleted],1727316016,2024-09-26 02:00,-11,[removed],helene,community_discussion,
loygoj7,t3_1fpkzxj,t3_1fpkzxj,sarasota,Maxpowerxp,1727316131,2024-09-26 02:02,1,Traffic is pretty bad.,helene,community_discussion,
loyhd3l,t3_1fpkzxj,t3_1fpkzxj,sarasota,Happee12345,1727316395,2024-09-26 02:06,6,If you’re younger you should move to St Pete.,helene,community_discussion,
loyi3fh,t3_1fpkzxj,t1_loyhd3l,sarasota,[deleted],1727316681,2024-09-26 02:11,-8,[removed],helene,community_discussion,
loyidxy,t3_1fpkzxj,t3_1fpkzxj,sarasota,she_russian_im_bustn,1727316796,2024-09-26 02:13,-1,Well.. when i lived there (2012-2023) we called it Share-a-sota…shes not your girl its just your turn. Does that answer your dating question?,helene,community_discussion,
loyig1l,t3_1fpkzxj,t1_loyg225,sarasota,noodles724,1727316819,2024-09-26 02:13,10,"Account is not even an hour old, yeah I’d say it’s a joke.",helene,community_discussion,
loyiim6,t3_1fpkzxj,t1_loyidxy,sarasota,[deleted],1727316847,2024-09-26 02:14,-5,[removed],helene,community_discussion,
loyj1k3,t3_1fpkzxj,t3_1fpkzxj,sarasota,No_Bite3721,1727317054,2024-09-26 02:17,0,"Traffic sucks, and it floods when we get a hurricane. You should go to st Pete it's nicer out there. But if you decide to stay be aware that the reddit sub gets spammed with ""hey I'm moving into sarasota any advice?"" Posts.",helene,community_discussion,hurricane
loyjlo1,t3_1fpkzxj,t3_1fpkzxj,sarasota,714091olegna,1727317273,2024-09-26 02:21,11,"Yeah, this is not the place to move to unless your retiring with money.",helene,community_discussion,
loykc42,t3_1fpkzxj,t1_loyjlo1,sarasota,[deleted],1727317568,2024-09-26 02:26,0,[removed],helene,community_discussion,
loylfpu,t3_1fpkzxj,t3_1fpkzxj,sarasota,One_Record_8146,1727318011,2024-09-26 02:33,1,Don’t come. There’s nothing to do unless you have a lot of $$,helene,community_discussion,
loylza8,t3_1fpkzxj,t1_loyi3fh,sarasota,Thanos_Stomps,1727318230,2024-09-26 02:37,9,"No. Everyone is 60+. If you want to have friends, or fun, you should move to St Pete. It’s much better.",helene,community_discussion,
loymfe4,t3_1fpkzxj,t1_loylfpu,sarasota,[deleted],1727318411,2024-09-26 02:40,1,[removed],helene,community_discussion,
loymi9a,t3_1fpkzxj,t1_loylza8,sarasota,[deleted],1727318443,2024-09-26 02:40,1,[removed],helene,community_discussion,
loyobuc,t3_1fpkzxj,t1_loygdtt,sarasota,UnecessaryCensorship,1727319185,2024-09-26 02:53,3,Seriously: Read through the history of this sub.  You'll find countless threads which address this.,helene,community_discussion,
loyp7af,t3_1fpkzxj,t3_1fpkzxj,sarasota,XheavenscentX,1727319550,2024-09-26 02:59,9,"As someone who has been trying to escape my whole life, WHY DO PEOPLE WANT TO LIVE HERE? The beach is only good for vacations. Do not buy into the marketing and believing that what you experience while on your vacations is going to be equal to your daily life. Florida sucks. It's where dreams come to die. It's a sunny place for shady people. It's sweaty genitals and mosquitos and flying cockroaches and wolf spiders while killing all your plants and grass hot 10 months out of the year. ""Oh well at least I don't have to shovel snow"" blah blah blah that's like what, 3 months out of your year? The water sucks and smells like rotten eggs, it makes your food and your hair terrible. It's poisoned by Piney Point or Monsanto or just the gross ass normal sweaty humid nature (like fungus, lots of mold here - look up fungal sinus infections, they are a real good time, life long maintenance meds for it will run you $3k a month). The developers rule the county and have lied to the wealthy northerners who can afford their prices while destroying every area of land the size of a postage stamp. Then all the old homes are flooded by the new developments, that's pretty cool. PEOPLE ARE FUCKING MISERABLE. 

Natives will hate you because your not from here. You can be the best person in the world and save all the Florida panthers and not molest alligators nor complain about the pizza here, but we will still hate you just for being from up north. And believe we can spot you from a mile away (looking at you ""endless summer"" surfer {we're on the fucking gulf side} license plate people with foreign car dealerships advertised on your vehicle). Transplants will hate you because they are mad they gave up their nice life up north for a marketing tactic they fell for while on vacation but don't want to admit they hate it here while at the same time complaining about every single. damn. thing. so they are overly aggressive about everything. Jobs? Do you work in the service industry? You'll make a killing for 6 months out of the year, but you will compete with natives, other transplants, hurricanes/ red tide, and/ or have to deal with no tipping Europeans/ Canadians/ 8 tops with 10 kids.

Things to do - do you like to sleep a lot? Drink? Eat? That's pretty much it. It's too hot to go outside. The beach parking is 0full by 9am off season. Restaurants can have 2 hr waits during season, so don't plan on going out to eat during Oct-May. There's a lot of drinking here. Plenty of great breweries. That's how we survive, alcohol and Surterra Wellness.

Dating - see paragraph 1, ""It's a sunny place for shady people."" Good luck.

COL/QOL - high cost of living due to locale, low wages due to service industry jobs being the most prominent (hotel/ restaurant), no big corporations here, it's just low wages in general, I work remote for a software company that literally pays me less because I live in FL. Quality of life - I have been trying to leave this hellhole since I was 15 years old. I've only ever lived here, but everyone I have met, including transplants after the first year of beach trips and Disney wears off!!, has wanted to leave. The education system sucks. 

Florida is like 50% Staten Island 50% podunk backwoods GA town you've never even heard of. Rude, obnoxious, think we know everything, ready to fight, kinda dumb yet kinda smart, angry, have guns, usually half naked, drunk/ high/ all of the above, pissed off, nascar drivers or grannies hugging the steering wheel doing 20 under (no in between), mad and ready to brawl (plus we have guns), loooooooots of turnover whether it's teachers, neighbors, coworkers, friends - everyone is transient. The sun becomes poison. You are closer to the equator, you get sunspots, freckles, moles, sunstroke, everything dies down here.

Pretend Florida is the gated hospital door in the first episode of The Walking Dead, ""Dead Inside, DO NOT ENTER.""",helene,community_discussion,
loyq44l,t3_1fpkzxj,t3_1fpkzxj,sarasota,scabbedcolon,1727319936,2024-09-26 03:05,6,bro what do you know about Applebees,helene,community_discussion,
loyqigv,t3_1fpkzxj,t1_loyobuc,sarasota,[deleted],1727320108,2024-09-26 03:08,1,[removed],helene,community_discussion,
