id,subreddit,author,created_utc,created_date,num_comments,score,title,selftext,hurricane,source_type,keyword_hit
1fpcu7u,asheville,Straight_Bid_4291,1727292039,2024-09-25 19:20,5,0,Good spots to watch the sunrise?,"What are some good spots around Asheville to watch the sunrise from? Somewhere where it is safe to park a car.  

  
",helene,community_discussion,
1fpcyqy,asheville,Tthrowaaaawy,1727292355,2024-09-25 19:25,17,0,How does this car dealership grift work?,"I’ve gotten these in the past and you are always a “winner” - what is the scam here? I know they want to get you to call or come down to the dealership, but how does this work? 

I know that everyone getting a mailer is not getting free gas for a year. Is it that you get it if you buy a new car or what? 

This is from a Nissan dealership in town somewhere ",helene,community_discussion,
1fpdafw,asheville,Sensitive_Kale_2598,1727293179,2024-09-25 19:39,9,27,I hope all who are affected by the state of emergency stay safe,,helene,community_discussion,
1fpdhh0,asheville,FlapjackBuns,1727293693,2024-09-25 19:48,91,101,“This storm is gonna be really bad.” What does “really bad” mean to y’all? ,"Been here a few years after spending a decade living in New Orleans. Trying to figure out what we’re realistically looking at for possible outcomes of this storm in the West Asheville area. Everything is subjective, and I want to be prepared, but it seems some of y’all are prepping for this as if we live in the panhandle 😂 

So, when folks say that “this has the potential to be really bad, in the way that previous storms have been really bad”, what do you mean? 

The power went out - are we talking for a few hours? A day? 3 days?

Your roof needed fixing - as in it sprung a leak, or you needed a new roof, or the whole thing blew away? 

It flooded - like your yard drowned, or your car got totaled? 

Thanks!",helene,community_discussion,storm|power
1fpenw3,asheville,Replabro,1727296665,2024-09-25 20:37,11,3,Am I crazy to think my flight out at Friday 5AM will take off?,"Also connecting in Charlotte for a 7AM flight, and that airport is absolute chaos even on a clear day. Have a wedding this weekend that I really don’t want to miss!!",helene,community_discussion,
1fpf8lg,asheville,lihiker,1727298134,2024-09-25 21:02,0,1,Blue Ridge Parkway Closures as of Wednesday 9/25,"Hey all, NPS has already started to close parts of the BRP. Just wanted to give a heads up",helene,community_discussion,
1fpf9m0,asheville,lihiker,1727298205,2024-09-25 21:03,0,16,Blue Ridge Parkwsy Closures for Wednesday 9/25,,helene,community_discussion,
1fpfijy,asheville,ligerqueen22,1727298836,2024-09-25 21:13,1,1,Bryson City trip this weekend help,So I’ve had a little trip to BC planned for a while for this Thursday-Sunday. Obviously the timing is turning out to be pretty terrible based on Helene’s current path. Should we scrap it? Would likely lose hundreds on the rental and other reservations but also I don’t want to die 🤷🏻‍♀️ We’d be staying in town near Bryson City Brewing. (Posting here and BC sub for increased visibility),helene,community_discussion,helene
1fpfnzo,asheville,au5lander,1727299224,2024-09-25 21:20,67,625,tourists in Asheville right now,,helene,community_discussion,
1fpfqg3,asheville,beaverlakenc,1727299397,2024-09-25 21:23,0,1,It's fucking raining mega thread,2 swimming holes on Patton ,helene,community_discussion,
1fpgf12,asheville,Ok-Drag7325,1727301246,2024-09-25 21:54,10,5,Reputable Well Drillers in Avl area.,"Getting a piece of property in candler and am looking to install a well - probably 9 inches or whatever is the standard size pipe. Have you done done this recently? Do you have a super rough ballpark of the cost?

Thank you!",helene,community_discussion,
1fpgf3k,asheville,Special_Story_2254,1727301251,2024-09-25 21:54,2,18,"Communities need to prepare for catastrophic, life-threatening inland flooding from #Helene, even well after landfall
Widespread power outages likely from hurricane and tropical storm-force winds - NOAA","UPDATED: September 25, 2024. *Reporters: This is a rare news release from NOAA for an operational weather event. We urge the news media to continue focusing the public’s attention on the major impacts from inland flooding expected along the path of Helene well after landfall.*



[https://www.noaa.gov/news-release/communities-need-to-prepare-for-catastrophic-life-threatening-inland-flooding-from-helene-even-well](https://www.noaa.gov/news-release/communities-need-to-prepare-for-catastrophic-life-threatening-inland-flooding-from-helene-even-well)",helene,community_discussion,hurricane|storm|power|weather|noaa|helene
1fpgk8h,asheville,Proof-Bell-826,1727301629,2024-09-25 22:00,22,428,Black Mountain’s storm prep or threatening tourists? ,"Sign off of exit 64, made me chuckle 

(Be safe everyone!)",helene,community_discussion,storm
1fpgp1b,asheville,ghostrabbitart,1727301985,2024-09-25 22:06,22,127,Missing elderly cat south Asheville - Luna ,"Missing elderly cat in South Asheville 

She never gets out  but last night she slipped out and our neighbor took her downstairs for some reason and now we can't find her. Would really like to get her back before the storm. She has a thyroid issue and needs her meds. She's always thirsty and loves laying in the sun. She usually comes if you yell ""chicken time""",helene,community_discussion,storm
1fpgqfp,asheville,TallBoy24,1727302090,2024-09-25 22:08,1,1,Anybody selling Mannequin Pussy tickets?,[removed],helene,community_discussion,
1fpgs8c,asheville,crapface1984,1727302234,2024-09-25 22:10,10,17,"My backyard off Newfound Rd, Thanks Helene! Stay safe everyone! ","Had the creek at my house reinforced today and it’s already being put to the test. The bottom is 6’ deep, about 17’ wide at the top and typically runs between 3”- 8” deep on a normal day. My patio is 8’ from the closest edge and 15’ from my exterior wall at the furthest. Don’t let the pictures fool you, it’s bigger thank you think and fast filling. The next 48-72 hours are going to be fun… 
Pictures from today at 1pm, 3:30pm and now 6pm. 
Stay safe everyone! ",helene,community_discussion,helene
1fpgsun,asheville,Comfortable-End-2894,1727302279,2024-09-25 22:11,6,43,"Depot flooded, don’t come this way ",,helene,community_discussion,
1fpgxft,asheville,studentoftheearth,1727302632,2024-09-25 22:17,47,178,Biltmore village Major flooding,"Avoid if you can. Wednesday 9\25 6:16pm
",helene,community_discussion,
1fpgzo5,asheville,holymountaincacti,1727302800,2024-09-25 22:20,0,2,PSA: Patton road is under water near the Waffle House - plan accordingly ,Basically just the title. Be careful out there. ,helene,community_discussion,
1fph2d2,asheville,holymountaincacti,1727303006,2024-09-25 22:23,9,30,PSA: Part of tunnel road near Waffle House is impassable and underwater ,"Just waited for a while in traffic, before realizing that I would have to turn around. It’s a total shit show out there, be careful",helene,community_discussion,
1fphgc1,asheville,GingerVRD,1727304091,2024-09-25 22:41,5,19,Flooding off Exit 23(North Asheville/Woodfin),"I made it home. Warning for swears. Do not go this way, use the highway. Police shut down the intersection.",helene,community_discussion,
1fphlz6,asheville,Technical-Avocado-92,1727304520,2024-09-25 22:48,2,28,Biltmore Village already has about 18” of standing water,"Multiple stalled/abandoned vehicles where Sweeten Creek enters the village. Sorry no pics but you know what they say, turn around, don’t drown!",helene,community_discussion,
1fphtoy,asheville,Hello_Hollow_Halo,1727305119,2024-09-25 22:58,0,1,OFFICIAL FLOOD MEGATHREAD 💦💦💦💦,,helene,community_discussion,flood
1fphvom,asheville,Hello_Hollow_Halo,1727305265,2024-09-25 23:01,0,1,FLOOD MEGATHREAD: Post Important Info Here!,[removed],helene,community_discussion,flood
1fphxx1,asheville,Hello_Hollow_Halo,1727305434,2024-09-25 23:03,735,491,Asheville Flooding Megathread: Post Updates Here,"Everyone’s asking for one so here it is. Stay safe and if you have important info or tips post em here. 

Tip for those who have plans to travel to Asheville this weekend: Don’t. Reschedule if you can. 

9/25 8pm: Flooding in Woodfin, Biltmore Village, Swannanoa, Patton Ave, Arden, Sweeten Creek Rd

9/25 9pm: small mudslide reported in Black Mountain Rt 9, power outages in Marshall

9/25 10pm: Cars submerged/stalled on Swannanoa river road by the Walmart. Woodfin ingles flooded inside. Radar showing steady rain until around 7am when rain will get much stronger

9/25 11pm: power outages in black mountain. Getting some rest. See y’all in the AM

9/26 5am: French Broad will exceed 2004 flood levels: https://water.noaa.gov/gauges/AVLN7",helene,community_discussion,flood|power|noaa
1fpi41n,asheville,themushroommage,1727305930,2024-09-25 23:12,5,8,How's the Dirty Broad? Flooded?,"Anyone work in and around the River Arts district? Curious what roads have the potential to be closed tomorrow.

Sorry for the dumb post title (30 character requirement for titles is stupid)
",helene,community_discussion,
1fpiciz,asheville,EGGlNTHlSTRYlNGTlME,1727306603,2024-09-25 23:23,11,53,Know this man?  He’s wanted for attempted kidnapping in Black Mountain,,helene,community_discussion,
1fpiemp,asheville,the_great_josh,1727306777,2024-09-25 23:26,0,3,Road condition updates around town,Hey everyone! hoping we can start a thread about how the roads are looking so people can make informed decisions if they have to be on the road. I just drove from the airport to north Asheville and 191 is already looking really bad. ,helene,community_discussion,
1fpik0m,asheville,Miserable_Meeting_26,1727307212,2024-09-25 23:33,2,8,Charge your portable batteries now,"I've experienced multiple large hurricanes and the aftermaths.

This storm could knock out power for a while. Now is a good time to top up all your power banks. Hunker down tomorrow night and don't venture out. The emergency services don't need extra calls from people trying to be adventurous and get hurt.

Also be careful with power lines in the aftermath and be careful assessing the scenes. 

If things get bad remember that we're all in this together. You probably have something your neighbor needs and vise versa. 

Hopefully it's not so bad, but I just wanted to send this message.",helene,community_discussion,storm|power
1fpimfn,asheville,Unable-Pepper8359,1727307409,2024-09-25 23:36,1,2,anyone got pics of river rd and broadway st specifically? ,,helene,community_discussion,
1fpj19k,asheville,FlyingDutchLady,1727308650,2024-09-25 23:57,2,1,Anyone know what the ABC stores are closed?,"I just tried to go to an ABC store around 7:15 and it was closed,which I’ve never seen happen. I assume it might be storm related but I’m still surprised. Anybody know what’s going on?",helene,community_discussion,storm
1fpj76s,asheville,Anita-dong,1727309127,2024-09-26 00:05,14,0,Hope you all are going to be safe…with Hel-ena…😹💕🙏,"I’m south & getting 
slammed tomorrow…
🫤🥹 I’ve lived through 
so many..but you all are kind 
of new to them..right? 🤔",helene,community_discussion,
1fpjac4,asheville,brooke_heaton,1727309391,2024-09-26 00:09,35,153,Half of Mark Robinson’s Capitol Staff Prepping to Quit En Masse,,helene,community_discussion,
1fpkm7u,asheville,deltama,1727313501,2024-09-26 01:18,14,101,Brace . . . . . .  yourselves . . . . . . .,F,helene,community_discussion,
1fpkvds,asheville,cheeseburgesticks,1727314316,2024-09-26 01:31,11,0,Round trip ride from Asheville Airport to Sapphire,"Hello new friends of Asheville - I will be flying into AVL on Thursday, October 3rd at 2 PM, and departing on Monday, October 7th at 7 AM. I need a ride from the airport to Sapphire on Thursday and from Sapphire to the airport for departure on Monday. Obviously I could rent a car, but they're all $500+ and I don't need a car during my trip, so trying to avoid that route.

I'm wondering how reliable Uber and Lyft are in the airport/Sapphire area and if can rely on that, or if anyone has any driver recommendations I can arrange rides with ahead of time. Any information is greatly appreciated! Thanks in advance!",helene,community_discussion,
1fpl91p,asheville,LimpDiggy,1727315479,2024-09-26 01:51,10,95,To the Gal in the white truck on Haywood today: ,"I was the guy who rear-ended your truck with my bike earlier this evening. The conditions were atrocious; I looked away for two seconds before I realized you were stopped. I bounced off your tailgate like a greased pig at the county fair.

If there are any damages, feel free to PM me, and I’ll take care of it.",helene,community_discussion,
1fplhzn,asheville,Nickyvox,1727316248,2024-09-26 02:04,13,151,Golf course on Beaverdam Rd and Elk Mountain.,About 6:45pm today,helene,community_discussion,
1fplnvn,asheville,Teriyaki-Bukkake69,1727316772,2024-09-26 02:12,17,0,Flat water kayaking spots nearby?,I’ve been getting into white water kayaking recently but would really like to find some spots where I can go solo so I don’t need the dual car transport system with a friend. Just looking for some spots I can get in and out at the same spot for a chill day on the water,helene,community_discussion,
1fpm5c3,asheville,Different_Type_2095,1727318341,2024-09-26 02:39,16,0,Best fresh cinnamon rolls in town. ,,helene,community_discussion,
1fpmywv,asheville,Dense_Delivery_6013,1727321119,2024-09-26 03:25,1,0,Is tunnel rd near mini jones still flooded I have an appointment tomorrow and i don’t know if i will be able to drive there does anyone know what’s going on that road ? ,,helene,community_discussion,
1fpmzhv,asheville,CryptidKeeper,1727321178,2024-09-26 03:26,0,2,Simpson St by Regeneration Station 7:30 pm 9/25,,helene,community_discussion,
1fpn12m,asheville,CryptidKeeper,1727321332,2024-09-26 03:28,6,23,Simpson St by Regeneration Station 7:30 pm 9/25,,helene,community_discussion,
1fpn2qn,asheville,msfigment69,1727321488,2024-09-26 03:31,4,3,How fucked is Amboy Rd with flooding rn?,I don’t wanna drive to work tomorrow morning.,helene,community_discussion,
1fpn6w4,asheville,TennyBoy,1727321894,2024-09-26 03:38,249,162,Asheville Flooding Megathread (Overnight): Post Updates Here!,Hey everyone! I saw the OP was getting some rest. I work overnight so please feel free to send updates and I'll update this post as much as I possibly can (I'm aiming for every 30 minutes or so).,helene,community_discussion,
1fpnex1,asheville,Mooksters32,1727322669,2024-09-26 03:51,28,0,Would driving to Knoxville and back tomorrow be a bad idea?,I’d be traveling from south of Asheville. I’m newer to the area and don’t understand how bad the flooding could be… I know that round is very windy. There’s a Avatar the Last Airbender concert I really want to go to lol,helene,community_discussion,
1fpnf0k,asheville,Sea-Iron7027,1727322677,2024-09-26 03:51,1,1,KILL ALL CYCLISTS THEY DESERVE TO DIE IN HELL ,[removed],helene,community_discussion,
1fpngjn,asheville,Sea-Iron7027,1727322829,2024-09-26 03:53,0,1,RIDE YOUR FUCKING BIKE YOU LAZY FUCK,[removed],helene,community_discussion,
1fpnjfc,asheville,Wide_Mood,1727323119,2024-09-26 03:58,43,324,Protect Waffle House at All Costs (Tunnel Rd),,helene,community_discussion,
1fpnxtd,asheville,Sea_Magician5829,1727324508,2024-09-26 04:21,4,20,Anyone catch hometown hero MJ Lenderman on Jimmy Fallon tonight ?,Love that he’s killing it.  His record release BBQ/show at Harvest  a few weeks ago was one for the books.,helene,community_discussion,
1fpoitx,asheville,ghostofbiltmore,1727326744,2024-09-26 04:59,7,0,Where is your cybertruck now? ,,helene,community_discussion,
1fpqyxr,asheville,Axel3600,1727337455,2024-09-26 07:57,2,1,ToBM sending mixed signals before the storm,,helene,community_discussion,storm
1fpqzgs,asheville,Axel3600,1727337526,2024-09-26 07:58,0,1,ToBM sending mixed signals today,,helene,community_discussion,
1fpr879,asheville,OmegaJ8006,1727338640,2024-09-26 08:17,26,593,Top 10 Tips for Snorkeling Biltmore Village,"Top 10 Tips for Snorkeling Biltmore Village

1. If you hear haunted tunes while underwater, it may be the McDonald’s piano playing all by its lonesome.

2. Snorkeling is free in Biltmore Village but it’s still $89 at Biltmore House. 

3. Dress code for snorkeling remains salmon-colored shorts and tortoise-shell glasses.

4. E. coli levels may be at an all-time high, so nothing has changed.

5. Despite being underwater, you’ll still be able to hear ‘WELCOME TO MOE’S!’ at Moe’s Southwest Grill.

6. Take advantage of the special at Casablanca — Helene-soaked cigars 50% off.

7. Avoid colorful coral reefs which may actually be floating bunches of floral loungewear.

8. Be wary of ripoffs — I mean, riptides — at Williams Sonoma.

9. Deep water can obscure light which should improve the art at New Morning Gallery.

10. All the lights will still be on at Long John Silver’s with absolutely no one inside.",helene,community_discussion,helene
1fpuqm5,asheville,Tatnasty6669,1727352981,2024-09-26 12:16,2,0,Local barber @ fox on Patton Avenue ,Would you guys drive in this for a haircut today or am I better of staying home ? LOL ,helene,community_discussion,
1fpuwoj,asheville,FreasFrames,1727353522,2024-09-26 12:25,3,2,Flooding in Asheville due to Helene,"I’m doing some photo reporting for the Associated Press and Getty. 

Is anyone currently seeing any flooding anywhere in Asheville? This could be flash flooding, river flooding or inundated roadways.

Also if any mud or landslides please post those here too.  Trying to keep an ongoing citizen reported thread of impacts for the duration of storm effects",helene,community_discussion,storm|helene
1fpv9nu,asheville,leaderofthemeatteam,1727354637,2024-09-26 12:43,31,0,Where to drink beer today?????,"Cuz ya know, it's the end of the world",helene,community_discussion,
1fpvix4,asheville,Hello_Hollow_Halo,1727355404,2024-09-26 12:56,994,231,Thursday Flooding MEGATHREAD: Post Your Pics and Updates Here!,Post pics and updates here. Prior megathreads linked below. Thanks to everyone for helping & stay safe. ,helene,community_discussion,
1fpvj58,asheville,Tinkerer221,1727355426,2024-09-26 12:57,33,66,Remembering the Flood of 1916 ,"I've heard people say that the current storm might be as bad as 2004.  Recently heard someone say it might even be as bad as the flood of 1916, which I only vaguely know about.  Here are a few story links:

* ""[Remembering the Flood of 1916](https://www.frenchbroadrafting.com/blog/remembering-the-flood-of-1916)"" - French Broad Adventures
* ""[Flood of 1916](https://www.asheville.com/flood-of-1916/)"" - Asheville.com
* ""[100 years after the FLood of 1916, the City of Asheville is ready for the next one](https://www.ashevillenc.gov/news/100-years-after-the-flood-of-1916-the-city-of-asheville-is-ready-for-the-next-one/)"" - 2016 Ashevillenc.gov
* ""[The Great Flood of 1916](https://storymaps.arcgis.com/stories/bcb2e5373c21491c9e68e96a8156d92b)"" - ArcGIS Storymap by NCGS and UNCA NEMAC",helene,community_discussion,storm|flood
1fpwijq,asheville,Tatnasty6669,1727358205,2024-09-26 13:43,36,598,Business will be booming today!!!,,helene,community_discussion,
1fpwvqe,asheville,Nousepretending,1727359217,2024-09-26 14:00,6,0,Best place to get a tasting menu,"I’m planning a weekend trip to Asheville in November, and really wanted to have a nice dinner, where I don’t have to make any decisions. I’ve been told about Asheville Proper, and Ukiah, and heard some whispers about Neng Jr. what’s my best bet, for a memorable dining experience?",helene,community_discussion,
1fpx3ek,asheville,Ellisd86,1727359757,2024-09-26 14:09,27,16,Should I stay or should I go now?,"My wife left for Charlotte with the baby on Tuesday to help take care of her sick father. 

My son and I stayed behind here in West Asheville thinking she would be back Friday (for my birthday) Now he and I are here in the flood zone, with the potential of power outages and non-potable water until Sat.

I’ve seen a lot of people say that tonight pm and tomorrow am will be the worst flooding times. I’ve also heard there will be a slight break/window in rainfall later today. The French broad flooding indicator is currently at “minor” and will be at its highest tomorrow am.

Would it be worth it if I leave within the next hour to drive to either Charlotte (her family) or Spartanburg (my family) to avoid being stuck here in a sketchier situation with just my son and I.",helene,community_discussion,flood|power
1fpx772,asheville,Sevenmodes,1727360035,2024-09-26 14:13,7,9,Suburban Propane - $4.64 per gallon… way higher than normal. Anyone else getting this?,"My usual bill is in the $3 range. I have not been keeping an eye on propane prices, but generally have though they tracked other fuel prices. This is way out of whack and edging me towards telling them to come get their tank and going with someone else.

Anyone else getting this?",helene,community_discussion,
1fpxg88,asheville,Ok_Mode8590,1727360690,2024-09-26 14:24,1,1,Places near Rabbit Rabbit to hear music,[removed],helene,community_discussion,
1fpxhcq,asheville,ExtraplanetJanet,1727360777,2024-09-26 14:26,1,2,Red Cross Shelter Open in Swannanoa ,"The Red Cross has opened a shelter at First Baptist Church, 503 Park Street in Swannanoa for people displaced or endangered by the storm or flooding. No pets are allowed at the shelter. Donations of food and material are not needed at this time and cannot be accepted at the shelter. 

Buncombe County is also in the process of opening a shelter, I'll provide details for that if I learn more about it. 

  
",helene,community_discussion,storm
1fpxrt2,asheville,h0zae,1727361541,2024-09-26 14:39,26,0,WLOS: Who do you trust to handle the economy?,,helene,community_discussion,
1fpxv0s,asheville,ISawWhatYouThought,1727361770,2024-09-26 14:42,29,41,Yall Please Get the Flood Memes Flying!,"Yall are much wittier than I am and there's too much serious. For those creative folks, please consider shining your comedic light on us.  We need some memes at the ready for when everyone we've ever known messages us with ""just checking in..."" ",helene,community_discussion,flood
1fpy3pt,asheville,DriftingWillowtree,1727362401,2024-09-26 14:53,5,1,"Advice driving to Charleston, SC Hurricane Helene","My friend is insistent that he will be safe driving from Asheville to Charleston, SC tonight. I’ve read him everything/risks and warnings trying to convince him it’s stupid. What else can I say? Is this dangerous? What are the risks I can point out to him? He says it’ll be mild weather in Charleston. I keep pointing out he has to drive back to Asheville on Sunday but he won’t listen.",helene,community_discussion,hurricane|weather|helene
1fpz65q,asheville,MelisWife22,1727365042,2024-09-26 15:37,14,10,"French Speakers/Native French People Living in Asheville, Preferably Young ","Hey everyone. I'm an Asheville native and I've been learning French for about a year. 

The thing is, I've not had very many opportunities to practice with people here. When I tried creating a French immersion group on Meetup, almost everyone that came was much older than me (I'm in my 20s), and not many people spoke at all or were interested in speaking really with me. Plus, with my epilepsy, things just got hectic, and, because I had to stop spending money on an organizer plan, well, it all just stopped. 

So, now I'm just coming here, I guess, to ask, well, who can I find that's around my age to speak and practice with, and hopefully to also make friends with? As an autistic person making friends can be hard, but I'm also trying to work on that as part of my therapy goals, and I would love to make more friends. 

I hope someone can understand and help, thank you so much! ",helene,community_discussion,
1fpzmua,asheville,HardPour_Cornography,1727366226,2024-09-26 15:57,1,4,I can't believe they gave me a parking ticket!,,helene,community_discussion,
1fpzsbn,asheville,Silly_punkk,1727366595,2024-09-26 16:03,16,238,Able to open my home up to small animals in need during the flood.,"Hello! I work in small animal rescue and as a certified pet care provider. If anyone needs help with their small mammals, reptiles, or birds during the flood, I am currently making room to take in three-four. I absolutely don’t need payment either.

If you need help, comment and I’ll send you my number so we can work everything out. I can also provide a quick reference so you can make sure your animal is safe. 

Remember, do not touch the flood water or let your children/animals touch it. Flood water can be extremely toxic/dangerous.",helene,community_discussion,flood
1fq0010,asheville,Ok___Culture,1727367134,2024-09-26 16:12,57,111,"Hey y'all, Blue Ridge Public Radio manager here -- we're collecting Helene photos and videos for our WNC coverage if you'd like to share yours with us! ","Hope this post is OK! I'll remove it if not. 

As part of BPR's live coverage of the hurricane across WNC, we're collecting photos and videos of how it's impacting people and what you're seeing. Some of the photos posted here are amazing, and if you want to send them to us too, you can do it [via this form](https://www.bpr.org/announcements/2024-09-26/what-does-hurricane-helene-look-like-where-you-are-send-us-a-photo-or-video) or in a DM on Instagram @/blueridgepublicradio. 

We're also posting a [live update blog](https://www.bpr.org/live-updates/live-blog-hurricane-helene-wnc) with info about closures, conditions etc. as we receive them. Feel free to send us any tips too, and PLEASE stay safe! Don't drive through water! ",helene,community_discussion,hurricane|helene
