id,subreddit,author,created_utc,created_date,num_comments,score,title,selftext,hurricane,source_type,keyword_hit
1fnypyy,NorthCarolina,Puzzleheaded-Drag655,1727134524,2024-09-23 23:35,17,0,"Visiting Raleigh NC, What to do? ","My brother and I are going to Raleigh for 4 days and we want some recommendations on what to do. We have family over there and we plan on visiting them but we want to do some type of activity. 

We’re from miami so we are very on the go people so let us know any recommendations! 

We like hiking, visiting museums, restaurants, bars, beaches etc. pretty much anything lol ",helene,community_discussion,
1fnz9y5,NorthCarolina,Vancouwer,1727136142,2024-09-24 00:02,13,0,538 polling - no real change from news?,"We all know the allegations towards mark for the past week, no change in polling.

[https://projects.fivethirtyeight.com/polls/president-general/2024/north-carolina/](https://projects.fivethirtyeight.com/polls/president-general/2024/north-carolina/)

I think Trump won by 1.3% in 2020. I'd be shocked if these polls are correct and he's still ahead.

Bookies believe that a Trump victory is more likely as well. Republicans announced they are halting funding to NC campaigns today which means they have given up; i doubt it means they think they've won.",helene,community_discussion,
1fo03d2,NorthCarolina,stainedglass333,1727138622,2024-09-24 00:43,60,334,North Carolina GOP senator signals he won’t vote for Robinson after bombshell report,,helene,community_discussion,
1fo07ka,NorthCarolina,Cultural_Affect8040,1727138975,2024-09-24 00:49,8,8,Split ticketing go brrr I guess,,helene,community_discussion,
1fo0nb2,NorthCarolina,themolenator617,1727140326,2024-09-24 01:12,1,6,Trump Just Went Full Holocaust With Latest Immigration Threat | Donald Trump wants to give immigrants “serial numbers.”,,helene,community_discussion,
1fo17ro,NorthCarolina,ryan112ryan,1727142079,2024-09-24 01:41,2,0,What’s on your fall / winter bucket list?,"Lived here a long time, but wanted to make a list of fun things to do this fall and/or winter. Open to anywhere in NC or even nearby states. 

What’s on your list or would you suggest?",helene,community_discussion,
1fo1cg2,NorthCarolina,Odd-Resource8283,1727142467,2024-09-24 01:47,0,1,"[US, KANSAS] ADVICE PLEASE",,helene,community_discussion,
1fo1k3x,NorthCarolina,carolebaskin93,1727143143,2024-09-24 01:59,8,0,I asked chatGPT to roast r/northcarolina ,,helene,community_discussion,
1fo31ki,NorthCarolina,[deleted],1727147805,2024-09-24 03:16,0,1,Any firsthand account of people reacting to Maro Robinson story?,[deleted],helene,community_discussion,
1fo3241,NorthCarolina,97jordan,1727147859,2024-09-24 03:17,0,0,Any firsthand account of people reacting to Mark Robinson story?,Curious to see if it made any difference.,helene,community_discussion,
1fo3nzq,NorthCarolina,TotenTeufel,1727149959,2024-09-24 03:52,20,0,WTF?  Cryptid in NC,,helene,community_discussion,
1fo4j14,NorthCarolina,Real-Hospital-3610,1727153138,2024-09-24 04:45,2,0,Does anyone know of dog friendly piers? ,"I know for safety concerns most don’t, just wondering??",helene,community_discussion,
1fo72a3,NorthCarolina,Appropriate_Win9743,1727163884,2024-09-24 07:44,0,1,Hey everyone 👋,[removed],helene,community_discussion,
1fo9zgb,NorthCarolina,Ok_Yogurtcloset2398,1727176660,2024-09-24 11:17,13,4,Selling car privately,"Please explain to me like I’m 5…(I’m so confused)

Got a van and it’s too expensive to fix.  Listed it on FB Marketplace and I’ve got someone coming to buy it and tow it.

What is the correct/ best process?

I’ve got the title.  I’ve printed out 2 copies of a “Bill of Sale” that I found online.

Should I take these and the buyer to my bank to get the Title and both copies of the Bill of Sale notarized?  If that is all, do I give the buyer the title and 1 copy of the Bill of Sale and give him the cars? Should I remove the license plate and return that to the DMV?

Or, do I go to the DMV with the buyer and transfer the title there and turn in my plate? (Wouldn’t I still need the title notarized before going to the DMV)?  Last time I was at the DMV in the early afternoon, the line was 50 people long, so I was hoping to avoid the DMV until I could go and be the first in line.

Not sure if it matters, but I presume the buyer is a NC resident.  If he is not, anything that I need to do?

Anything else to consider? 

Thanks.",helene,community_discussion,
1foab2u,NorthCarolina,TropicApe,1727177833,2024-09-24 11:37,26,137,"Newly unearthed data shows closer links to Robinson and porn, dating sites",,helene,community_discussion,
1foabno,NorthCarolina,Elunajewelry,1727177889,2024-09-24 11:38,68,176,Saw new Dan Bishop Commercial yesterday ,"Saw the commercial during the evening news last night.  Bishop says rape and murder are up 35% and 45% percent (don’t remember which crime got which percent and no source was given to fact check).

The irony is that his commercial was shown just after the news clips where the FBI had released new crime data. And violent crime in N.C. is reported to have dropped 9.7%

So who to believe here? 🤔

A political candidate who has power and influence to gain and who commercial only talks about how “unsafe” we should feel. 

Or a criminal task force whose entire job is to find and arrest criminals. And who have no personal vestment in the numbers. 🤔🤔

",helene,community_discussion,power
1fob9b4,NorthCarolina,WashuOtaku,1727180897,2024-09-24 12:28,46,103,Amtrak to offer direct train service between the Triangle and the Midwest,,helene,community_discussion,
1fobjc3,NorthCarolina,LifeOfSpirit17,1727181753,2024-09-24 12:42,4,0,Anyone remote work here part time but domicile in another state? ,"I'm sure this is a classic story but hoping to find some specific help since I can't find the exact info. So I'm a resident in another state but have a lease here that I use through out the year. I'm trying to stay tax compliant but I don't want to switch over all my stuff to nc. 

Anyone know what the process is for this? Like how do I report my taxes to nc? Do I just track the time I'm here and then file for that at the end of the year? 

Any help or advice would be appreciated. I'm sure someone will say to talk to a tax person and yes I will but want to hear others opinions too that have experience with this. ",helene,community_discussion,
1fobmyi,NorthCarolina,SnarkiSnail,1727182056,2024-09-24 12:47,0,45,Exotic French bulldog breeder and mom of 4 mysteriously found dead in the woods in Bolivia NC,,helene,community_discussion,
1foc99o,NorthCarolina,Key_Flan_5631,1727183838,2024-09-24 13:17,11,0,What city in North Carolina has the worst drivers? ,https://www.instagram.com/reel/DARv6c1SpjO/?igsh=MW15ZGhwcGp1bDUwbA==,helene,community_discussion,
1focgyv,NorthCarolina,MikeNice81_2,1727184450,2024-09-24 13:27,0,1,Mark Robinson isn’t the only problematic candidate on North Carolina’s GOP ticket,,helene,community_discussion,
1fodfbq,NorthCarolina,allnamesaretaken467,1727186994,2024-09-24 14:09,134,632,Why do we need a constitutional amendment on voting rights when it's already well-covered? WE DON'T. Here's an analysis on why we have one anyway:,"TEXT FROM PHOTOS:
From your local expert on citizenship and naturalization law (a Wake Forest University Professor of Law who has taught immigration and citizenship law for over thirty years), why you should ***VOTE AGAINST*** the North Carolina referendum pictured below:

ALREADY, THE NORTH CAROLINA CONSTITUTION RESTRICTS VOTING TO CITIZENS OF THE UNITED STATES.  Article 6, Section 1 (""Who may vote"") currently states:  ""Every person born in the United States and every person who has been naturalized, 18 years of age, and possessing the qualifications set out in this Article, shall be entitled to vote at any election by the people of the State, except as herein otherwise provided.""  

So, why is the referendum below on the ballot?  First, it's intended to spread disinformation and confusion by creating the misimpression that our state constitution needs to be amended to prevent noncitizens from voting.  The old adage ""if it ain't broke, don't fix it"" should guide your vote here.  Voting ""no"" will demonstrate that North Carolina voters won't be manipulated by these cynical efforts to mislead them.  

Second, notice the variations in language between our current constitution the proposed amendment.  Why eliminate from the text of our state constitution the specific protection of voting rights for ""every person born in the United States"" and ""every person who has been naturalized""?  These phrases mirror the protections of the 14th Amendment to the U.S. Constitution, which states:  "" All people born or naturalized in the United States . . . are citizens of the United States and of the state they reside in.""  So perhaps (and we can only speculate here, because there's no real reason for this change) the proposed amendment is meant to create confusion and discourage naturalized citizens from exercising their right to vote.  Or maybe it's meant to support Trump's completely  preposterous theory that he can unilaterally repeal the 14th Amendment's provision protecting birthright citizenship, by eliminating that voter protection language from our state constitution.  

Finally, notice that our current constitutional provision protects the right to vote for any citizen ""possessing the qualifications set out in this Article.""  That means that North Carolina General Assembly can't by itself change voting protections set out in Article 6, Section 1; instead, the state constitution must be amended.  In contrast, the proposed amendment protects the right to vote only for citizens ""otherwise possessing the qualifications for voting,"" which would weaken voting protections if it was interpreted to allow the General Assembly to establish those qualifications.  (Remember the literacy tests of the Jim Crow era?)

The bottom line:  don't be fooled by this fear mongering.  The proposed constitutional amended is really just intended to create mistrust in our elections and perpetuate racist anti-immigrant sentiment.

Vote NO! (And feel free to share this post)",helene,community_discussion,
1fodge9,NorthCarolina,Flyinghud,1727187067,2024-09-24 14:11,2,23,Happy absentee ballot day!,Absentee ballots start getting sent out today. If you need to request one go here: https://votebymail.ncsbe.gov/app/home if you haven’t yet registered to vote go here: https://www.ncdot.gov/dmv/offices-services/online/Pages/voter-registration-application.aspx,helene,community_discussion,
1fodgur,NorthCarolina,wildwildwaste,1727187099,2024-09-24 14:11,5,24,Seeing the latest weekend forecast,"Well, there goes this falls marshmallow crop",helene,community_discussion,
1fodrqx,NorthCarolina,xXVoicesXx,1727187913,2024-09-24 14:25,0,5,ISO Mental Health Occupational Therapist,"Specifically to handle hoarding disorder. I’m having difficulties finding someone in the piedmont triad area, but I’m willing to also go to the triangle. ",helene,community_discussion,
1fodwup,NorthCarolina,muishkin,1727188278,2024-09-24 14:31,1,1,N.C. Democrats Fight to Hold State Supreme Court Seat,,helene,community_discussion,
1fodx2k,NorthCarolina,Historical_Ear_4500,1727188292,2024-09-24 14:31,3,1,Choose & Cut,"I know it’s early in the season, but my boyfriend is wanting to cut our own Christmas tree this year. I’m currently trying to plan a surprise trip for us to do so and make a little getaway out of it. Is there anywhere you recommend for us choose and cut our own tree? ",helene,community_discussion,
1foebc8,NorthCarolina,BarfHurricane,1727189308,2024-09-24 14:48,64,335,'We are not going to be intimidated': NC's top elections official says FBI is investigating threats,,helene,community_discussion,
1fof2p6,NorthCarolina,zennyc001,1727191219,2024-09-24 15:20,157,648,"Trump Withdraws Support, GOP Pulls Funding From ‘Black Nazi’ Mark Robinson",,helene,community_discussion,
1fofbdk,NorthCarolina,TatersAndHotSauce,1727191827,2024-09-24 15:30,3,36,"Track coach arrested, accused of SA juveniles",,helene,community_discussion,
1fofxf9,NorthCarolina,SnarkiSnail,1727193376,2024-09-24 15:56,104,175,Trump ‘assassin’ Ryan Routh’s son Oran arrested after ‘hundreds of child pornography files found at his home,,helene,community_discussion,
1fofxmk,NorthCarolina,RamesesLabs,1727193390,2024-09-24 15:56,12,17,"Trump assassination attempt suspect's son, Oran Routh, arrested",,helene,community_discussion,
1fog5zi,NorthCarolina,snugglebliss,1727193964,2024-09-24 16:06,5,9,"Credible lawsuits - Trump is accused in sworn court testimony of raping a 13 yr old girl supplied by Jeffery Epstein, according to the victim and a second witness. The girl and her family were threatened / murdered if they didn’t drop her cases 2x. ","Here are case numbers.
SDNY 1:16-cv-04642, then SDNY 1:16-cv-07673
Google the cases but be aware they're a horrible read.",helene,community_discussion,
1fogdmg,NorthCarolina,ashgnar,1727194508,2024-09-24 16:15,381,606,Right wing militia recruiting in Rutherford County,"These have started popping up all around here, and from the research I’ve done on the group they seem super concerning. I’m planning to go with some other lefty folks to observe/ask critical questions- have they popped up in any of y’all’s towns? ",helene,community_discussion,
1fogeyh,NorthCarolina,uncertaincoda,1727194600,2024-09-24 16:16,16,154,Mo Green releases new ad against Michele Morrow,,helene,community_discussion,
1fogmnk,NorthCarolina,AtypicalAshley,1727195140,2024-09-24 16:25,1,0,Trails with caves/waterfalls that are suitable for the elderly in WNC?,My grandma has really been wanting to go see either caverns or waterfalls but she has a bad leg and can’t do steep inclines or long trails. I know she definitely couldn’t do the trail at South Mountain with all those stairs that lead up to the waterfall. Ive been trying to research trails but I know the difficulty indicator can be misleading or inaccurate sometimes. ,helene,community_discussion,
1fogy7a,NorthCarolina,ExplorerOk2700,1727195942,2024-09-24 16:39,11,0,How can I get my name off a car title/registration? ,"Long story short I’m getting a divorce and my wife has been driving our car all up and down the east coast racking up a large amount of toll fees. She is living in NY now but still drives our car. Problem is everything is getting billed to ME, because my name is whats listed first in the title. She is uncooperative and unwilling to come down here to the DMV to change it to her name exclusively. Anything I can do to force her hand, or anything I can do on my own?",helene,community_discussion,
1foh4tq,NorthCarolina,MinimumPosition9612,1727196390,2024-09-24 16:46,0,1,North Carolina Reproductive Health Policy Knowledge and Opinions,[removed],helene,community_discussion,
1foi3dy,NorthCarolina,EMSMomx3,1727198760,2024-09-24 17:26,11,14,Why do we need a constitutional amendment on voting rights when it's already well-covered? WE DON'T. Here's an analysis on why we have one anyway:,,helene,community_discussion,
1foi78a,NorthCarolina,Angelinacath,1727199024,2024-09-24 17:30,0,1,"Well I am a Honest,Kind,Caring,Loyal ,truthful and God fearing Person, I am not here for any any games But I am Looking for a serious and Long term relationship.",[removed],helene,community_discussion,
1foicah,NorthCarolina,sandovalevan,1727199376,2024-09-24 17:36,4,0," The ""Keep It Simple, Sweetheart"" Party.","Hi all. Apologies as this is a bit of promotion, though relevant to NC as I'm from here/live here and hope to spend much of my free time leading up to the election canvassing with this website in our important, swing state. ... In the website, I've tried to locate some basic, societal principles to consider without party affiliation. As you know, the separate parties don't just ignore each other today, but, it seems, don't even have *the capacity* to take in information from the ""other side."" So, I made this site in an attempt to be a buffer where people can maybe consider all angles. It's certainly not perfect, but it's a sincere attempt to try to make a bridge.

If you have time, please check it out. And, if you dig it, please pass it along as I hope to keeping contributing to it through November. (Just in case - to be clear, KISS is not a *real,* registered party. Just a blog/platform). Thanks!",helene,community_discussion,
1fokt4a,NorthCarolina,Low-Regret5048,1727205479,2024-09-24 19:17,39,54,Collapsed Beach houses,I am curious as to why they don’t tear down the houses in Rodanthe before they get washed away. Is it insurance? So much time and effort is needed to clean the debris once they collapse in the water.,helene,community_discussion,
1folfdx,NorthCarolina,Big_BCG,1727206989,2024-09-24 19:43,7,0,Restaurants in the triangle ?,Where’s a good spot to take my lady for a nice date night?,helene,community_discussion,
1folni9,NorthCarolina,EvenPressure3959,1727207547,2024-09-24 19:52,64,357,The GOP’s Lt. Governor candidate distances himself from Robinson,,helene,community_discussion,
1fom0eg,NorthCarolina,VonGraf87,1727208439,2024-09-24 20:07,6,0,Obtaining 21+ License,"I turn 21 on November 29, 2024, which is when my current license expires (Full Provisional License). 

I’ve been researching getting my 21+ license, but I’m not sure what I need to do, as the DMV website sucks. I can’t get any appointments before then in any county. Am I screwed to have to wait until December, or is it possible to get it before my birthday by just sitting at a DMV office waiting to be seen? Also, am I simply renewing a license or does this classify as getting a first-time license? I’ve also heard that this should be done before my birthday so I don’t drive around with an expired license. I want to be able to use my 21+ freedoms ASAP after getting my license, and I just want to know what I need to do to accomplish this.",helene,community_discussion,
1fom0ql,NorthCarolina,WashuOtaku,1727208461,2024-09-24 20:07,16,23,"Harrah's Cherokee Valley River doubles hotel space with new tower, boosts local economy",,helene,community_discussion,
1fon3x1,NorthCarolina,willowtreewanderer,1727211234,2024-09-24 20:53,8,0,Vacation and Hurricane Helene,"Hi all!

I had a trip planned to visit North Carolina (specifically driving from Greenville, SC to Asheville to Blowing Rock) for the 26th-1st. Of course, weather reports come out this week about hurricane Helene and bad weather.

I am from California so I am not quite used to hurricane weather and what to expect. I am wondering how frequently these weather patterns can change, if at all? And whether you (as locals) advise I take my chances or take the loss and try to get refunds on the trip?

I don't mind some rain, my biggest concern is for driving conditions or weather being so extreme you can't really do much...

Thank you all for any advice :)",helene,community_discussion,hurricane|weather|helene
1fonljc,NorthCarolina,snugglebliss,1727212474,2024-09-24 21:14,3,9,"Russia produced most AI content to sway presidential vote, US intelligence official says",Russia has generated more AI content to influence the U.S. presidential election than any other foreign power as part of its broader effort to boost Republican candidate Donald Trump over Democrat Kamala Harris,helene,community_discussion,power
1fonpa9,NorthCarolina,Thirdz,1727212736,2024-09-24 21:18,61,545,New Amtrak service will connect North Carolina and Chicago,"Service will begin in November and run from Miami to Chicago, with a stop at the Union Station in Raleigh. ",helene,community_discussion,
1fonvun,NorthCarolina,DJMagicHandz,1727213205,2024-09-24 21:26,230,1172,This person was at Jan. 6th and they want to run NC Schools. ,,helene,community_discussion,
1foo9uc,NorthCarolina,[deleted],1727214218,2024-09-24 21:43,1,1,Team Vietnam Lacrosse Recruiting Olympics,[removed],helene,community_discussion,
1fopetg,NorthCarolina,Firenze42,1727217348,2024-09-24 22:35,56,0,Is this legal?,"I am not for Mark Robinson, but I think this is a poor campaigning technique by Josh Stein's supporters. Is this legal in NC. I feel.they should just put up another sign by Robinson's, rather than cover it up. ",helene,community_discussion,
1foqtbu,NorthCarolina,Runs93,1727221350,2024-09-24 23:42,0,1,Mark Robinson’s campaign with dwindling funds to fight mega CNN lawyers - this is not gonna end well for him.,,helene,community_discussion,
1foqvkw,NorthCarolina,Runs93,1727221533,2024-09-24 23:45,4,5,Campaign with dwindling funds goes to fight mega CNN lawyers.,,helene,community_discussion,
1for5bo,NorthCarolina,iamexistingx,1727222343,2024-09-24 23:59,0,0,Vintage Jewelry in NC: Where to buy vintage jewelry lots/in bulk?,"Hi, everyone! Hope you’re all doing well. For those who are into vintage items - buying and selling, can you please point me to where I can find vintage jewelry to buy in bulk? I’m not too interested in buying individual pieces, just bulk for personal wear and to maybe sell - but just interested in buying for myself. I’m in the Triangle, but willing to drive a little further out. 

In case this helps - I’m looking for all types of jewelry, but I do love gold tone jewelry, plain or with color :). Please, please let me know if you know of any places to find bulk jewelry.

Thank you so much!!",helene,community_discussion,
1foreym,NorthCarolina,Diemomentum-amori,1727223148,2024-09-25 00:12,0,1,Off Grid/ Sustainable Energy/Construction Apprenticeship,"Hello,

I'm seeking to expand my off grid living skills to one day own a homestead. I also enjoy learning new skills and have a keen interest in sustainable energy, particularly solar and hydroelectricity. I would like to be an apprentice of sorts to anyone willing to teach in exchange for labor. Thus far, I am a good gardener, cook, cleaner, and salesperson. I have minimal construction experience.I am a quick learner and have a strong work ethic.  I enjoy living in the wildnerness or rural areas. I am mainly looking around the Hillsborough/Orange County area due to part time job but also open to expanding around North Carolina.

Feel free to reach out if you or anyone you know would be interested in a mutually beneficial arrangement.",helene,community_discussion,
1forugw,NorthCarolina,cap123abc,1727224454,2024-09-25 00:34,2,6,How to cope with my girlfriend being a DACA recipient before the 2024 election.,"Hey guys, I am hoping to gain any information in regard to the DACA process. My girlfriend of many years is a DACA recipient and I am super worried about what may happen if Trump wins the White House. My main concern is her safety above all else. She has lived in this country almost as long as I have and is a red blooded American! Our state is potentially a pivotal state in the country and I am obviously voting for Harris. Just super anxious and hoping to get any info if possible.",helene,community_discussion,
1fos1lz,NorthCarolina,stainedglass333,1727225065,2024-09-25 00:44,112,552,Harris has 1-point lead over Trump in North Carolina poll,,helene,community_discussion,
1fou62i,NorthCarolina,LtDan18,1727231616,2024-09-25 02:33,1,0,"Looking for someone to sublet my apartment @ Uptown 550 in Charlotte, NC","Looking for someone to take over my lease In late December or early January! Lease will go to August 2025. I am relocating for work and would like someone to take it over!

Rent:$1599
 - I am willing to give a discount of one time $1000 payment for the individual who takes over my lease. 

DM for additional detail!",helene,community_discussion,
1fov6dl,NorthCarolina,Eloiseonacid,1727234833,2024-09-25 03:27,0,0,Air Quality fine in Charlotte says app,"Yes this is everyday

#Chernobyl 

BUT EVERYTHING is FINE





",helene,community_discussion,
1fovm3g,NorthCarolina,WCurt92,1727236386,2024-09-25 03:53,0,1,When the parody becomes reality...,,helene,community_discussion,
1fovqzq,NorthCarolina,WashuOtaku,1727236860,2024-09-25 04:01,7,12,Community mourns unexpected loss of former Avery student in South Africa,,helene,community_discussion,
1fox1h3,NorthCarolina,Silly_Abies6047,1727241748,2024-09-25 05:22,3,0,Crazy Traffic in NC,Traffic in North Carolina is getting crazy. How did we get here?,helene,community_discussion,
1foxysq,NorthCarolina,universalresident90,1727245705,2024-09-25 06:28,0,1,The Choice 2024: Harris vs. Trump (full documentary) | FRONTLINE,,helene,community_discussion,
1fozkoe,NorthCarolina,CzernaZlata,1727253141,2024-09-25 08:32,13,283,"Deleted tweets, canceled events, erased endorsements: How Republicans are fleeing from Mark Robinson | CNN Politics",Well that's hopeful right?,helene,community_discussion,
