id,subreddit,author,created_utc,created_date,num_comments,score,title,selftext,hurricane,source_type,keyword_hit
1fp10jj,NorthCarolina,PassionPaints,1727259518,2024-09-25 10:18,1,0,We're looking for people to trial our business,"Have you ever wanted to have a painting of your partner, a family portrait, your dog or whatever your favorite photo is? I always loved the idea of painting but unfortunately I'm not the best at it. A few months ago though a friend and I came up with a cool idea, what if you could turn any photo you want into a paint by numbers. That way anyone can paint, anything they want.

We looked up custom paint by numbers and found a few Etsy stores selling them but they were way overpriced and most of them didn't even come with the canvas on a frame. So we looked around and talked to a bunch of suppliers, eventually we managed to produce custom paint by number kits cheaper then anywhere else and already framed (you can still order them without a frame but we found most people want them ready to go out of the box).

Long story short though we're trying to grow and get more people talking about us. So we decided it would be a good idea to reach out to some local subreddits and hopefully you'll enjoy them enough to share your experience :)

You can use the code ""COSTPRICEREDDIT"" to get our kits for cost price (our margins are pretty slim right now we want to be as affordable as possible). You can get up to 4 kits at that price so feel free to buy a few and plan a date night, family activity or just get your Christmas shopping done early.

Link - [https://passionpaints.com/products/custom-paint-by-numbers-kit](https://passionpaints.com/products/custom-paint-by-numbers-kit)",helene,community_discussion,
1fp1ggo,NorthCarolina,Winter-Owl1,1727261292,2024-09-25 10:48,40,80,It's always the large trucks that can't drive or park properly.,,helene,community_discussion,
1fp1kkl,NorthCarolina,MonsieurGriswold,1727261735,2024-09-25 10:55,198,679,"TIL that the 2024 NC GOP Gubernatorial candidate’s only experience prior to politics was a few years in the Army, working at furniture factories, plus some college. And the state elected him as Lt. Governor in 2020!",,helene,community_discussion,
1fp1uib,NorthCarolina,M795,1727262723,2024-09-25 11:12,107,392,"Under pressure to prove porn-site denial, Robinson hires law firm",,helene,community_discussion,
1fp28xr,NorthCarolina,antdude,1727264212,2024-09-25 11:36,1,3,Blue sea dragons on NC's beaches...,,helene,community_discussion,
1fp2wfo,NorthCarolina,Luna_dog,1727266399,2024-09-25 12:13,2,36,"Wapo: Mark Robinson’s campaign and faith without deeds, just vitriol",[https://wapo.st/3XRJqXf](https://wapo.st/3XRJqXf),helene,community_discussion,
1fp311p,NorthCarolina,safe_balance_here,1727266797,2024-09-25 12:19,3,1,AI-powered Device Used to Detect Skin Cancer,,helene,community_discussion,
1fp3nyv,NorthCarolina,SweetestPetalsss,1727268664,2024-09-25 12:51,7,38,"Buzzard Rock Trailhead, Latte Nature Preserve in Huntersville has a beautiful view of Mountain Island Lake","Does anyone know of any other nature preserves to visit in Charlotte that have access to a lake similar to Latte Nature Preserve? 

I have visited Latte Nature Preserve, Reedy Creek and  McDowell so far. These photos are from Latte Nature Preserve, Buzzard Rock Trail in Huntersville. I am looking for something similar to this. I frequent this site a lot and want to try something different (especially if they offer kayak/canoe rental) ",helene,community_discussion,
1fp4fjg,NorthCarolina,MoldyMerkin,1727270845,2024-09-25 13:27,2,0,Western North Carolina - Divorce Lawyers,"Hello,

I live in WNC and I am looking for recommendations for a divorce lawyer. Does anyone in the area have experience with a law firm that they would recommend?",helene,community_discussion,
1fp4k5o,NorthCarolina,nickel_dime_quarter_,1727271196,2024-09-25 13:33,569,561,Goldsboro public school baptism ,Public school football baptism ,helene,community_discussion,
1fp4tgr,NorthCarolina,Artistic-Ad2010,1727271915,2024-09-25 13:45,26,0,"Which city is worse, Lumberton, NC, Wadesboro, NC, or Dillon, SC","I live 30 mins away from Lumberton, NC. So scared. I did not know I was in the most dangerous city in North Carolina. I am 38 mins away from Dillon, SC. 
Fayetteville, NC is big with lots of army people. Laurinburg, NC always get compared to Lumberton, NC. 
Wadesboro, NC don't even have a Walmart though.


",helene,community_discussion,
1fp4tro,NorthCarolina,panadventurer,1727271935,2024-09-25 13:45,1,0,CNC_S3E14_Felicia Baxter,"I had a hard time finding information about Felicia C Baxter, who is a candidate running against Benton Sawrey for the NC Senate seat for District 10. I eventually found this video of a nice interview that she did a few months ago that covers a lot about her experience and intentions.  
  
Figured I should share it here for anyone that will be voting in that district (Sampson, Duplin, and Johnston counties). ",helene,community_discussion,
1fp4ypw,NorthCarolina,Silly_Abies6047,1727272312,2024-09-25 13:51,7,0,The best time to start was yesterday. The second best time is today.,"""There are 7 days in a week, and someday isn’t one of them.""

I’ve come to realize that firsthand.

I don't know who initially said this quote, but I should have heeded that advice long ago.

I’ve come to realize that firsthand.

For the longest time, I had this burning desire to start writing online about topics that I'm passionate about.

I thought about it, drafted plans, and even had a name for it. But that elusive 'someday' kept creeping into my mind.

I told myself I needed more time, more resources, more… whatever.

In reality, I was procrastinating out of fear—fear of failure, of being too late, or simply not being good enough.

But one day, I decided that waiting for the perfect moment wasn’t getting me anywhere.

So, I jumped in, imperfections and all. And guess what? It wasn’t perfect, but it was progress.

Now, I’m all in—no more 'someday.' If you're waiting for the right moment to pursue your passion, trust me, it’ll never feel right.

Take the leap today, because the only thing worse than failing is never trying at all.

Today, I spend my time talking to local entrepreneurs in Charlotte and picking. I share what I from them in my newsletter.

Check it out here: \[www.thecharlottehustle.com\]",helene,community_discussion,
1fp5oi1,NorthCarolina,thejesse,1727274188,2024-09-25 14:23,30,85,"‘Predatory’ worm found in North Carolina is new species of unknown origin, report says.",,helene,community_discussion,
1fp5pb8,NorthCarolina,tinverse,1727274248,2024-09-25 14:24,5,1,Question about PTO in NC,"Hey everyone, I have a friend that's job offers 4 weeks of PTO but always blocks him from taking PTO and then my understanding is that they either don't pay the time out or pay it out at half his normal pay (I don't remember), but in either case he's getting screwed. He complained about it to his boss and they decided to set some random days throughout the year when he will have the day off for 2 weeks total used PTO over the year. That sounds like it shouldn't be legal to me and I know NC doesn't have strong labor laws, but was hoping someone could point me to where I could look this up on a Federal level.",helene,community_discussion,
1fp5q0f,NorthCarolina,CrankyBear,1727274300,2024-09-25 14:25,37,82,Election Watch: Mark Robinson joins long list of political candidates embroiled in a sex scandal ,,helene,community_discussion,
1fp5siw,NorthCarolina,KingStannis2020,1727274489,2024-09-25 14:28,55,259,Mark Robinson in 2009: ‘They Should Have Shot Al Sharpton’,,helene,community_discussion,
1fp7b5y,NorthCarolina,AaronisUpRiver,1727278261,2024-09-25 15:31,7,0,Does North Carolina have the best golf in the United States?,"Filming The Land As it Lies documentary with @UpRiverGolfCo has opened my eyes to the beauty of golf course architecture.

Enjoy this cinematic experience as we dive into the “how” & “why” of the architectural design process at the 1921 Donald Ross design, Mid Pines. BUT… Did you know Mid Pines was restored by architect Kyle Franz in 2013, winning restoration of the year!

P.S.
I can say this. The sand hills of North Carolina is my favorite region for golf, without a doubt.",helene,community_discussion,
1fp7bpr,NorthCarolina,doormommoo,1727278299,2024-09-25 15:31,1,14,Major Clean Energy Investment Aims To Jump-Start Edgecombe’s Economy - NC Voices,,helene,community_discussion,
1fp7j52,NorthCarolina,RockfordFiles4life,1727278814,2024-09-25 15:40,0,0,Relevant Mark Robinson thread,,helene,community_discussion,
1fp91tc,NorthCarolina,missellesummers,1727282592,2024-09-25 16:43,91,217,What do y'all think of what really happened to the Roanoke Colony and the Dare family?,,helene,community_discussion,
1fp9au9,NorthCarolina,throwaway2000g,1727283202,2024-09-25 16:53,1,0,Name change question ,"Hi everyone I just had a question, so I recently changed my name the other day with the clerk and he said he has granted me my new name but my question is, I never got a physical court order, and he said it will be emailed to me… has anyone had something similar happen and if so how long did it take for it to be emailed?? Or mailed? Was just kinda taken back that they don’t do physical copies anymore!",helene,community_discussion,
1fp9e9m,NorthCarolina,Mental-Past-7450,1727283439,2024-09-25 16:57,37,0,Door to door campaigner knew my name?,"So this is weird, small town, NC yesterday, I had a guy come to my door asking if I was Mr. Last name but he said it wrong. It's not a common last name but in my town we are half the phone book and I'm used to correcting people that are here for school or new to the area. He asked me if I'd be voting for candidate x and I said no but thank you and he left. It was later I started wondering how he knew my name. Anyone else have this happen? The guy was 100% not from ENC.",helene,community_discussion,
1fp9gx8,NorthCarolina,Cold-Independence-37,1727283618,2024-09-25 17:00,10,1,Duck hunting,Would anyone be open to taking me duck hunting? I just moved here for army I have a dozen decoys 2 mojos and my own gun. I just dont have my kyack or any kind of boat. If anyone has some walk in spots that I would have a chance on it would be much appreciated. ,helene,community_discussion,
1fpa0bs,NorthCarolina,SideHot6306,1727284938,2024-09-25 17:22,12,0,I hate how competitive high school sports are in NC,"You have to play since 5 to make the JV teams of any team in high school. I unfortunately didn’t take sports seriously when I was young, and I couldn’t do simple things like pass or throw a ball in PE. I obviously didn’t come close to passing tryouts, and it sucked. A ton of kids who did play since 5 never made it too, even for smaller sports like tennis or lacrosse. 


It sucks because a lot of social status in high school comes from playing sports, especially for guys. Guys who are athletic are popular while those who do things like debate or robotics are seen as weird and awkward. It sucks",helene,community_discussion,
1fpbb3e,NorthCarolina,TexASS42069,1727288163,2024-09-25 18:16,1,1,"(Pre-Scandal AARP NC Poll) POTUS: Trump (R) +3, Governor: Stein (D) +10, Attorney General: Jackson (D) +4",[removed],helene,community_discussion,
1fpbcsz,NorthCarolina,Impressive-Taro-4525,1727288285,2024-09-25 18:18,4,2,Help Verifying Unemployment Benefits,"I'm assisting my father in-law with applying for Medicaid.  The application asks for any dates that unemployment benefits were paid.  Where can i go to see when he received these benefits and how much benefit he received?

",helene,community_discussion,
1fpbcty,NorthCarolina,TexASS42069,1727288287,2024-09-25 18:18,1,1,"AARP in NC (pre-Robinson Scandal): Trump +3, Stein +10, Jackson +4",[removed],helene,community_discussion,
1fpbeob,NorthCarolina,TexASS42069,1727288414,2024-09-25 18:20,99,128,"AARP NC: Trump +3, Stein +10, Jackson +4","[AARP Poll: Trump, Harris in Close North Carolina Race](https://www.aarp.org/politics-society/government-elections/info-2024/north-carolina-poll.html)",helene,community_discussion,
1fpcoue,NorthCarolina,Somali_Pir8,1727291663,2024-09-25 19:14,2,0,"Amtrak Launching the Floridian, with Daily Service at Raleigh & Between Chicago and Miami",,helene,community_discussion,
1fpcwg9,NorthCarolina,mountain-sandwich927,1727292193,2024-09-25 19:23,0,1,East U.S. mountain living?,[removed],helene,community_discussion,
1fpd0u9,NorthCarolina,Grand-Molasses8009,1727292499,2024-09-25 19:28,57,145,Father of teenage suspect in North Carolina mass shooting pleads guilty to gun storage crime,,helene,community_discussion,
1fpdc8f,NorthCarolina,asheville-person,1727293307,2024-09-25 19:41,23,0,Where is the cheapest co-working space in nc?,"If you think you no of the cheapest, go ahead and mention it. Thank you. ",helene,community_discussion,
1fpdd91,NorthCarolina,Thevenin413,1727293382,2024-09-25 19:43,9,0,Speeding to License Suspensions,I was watching some YouTube and saw these videos by some attorneys where they state that if you get pulled over doing 80+mph or doing 20+mph over the posted speed limit that you will get a ticket and lose your license for a year if you just pay it. Is this real? I saw some stuff where it is the law but is it one that’s actually enforced? I just chalked it up to the attorneys trying to scare people and get business but I’m not so sure anymore,helene,community_discussion,
1fpeldy,NorthCarolina,postlw8j,1727296486,2024-09-25 20:34,11,0,DVM Real ID question- proof of residency for on-minor living at home,"TL;DR What can a non-minor who still lives with parents (college student) use for proof of residency?

My family just moved to NC and getting drivers licenses and Real ID for me and my wife was fairly straight forward. The issue is my son who is 18 and a college student (out of state).

For non-minors, the DMV website lists proof of residency documents that he does not have since he still lives at home (utility bills, property insurance statements, etc.). For minors, it specifically states that we can bring tax documents listing him as a dependent.

I have not found any information regarding non-minors who are still dependents. Does anyone know if we can still use a tax document listing him as a dependent and a parent’s Real ID as a proof of residency in this case?",helene,community_discussion,
1fpeuiv,NorthCarolina,Quinn8787,1727297132,2024-09-25 20:45,0,30,View of Mount Holly on approach to Charlotte Douglas,I’ve been practicing my photography and I think I did a good job with this one!!,helene,community_discussion,
1fpf6q3,NorthCarolina,Euphoric-Spare8271,1727298011,2024-09-25 21:00,0,0,Capital,So North Carolina is voting for a black nazi tranny porn loving nasty idiot!,helene,community_discussion,
1fpf8te,NorthCarolina,Yokelele,1727298148,2024-09-25 21:02,44,252,Please show hospitality for evacuees,"I want to offer a friendly reminder that our state may be receiving people from out of town who are evacuating from the hurricane. These people may be stressed and tired from their evacuation. Please show patience and hospitality on the roads and in places like stores, restaurants and parks. You may also have useful resources like housing that you can offer or discount. Similarly, we may also receive birds who are trapped in the eye wall who would appreciate food, clean water and housing if you have space outside your home. ",helene,community_discussion,hurricane
1fpggyx,NorthCarolina,caf61,1727301390,2024-09-25 21:56,15,0,Visiting Wilmington Advice,We (3 adults) will be visiting the Wilmington & Southport area next week. Staying downtown for a few days before heading to Southport to visit friends. Any advice on food and activities? Thanks for any suggestions. ,helene,community_discussion,
1fph5u0,NorthCarolina,phodye,1727303277,2024-09-25 22:27,117,724,Mo Green must win,"Y’all listen,

Lemme preface this by saying I try not to engage in politics on the internet because I don’t think it’s very productive. And I try not to engage in histrionics or give into the polarization that the internet tends to engender. 

If you’re on Reddit you’re likely left leaning to moderate and you’re likely more politically cognizant than the average voter. So you probably know that Michelle Morrow is a nut. She must not be elected, she could do damage to a generation or more of North Carolinians. 

I am a native, I have family here that goes back generations. I tend not to talk to the extended family about politics due to the fraught nature of those chats in recent years. 

All of that being said, I’ve had good discussions in the last couple of weeks with members of my family who have different views than I do. They’re good people who have voted for the GOP their whole lives and they didn’t know anything about Michelle Morrow beyond her party affiliation. Just talking about the kind of crazy stuff she’s said and how unfit she is was enough to change their minds and get them to agree to vote for Mo Green. 

Talk to your people! Talk to the people who disagree with you! Be kind, respectful and remember the ties that bind but please, we’ve all got to do whatever we can to prevent Michelle Morrow from damaging our great state. 

And if you don’t know- the latest polling has the race as a statistical tie, check the linked article. Every bit counts. ",helene,community_discussion,
1fphv8a,NorthCarolina,jonride,1727305235,2024-09-25 23:00,95,75,Is this legit?,"Received this triple text out of the blue today, I can’t remember that I’ve driven a toll road anytime recently. Is this a scam?",helene,community_discussion,
1fpjtsn,NorthCarolina,YesFlyZone420,1727311042,2024-09-26 00:37,97,394,"In North Carolina, Tribal Marijuana Store Sees Thriving Sales and No Arrests After Nearly Three Weeks Open to Everyone 21+",,helene,community_discussion,
1fpkd2c,NorthCarolina,battleship217,1727312696,2024-09-26 01:04,27,49,Removed From Voter Register?,"I'm a college student, and I just went to put in my voter info to view a sample ballot, and the information had no results. The look-up has worked as of a week ago, has anyone else had this issue?",helene,community_discussion,
1fplum5,NorthCarolina,Zealousideal_Act9107,1727317373,2024-09-26 02:22,5,0,Driving license problems,"Hi all. I just moved to Raleigh as a first year PhD student in NCSU.

First, I want to say NC is a really good state for living, but the NCDMV is insane.

First, the appointment at NCDMV is crazy. For DMV in Raleigh, there are no time slot in online system, even 90 days after. I don't know if they just release only serveral slot or not. I have some low back issue, so I can not stand or sit for a long time. Thus, the walk-in option is denied. Besides, because of recent medical problem happened in front of the RMV, they changed the walkin rules. All walk-in customer need to come after 12 at noon. So, I decide to go somewhere outside Raleigh. Guess where I found a recent slot. Greenville! Almost arrive atlantic ocean. I have to drive 90 mins one way to there. Just for transfer my out of state license to NC! That is crazy. One thing is good. The dmv agent is really nice.

That visit to DMV happens two weeks ago. I was living in MA. I could receive my MA license within one week after the renewal. But for here, I have not receive anything yet. It has been 2 weeks(10 business days). I was planning to transfer my title with my NC license. After waiting one week, I just use the temporary license to do that. Compared to driver license office, the plate office is much better. I finished the whole transfer process with in 20 mins.

So, now, I am waiting my license and title. I visited the plate office on 9/19. Let's see which will come first.

I am creating this post just for give more info to someone like me. Don't worry. Just wait. I will update the post once I receive the license and title.",helene,community_discussion,
1fpmcgp,NorthCarolina,Embarrassed_Cod_2093,1727319005,2024-09-26 02:50,0,1,Petition for NC State to Release Remediation Documents for PCB Infected Buildings,,helene,community_discussion,
1fpmddd,NorthCarolina,Embarrassed_Cod_2093,1727319088,2024-09-26 02:51,0,1,"Demand NC State to Release Remediation Documents for PCB Infected Buildings
",,helene,community_discussion,
1fpmdp1,NorthCarolina,[deleted],1727319120,2024-09-26 02:52,0,1,Petition for NC State to Release Remediation Documents for PCB Infected Buildings,[removed],helene,community_discussion,
1fpmt5e,NorthCarolina,mahoneysounds,1727320559,2024-09-26 03:15,1,0,New to the 252 Area looking for a tattoo artist,"Hey everyone, I just moved from PA to NC and I’m looking for a reputable tattoo in in north east NC or possibly in Virginia. I’m not very familiar with the area yet so please give me some good recommendations! Thank you!",helene,community_discussion,
1fpqc24,NorthCarolina,universalresident90,1727334480,2024-09-26 07:08,0,1,"Mark Cuban slams Trump, endorses Harris: ‘She's run her campaign like a ...",,helene,community_discussion,
1fpqsa5,NorthCarolina,universalresident90,1727336561,2024-09-26 07:42,0,1,"Kamala Harris full speech Pittsburgh, PA (Sept. 25, 2024)",,helene,community_discussion,
1fpsjf6,NorthCarolina,Muldoon2442,1727344715,2024-09-26 09:58,46,0,Another Soft Interview with NO Substance ,[https://www.bostonglobe.com/2024/09/25/nation/three-takeaways-kamala-harriss-interview-msnbc/](https://www.bostonglobe.com/2024/09/25/nation/three-takeaways-kamala-harriss-interview-msnbc/),helene,community_discussion,
1fpss18,NorthCarolina,BobbyLucero,1727345713,2024-09-26 10:15,141,681,Ex-North Carolina GOP gov admits Republicans knew Mark Robinson was a 'ticking time bomb',,helene,community_discussion,
1fpvkii,NorthCarolina,plusharmadillo,1727355542,2024-09-26 12:59,10,178,PSA: Those NC QuickPass texts are a scam,The NC DOT website has an update about it as well as info about where to report these scam texts (https://www.ic3.gov/),helene,community_discussion,
