id,subreddit,author,created_utc,created_date,num_comments,score,title,selftext,hurricane,source_type,keyword_hit
1fpw1c0,NorthCarolina,LetterGrouchy6053,1727356860,2024-09-26 13:21,15,0,"Will Donald Trump if elected, use his presidential powers to force North Carolina Republicans to appoint Mark Robinson to a high-level state position?","The man representing the North Carolina Republican party makes Laura Loomer seem like a Shaker schoolmarm, and Trump's seminar on pussy-grabbing a Sunday School lesson.  He is a Holocaust denier who has often compared homosexuality to pedophilia. But that is but one item in his Megillah of Malice. He is also quoted as saying: 'He's a black Nazi, likes transgender porn,  and graphically described becoming aroused by the memory of “peeping” on women in public gym showers as a teenager.

He said: “I like watching \[transgender slur\] on girl porn! That’s fucking hot! It takes the man out while leaving the man in!”

Despite his storied history of anti-transgender comments, Robinson previously admitted to liking transgender porn.

“And yeah I’m a ‘perv’ too!” He said 'it's time to “start reading” quotes from Hitler and Stalin'.

Robinson told an audience gathered at Moms for Liberty’s “Blessings of the Liberty Breakfast” in July last year that instead of criticizing the conservative group for quoting Hitler in their June newsletter, it’s time to “start reading” quotes from fascist strongmen like Hitler and Stalin.

“Whether you’re talking about Adolf Hitler, whether you’re talking about Chairman Mao, whether you’re talking about Stalin, whether you’re talking about Pol Pot, whether you’re talking about Castro in Cuba, or whether you’re talking about a dozen other despots all around the globe, it is time for us to get back and start reading some of those quotes,"" he said.

'Once a woman is pregnant, ""it's not her body anymore"", He also disagreed with exceptions for rape and incest in abortion bans, implying that victims of assault deserved what happened to them under Charles Darwin's ""survival of the fittest"" evolutionary theory, and Robinson wasn't a fan of Marvel's Black Panther when it first came out in 2018. He accused the movie of trying to make Black audiences more favorable to Jewish people in Facebook post at the time, while using a Yiddish racial slur for Black people.

With even more stupidity he said' Shortly after calling reports of the Holocaust ""hogwash,"" Robinson went on the podcast of an alleged cult leader in 2019 and endorsed the host's remarks that Jewish bankers are one of the ""Four Horsemen of the Apocalypse."" The other three? Muslim people, China, and the CIA.

After saying he thinks 'Slavery is a good thing, and that he would buy a few for himself if he could', he added, “We now find ourselves struggling with people who have evil intent. You know, there’s a time when we used to meet evil on the battlefield. And guess what we did to it? We killed it!” Robinson said, continuing, “Kill them! Some liberal somewhere is going to say that sounds awful. Too bad. Get mad at me if you want to. Some folks need killing! It’s time for somebody to say it. ... It’s not a matter of being mean or spiteful. It’s a matter of necessity!""

All these racist, homophobic and antisemitic remarks will certainly cost him the governorship, and it is here things get even more insidious. You see, Trump agrees with everything this disgusting human being promulgates. 

The former president once described Robinson as “Martin Luther King on steroids,' and added, said, ‘I think you’re better than Martin Luther King. I think you are Martin Luther King times two,’” Trump said at the time.

Trump's MAGA Manifesto, Project 2025, calls for the firing of competent and experienced civil servants and replacing them with malcontents, incompetents, and sycophants who owe no loyalty to the United States, but only to Trump, himself.

Will Robinson become the next head of HUD, or Tsar of Immigration and Naturalization Service, or will Trump once again foist this reprobate back on the decent citizens of North Carolina?",helene,community_discussion,
1fpx8oj,NorthCarolina,butch_tits,1727360140,2024-09-26 14:15,66,24,Helene in Hot Springs?,"My husband and I are supposed to be getting on a plane from Boston to Asheville tomorrow morning to attend our best friend’s wedding in Hot Springs on Saturday. Our plan had been to stay at a hotel in Asheville and drive to and from Hot Springs the same day so we could catch our early flight out on Sunday. That said, we’re very conscious of the hurricane and are skeptical how to proceed. Is this just a fool’s errand? Obviously we want to attend the wedding, everything is already booked, but we are completely unfamiliar with the area and know that we’d be driving through a mountainous area during a hurricane which sounds like a stupid idea. Can anyone provide insight into this? Thank you so much. ",helene,community_discussion,hurricane|helene
1fpxvl5,NorthCarolina,TalkMilkDrink,1727361812,2024-09-26 14:43,148,69,Please help a traveling Canadian understand Hurricane Helena,"My daughter and I will be traveling for a girls trip from Alberta Canada this weekend and everyone is telling us not to go because of the State of Emergency that has been declared.  

I looked at the hurricane path and it seems to not be hitting where we are going (Charlotte/Outer Banks) but this is very out of my element as our big weather concern is massive snowfalls (which we just push through).  Hoping you locals can let me know what I'm in for this weekend? Will businesses be shut down? How accurate is a predicted hurricane path?! Lol",helene,community_discussion,hurricane|weather
1fpye79,NorthCarolina,melib046,1727363122,2024-09-26 15:05,12,0,Asheville for New Year's. What should we do?,"Hi all, visiting Asheville for the first time for New Year's as a mini honeymoon trip. Would love some recommendations on fun things to do around town. TYIA",helene,community_discussion,
1fpyjcy,NorthCarolina,Ready_Problem3346,1727363481,2024-09-26 15:11,17,0,State of Emergency,Cooper officially put us under a State of Emergency but my college is still making today a required day. Is this legal? This is Mecklenburg. ,helene,community_discussion,
1fpzbp1,NorthCarolina,PrizeBuilder9671,1727365437,2024-09-26 15:43,5,199,Cape Lookout Lighthouse,,helene,community_discussion,
1fq0ho8,NorthCarolina,Spiderwig144,1727368384,2024-09-26 16:33,217,537,"Major North Carolina poll post Mark Robinson revelations: Stein 54 Robinson 43 (Governor), Harris 49 Trump 49 (President)",,helene,community_discussion,
1fq17hu,NorthCarolina,FoxNewsIsRussia,1727370186,2024-09-26 17:03,42,101,Just look out the window I guess?,,helene,community_discussion,
1fq2b9j,NorthCarolina,wadebwilson23,1727372902,2024-09-26 17:48,1,43,"Democrat Wesley Harris, candidate for NC treasurer, answers our questions",,helene,community_discussion,
1fq2qr0,NorthCarolina,StaindWithSin,1727373961,2024-09-26 18:06,54,48,Door to door voter polling? Did I get scammed?,"Someone showed up at my home in Graham and if I'd be voting for NC governor and who I'd be voting for. I said Josh Stein and they asked me to fill out a form with my name, address, and email.  

I've never had this happen before, but as soon as they left, I felt like I was scammed somehow. I was distracted because I work from home and got caught off guard. 

Did I get scammed or is this a normal thing during election season? ",helene,community_discussion,
1fq2yqn,NorthCarolina,rs6814mith,1727374521,2024-09-26 18:15,2,1,This could tip the senate....,,helene,community_discussion,
1fq2zes,NorthCarolina,NCTransportation,1727374572,2024-09-26 18:16,0,1,Know a Marine Mechanic Supervisor in the Outer Banks looking for a great job?,"https://preview.redd.it/8adme3bc37rd1.jpg?width=1200&format=pjpg&auto=webp&s=0fddf46d844115dfbae4250875aefcb8a793f0b9

NCDOT Ferry is hiring a **Marine Mechanic Supervisor** to join our team in **Manns Harbor, NC.** Pays $40K to $71K w/full State benefits & pension! Apply by **Oct 1** at [https://www.governmentjobs.com/careers/northcarolina/jobs/4660964-0/marine-mechanic-supervisor-ii](https://www.governmentjobs.com/careers/northcarolina/jobs/4660964-0/marine-mechanic-supervisor-ii#)

  
In this role, you will:

   * Determine types and extent of repair work necessary to return equipment to proper operation as soon as possible.
   * Schedule and assign work to staff and establish general work hour limits necessary to complete repairs.
   * Assist staff with difficult and specialized assignments, and with problems encountered.
   * Determine extent of additional repairs to be done; and at times, perform a variety of skilled tasks.
   * Inspect work upon completion and determine equipment is in proper operating condition.
   * Prepare reports, work schedules, and materials requisitions.
   * Manage inventory and project budgets.",helene,community_discussion,
1fq3hfx,NorthCarolina,keyjan,1727375862,2024-09-26 18:37,250,1095,"North Carolina removes 747,000 from voter rolls, citing ineligibility",,helene,community_discussion,
1fq3l8s,NorthCarolina,SpareNeck2958,1727376135,2024-09-26 18:42,17,0,"Married no kids (never having kids) coming from Washington state, then to Northern California (VERY different from California as a whole)",Planning on moving in the next few years  to be closer to family in DC. Can everyone give me some pros and cons? Just trying to Gauge my options for moving to the east coast.,helene,community_discussion,
1fq3ovp,NorthCarolina,Efficient-Leg-4481,1727376394,2024-09-26 18:46,1,0," The Triangle and Surrounding Areas
Give us a chance to give you the peace of mind that your loved ones are in the care of certified professional healthcare enthusiast. Keep your loved ones in the comfort and familiarity of their own home. Visit our website for more information and/or call today!
 ","Calming Hearts Home Healthcare, LLC.

Give us a chance to give you the peace of mind that your loved ones are in the care of certified professional healthcare enthusiast. Keep your loved ones in the comfort and familiarity of their own home. Visit our website for more information and/or call today!

 [www.calmingheartshhc.com](http://www.calmingheartshhc.com/) 336-583-5699",helene,community_discussion,
1fq3z0b,NorthCarolina,merletrutledge,1727377112,2024-09-26 18:58,4,0,(R) Merle Rutledge slams Virginia Governor Youngkin for being the “Establishment Parrot” against Black Conservatives that don’t bow to the left or Va Senator Lucas!,,helene,community_discussion,
1fq43ew,NorthCarolina,Lo-And_Behold1,1727377402,2024-09-26 19:03,1,0,"North Carolina removes 747,000 from voter rolls, citing ineligibility",,helene,community_discussion,
1fq4414,NorthCarolina,Minimum-Customer-972,1727377444,2024-09-26 19:04,16,150,"Republican for NC Commissioner of Labor, Luke Farley, deletes social media posts with Mark Robinson ",,helene,community_discussion,
1fq4dh4,NorthCarolina,PhillyJ82,1727378115,2024-09-26 19:15,238,625,New IDs from DMV are useless. ,"Just renewed my driver’s license and got the new style ID. Unfortunately if you try to use the ID for anything online most programs reject them as fake/invalid. I tried to verify my ID on id.gov and Va.gov and both sites said it wasn’t a valid form of identification. Last week I went to sign my kid out of school and the Wake County school kiosk refused to scan my ID. The receptionist said their machines won’t accept the new IDs. Most online sites that want you to scan the id say it won’t accept it because there are blurry images, which are designed on purpose on the ID. Classic DMV shenanigans, wait weeks for an appointment, then wait even longer for the actual ID, just to have it barely work anywhere. ",helene,community_discussion,
1fq4vpk,NorthCarolina,themolenator617,1727379406,2024-09-26 19:36,9,68,"North Carolina removes 747,000 from voter rolls, citing ineligibility",,helene,community_discussion,
1fq54ya,NorthCarolina,WHRO_NEWS,1727380068,2024-09-26 19:47,1,10,North Carolina’s rural Chowan County has a new export: wind power,,helene,community_discussion,power
1fq5ksn,NorthCarolina,Fickle-Captain-772,1727381186,2024-09-26 20:06,34,0,Hurt at Great Wolf Lodge ,Does anyone know if you can file a claim if my son got hurt at Great Wolf Lodge? A wall panel fell on him and scratched his back up pretty bad. I know it’s not considered “catastrophic” but what are our options? Waiting to hear back from a few lawyers but wanted to see if anyone else had advice ,helene,community_discussion,
1fq5lz9,NorthCarolina,baitnnswitch,1727381269,2024-09-26 20:07,0,1,"North Carolina removes 747,000 from voter rolls, citing ineligibility ",,helene,community_discussion,
1fq5vuo,NorthCarolina,goldbman,1727381977,2024-09-26 20:19,65,87,"9 potential non-citizens identified as registered voters in NC, state elections officials say",,helene,community_discussion,
1fq6c8b,NorthCarolina,kyrin100,1727383136,2024-09-26 20:38,13,31,Check your voter registration,Mass purging of voter rolls.  Be sure to check your voter registration ,helene,community_discussion,
1fq6iog,NorthCarolina,BobbyLucero,1727383591,2024-09-26 20:46,1,1,"North Carolina removes 747,000 from voter rolls, citing ineligibility",,helene,community_discussion,
1fq78a6,NorthCarolina,-PM_YOUR_BACON,1727385414,2024-09-26 21:16,1,1,"9 potential non-citizens identified as registered voters in NC, state elections officials say",,helene,community_discussion,
1fq7kv0,NorthCarolina,Sufficient_Royal6023,1727386320,2024-09-26 21:32,2,1,North Carolina removes 7.47 million Democrats from voter rolls but do not give a reason,,helene,community_discussion,
1fq7rol,NorthCarolina,Plastic-Age5205,1727386820,2024-09-26 21:40,2,0,Helene is going to hit our mountains hard,,helene,community_discussion,helene
1fq85qx,NorthCarolina,Plastic-Age5205,1727387853,2024-09-26 21:57,11,162,"Western NC impacts: Biltmore Village flooded, Blue Ridge Parkway closed, thousands lose power",,helene,community_discussion,power
1fq85xf,NorthCarolina,BobbyLucero,1727387868,2024-09-26 21:57,6,0,Older white voters — who tend to get out on Election Day — power Trump's lead in North Carolina: poll,,helene,community_discussion,power
1fq86az,NorthCarolina,totemp0le,1727387896,2024-09-26 21:58,5,3,"North Carolina removes 747,000 from voter rolls, citing ineligibility ",,helene,community_discussion,
1fq87cu,NorthCarolina,ddll1986,1727387976,2024-09-26 21:59,4,0,Nc state gov application,I just checked my application status and it says extending an official offer. I know that they put in for top 2 candidates so that if first choice declined offer would go to second choice does this mean I am the selected first  candidate I am dying to know!!!! It wouldnt say that on both of our application statuses correct? Also how did you all get an offer is it mail or email or a call! Thanks!!,helene,community_discussion,
1fq8a0j,NorthCarolina,IceTech59,1727388174,2024-09-26 22:02,1,3,Manchester swiftwater team heads south to help with response to Hurricane Helene,,helene,community_discussion,hurricane|helene
1fq8nyu,NorthCarolina,Grand_Recipe_9072,1727389228,2024-09-26 22:20,0,0,"WHO YOU RUNNIN’ FROM, WEATHERMAN?!!!!",,helene,community_discussion,
1fq8rnu,NorthCarolina,spoderman123wtf,1727389518,2024-09-26 22:25,1,1,"North Carolina removes 747,000 from voter rolls, citing ineligibility",,helene,community_discussion,
1fq8tsr,NorthCarolina,IceTech59,1727389686,2024-09-26 22:28,0,8,Manchester (NH) swiftwater team heads south for hurricane response,,helene,community_discussion,hurricane
1fq8u8d,NorthCarolina,nomsain919,1727389718,2024-09-26 22:28,5,3,"North Carolina removes 747,000 from voter rolls, citing ineligibility ",,helene,community_discussion,
1fq8vgx,NorthCarolina,rednap_howell,1727389814,2024-09-26 22:30,2,7,"North Carolina removes 747,000 from voter rolls, citing ineligibility",,helene,community_discussion,
1fq926v,NorthCarolina,Dogesaves69,1727390323,2024-09-26 22:38,8,7,"Visiting NC this fall, want to see agriculture.","Hey guys, just wanted to ask a quick question. I will be spending a forced vacation in Davidson this Thanksgiving(exciting ik…). I’m a farmer and would love to check out some towns with a ag based economy while I’m here and maybe stop by a cooperative or two and talk shop, buy a hat or something. Just wondering what would be an area where I could do this nearish to Davidson.

Thanks!",helene,community_discussion,
1fq9f1z,NorthCarolina,AlternativeParty5126,1727391324,2024-09-26 22:55,2,3,"After registering, how long did it take you to get your voter ID card in the mail?","I registered at my local NCDHHS office and filled out the physical paper, handed it to someone and figured I would be registered by two weeks at least. But it's been almost a month now and It's still not showing up when I check my registration online.",helene,community_discussion,
1fq9l25,NorthCarolina,newzee1,1727391792,2024-09-26 23:03,49,73,"Mark Robinson Says He is Suing CNN: ""We're going after them!""",,helene,community_discussion,
1fq9nfj,NorthCarolina,neuralhaddock,1727391980,2024-09-26 23:06,6,6,Check your voter registration ,"Today North Carolina removed 747,000 from voter rolls citing ineligibility- https://thehill.com/homenews/campaign/4901476-north-carolina-purges-747k-voters/",helene,community_discussion,
1fq9qli,NorthCarolina,DoesThisDoWhatIWant,1727392230,2024-09-26 23:10,3,0,"North Carolina removes 747,000 from voter rolls, citing ineligibility ",,helene,community_discussion,
1fqa9iz,NorthCarolina,LittleMooner,1727393769,2024-09-26 23:36,0,1,"Everyone is home safe, unless you work for Ingles.",[removed],helene,community_discussion,
1fqao4c,NorthCarolina,MikeNice81_2,1727395000,2024-09-26 23:56,0,1,"North Carolina removes 747,000 from voter rolls, citing ineligibility",,helene,community_discussion,
1fqb469,NorthCarolina,SuperTopperHarley,1727396342,2024-09-27 00:19,6,69,North Toe River at Penland Road Bridge,,helene,community_discussion,
1fqbbbv,NorthCarolina,Tmarie310,1727396965,2024-09-27 00:29,50,0,"Best Neighborhoods in North Carolina for a Walkable, Car-Free Lifestyle?","
Hi everyone,

I’m planning a move to North Carolina from Los Angeles and could really use some advice on which areas would be the best fit for me. I’m 40, single, no kids, a Black female, and work in tech. I’m looking to purchase a 1-4 unit house/building.

One of the most important things for me is finding a walkable neighborhood. I love cycling and plan to live without a car, so being able to walk to coffee shops, restaurants, and other amenities is a must. I also plan to use public transportation regularly.

I travel frequently for work, so being relatively close to an airport would be a bonus, though it’s not a dealbreaker.

Any suggestions on which neighborhoods might be the best fit for my lifestyle? I’m thinking Charlotte or Raleigh but would like to know which neighborhoods in those areas and recommendations for any other areas that might be a good fit. Thanks in advance for your help!",helene,community_discussion,
1fqbhob,NorthCarolina,Tight_Property3955,1727397531,2024-09-27 00:38,1,0,Handgun laws in NC,"I know you can buy rifles or other weapons at 18, do you have to be 18 or 21+ to get a handgun/pistol?",helene,community_discussion,
1fqbiik,NorthCarolina,say_what_nowshugga,1727397601,2024-09-27 00:40,72,680,Insane warning from the National Weather Service for the southern most part of the AT,,helene,community_discussion,weather
1fqbt70,NorthCarolina,Both_Credit_5001,1727398536,2024-09-27 00:55,10,0, The flooding rn in Boone sets,,helene,community_discussion,
1fqc8we,NorthCarolina,SuchDogeHodler,1727399894,2024-09-27 01:18,0,15,Flooding in Hendersonville.,,helene,community_discussion,
1fqclue,NorthCarolina,Nutterbutter_Nexus,1727401049,2024-09-27 01:37,5,0,GOP Purges North Carolina Voting Rolls,"Be sure to double check your registration, you may have just been purged.",helene,community_discussion,
1fqcqho,NorthCarolina,Iride3wheels,1727401466,2024-09-27 01:44,37,7,Tell me you live in Chowan County,Tell me you live in Chowan County without telling me you live in Chowan County.,helene,community_discussion,
1fqcsqo,NorthCarolina,satti76,1727401659,2024-09-27 01:47,4,0,NYC Mayor Eric Adams Indicted: What Charges Does He Face?,,helene,community_discussion,
1fqe7e0,NorthCarolina,ILikeNeurons,1727406237,2024-09-27 03:03,20,43,"Trial set for North Carolina man charged for 1984 rape, assault in Columbia",,helene,community_discussion,
1fqil9k,NorthCarolina,worlddestruction23,1727423872,2024-09-27 07:57,11,82,Trump dodges question on Mark Robinson ,A coward and a hypocrite.  ,helene,community_discussion,
1fqioui,NorthCarolina,gliberty,1727424322,2024-09-27 08:05,21,31,North Carolina: check you are still registered to vote!! They pulled almost a million people off!,"Please put in the extra effort to double check that you are still registered!! More in the video, plus please check ✔️✅🗳️🙏",helene,community_discussion,
1fqirts,NorthCarolina,universalresident90,1727424730,2024-09-27 08:12,0,1,President Biden and Vice President Harris Deliver Remarks on Addressing ...,,helene,community_discussion,
1fql93m,NorthCarolina,Sauzer909,1727435658,2024-09-27 11:14,5,0,Things to do around Charlotte and Hickory ,"Yo! I'll be in NC for few days before Thanksgiving visiting friends. I'll fly over Charlotte and mostly staying around there and Hickory where my friends are based. 

Any ideas about what I could do in 3-4 days? 

I love beers and food, music, motorsports and walking in the mountains. But I also love to quirky things that can be done only in that place. 

Thanks ",helene,community_discussion,
1fqmz06,NorthCarolina,JeffJacksonNC,1727441493,2024-09-27 12:51,73,750,"In our state, the AG gets special authority to combat price gouging during natural disasters. That law is now in effect as Helene approaches. You can report price gouging here, and stay safe. - Rep. Jeff Jackson",,helene,community_discussion,helene
1fqn32u,NorthCarolina,ILikeNeurons,1727441853,2024-09-27 12:57,3,19,Jury Convicts Man Of Rape During Special Victims Team Trial,,helene,community_discussion,
1fqnon0,NorthCarolina,DCGirl20874,1727443581,2024-09-27 13:26,117,297,Trump Refuses to Disavow ‘Black Nazi’ Republican in NC,,helene,community_discussion,
1fqnrzb,NorthCarolina,Snapbeangirl,1727443855,2024-09-27 13:30,9,0,NC purged +700k voter ,https://l.smartnews.com/p-SQTVc/ztjfZZ,helene,community_discussion,
1fqnz2f,NorthCarolina,RamesesLabs,1727444428,2024-09-27 13:40,0,16,NC Power Outages Information,,helene,community_discussion,power
1fqo12p,NorthCarolina,betterplanwithchan,1727444588,2024-09-27 13:43,58,756,King Street in Boone (from Brad Panovich and WCNC),,helene,community_discussion,
1fqocz7,NorthCarolina,Swayzeebaby,1727445489,2024-09-27 13:58,45,42,Hurricane BUD! What was you first Hurricane?,"Harvey and I out in them elements, This ⁷Harvey's first Hurricane  That got me thinking about my first Hurricane which was HUGO(yes I'm that old ...don't believe me hol up)  I remember it so vividly because we went to Hardee's and got a 8 piece chicken family meal (told you i was around when Hardee's was a chicken joint) and as we pulled out the damn Hardee's sign come flying off in scary but  epic fashion my dad hurried us home after that lol",helene,community_discussion,hurricane
1fqovpe,NorthCarolina,NAZRADATH,1727446869,2024-09-27 14:21,41,0,"In Shelby. No power, need booze. Any ideas on the closest ABC that's open?",,helene,community_discussion,power
1fqpcz0,NorthCarolina,Minimum-Customer-972,1727448146,2024-09-27 14:42,39,93,Braxton Winston is running to be NC's next Commissioner of Labor,"Braxton Winston believes in a South where workers have heat safety protections and return home from a hard day’s work healthy and alive. He believes in a North Carolina where businesses AND workers thrive. He believes the future generation is worth investing in so that NC has a strong and resilient workforce for years to come.  
  
Being NC’s Commissioner of Labor is so much more than just being the face in every elevator. Vote for Braxton on November 5th.",helene,community_discussion,
1fqqbeq,NorthCarolina,Hot_Revolution3283,1727450641,2024-09-27 15:24,0,1,"Please help us, a tree devastated our home due to the hurricane",,helene,community_discussion,hurricane
1fqqbrz,NorthCarolina,Cy_098,1727450667,2024-09-27 15:24,3,24,Reason for Durham County manager’s absence still unclear after over two weeks on leave,,helene,community_discussion,
1fqqe9g,NorthCarolina,lordgilman,1727450854,2024-09-27 15:27,17,188,Lake Lure dam failure prompts mandatory evacuation,,helene,community_discussion,
1fqqg7k,NorthCarolina,MrArkrath,1727450996,2024-09-27 15:29,22,28,News on Brevard?,"We have family in Brevard not answering their phones and it is very unlike them. With the storms we are extremely concerned.

Is cell network out? I see [https://poweroutage.us/area/county/518](https://poweroutage.us/area/county/518) reports 80% outage but I didn't think that would prevent phones connecting.

Is anyone in Brevard with a status update? What's it like there? Any help or insight would go along way a calming my nerves.",helene,community_discussion,outage
1fqqys0,NorthCarolina,agtone12,1727452312,2024-09-27 15:51,8,0,Flooding in NC mountains,My family and I have tickets to tweetsie next Saturday. But flooding has us worried that we will have to cancel are hotel and tickets. Do y’all think the water and storm clean up will have things clear by next weekend? This is historic level rain for that area and I know they are prepared more for snow than flooding. So I don’t know what to do.,helene,community_discussion,storm
