id,subreddit,author,created_utc,created_date,num_comments,score,title,selftext,hurricane,source_type,keyword_hit
1foleid,asheville,bodai1986,1727206929,2024-09-24 19:42,45,15,Constitutional Amendment on the upcoming ballot,"Obviously the wording isn't saying what its suppose to be. Its vague and on the surface seems reasonable.

  
Can someone give me an explanation of this amendment? Preferably both sides of the ""for"" or ""against""?",helene,community_discussion,
1fom411,asheville,mingohills,1727208690,2024-09-24 20:11,7,1,Self Leveling Concrete Floors - Residential Build,"Has anyone installed self leveling concrete floors or had a a local installer do it? New build, residential. Just want to do the main floor with a concrete finish. Contractor is concerned (as am I) that the current plans won't support a slab.  ",helene,community_discussion,
1fomd21,asheville,emerald-cupcakes,1727209331,2024-09-24 20:22,6,3,Help - indoor venue in the Waynesville area for a small celebration of life gathering,"Hello Ashvegas and surrounds! I am hosting a small celebration of life gathering for my mother next weekend in Waynesville and have rented a picnic shelter in the area. However, I am now worried about hurricane rain. My mother was in her 80s and so are many of her friends and I don't think sideways rain is going to work for this crowd.

I'm desperately trying to find an indoor option that could host about 30 people, and that isn't too expensive. Any ideas??? She was not a member of any church in the area. I already have catering arranged so really I just need a small cheerful space. TIA!!",helene,community_discussion,hurricane
1fomteb,asheville,DarkForestTurkey,1727210487,2024-09-24 20:41,3,3,Tiny handyman job in Erwin hills,"Two doors that need the locks adjusted, one the strike plate doesn’t fit, and the other one the deadbolt doesn’t quite close. It’s a tiny job, most places are going to want to take it on.  I’m hoping to get it done in the next two days.  Takers?  I just don’t have the time to do it myself.",helene,community_discussion,
1fomumg,asheville,willowtreewanderer,1727210571,2024-09-24 20:42,1,1,Vacation and Hurricane Helene ,[removed],helene,community_discussion,hurricane|helene
1fomv4m,asheville,Heavy-Pension5519,1727210608,2024-09-24 20:43,1,1,is there anywhere that i can go in person to buy tickets to a show at the civic center??,[removed],helene,community_discussion,
1fonk2b,asheville,Brooklynn88,1727212369,2024-09-24 21:12,1,1,"Can anyone recommend a good/safe area to stay with a decent hotel, nothing too extravagant, between Asheville airport and Johnson City?","Can anyone recommend a good/safe area to stay with a decent hotel, nothing too extravagant, between Asheville airport and Johnson City?",helene,community_discussion,
1fono4k,asheville,AVLNative828,1727212654,2024-09-24 21:17,1,1,Pie.Zza with another cringey post,[removed],helene,community_discussion,
1fonrki,asheville,kilohsdestiny,1727212900,2024-09-24 21:21,1,1,In desperate need of housing by Oct. 10th. Anything helps!,"Hey! My name is Tanner (21M) and I'm desperately looking for a place to rent by October 10th. 
My budget is 650 a month and I'd prefer a room to rent until I can get fully back on my feet. 

About me:
- sober
- clean
- well mannered
- communicable

Please if anyone has any leads let me know. So far I've only come across scammers and my deadline is approaching fast. 
I can do weekly payments as well if needed",helene,community_discussion,
1foo5xd,asheville,Honest-Map-1847,1727213932,2024-09-24 21:38,1,3,Anyone use Blue Ridge Behavior for their pets?,"I’m looking for some help with integrating new cats into my home. This clinic keeps popping up and I’ve been referred to one of the vets that works there. But absolutely no reviews are available anywhere. Anyone use them for a cat issue and have success? 
Thank you!",helene,community_discussion,
1fook2z,asheville,PrismPhoneService,1727214963,2024-09-24 21:56,118,89,"If anyone has any questions about what tactics the rightwing militia next door will be teaching before the election, just call Ken and ask him. ",Se,helene,community_discussion,
1fooqz4,asheville,mysticmerlotman,1727215473,2024-09-24 22:04,63,205,Asheville Blursed   _  warning,,helene,community_discussion,
1foor6w,asheville,AVLNative828,1727215488,2024-09-24 22:04,0,1,Piezza makes (another) weird post ,[removed],helene,community_discussion,
1fop4bp,asheville,nothing_666_,1727216521,2024-09-24 22:22,13,1,Looking for tadpoles in asheville,"Hi Guys,
I am looking for native tadpoles as I need about 90.  It's almost past season so I was wondering if you guys had seen any this week?",helene,community_discussion,
1fopps6,asheville,Sensitive_Kale_2598,1727218211,2024-09-24 22:50,89,25,Dad bod strikes again on Pearl Street,Very recent as this wasn't here 2 days ago,helene,community_discussion,
1fopv3f,asheville,SoupThereItIs130,1727218646,2024-09-24 22:57,0,1,Looking for weeding help in WAVL,Any recommendations for some simple weeding help? Our garden has gotten away from us lately. ,helene,community_discussion,
1fopzsk,asheville,eatdrinkexplore29,1727219001,2024-09-24 23:03,0,1,Wanting to move to Asheville to be a handyman ,[removed],helene,community_discussion,
1foqawf,asheville,RelayFX,1727219851,2024-09-24 23:17,34,58,"Juvenile killed after apparent home invasion, robbery, Asheville police say","On Tuesday, Asheville Police Spokesman Rick Rice said it appears the shooting happened after an apparent home invasion.

""Evidence suggests this was a home invasion,"" Rice said.

A neighbor on Allen Avenue told News 13 the male shooting victim died outside the home on a front lawn.

""Detectives are working with the district attorney to determine if criminal charges will be filed,"" Rice said.

Mackenzie Davis, the homeowner of 9 Allen Avenue where the alleged home invasion took place, said the property is a rental. Davis also said the shooting ""was a self-defense situation.""",helene,community_discussion,
1for9q7,asheville,Aggravating-Split448,1727222699,2024-09-25 00:04,5,11,Do you need someone to build something?,"Carpenter, builder, remodeler, and handyman. High-quality work. Built houses/restaurants, remodeling kitchens and baths, refurbished decks and fences. Business used to be in Pebble Beach, CA. Just moved to AVL. DM me for a call back. Available most days.",helene,community_discussion,
1foru07,asheville,Divergent_,1727224413,2024-09-25 00:33,152,562,Anytime you try and bike in Asheville,,helene,community_discussion,
1fos3kz,asheville,porcine_endeavor,1727225223,2024-09-25 00:47,0,1,Issued a seatbelt citation despite wearing a seatbelt?,[removed],helene,community_discussion,
1fotsjz,asheville,waylanddenton,1727230444,2024-09-25 02:14,3,1,Asheville 4 day weekend activity suggestions,Headed to Asheville Thursday-Sunday and looking for some ideas of things to do.  Thanks in advance. ,helene,community_discussion,
1fou620,asheville,Zmchastain,1727231615,2024-09-25 02:33,11,25,Join Warriors of Ash Saturday for Brawls & Brews: A Festival of Heroes at Sideways Farm & Brewery!,"Looking for something fun to do with the family this weekend? Spend the day with your local Historical European Martial Arts (HEMA) school — the Warriors of Ash — on September 28 at Sideways Farm & Brewery from 11AM - 8PM for Brawls & Brews: A Festival of Heroes! 

Brave fighters travel from distant lands to test their skills in 2v2 brawl-style battles. Enjoy a meal and locally crafted brews while you marvel at our warriors’ martial prowess.

Then challenge your own abilities with our Warrior Obstacle Course for all ages, axe throwing with Clever Rabbit Throwing Club, browse our vendor market, and throw your name in for our fundraising raffles for a chance to win fabulous prizes that you can get a sneak preview of every day this week on our Instagram and Facebook!

You can find all of the details on the event page: https://www.facebook.com/share/KMqELXGZdKKn7ScC/?mibextid=9l3rBW",helene,community_discussion,
1foux8e,asheville,motosapian1,1727233987,2024-09-25 03:13,3,6,Do you have an old motorcycle that needs work?,"Do you have an old single or twin cylinder motorcycle you’d like to get running again so you can ride it back in time or sell it?   Go back in time when it’s running like new again!  All makes and models!  Or would you like to customize it to your flavor?  Tires, bring them in and I can change those too.  Whatever it is you need done, please include year make and model in the message!  I also buy small old motorcycles, so if you’ve got one of those laying around, rusting away and have a title for it, let me know!  

Thank you, and ride safe !!  All pictures are my own of bikes I’ve fixed.  Everything from Hondas & Kreidlers to Indians. ",helene,community_discussion,
1fov2y2,asheville,Sensitive_Kale_2598,1727234508,2024-09-25 03:21,8,2,Any Mom and Pop places hiring?,"Any Mom and Pop places hiring at 14 in Asheville, thanks",helene,community_discussion,
1fov4ap,asheville,ghostofbiltmore,1727234638,2024-09-25 03:23,1,2,Any time you drive a car in Asheville ,,helene,community_discussion,
1fovsgy,asheville,Fun_Explanation_3417,1727236989,2024-09-25 04:03,11,6,Question about Mela restaurant ,"Since someone just asked and got decent answers about silver ball subs, does anyone know if Mela restaurant has changed hands recently? 

Hadn’t been for lunch in a few months, went the other day and all the usual buffet waitstaff was gone, seems like a husband, wife(?), and some other dude were running the entire place as a trio. Food looks the same but tasted very different, textures off, vinegar-y rice and saag.. I asked if they changed chefs recently and didn’t really get an answer or a question as to why I was asking. 

 It wasn’t bad but it also wasn’t as good as usual. ",helene,community_discussion,
1fowe9y,asheville,longcooolwoman,1727239223,2024-09-25 04:40,150,131,Family attacked by a dog today,"And I can’t get over it. I was walking my dog and 2 year old in her stroller around my neighborhood and a dog (I’m not sure if he got off the leash or was never on it. Old man had him) charged all of us and started attacking my dog first, then me as I tried to stop him, then knocked my daughter’s stroller over in the road. I’m still trying to fight off the dog as my daughter is on the ground crying.

Normally she’s on a push bike but I was trying to get her to take a nap (news flash: that didn’t happen.) She would’ve been seriously hurt had I put her on the bike as usual this afternoon. My dog will never fucking be the same.

But the WORST part was that I was INSULTED by a random man in a car just idling and watching. The dog owner never apologized to me then this guy in the car starts telling me to leave the guy alone and that it’s my fault for having too much going on. Excuse me? All I said to the guy was to get a new leash. I COULD HAVE gotten his information and had the dog euthanized.

This man absolutely would not lay off me and I was so pissed off that I was having to defend myself while trying to make sure my kid and dog were okay. No one offered to help us. All bystanders just watched me struggle alone. Then basically told me it’s my fault for trying to exist. I told his friend (the dog owner who was standing right next to me with the dog for some insane reason) to tell her friend to lay off but he stood there like a coward. I ended up having to leave the situation as they stayed and continued to have a conversation together like nothing ever happened.

My problem is: this is my neighborhood. These are the people I live around. This is the walk I take my family on every day. I’m still so shaken up and feel so defeated. I have been trying to sleep for the last 4 hours but I’m wide awake. I hate that I didn’t get any justice for me or the rest of my family, and I hate that I will never know if I will encounter them/the dog again. And I hate how the unrelated nasty man in the car told me to take my family and walk away/leave the other guy alone while I was making sure they weren’t hurt.

I think I’m looking for some sort of closure. Can anyone offer me some “there, there’s” or some bullshit Buddhist saying to help me move on with my life? I feel like such a little toad because I’m usually so tough and this isn’t even the first time a dog has attacked us (I have spray and just didn’t happen to have it today which haunts me now.) This particular experience was just so beyond what I was mentally able to handle this week. And as usually I’m doing it all alone.

Sob story over.",helene,community_discussion,
1fowesm,asheville,marshmall0wface,1727239277,2024-09-25 04:41,1,2,Anyone selling 2 tickets to the Jose Gonzalez show at the Orange Peel next month? 😭,[removed],helene,community_discussion,
1foyy73,asheville,lostinco,1727250186,2024-09-25 07:43,12,63,Basement Flood Gang Checking in!,,helene,community_discussion,flood
1fp0xkq,asheville,4Nails,1727259181,2024-09-25 10:13,13,18,Do you guys know about the Asheville App to fix pot holes and stuff?,,helene,community_discussion,
1fp12o6,asheville,Careless_Silver6656,1727259742,2024-09-25 10:22,6,0,An ode To the man on Charolette street.," 
An ode to the man on Charolette street.

Oh! How I have no clue where I am going, 
I will follow what this man is perusing!
Oh! Oh! No! My gps is saying I’m wrong! 


Oh oh  how such a kind smile for my massive mistake. I try to smile but then my light turns green!   

Thank you much kind sir for no nasty, hasty, pasty looks. 
I appreciate all you do,
When kindness is your works!.




Tdlr: I’m stupid and almost hit this dudes car but then he smiled at me so all is okay?? ",helene,community_discussion,
1fp1fbr,asheville,erin1818,1727261171,2024-09-25 10:46,3,5,Bathroom interior design advice,Hello! I am updating a bathroom and would like some advice on color and selections. I have the tile installer ready to go. Can anyone recommend an interior designer who will do a consult and help me move the project forward? Thanks! ,helene,community_discussion,
1fp2j6l,asheville,InspectionMedium1713,1727265217,2024-09-25 11:53,7,3,Selling scrap metal in asheville,"hey is there anywhere in asheville i can take scrap metal and stuff like that and sell it ?? thanks in advance 
",helene,community_discussion,
1fp3u5q,asheville,wanderingmanimal,1727269175,2024-09-25 12:59,261,343,Look at the unprofessional contractor behavior AVL Airport hired,"ISEC, Inc contractor thinks it’s okay to sport your weird fetish for felons, pedophiles, cloaked profanity, and fascism in a public space. 

Super weird, but not unexpected I suppose. ",helene,community_discussion,
1fp46fr,asheville,erockdanger,1727270132,2024-09-25 13:15,1,1,Looking for a barber [more words for character count],Need help! My beard is scraggly. Any recommendations for a barber that can find a balance between too hipster and too linked in looking? ,helene,community_discussion,
1fp59n8,asheville,PeiksPeak,1727273112,2024-09-25 14:05,15,12,Kim Roney | Asheville City Council Candidate,"[https://www.buzzsprout.com/2125704/episodes/15803295](https://www.buzzsprout.com/2125704/episodes/15803295)

On ***The Overlook with Matt Peiken*** podcast, my series of episodes spotlighting every candidate for City Council continues here with current sitting councilperson Kim Roney. 

Pick an issue, and voters are likely to view it as yes/no, black-and-white question. They want to know whether their elected officials are for or against something. But Roney has served on the Asheville City Council long enough to learn that behind every yes or no vote, there’s subtext and context.

We talk about the nuances and complexities of policy decisions and weave our way through tourism, climate justice, infrastructure maintenance, reparations, even water rate parity. We also delve into one of Roney’s everpresent issues—transparency in government—and the return of structured but off-the-record mini council sessions.

  
",helene,community_discussion,
1fp5olq,asheville,CrankyBear,1727274195,2024-09-25 14:23,35,65,Election Watch: Mark Robinson joins long list of political candidates embroiled in a sex scandal • Asheville Watchdog,,helene,community_discussion,
1fp5yyh,asheville,Doiq,1727274955,2024-09-25 14:35,93,211,Hold onto your butts. Helene could be the most impactful event WNC has seen since Frances and Ivan in 2004.,,helene,community_discussion,helene
1fp6t40,asheville,Lionelchesterfield,1727277021,2024-09-25 15:10,1,1,"First time staying in Asheville this weekend, question regarding the weather.","Hey there, I'll be staying staying up near Bull Creek Thursday through Sunday so I'm curious what to expect up there given the elevation and the storm. Any advice or tips would be super helpful, thank you!",helene,community_discussion,storm|weather
1fp6z1e,asheville,Campfire77,1727277419,2024-09-25 15:16,0,2,Tedx Festival at Brevard College on Saturday September 28th! ,"10 TEDxBrevard Speakers! 

Ischa Vingle, Parker Hays, Michael Collins, Rachel Dickson, Sae Mickelson,
Cody Hale, Christy Bauman, Brett Loftis, Sammantha Coffin, Jennifer Peyton 
 
Main Theater Musical Performances by:
Suzanne Germaine, Carrie Morrison, Keturah Allgood, Lillie Syracuse,  Cody Hale, Sarah Siskind
​
Ampitheather Musical Performances by: 
Dave Desmelik, Judy Morgan, Dustin Maxwell, Mason Maynard
and Nathan Taylor  
​
Featured Artists:
Marcia Moore, Steve Shiflett, Angela Cunningham 
 
30 + Vendors & Artists
Food Trucks, Games and More....
Join us!

Saturday, September 28, 2024 
Porter Center at Brevard College 
Brevard,  North Carolina ",helene,community_discussion,
1fp79gg,asheville,ghostrabbitart,1727278137,2024-09-25 15:28,8,71,Missing elderly cat in South Asheville ,"She never gets out  but last night she slipped out and our neighbor took her downstairs for some reason and now we can't find her. Would really like to get her back before the storm. She has a thyroid issue and needs her meds. She's always thirsty and loves laying in the sun. She usually comes if you yell ""chicken time""",helene,community_discussion,storm
1fp7a3g,asheville,tintinringaling,1727278185,2024-09-25 15:29,8,1,Cabin Getaway this Weekend to Marshall,"My partner and I are heading up to Marshall from Georgia this weekend to stay in a Cabin. Our checkin time is 3:00 on Friday.

With the recent hurricane coming through. Do y’all think it’s too dangerous to travel there Friday? 

Thanks 

",helene,community_discussion,hurricane
1fp7nku,asheville,pookiebelle,1727279122,2024-09-25 15:45,6,3,Saw this truck on my morning commute.,I'm sure at some point somebody posted it but I also know how much y'all love these kind of vehicles.,helene,community_discussion,
1fp7x81,asheville,dicemastermallory,1727279800,2024-09-25 15:56,4,16,Looking for 2 D&D Players Who Can Join Bimonthly Wednesday Campaign,"Hey all! I'm a DM running a homebrew D&D 5E campaign every other Wednesday at 6:30pm.

My group is looking for 1-2 new players who can commit to this time slot. It's been hard to find friends whose schedules allow them to join game nights in the middle of the week. In fact, our original group were all Asheville Reddit recruits for this reason, though we've lost and gained a couple players over time due to moving/schedule changes. Our game night schedule has been consistent for about 2 years- every other Wednesday at 6pm.

As the DM, I need players who are vaccinated and covid-safe (or just generally cautious about sickness and germs). It's not as big a deal as it was when I recruited our group two years ago, but I'm asthmatic with a history of pneumonia and still trying to be careful. If you're sick on game night, you gotta stay home.

Our group is at level 9 (landmark, not XP). We currently have a rogue, a cleric, and a wizard, so we probably need some new heavy hitters. No evil aligned PC's. Neutral is fine as long as you're not too murder hobo about it, but good alignments preferred.

The game take place on a ship crossing an ocean, but our current arc is on an island. 

  
**Game Hook:** The Churning Sea is a vast ocean full of incredible storms, massive whirlpools, and full of countless sea monsters. For two millennia the Churning Sea has been utterly impassible, unmapped and unexplored. Some months ago, there was a change. The millennia long storms, whirlpools, and fleets of monsters have begun to subside. The sea has been relatively calm for the first time in living history.

The Aedris Empire in the north seems to know something about what caused the change. High King Behani Oppius has called for adventurers to venture out into the Churning Sea to recover four ancient artifacts- four “Ocean Jewels” or “Jewels of the Churning Sea” and bring them to the capitol of Aedris. These jewels are said to be scattered throughout the strange and uncharted Churning Sea, and each has powerful magic. Rumor has it that these magical jewels have something to do with why the sea stopped churning, but no one knows how or why.

*Reward***:** A parcel of land with a Barony, a very rare magic item, and 500,000gp PER JEWEL COLLECTED.

**Current Arc:** The party has been sailing aboard the Gravegale for several weeks, and dropped anchor off a mysterious island a few days ago. Most of the island and surrounding waters are covered in a thick, dangerous fog. The party has a lead that one of the jewels is in the cave of a blue dragon at the top of a mountain, but they might have to work with cultists to get it. ",helene,community_discussion,
1fp8bcz,asheville,hottakesnobreaks,1727280750,2024-09-25 16:12,263,57,What’s everyone doing to prepare for the storm? ,Looking for actual advice but won’t say no to a few snide remarks 😏,helene,community_discussion,storm
1fp901j,asheville,JournalistKnown5428,1727282466,2024-09-25 16:41,3,4,How Much Were Ol’ Skool Salsa’s Burritos?,"I was discussing Good Hot Fish (respect) prices with a friend, and we couldn’t remember how much Hector (I know, I know) charged when he was slinging burritos from the window. It seemed like a lot. Anybody?",helene,community_discussion,
1fp9fxo,asheville,drunkerbrawler,1727283554,2024-09-25 16:59,25,41,Hot Fish on NYT 50 best restaurants of 2024 list,,helene,community_discussion,
1fp9kjz,asheville,Effective_Window1178,1727283847,2024-09-25 17:04,0,8,Last night at Council: A remixed Ramada Inn plan moves forward,,helene,community_discussion,
1fp9p8b,asheville,Afraid-Beginning-308,1727284176,2024-09-25 17:09,1,3,Any moving jobs in that just need movers,Any moving jobs that don’t force you to drive?,helene,community_discussion,
1fpanu7,asheville,EffReddit420,1727286556,2024-09-25 17:49,3,2,How can I reach Mission memorial Hospital record by phone? ,"

I am needing to contact Mission Memorial Hospital records department by phone. Some years ago, i requested medical documents which i received in paper about 30 or so pages long with everything i needed. To the best of my memory is was over the phone. 

However, this year I ordered it and it and got only half the pages and apparently, its not everything and I want to know why. The procedure I was looking for was not mentioned and I need to find out if it was at the same hospital or not. And if not, what hospital.  ",helene,community_discussion,
1fpau5p,asheville,thepeyoteugly,1727286999,2024-09-25 17:56,0,1,Storms Comin' xxzxzxzzzzzxzxzzzz,,helene,community_discussion,
1fpb1ye,asheville,BestBiscuits,1727287518,2024-09-25 18:05,1,1,Help save our trip! Here from New Orleans. ,"The hurricanes followed us from New Orleans. 
Very sorry about that. 
And I know tourist aren’t too popular (but we’re from New Orleans so I get it) 

But we brought our four kids to do some hiking, see some color on the leaves, and my soon to be 13 year old son requested to primitive camp with his dad while we’re here. This trip is basically his 13th bday gift. 

The storm has changed those plans. 

What are some indoor things we could do Friday and Saturday? If the flooding isn’t too bad by then. 

I’ve already thought about indoor climbing(one of the bday boy’s faves) and an arcade. 

Which would you recommend? ",helene,community_discussion,storm
1fpbbej,asheville,UnderstandingBig3860,1727288185,2024-09-25 18:16,12,20,Adult driving lesson recommendations?,"As a recent cat-eating filthy immigrant transplant from a country where public transit takes precedence over cars, driving my ass about is not something I've ever had to deal with. Much as I love Asheville the bus is quite limiting. Does anyone have any recommendations for adult driving schools/instructors in the region? Ideally the kind that has a car I can drive rather than me needing to have my own. Thanks everyone!",helene,community_discussion,
1fpbpbk,asheville,Diligent_File_7106,1727289170,2024-09-25 18:32,15,3,Looking for Wood Pallets in or near Asheville,"Does anyone know where I can get wood pallets in Asheville or in any of the cities close by? I have tried looking on Facebook marketplace and I called home depot and I haven’t had any success. Does anyone know of any business that might be looking to get rid of some wood pallets? 
",helene,community_discussion,
1fpck6e,asheville,[deleted],1727291334,2024-09-25 19:08,0,1,This pretty much goes for al parking near the rivers. Stay high and dry! ,[deleted],helene,community_discussion,
1fpckvb,asheville,brooke_heaton,1727291384,2024-09-25 19:09,6,87,Pretty much goes for all parking near the rivers. Stay high and dry! ;),,helene,community_discussion,
1fpcm9k,asheville,DryDeal2481,1727291479,2024-09-25 19:11,1,1,Looking for Violent Femmes tickets,[removed],helene,community_discussion,
