id,subreddit,author,created_utc,created_date,num_comments,score,title,selftext,hurricane,source_type,keyword_hit
1fn81pk,asheville,Human-Tradition-5527,1727051619,2024-09-23 00:33,1,1,Best tattoo artists for cover up?,Any recommendations on local artists who are good with cover ups or fixing up old tattoos? Specifically color tattoos. Preferably around avl but willing to travel a bit! ,helene,community_discussion,
1fn8pqa,asheville,Everynameismistaken,1727053697,2024-09-23 01:08,108,10,On Target post pandemic (30 characters),"I used to go to the range at On Target because they didn’t push a republican agenda.  I haven’t been since the pandemic.  If you’ve been recently, do they still realize that dems own guns too?",helene,community_discussion,
1fn90yx,asheville,ComfortableParking83,1727054659,2024-09-23 01:24,27,0,Where in Asheville can I find skirt steak?,"I went to a bunch of grocery stores over the weekend and didn't find what I needed, had to settle for flank steak which I found in Publix, it's thicker and not fatty enough, so I'll have to marinate it.",helene,community_discussion,
1fnbr0v,asheville,papervegetables,1727063686,2024-09-23 03:54,11,0,"Dumpling wrappers, where to find? ",Where can I find dumpling/wonton wrappers reliably? Do any of the general supermarkets carry them? TY! ,helene,community_discussion,
1fnbyw1,asheville,poledrawolf,1727064449,2024-09-23 04:07,2,0,I'll Just Leave This Here...Enjoy!,[https://www.facebook.com/share/r/xv4kYm5SpG8UjZht/](https://www.facebook.com/share/r/xv4kYm5SpG8UjZht/),helene,community_discussion,
1fnfrc3,asheville,highfivedownlow,1727080811,2024-09-23 08:40,4,23,Be careful of wildlife while driving,"This goes for any road and any time of day but if y’all are ever driving on North Bear Creek Road, please be careful. There is so much wildlife around there and I constantly see poor little animals hit on the side of the road. I’m hoping in the future to ask the city to put a “wildlife crossing” sign(or two) on that road to make people more aware as well. Just be mindful please! ",helene,community_discussion,
1fngsx9,asheville,AutoModerator,1727085639,2024-09-23 10:00,33,2,Visiting or Moving to Asheville? Ask your questions here!,"Hi and welcome to Asheville! We get a lot of posts asking very similar questions so this post aims to address some of our most Frequently Asked Questions, and give you a place to ask for assistance.

[CLICK HERE](https://www.reddit.com/r/Asheville/wiki/index) TO SEE OUR COMPREHENSIVE GUIDE ON WHAT TO DO IN ASHEVILLE. It covers the best restaurants, breweries, and coffee shops and directs you to all the best things to do in Asheville. It also recommends the neighborhood that's right for you to move to, tells you where the jobs are, and who the best ISP is.

**Have you scoured the FAQ and still have some questions? Here are a few tips to include in your question:**

Tell us about you - If you want us to suggest things for you to do then you need to give us a good idea of what you enjoy.

Tell us your budget - If you're on a budget then tell us what it is and we can bear that in mind when making recommendations.

Non-touristy stuff - There are no secret corners where we hide the good stuff from outsiders!

**Good resources for finding things to do:**

*General Calendars*[MountainX Main Calendar](http://mountainx.com/calendar/)

[Explore Asheville Calendar](http://www.exploreasheville.com/things-to-do/events/)

*Music/Comedy/Live Events*

[MountainX Clubland](http://www.mountainx.com/clubland)

[JamBase music calendar](http://www.jambase.com/shows/Shows.aspx?City=Asheville&State=NC&radius=25)

*Beer Related Events*

[MountainX On Tap](http://mountainx.com/ontap/)

[Asheville Ale Trail Event Calendar](http://ashevillealetrail.com/asheville-craft-beer-events/)

**Please note that all visiting and moving posts outside of this thread will be deleted and referred back to this thread. Derisive or off topic comments will be deleted.**",helene,community_discussion,
1fniso8,asheville,Huge_Cry_2007,1727093210,2024-09-23 12:06,1,1,MJ Lenderman Manning Fireworks ,[removed],helene,community_discussion,
1fnj19m,asheville,CoraxCorvid,1727093988,2024-09-23 12:19,3,11,Any noise rock folks want to play music together?,"46M looking to play covers with fun people. I play drums. Would love to cover heavy, feedback laden, heavy, noisy songs by bands like: iceage, Warsaw, etc. I am in Laurel Park but potentially could travel. I have a set and practice space. Chill, friendly, low drama crushers only! Let's play!",helene,community_discussion,
1fnjc5e,asheville,Huge_Cry_2007,1727094926,2024-09-23 12:35,13,47,MJ Lenderman Manning Fireworks,"Looks like MJ Lenderman is getting pretty big with this new album. Praise all over the internet, selling out almost every stop on his tour. It’s cool to see somebody local in the spotlight. Quickly becoming Asheville’s most famous musician",helene,community_discussion,
1fnjhnz,asheville,Sovryx,1727095370,2024-09-23 12:42,1,3,The Bluffs developer sues Woodfin; Resident concerns over a 'megadevelopment' renewed,,helene,community_discussion,
1fnkig8,asheville,Comfortable_Rip_5746,1727098285,2024-09-23 13:31,16,68,"RIP Billy Edd Wheeler, author of Asheville the Record",,helene,community_discussion,
1fnkxt3,asheville,CrankyBear,1727099475,2024-09-23 13:51,6,43,"Randy Shepherd of Asheville, Crossfire Ministries co-founder, basketball coach, dies at 60",,helene,community_discussion,
1fnlgvo,asheville,M795,1727100859,2024-09-23 14:14,4,15,Drilling work for I-26 Connector begins in French Broad River,,helene,community_discussion,
1fnm9hr,asheville,x10lovesyou,1727102940,2024-09-23 14:49,11,11,Does anyone recognize this artist? ,Staying at a VRBO in Asheville and love this mug. Can’t figure out the artist’s name and the host doesn’t know either. Does this look familiar to anyone? ,helene,community_discussion,
1fnmopa,asheville,Informal-Echo-192,1727103996,2024-09-23 15:06,2,0,Gay camping buddy- west AVL/Haywood county,"Hey y'all!

I'm late 30s athletic bi bottom and I'm looking for a gay camping buddy (or group!) to explore the beautiful outdoors with. Let’s hit the trails, set up camp, and enjoy some quality time in nature.

I'm open to weekend trips around the Blue Ridge Mountains or any cool spots you might know of. I love hiking, campfires, stargazing, and just unplugging for 

If you're interested, drop me a DM or reply here, and let's plan something fun! 🌲🏳️‍🌈

Cheers!",helene,community_discussion,
1fnmpp7,asheville,Consistent_Judge1988,1727104063,2024-09-23 15:07,75,26,Walk Restraunt Experience - My experience trying something new,"Here we go...

I was out and about on Sunday morning wanting something nice to eat at a low-key place with my partner.  I suggested BBQ but both places were closed.  I suggested West Ashville because I've had some of the best food experiences here.  We went to the ""Walk"".

-Enter the establishment and ""Seat Yourself"".

-Seated and looking at the menu ordered drinks. Waters and an OJ. (OJ didn't come until after the food was served. This was also a verbal reminder from my partner, as I at that point, wouldn't have said anything and just removed it from the bill on checkout.

-Waiting seemed long especially with no Brunch lines or hordes in there.  

-My partner had ordered a ""biscuit"" and a Salad.  The biscuit was CornBreadish...The salad was just arugula in a side dish, which she had ordered an actual salad option from the menu, not the side salad.

No big deal. Miscommunication. Normal, I guess. They checked in on us twice while this was going on.

My food was served and it was fine.  

-Waiting again. #commontheme

Then when they finally showed up with the check in hand I handed my credit card to them.  

Waiting again.  Then they came over to tell us that they lost my card.

I'm sure at this point some of you reading this would be mildly irritated.  I work with customer service so it takes a lot for me to get upset anymore.  Patience is my superpower.  However, I didn't go out of my way to make their lives any harder than needed.  They explained what happened and offered me a 25.00 gift card, comp'd the meal.  I declined the gift card as this was a less-than-desirable situation and experience.  We promptly left and I did provide them with info to contact me if they ever found the card.  I promptly CXL'd and Froze my card.  I also went through the process of changing everything that the card had associated with it.  SIGH.

  
They did call an hour later and told me they found it.  So good on them for trying.  Does anyone else have luck like this or experienced this with other restaurants around here?  Let me know so I can avoid them.  

",helene,community_discussion,
1fnmwwf,asheville,Mystical_Moose89,1727104568,2024-09-23 15:16,5,2,Anyone hiked Chimney Rock in the Rain?,Anyone know how hiking chimney rock in the rain is? It is supposed to rain all week before we go due to the storm on the Gulf coming in. Not sure if it is still considered safe after a week of raining?,helene,community_discussion,storm
1fnn0qu,asheville,PeiksPeak,1727104832,2024-09-23 15:20,3,8,Tod Leaven | Asheville City Council Candidate,"[https://www.buzzsprout.com/2125704/15783662](https://www.buzzsprout.com/2125704/15783662)

Tod Leaven doesn’t dwell on the details when he speaks of his twin sister, who he says was battling addiction and chronic homelessness in the early 2000s when she was killed. But it isn’t a reach to see the connection with his sister, in part, fueling Leaven’s career as an attorney, his community service and his current run for a seat on Asheville’s City Council.  
  
On the new episode of *The Overlook with Matt Peiken* podcast, my conversation with Tod Leaven continues our series of episodes devoted to every candidate for City Council. Leaven talks about his path from the active duty military to a career in law to his current campaign. We dive deep into his takes on affordable housing, stewardship of public money and prioritizing what he believes are core city services.",helene,community_discussion,
1fno54f,asheville,CrankyBear,1727107576,2024-09-23 16:06,37,39,"One year in, Compass Point Village has changed lives for the better — and caused problems along Tunnel Road • Asheville Watchdog",,helene,community_discussion,
1fnpf2s,asheville,Own_Section_1445,1727110748,2024-09-23 16:59,22,15,Recommendations for lawyer to help me fight being sued for something bogus? ,"I’m being sued for something ridiculous that is very likely an attempt for the person suing to get some insurance money. I need a lawyer to help me fight it—Who do you recommend? I’ve called a few lawyers but can’t seem to get a call back even for an initial consultation, so open to anyone at this point. TIA! ",helene,community_discussion,
1fnrv40,asheville,og_speedfreeq,1727116713,2024-09-23 18:38,4,0,Who will do a rough alignment on my 03 Ram 1500?,"I'm not in a position to replace all the ball joints at this time, but I just want the truck to go down the road in a straight line. Does anybody know a shop that'll throw it on the rack and get it more or less aligned?",helene,community_discussion,
1fnsiu6,asheville,tprmeasap,1727118323,2024-09-23 19:05,5,4,Windshield Washer Fluid Tank Repair - Hendersonville,Any suggesions for a shop near Hendersonville who can fix a leaking windshield washer tank or related hoses?  I dropped a whole gallon in a day...so it is obviously leaking somewhere.  I have 2021 Tahoe.  Thanks in advance!,helene,community_discussion,
1fnsn48,asheville,brooke_heaton,1727118616,2024-09-23 19:10,103,390,Nearly all of Lt. Gov. Mark Robinson's campaign staff quits after CNN report,,helene,community_discussion,
1fnt700,asheville,Unlikely-Cream8300,1727119984,2024-09-23 19:33,1,1,Booking a bachelor party weekend,[removed],helene,community_discussion,
1fntpd6,asheville,Dazzling_Street_3475,1727121251,2024-09-23 19:54,9,0,When do the leaves lose their color and die?,"Peak week is usually late October correct? Depending on elevation. 

How long after that do they lose their color then die?",helene,community_discussion,
1fnua3q,asheville,Pennythe,1727122675,2024-09-23 20:17,10,3,What’s best haunted house? The haunted farm or pinheads graveyard?,Haven’t spent Halloween here. We loved hickory haunts so much when living in Hickory.,helene,community_discussion,
1fnuke9,asheville,ahkd13,1727123395,2024-09-23 20:29,11,0,South French Broad Neighborhood,"I’m considering purchasing a property in the South French Broad area of Asheville, but as I'm not very familiar with the neighborhood, I wanted to ask for your insight. My primary concern is safety, particularly for my elderly and female family members. Would you say this area is considered relatively safe? Would you feel comfortable with your own loved ones, especially women or elderly family members, walking around the neighborhood in the evening? I have already checked [Niche.com](http://Niche.com), [CrimeGrade.org](http://CrimeGrade.org), and [https://police-transparency-avl.hub.arcgis.com/pages/crime-stats](https://police-transparency-avl.hub.arcgis.com/pages/crime-stats) but I wanted a human perspective, ideally from locals.

Any feedback you can provide would be greatly appreciated!",helene,community_discussion,
1fnuu0f,asheville,mel_bol,1727124066,2024-09-23 20:41,2,0,Asheville getting negative press,Have you seen this article? Pretty real. Thoughts?,helene,community_discussion,
1fnuyfc,asheville,lavendervc,1727124378,2024-09-23 20:46,4,2,Q about Rhododendron Gardens in Bakersville,"I want to know everything about this place! I am planning a proposal and I think this would be the perfect spot. However, I am a few states away and have never been here, and probably will not get the chance until the actual proposal. 

When are the peak blooms? Are there any spots along it that are better than others? When is the best time of day to visit? Is it generally crowded or private? Does it actually live up to the hype? Is it worth the trip?  ",helene,community_discussion,
1fnv33q,asheville,mel_bol,1727124700,2024-09-23 20:51,7,0,"Asheville got a negative article, 2nd attempt.","I screwed up the first time I tried to share this, but here is the correct link. Thoughts ",helene,community_discussion,
1fnv6p0,asheville,ComfortableParking83,1727124952,2024-09-23 20:55,4,0,Accident on Brevard Rd N near the hotdogs place. I don't have pictures,"Looked like a truck or something flipped on its side. Slow down folks, a little rain is like ice sometimes.",helene,community_discussion,
1fnwkd0,asheville,MajorAd3363,1727128543,2024-09-23 21:55,25,8,Almost hit (or hit by) a bear on Parkway today,"On my way home from work, northbound on the parkway from the Hendersonville Rd entrance.  Bear comes running out of the treeline right across the road.  Had to jam on the brakes to miss it.  ",helene,community_discussion,
1fnx9sn,asheville,cincodublin,1727130456,2024-09-23 22:27,1,1,Looking for general contractors in Western NC,Preferably with ongoing flexibility for future jobs!,helene,community_discussion,
1fnxqlm,asheville,cincodublin,1727131734,2024-09-23 22:48,0,0,Looking for general contractors in Western NC with ongoing flexibility for future jobs,,helene,community_discussion,
1fnxr07,asheville,Sufficient_Fig_4887,1727131767,2024-09-23 22:49,6,0,Traveling to the area for the first time! ,"Hey all, the wife and I are headed to Ashville for  the first time on Wednesday. The forecast looks a bit wet with the tropical storm, we still have the option to change our flights somewhere dry. 

We were hoping to hike and explore the mountains, drink beer, and take in nature. Should we try and come back another time to get the most of the area? 

Guess I’m hoping you can all point us to some indoor activities that will keep us entertained if we’re stuck inside. ",helene,community_discussion,storm
1fnxwqs,asheville,TriangleGC,1727132216,2024-09-23 22:56,13,0,Elopement Photographer Needed 10/19,I know it’s incredibly last-minute but my fiancé and I have finally decided to get married. We rented an Airbnb in Mars Hill and are having our families come and planning on having the ceremony on the top deck on the evening of the 19th. Any leads for this or suggestions on where to look? ,helene,community_discussion,
1fnyk6w,asheville,kyoselflove,1727134073,2024-09-23 23:27,1,1,Saw this on Brevard Rd today lol,,helene,community_discussion,
1fnyqoh,asheville,Key_Flan_5631,1727134579,2024-09-23 23:36,1,0,Surprised more people in the interview didn’t say Asheville for worst drivers in North Carolina! ,https://www.instagram.com/reel/DARv6c1SpjO/?igsh=MW15ZGhwcGp1bDUwbA==,helene,community_discussion,
1fo0r0l,asheville,Enlightened_Sloth,1727140651,2024-09-24 01:17,1,1,Looking for 2 tickets for MJ Lenderman at Orange Peel,[removed],helene,community_discussion,
1fo0tlq,asheville,Ancient_Midnight_736,1727140871,2024-09-24 01:21,3,0,Hotel recommendations near the Biltmore,My husband and 7mo old son are taking a weekend trip to Asheville soon. We would love to stay in a hotel with Mountain views that’s also not far from the Biltmore. Any recommendations? Thanks in advance,helene,community_discussion,
1fo68wy,asheville,Ok_Spot975,1727160214,2024-09-24 06:43,2,0,Lil bitch bawhahaha fucktard....,These stupid ass people here walked into chaos and I'm skin in them fucks as wel.....lil nitch..........,helene,community_discussion,
1fo8nhx,asheville,six_seasons_,1727171396,2024-09-24 09:49,32,31,Sandra Kilgore's speech at the Walz rally,"I went to the Walz rally last week and heard council person/Vice Mayor Sandra Kilgore speak. She had some great points, and mentioned the housing affordability crisis. I know she's exiting council this year but I thought that was an interesting point to mention when she owns a property management company here in town......",helene,community_discussion,
1fo91a7,asheville,Metalrxe,1727173016,2024-09-24 10:16,7,4,Body Paint Repair Recommendations ,"My car has some scratches on it including a deep scratch in the back. Any recommendations for body repair shops that are reasonably priced? I don't surrounded areas such as Asheville, Arden, or Hendersonville. 

Thanks! ",helene,community_discussion,
1fo9lmb,asheville,Ill_beans55,1727175238,2024-09-24 10:53,1,1,Looking for wedding DJ in western NC,Getting married in black mountain NC and looking for DJ recommendations in the Asheville area? Who should I check out? Also open to other vendor recommendations if you got em - thanks in advance! ,helene,community_discussion,
1foafc7,asheville,lakegoat,1727178238,2024-09-24 11:43,35,52,Looking for a men's group or something similar,I'm a 56 year old male looking for either a non-misogynistic men's group or coed group to connect with people. Any recommendations would be welcome. Thanks in advance. ,helene,community_discussion,
1foaph9,asheville,scool298,1727179164,2024-09-24 11:59,0,1,USPS - What would this happen?,"Is this normal? I really don't know/understand why a package originating from Asheville, to be delivered in Asheville, would be taken through this route. Makes 0 sense to me but I may be missing something...",helene,community_discussion,
1foarba,asheville,scool298,1727179314,2024-09-24 12:01,52,31,USPS - Is there a reason for the wacky AVL to AVL routes?,"Does anybody know why a package that was sent from Asheville, to be delivered TO Asheville, would be taken through this route?

It makes 0 sense to me but Im sure Im missing a part of the story...",helene,community_discussion,
1fob2n6,asheville,Permit_Alert,1727180330,2024-09-24 12:18,0,1,1881 folks without power from downed limbs/trees,"Started at 4:22 am, not due to be restored until noon per Duke energy website.",helene,community_discussion,power
1fob93a,asheville,Far_Yam_9838,1727180878,2024-09-24 12:27,8,0,Bear alert in Burton community ,Cub hanging around near Martin Avenue and Clay Street in the Burton community. Might want to keep an eye on your dogs.,helene,community_discussion,
1fobndx,asheville,themawtheband,1727182090,2024-09-24 12:48,0,1,Seeking drummer for extreme metal band,[removed],helene,community_discussion,
1fobp1i,asheville,themawtheband,1727182231,2024-09-24 12:50,0,1,Seeking Drummer for Extreme Metal Band,[removed],helene,community_discussion,
1focz9a,asheville,goldbman,1727185825,2024-09-24 13:50,136,237,North Carolina District 11 Congressman Chuck Edwards with NC Lt. Gov. Mark Robinson (undated),,helene,community_discussion,
1fodrgw,asheville,CrankyBear,1727187896,2024-09-24 14:24,3,29,When is early voting in NC? Absentee voting? What to know ahead of Election Day 2024,,helene,community_discussion,
1fodypc,asheville,Hello_Hollow_Halo,1727188414,2024-09-24 14:33,0,1,Decent places for night running? ,[removed],helene,community_discussion,
1foe3ca,asheville,LoraxVW,1727188758,2024-09-24 14:39,32,87,Your sample ballots are now available to print so you can research your local candidates and referendums.  ,,helene,community_discussion,
1fof3qg,asheville,Major_Notice_4875,1727191289,2024-09-24 15:21,0,1,"31 and at a loss , looking for friends ",[removed],helene,community_discussion,
1fogo04,asheville,garye55,1727195231,2024-09-24 16:27,21,70,"Firm hired by TDA to promote Asheville sporting events is accused of diverting $50,000 donation for nonprofit in Florida • Asheville Watchdog",,helene,community_discussion,
1fohawe,asheville,TheWhaleAVL,1727196813,2024-09-24 16:53,0,5,Tonight at 6pm at The Whale South Slope! Teams of up to 6 people. ,,helene,community_discussion,
1fohfmf,asheville,LadyBelladonna1995,1727197149,2024-09-24 16:59,8,2,Car mechanic recs break pads/ timing belt,Looking to get new break pads and a new timing belt. Just simple maintenance stuff. Toyota dealership wants to charge me quite a lot for this. Any affordable and reliable shops in the area for this kind of thing?,helene,community_discussion,
1fohg8r,asheville,CrankyBear,1727197192,2024-09-24 16:59,1,7,"Firm hired by TDA to promote Asheville sporting events is accused of diverting $50,000 donation for nonprofit in Florida",,helene,community_discussion,
1fohwyo,asheville,avldogindividual,1727198324,2024-09-24 17:18,13,5,Question about good ole Silverball Subs,"Has there been a change of management? 

The quality is as good as ever, and it seems to be busy every time I'm there. But I don't see the (previous?) owners around anymore. And it seems like they're focusing less and less on the pinball part: there are only a few machines in there now.

Wishing them the best but hoping we don't end up with a pinball-free Silverball :/",helene,community_discussion,
1fojk9x,asheville,Otherwise_Floor_9546,1727202403,2024-09-24 18:26,32,0,To the disgusting man at YMCA. ,"I am sick and tired of all of y’all old men crushing the locker room / shower / saunas. 

Yes, I am talking to you short military cut, salt and pepper mustache, with a white towel. 

I will report you the next time I see you staring at me or any other person. ",helene,community_discussion,
1fojrx1,asheville,Flat-Barracuda-3572,1727202920,2024-09-24 18:35,2,1,Visiting and looking for vegan treats ,Hi everyone. I’m visiting and looking for a coffee shop that has some vegan bakery. I saw Gallivant listed on this page but it appears to have closed. Any other vegan treat locations or recommended coffee shops would be appreciated. Thank you ,helene,community_discussion,
1fok098,asheville,Flat-Barracuda-3572,1727203490,2024-09-24 18:44,5,3,Looking for vegan treats at coffee shop ,"Let’s try this again. Reddit didn’t like my last post :)

Hi everyone. I’m looking for a coffee shop that has some vegan bakery. I saw Gallivant listed on this page but it appears to have closed. Any other vegan treat locations or recommended coffee shops would be appreciated. Thank you ",helene,community_discussion,
1fok5r3,asheville,SpiritedSpecialist15,1727203870,2024-09-24 18:51,158,72,Looking at the weather forecast - how does Asheville handle 8+in of rain? ,"I’m newish here. Just curious with a tropical sister to move through by weeks end. 

Is the area prone to flooding? How does it handle tons of rain and/or wind? Areas to stay away from? 

In case it’s not clear, I have some moderate weather anxiety and like to be prepared 🙈",helene,community_discussion,weather
1fokai3,asheville,Nameless-Glass,1727204202,2024-09-24 18:56,1,4,Flooring repair recommendations? ,"Looking for recommendations for people that can repair different kinds of flooring, got some bunched up LVP that needs breathing room and a few other random issues. ",helene,community_discussion,
1fokd58,asheville,Educational_Sir3198,1727204391,2024-09-24 18:59,14,0,Is there a LGBTQ+ Rights activist group for young adults in Asheville?,"Would love to be a part of something locally!  I helped to start a gay rights group in 2010 called Just Us For All here in Asheville and it was some of the best years of my life.   Our group had mostly young people though had several older people as well that were amazing mentors.  These are crazy times and I would love to put my energy into changing things for the better.   I am very open to helping someone or a group of people start something new (a new activist group) as well, I just don't want to be a leader of the group if that makes sense lol",helene,community_discussion,
1folebz,asheville,mbetz08,1727206917,2024-09-24 19:41,18,21,Benne on Eagle Announces Closing,"There aren't a lot of details, but they posted that they are now closed on Instagram [https://www.instagram.com/p/DATePI4xCve/?hl=en](https://www.instagram.com/p/DATePI4xCve/?hl=en) ",helene,community_discussion,
