id,subreddit,author,created_utc,created_date,num_comments,score,title,selftext,hurricane,source_type,keyword_hit
1fn7ict,NorthCarolina,Dio_Ludicolo,1727050024,2024-09-23 00:07,5,11,Nearly all of Lt. Gov. Mark Robinson's campaign staff quits after CNN report,,helene,community_discussion,
1fn7rgc,NorthCarolina,Witty-Duck2255,1727050782,2024-09-23 00:19,1,0,Registration question,"When I renew my registration in person, do they immediately give me a new registration card or does it get mailed? 

Also do I need my physical title to renew my registration in person?",helene,community_discussion,
1fn7rkw,NorthCarolina,BobbyLucero,1727050795,2024-09-23 00:19,1,1,Top staff from Mark Robinson campaign resign after porn website scandal,,helene,community_discussion,
1fn7smi,NorthCarolina,No_Emotion_9904,1727050876,2024-09-23 00:21,0,0,Best Spooky Houses/Parks East Carolina,"We live in Greenville and are looking for a good haunted place to go next month. Panic Point and Extreme Fear Scaregrounds are two close to us, but I wanna know the best one on the East Side of the state. There’s a lot to choose. ",helene,community_discussion,
1fn88ib,NorthCarolina,Maleficent-Brief1715,1727052204,2024-09-23 00:43,20,123,Mark Robinson sees NC campaign staff quit in droves after damning CNN report,"Mark Robinson has brought his problems on himself. He calls himself a ""black Nazi"". He doesn't believe women deserve to vote, he hates LGBTQIA+ people yet watches trans porn. He visits porn sites like Nude Africa. He's a walking disaster.

[https://www.independent.co.uk/news/world/americas/us-politics/mark-robinson-campaign-staff-quit-nc-b2617186.html](https://www.independent.co.uk/news/world/americas/us-politics/mark-robinson-campaign-staff-quit-nc-b2617186.html)",helene,community_discussion,
1fn8n7f,NorthCarolina,Charming-Tap-1332,1727053483,2024-09-23 01:04,4,15,Nearly all of Lt. Gov. Mark Robinson's campaign staff quits after CNN report,https://www.wunc.org/politics/2024-09-22/mark-robinson-campaign-staff-quit-cnn-report,helene,community_discussion,
1fn8uwh,NorthCarolina,agaetisbyrjun22,1727054136,2024-09-23 01:15,30,110,"North Carolina Museum of Art in Raleigh temporarily closes due to social media threat, museum says",,helene,community_discussion,
1fn9zo0,NorthCarolina,bluecollarwithabsba,1727057728,2024-09-23 02:15,2,0,New license plate,"So I have an oddball question. I’m a resident of NC, but I’m not currently living there. I’m a travel healthcare worker and am currently living in New England. 

Several years ago I applied for the Venus fly trap license plate. I finally got it a few days ago. I want to put it on my car, but I won’t have a registration sticker on the new plate. 

My registration isn’t up until February on my current plate. 

How do I go about getting a registration sticker for my new plate when I’m working out of state? Tentative google searches haven’t turned up much info. I feel like I need to place a call to the abyss that is the NC DMV customer service line. ",helene,community_discussion,
1fna74i,NorthCarolina,DrFloyd5,1727058421,2024-09-23 02:27,2,2,Why is Lewis Fork in Kerr Scott Reservoir so bubbly?,I was at the lovely Kerr Scott Reservoir today and took a boat in to Lewis Fork. There were small bubbles floating up through the water everywhere. Almost as if the lake was on a low simmer. I know decomposition can cause methane bubbles. But this area of the lake is always bubbly.,helene,community_discussion,
1fnah8b,NorthCarolina,Thinmintcereal,1727059308,2024-09-23 02:41,60,31,Sloth like cryptid in Duplin county? ,"Wondering if anyone has seen something like this. My wife’s uncle said he seen a dark sloth like creature a few days ago at night. Had a creepy vibe to it. It was in Duplin county. He flashed his light at it and it went bipedal and took off into the woods. He said he hasn’t been able to stop thinking about it since he seen it, so I’m tryna get answers as to what it might be. ",helene,community_discussion,
1fnaiq9,NorthCarolina,Prudent_Ad_6335,1727059442,2024-09-23 02:44,3,0,Tattoo artist in Charlotte?,Anyone know of any good tattoo artists that specialize in cyber sigilism? I’ll be in town in October.,helene,community_discussion,
1fndxfg,NorthCarolina,New-Preference-335,1727072348,2024-09-23 06:19,64,0,How were comments traced to Robinson technically?,"I can't get good info on how they KNOW Robinson made the comments.   Does anyone have the technical deets?  IP addresses?   I don't doubt it because he is clearly a closet case who eats to numb the shame.    
What is the proof?",helene,community_discussion,
1fne7lp,NorthCarolina,love_you_never,1727073637,2024-09-23 06:40,1,1,Credit card tips ,[removed],helene,community_discussion,
1fnesfk,NorthCarolina,Itslayzer,1727076242,2024-09-23 07:24,12,9,Help! I need advice ,"I believe my employer is taking mine and my coworkers credit card tips. We receive ALL tips cash, I’m unable to see how much I should make and how much I am taxed on it. 

1. Is it legal? 
2. How should I go about this? 

I’ve never received my credit card tips in cash at any other job … 


I make more than minimum wage if that makes a difference ",helene,community_discussion,
1fnh3bh,NorthCarolina,Owww_My_Ovaries,1727086835,2024-09-23 10:20,21,458,The combo is intoxicating ,,helene,community_discussion,
1fnh9zl,NorthCarolina,Sufficient_Shock_251,1727087609,2024-09-23 10:33,15,0,Traffic infraction ticket out of state (help),So I was caught doing 76 in a 55 zone out at the edge of person county leading to the border of Virginia and the only reason was there was a suv going 20 under because it was 9:50 at night and it was pitch black and I was already tired at the time and I know better than to go that fast I learned my first time going around this isn’t my first time getting pulled over but still it’s considered reckless driving the court is only 30 minutes away from where I live and I really don’t have the money for a lawyer due to the fact I just bought a home but my record is spotless and my last speeding ticket was knocked down to a defective equipment and I took the driving course 1500 later and I was free and then I recked out 2 months ago and that wasn’t put on my record so I don’t know what to think or do I complied and was nice to the officer and the officer understood where I was coming from just wasn’t happy I was going that fast and he even said he would have done the same so let me know how cooked I am ,helene,community_discussion,
1fnhuu8,NorthCarolina,Main-Street-6075,1727089908,2024-09-23 11:11,140,314,Trump shakes hand of self proclaimed Black Nazi and supporter of Proslavery,,helene,community_discussion,
1fnhxto,NorthCarolina,NighthawkCP,1727090232,2024-09-23 11:17,19,3,WSJ Article on Civil War Monuments in NC,,helene,community_discussion,
1fnjroj,NorthCarolina,cuspofgreatness,1727096202,2024-09-23 12:56,5,30,Sen. Raphael Warnock says embattled N.C. GOP candidate Mark Robinson is ‘white supremacy in blackface’,,helene,community_discussion,
1fnknmw,NorthCarolina,FairtexBlues,1727098701,2024-09-23 13:38,33,100,These bizarre generic GOP ads. ,"Anyone else getting swamped with GOP ads that wont even feature their candidates? Just bland random sheriff or business owner.  

Not a single shot of Robinson, Trump, or the nut running for the education board. Pretty damning when you cant put up a figure head or a real “why us” message. ",helene,community_discussion,
1fnkqhd,NorthCarolina,cuspofgreatness,1727098918,2024-09-23 13:41,11,124,Four Mark Robinson staffers step down from embattled campaign,,helene,community_discussion,
1fnl2pu,NorthCarolina,motherofspoos,1727099851,2024-09-23 13:57,17,33,"What is Ziklag and why should we, as a swing state, be horrified?","Please share this article by ProPublica if you believe that there is truly a movement to eliminate any religion but ""Christianity"" in the U.S.  

[https://www.propublica.org/article/inside-ziklag-secret-christian-charity-2024-election](https://www.propublica.org/article/inside-ziklag-secret-christian-charity-2024-election)",helene,community_discussion,
1fnlljv,NorthCarolina,BarnacleOk8604,1727101197,2024-09-23 14:19,13,0,Do HOA industry surveys prove HOA residents are satisfied?,,helene,community_discussion,
1fnlxqp,NorthCarolina,Proof_Succotash_8715,1727102093,2024-09-23 14:34,86,46,Received an Offer from USA: any suggestions?,"Hi everyone. 

After searching for opportunities in USA from Spain, I have received a formal proposal from a US company for a technical sales role and they're offering me 65k gross per year and helping me relocate to Raleigh NC.

If you happen to live in USA, or have lived there for a long time, my questions would be:

1. Is 65k gross a salary good for what in Raleigh NC? Just good to living alone cutting expenses as much as possible? Or would it be possible to build a relationship?
2. Is it enough to make at least 10k net savings per year?? Consider a not-married status and a very standard living in Raleigh. 
3. Is the 65k offered by the company to low for a technical sales role? Consider the role will be selling laboratory services within the pharmaceutical and biotech industry.
4. If 65k gross is low: what salary range I should propose to the company, 80k-100k? I did a BSc in Bioengineering, and I have 6y of experience in Technical Sales. 2y within the pharmaceutical sector.

Looking forward to hear your comments regarding my questions.

Thanks to everyone and wishing all the best!",helene,community_discussion,
1fnlzgb,NorthCarolina,skubasteevo,1727102217,2024-09-23 14:36,54,86,"Raleigh #9 most polite, Charlotte #10 rudest city in the country",,helene,community_discussion,
1fnnn6k,NorthCarolina,Sorry_Antelope7878,1727106351,2024-09-23 15:45,70,452,"As Lt. Gov. of NC, Mark Robinson frequently missed Senate sessions, other board meetings",,helene,community_discussion,
1fno688,NorthCarolina,sycamoreshadows,1727107654,2024-09-23 16:07,63,459,Nearly all of Lt. Gov. Mark Robinson's campaign staff quits after CNN report,"[Nearly all of Lt. Gov. Mark Robinson's campaign staff quit after CNN report | WUNC](https://www.wunc.org/politics/2024-09-22/mark-robinson-campaign-staff-quit-cnn-report)

>Days after a CNN report about racist and sexual comments posted on a pornography forum, all but a few of Lt. Gov. Mark Robinson's campaign team quit their jobs on Sunday.

>A campaign news release said that four top staffers have left the campaign: Conrad Pogorzelski, general consultant and senior advisor who's worked for Robinson since his initial 2020 lieutenant governor campaign; Chris Rodriguez, campaign manager; Heather Whillier, finance director; and Jason Rizk, deputy campaign manager.

>But WUNC has confirmed that other staffers have quit as well, leaving Robinson with just three people working on his campaign — two campaign spokesmen and a bodyguard. The list of departures also include longtime director of operations Patrick Riley and political directors John Kontoulas and Jackson Lohrer.

>Sunday's news release says that new staff hires will be announced ""in the coming days."" But hiring a new campaign team less than two months from Election Day will be tough for a campaign rocked by scandal.",helene,community_discussion,
1fnp94k,NorthCarolina,Comfortable-Kiwi-955,1727110335,2024-09-23 16:52,5,0,"Where to stay for a bachelorette party in Wilmington, NC","Hi everyone! I’m looking for recommendations on which area to stay for my bachelorette trip to Wilmington, NC. I’m looking for a safe area for a group of girls in their 20s. We would love easy access to both the beach and restaurants/beach bars. Thanks in advance for your recs!",helene,community_discussion,
1fnqdle,NorthCarolina,goldbman,1727113068,2024-09-23 17:37,26,102,Cape Lejeune Marines charged with rape in Surf City,,helene,community_discussion,
1fnqlbf,NorthCarolina,PaperPasserby,1727113592,2024-09-23 17:46,20,0,Political Posts,"I recall seeing a post mentioning a way to hide political posts (guessing they should have a flair). 

Does this work and how do we do this?

",helene,community_discussion,
1fnqp89,NorthCarolina,Flat_Hall_8039,1727113861,2024-09-23 17:51,0,1,I'M Single and looking for friends .....,,helene,community_discussion,
1fnr6pd,NorthCarolina,brainwashed_this_way,1727115042,2024-09-23 18:10,15,0,Relaxing beach towns to visit in October?,"Hi.  I'm from northeast Ohio and was thinking of taking a vacation in NC in mid to late October.  I was looking to stay in a beach town with similar vibes to Tybee Island in GA.  I'd be happy to spend the days reading on the beach... visiting a local pub/restaurant at the end of the day... wash, rinse, repeat. 

  I apologize if this is the wrong sub reddit for this type of question.",helene,community_discussion,
1fnr7vf,NorthCarolina,RamesesLabs,1727115123,2024-09-23 18:12,15,0,"Nick Johnson on YouTube in Wilmington NC - I Went To The Hood To Ask About Trump and Harris. The Polls Are Wrong.
",,helene,community_discussion,
1fnr7zn,NorthCarolina,MassiveLake6012,1727115131,2024-09-23 18:12,3,0,What is the process of legally changing your name in NC?,"Hi there, I (19F) would like to get my last name legally changed. 

When I was born, I was given my mothers maiden name instead of my dads last name. To make a long story short, my mother was very abusive all my life and I have always wanted to distance myself from anything and everything that has to do with her. I have an amazing relationship with my dad and stepmom, whom I completely see as my mother, and I have always felt like I should have had his name.

Most people tell me this is pointless because I’ll just get married anyways, which I understand, but my middle name is also related to my mother. When I get married I’d like to drop my middle name, keep my dads last name in its place, and take on my husbands last name.

This is something that would mean a lot to me personally and my father as well. 

Can someone simplify the process for me? What do to, where to go, what documents to bring? Will a court even allow my reasoning?

Please dumb it down, the internet has scrambled my brain trying to figure this out on my own. 
Thank you!",helene,community_discussion,
1fnr9wk,NorthCarolina,NovelPiano9885,1727115268,2024-09-23 18:14,3,0,Transferred my vehicle from nc to FL,"I heard I need to send the old number plate/title to dmv. Needed really? If yes, more details please where to send etc? 

Thank you so much in advance !!",helene,community_discussion,
1fnrdt8,NorthCarolina,nc0426,1727115530,2024-09-23 18:18,62,0,If Mark Robinson does drop out who replaces him?,If Mark Robinson were to drop out who replaces him has the GOP named any names? I hope and pray it's not Dan Forest again that man is actually worse.,helene,community_discussion,
1fns6iz,NorthCarolina,Plus-Bluejay-2024,1727117490,2024-09-23 18:51,19,235,This comes as nearly all his staff have quit...,,helene,community_discussion,
1fns7o0,NorthCarolina,rednap_howell,1727117565,2024-09-23 18:52,0,121,Republican Governor Association Calls It Quits on Additional North Carolina Ad Buys as Mark Robinson Staff Exodus Continues,,helene,community_discussion,
1fnsbmr,NorthCarolina,GaryTheSecond,1727117834,2024-09-23 18:57,23,509,Please don’t forget: Vote Mo Green.,superintendent-of-public-instruction-in-a-live-forum/21621521/,helene,community_discussion,
1fnsgc9,NorthCarolina,Used_Ad4147,1727118147,2024-09-23 19:02,215,308,Police trying to search my house,"A single offficer knocked on my apartment about an hour ago saying that they have video evidence of me bumping into someone and stealing his/her phone at a local cvs (I did stop by a cvs today, but did not bump into anyone or stole a phone). I did not ask for id and instead told him that I was innocent, and he said he will come back with a search warrant. He has not returned yet and im sitting in my room terrified. I am in North Carolina, a college student residing with a Green Card. What should I do when he returns? All tips/recommendations are welcome. Thank you!",helene,community_discussion,
1fnt619,NorthCarolina,invictus_39,1727119913,2024-09-23 19:31,2,0,Sales tax on in leased vehicles,"Hello,

I am planning to lease a new car for 3 years. Do I get taxed for the total vehicle purchase price or  total price - residual value? 

At the end of the lease, if I buy the car, do I need pay the sales tax again?

I was under the impression, I should pay taxes for total - residual during the lease period and pay taxes on residual value if I buy the car at the end of lease.",helene,community_discussion,
1fntbau,NorthCarolina,fiestagoose,1727120286,2024-09-23 19:38,4,4,"Teacher Vacancies Are Down This Year, But Data Shows There’s Still Work To Do",,helene,community_discussion,
1fntwqk,NorthCarolina,RamesesLabs,1727121750,2024-09-23 20:02,26,0,"""She's 78 years old!"" - Addul Ali is running against Alma Adams for Congress (Highlight)
",,helene,community_discussion,
1fnu7b5,NorthCarolina,Human-Bluebird-1385,1727122483,2024-09-23 20:14,1,0,UNCENSORED Posts by Trump NC Gov Candidate EXPOSED… 🤿,,helene,community_discussion,
1fnu8pe,NorthCarolina,Saveme_999,1727122577,2024-09-23 20:16,12,0,What happens if police spot you driving without a license but dont pull you over? ,"Today I was driving home from the corner store and One a two lane road I see a cop car approaching , I was thinking it was over and he would turn around as soon as he spotted me. Ngl I quickly drove back to the house in hope that he wouldnt catch me if He did turn around which I believe he didnt. Do all cops know which cars are not supposed to be driving? Im sure if it was the cop who pulled me over for DWL the first time he would have turned on the lights when I passed him huh? Like I said i passed him head on so he didnt have a chance to run my plates unless he has a plate reader on the back of the car. My house is right down the street too so if it was the same officer im sure he would have came and knocked on my door huh? Sorry if this sounds ignorant I know driving without a license is horrible especially after it has already been revoked , I only drive to the store and back now I dont even get on main roads. ",helene,community_discussion,
1fnuhlv,NorthCarolina,Oddlydrawncharlie,1727123198,2024-09-23 20:26,2,1,Help me help a friend in Canton,"Hello,


I have a friend's birthday in Canton, NC coming up in about 2 weeks. She's a forgotten about mom and I want to have a cake/cupcakes delivered to her. However nothing budnt cakes doesn't deliver to her address. I saw there's a food lion nearby and I think a Walmart but not sure if they deliver to her address. Can someone help me think of a way to get her special treats delivered for her birthay ? Thank you! ",helene,community_discussion,
1fnuoyg,NorthCarolina,beal99,1727123708,2024-09-23 20:35,159,604,Robinson now threatening to sue CNN,"Oh Marky Mark. CNN just reported it, the call actually came from inside the house. ",helene,community_discussion,
1fnv6eo,NorthCarolina,AdminIAmAwake,1727124932,2024-09-23 20:55,12,11,Are these the values we want in the President of the United States,"Is this really the kind of example we want for our sons and daughters? Do we want our children growing up thinking that these are the traits of a leader—someone they should admire or aspire to be?

A draft dodger, he couldn't walk to fight in Vietnam, but has no issues playing golf.  But really, he even cheats at golf.  What kind of person really does that?

A person that flat out lies, remember Obama's birth certificate? That Mexico would pay for the wall?

A former president with a history of failed businesses—do we want our children to believe that incompetence can still lead to success?

A man who bankrupted a two  casino, of all places—should our sons and daughters think that poor judgment and irresponsibility can be brushed off without consequence?

Three marriages, each beginning with an affair. What does that teach our children about loyalty, respect, or commitment to their families? Do we want our daughters to think they deserve to be disrespected, or our sons to believe that cheating is acceptable behavior for a leader?

He was found guilty in a civil court of rape—how do we explain this to our children? How do we teach them to respect others when the highest office in the land could be occupied by someone found guilty of such a heinous act?

Two impeachments—should our children believe that no matter how often you break the law or betray the trust of a nation, you can still lead with impunity?He incited an insurrection because he couldn’t accept defeat. Is this how we teach our children to handle losing—by violence and refusing to play by the rules?

Thirty-four felony convictions and ongoing investigations—do we want our children to believe that this kind of behavior is acceptable or justifiable if you’re in power?

An endless list of lies, easily proven by fact-checkers and news outlets—what lesson does this send about honesty, truth, or the value of integrity?

Our children watch. They absorb. They model their behavior on the figures we elevate. What kind of future do we want for them? Do we want a generation of leaders who follow this example—leaders who think cheating, lying, lawbreaking, and undermining democracy are acceptable, so long as you win?

We need a president our sons and daughters can look up to with pride. One who shows that honesty, hard work, and respect for others are the true markers of success. A leader who demonstrates that character matters. What we teach our children today shapes the future of this country. Let’s not teach them to accept this as leadership.
",helene,community_discussion,power
1fnvde6,NorthCarolina,Think-Chemist-5247,1727125416,2024-09-23 21:03,8,0,WHO'S COMING DOWN FOR MULE DAYS!?!?!,Let's get hype yall! Mule Days in Benson is this weekend!? Who's coming down!?,helene,community_discussion,
1fnvgh4,NorthCarolina,Main-Street-6075,1727125635,2024-09-23 21:07,9,0,"If Kamala Harris wins North Carolina, I will eat 50 ribs",,helene,community_discussion,
1fnvie2,NorthCarolina,uncertaincoda,1727125772,2024-09-23 21:09,1,5,Safe Babies Court pilot program off to promising start in NC,,helene,community_discussion,
1fnvm2a,NorthCarolina,jizzlefizzle55,1727126040,2024-09-23 21:14,11,0,Teachers of NC Health Plan,"Afternoon everyone, open enrollment for state health plans for teachers is coming up soon and my wife and I were discussing putting her on my plan. Currently my monthly payment by myself is $25 however if my wife were to be added on it would be $590 a month (absolutely insane if you ask me). That kind of increase has me super concerned even if she were to pay me what she pays now. Obviously my health plan is way better but we’re trying to determine if the juice is worth the squeeze. Any teachers with their partners on their insurance have any tips/ideas on how to make this not seem so detrimental?",helene,community_discussion,
1fnvqz8,NorthCarolina,dankantspelle,1727126388,2024-09-23 21:19,4,5,"If Kamala Harris wins North Carolina, I will eat 50 ribs",,helene,community_discussion,
1fnvztq,NorthCarolina,oops-im-sassy,1727127033,2024-09-23 21:30,6,0,Childcare Subsidy in NC Question,"Hello!  
I'm hoping someone knows the answer to this question I have. My children are in childcare while I attend school again and it is becoming very costly ($3,000 a month just so I can attend nursing school lol cry with me). Of course, every childcare center is filled. We decided to apply for childcare subsidy vouchers, but today I asked our current school if they have any spots for vouchers available, because I know some schools only allow so many. They disclosed to me that they only allow subsidy vouchers to be used by their employees? Is this acceptable? They are enrolled in the childcare subsidy according to the state. What do I do? ",helene,community_discussion,
1fnw1us,NorthCarolina,FavoriteAuntL,1727127177,2024-09-23 21:32,301,949,For anyone thinking the Gov race is decided: ,,helene,community_discussion,
1fnwl9s,NorthCarolina,Curious-Camp-7618,1727128610,2024-09-23 21:56,1,2,Nearly all of Lt. Gov. Mark Robinson's campaign staff quits after CNN report...,,helene,community_discussion,
1fnwmtm,NorthCarolina,M795,1727128725,2024-09-23 21:58,33,363,"Robinson rejected offers of tech help to investigate posts on porn site, sources say",,helene,community_discussion,
1fnwpoj,NorthCarolina,uncertaincoda,1727128930,2024-09-23 22:02,10,98,"Newly unearthed data shows closer links to Robinson and porn, dating sites",,helene,community_discussion,
1fnwuzi,NorthCarolina,LawyerBelle07,1727129320,2024-09-23 22:08,1,1,"Newly unearthed data shows closer links to Robinson and porn, dating sites",,helene,community_discussion,
1fnx9oo,NorthCarolina,PixelJoy,1727130447,2024-09-23 22:27,0,1,Robinson rejected offers of tech help to investigate posts on porn sites,"I wonder why 🤔 
Only a guilty man would take help to clear his name 😂 Man is screwwwwweddd",helene,community_discussion,
1fnxog6,NorthCarolina,RamesesLabs,1727131570,2024-09-23 22:46,97,218,"Trump holds edge in Arizona, Georgia, North Carolina, NYT poll shows",,helene,community_discussion,
1fnxt3h,NorthCarolina,ChelseaSellsHomes,1727131932,2024-09-23 22:52,1,3,North Carolina's Top 2023 Haunted Attractions,,helene,community_discussion,
1fnyl4c,NorthCarolina,slipsliding1007,1727134150,2024-09-23 23:29,0,1,"One of the messages Mark Robinson posted on ""Nude Africa.""",,helene,community_discussion,
