Comments,NEG,NEU,POS,Compound,Sentiment
"Ok I am 100% concerned and praying for everyone that appears to be the path of this disaster. However I am trying my best to get my FIL memorial to happen near Myrle beach this next weekend. While we are worried abut that we have a non diagnosed person who is deeply connected with Hot Springs NC…his always concern, love, and hold out. The way I am",0.092,0.739,0.17,0.7206,POS
"Take surge seriously folks...I know all of our ❤️s are with Ashville but let me tell you, the ENTIRE WEST COAST OF FLORIDA WAS UNDER 3-7 FOOT OF WATER FOR HELENE....CLEARWATER, INDIAN ROCKS BEACH, REDINGTON SHORES, TREASURE ISLAND, MADEIRA BEACH, ST PETE, PASADENA, GULF PORT & BEYOND....DEMOLISHED ON THE ISLAND FROM HELENE...PEOPLE DIED IN THIS STORM! ALL OF OUR HOMES OFF GULF BLVD TO INTERCOSTAL UNLIVABLE!! PRAYING FOR ALL!! No idea where the monstrous piles of debris will end up. Love & prayers to all!!",0.099,0.752,0.149,0.7945,POS
"I know it's the other coast but me being in Tampa Bay and my kiddo at College at Florida Tech in Melbourne scares me too. Models all show it headed straight across. All his reports act like it's no big deal it ""usually"" dissipates when it reaches their side. The campus housing isn't hurricane rated and they are responsible to seek their own shelter. Ugh, I hate this.",0.178,0.703,0.119,-0.7783,NEG
Are we rule 7-ing?,0.0,1.0,0.0,0.0,NEU
My family was talking about a better place to leave and get away from the storm. Is that a bad idea Denis Phillips,0.184,0.703,0.113,-0.2023,NEG
"Thanks again Denis Phillips for your timely updates and honest reporting of the facts. Praying that you, your family and everyone in Florida stay safe.",0.0,0.644,0.356,0.891,POS
Booked a room in Ocala earlier..now we’re worried that wasn’t smart. Kind of terrified.,0.328,0.529,0.143,-0.5423,NEG
" If your goal is to get as far away from the storm as possible, don’t go to Ocala. If you just want to be safe and go home to check your house, I’d go to Ocala. You’re lucky you got a hotel, everything is booking up. It isn’t anywhere near the ocean, it doesn’t flood and you’ll get outer bands.",0.0,0.889,0.111,0.7184,POS
why worried there ???,0.477,0.523,0.0,-0.4098,NEG
When does rule #7 apply?!?!,0.0,1.0,0.0,0.0,NEU
"I live in Pinellas Park I'm thinking of heading towards Gainesville any thoughts...
Do you think it would be safer?
Everyone stays safe.",0.0,0.778,0.222,0.6908,POS
all hotels are booked,0.0,1.0,0.0,0.0,NEU
Stay safe Phillips family. Has this type of formation ever happened before? Thank you for all you do to keep us safe.,0.0,0.696,0.304,0.8074,POS
Am I reading this right that the nasty weather will start Wed morning? Wondering if I'll be safe to drive home from work late Tues. I don't want to stay over if I don't have to. Hopefully traffic wouldn't be a problem too.,0.153,0.735,0.112,-0.2316,NEG
Rule #7? ,0.0,1.0,0.0,0.0,NEU
Rule #7 has been absent for days! I've been feeling it in my soul! Where is #7? Where'd it go?!?!,0.0,0.856,0.144,0.4953,POS
Any advice for those of us on the opposite side of the state? What should we expect?,0.0,1.0,0.0,0.0,NEU
"Denis Phillips, it’s so incredibly windy out here in Tierra Verde right now. Woke me up out of a dead sleep. Why so soon, if winds aren’t supposed to pick up yet?!",0.133,0.867,0.0,-0.68,NEG
You deserve all of the green lights!,0.0,1.0,0.0,0.0,NEU
And the poor Eckerd College students are already remote. They haven’t recovered from Helene.,0.193,0.807,0.0,-0.4767,NEG
"I have lived in Florida since I was 3. 1968 we moved to Clearwater, actually High Point. I’ve seen many storms and even more tornadoes. I now live in Citrus County about 20-25 miles inland. I never once have worried about a storm surge but Helene made me curious. I look up my elevation which is 73 feet but the article said to go between 25-50 miles inland. Denis, to your knowledge, has a storm surge ever gotten as far as Inverness? Thank you for keeping me informed and for all the updates. You’re my only go to weather man. I remember Paul Delagatto’s first day! Thanks for looking out for us. Be safe.",0.0,0.866,0.134,0.9396,POS
Thoughts on Hernando county?,0.0,1.0,0.0,0.0,NEU
This is right off of the NWS website for this area! Glad to see someone’s doing their job correctly! Better get out the snow shovel. You gotta mention this. We could use some humor right about now.,0.0,0.798,0.202,0.8217,POS
I've even seen other news stations stating we're the going to get winds of up to 150 mph. I almost screamed but I only listen to what you have to say. Best weatherman of all,0.039,0.809,0.151,0.7428,POS
