Comments,NEG,NEU,POS,Compound,Sentiment
"Heavenly Father,
I come against this storm named Milton! I declare and stand on your word that no weapon formed against us shall prosper. I speak LIFE over the state of Florida and all surrounding areas. I praise you for sending your archangels to protect everyone in the path of this evil. I THANK YOU for your divine protection, Father. I speak to this storm as Jesus did and rebuke Milton for causing any harm. I say to the winds and rain, Peace! Be still! I declare that your people shall be filled with your Holy Spirit and rise up to declare that all glory will be yours.
May your will be done on earth as it is in Heaven, Amen.",0.092,0.699,0.209,0.9498,POS
Amen,0.0,1.0,0.0,0.0,NEU
Amen! Thank you for your powerful prayer! In Jesus name we pray! ,0.0,0.515,0.485,0.8164,POS
thank you for this!! Amen amen,0.0,0.619,0.381,0.4738,POS
 ln Jesus precious name amen ,0.0,0.519,0.481,0.5719,POS
"I agree in the Mighty name of Jesus!!
",0.0,0.661,0.339,0.4738,POS
"This page is a Godsend to parents (family) that live in other States. Here is SC, after having experienced Helene as well, we were really anxious for our children and grandchildren living in Florida and weren't sure about all the reports we were hearing or maps we were seeing. You're really giving us the news we need to stay in touch with what is going on! Thank you!",0.055,0.793,0.152,0.8137,POS
"I agree! We live in Oklahoma but our daughter, son in law and 3 young grandchildren live in Pinellas Park. I’m so thankful for Denis Phillips keeping us in the know.",0.0,0.757,0.243,0.8643,POS
"Live in Manatee County, and I've been on the Gulf coast for 16 years (12 in Tampa Bay area), he's the only one I listen to.",0.0,1.0,0.0,0.0,NEU
we’re the same. Children/grandchildren in Tampa and we’re in SC.,0.0,1.0,0.0,0.0,NEU
"Same from Colorado. I lived in Tampa Bay for 37 years and we used to watch The Weather Channel and BayNews9. The last few years all I heard was ""Denis Phillips"". Now I know why family and friends watched Mr. Phillips exclusively.",0.0,0.925,0.075,0.4767,POS
Im in Florida and none of the channels are on the same page its scary for sure,0.156,0.732,0.112,-0.2263,NEG
You guys are doing a great job! Stay safe and Thank you for keeping us informed!,0.0,0.543,0.457,0.8774,POS
Thank You Thank You Thank You Denis and family. For keeping us up to date without the drama and to your family for allowing us to have so much of your time and talent during this stressful time. You are a Godsend.,0.063,0.668,0.269,0.8689,POS
"AMEN Gretchen! We're so grateful to Denis, his family, and his colleagues for the time and dedication that Denis shows us every day. We're very blessed to have him providing us with constantly updated information on these incredible hurricanes. Praying for the safety of everyone in our beautiful state! ",0.0,0.711,0.289,0.9574,POS
 perfectly expressed. I believe we are all in agreement. Be safe.. 🙏 prayers are being said for ALL.,0.0,0.654,0.346,0.8126,POS
"My house is 12 ft above sea level a bit under a mile and a half from the water, but ive seen inundation maps that had my street in the orange, can someone explain how thats physically possible if the predicted surge is 10-15? I cant find any super specific info online and i want to know every little detail i can!",0.075,0.901,0.024,-0.6201,NEG
 stop questioning it. You definitely sound like you live in a zone that's been evacuated. No one knows exactly what's gonna happen. The experts have done the best to keep you safe. Now do your job and get out of town.,0.114,0.646,0.241,0.8176,POS
"to everyone responding to this comment - they did not mention anything about staying. They just might want to know if they will have a house to come home to. The more information someone has, sometimes it helps with anxiety. I have a family member with a home in this area who is not staying, but is wondering the same for their house. Homeowners insurance usually does not cover storm surge, so if you don’t have flood insurance, it’s very stressful to think about.",0.074,0.891,0.035,-0.6474,NEG
video your whole house in and out. Take your insurance information and most important papers! Best case hit a school shelter so you can return easily to ease your soul!,0.0,0.675,0.325,0.9009,POS
a mile and a half ain’t much. Combined with fresh water flash flood it could get deep quickly,0.0,0.867,0.133,0.3182,POS
"look at Asheville. The mountains flooded. With mother nature, anything is possible.",0.0,1.0,0.0,0.0,NEU
"The speed/category of Milton is so concerning to forecasters because the more powerful the storm over sea, the larger the surge. It will flood to levels never seen before and have power behind it, leading to inundations over historic markers. If you can get to a higher elevation, please do. The 12 ft elevation of your house, vs a 10-15 inundation ? Your house will not win, you will be left stranded. The water level alone will flood the house, but the power (basically the speed of the water) will be high. The water does not rise slowly and still, it will push at pillars, foundations, all structural elements. Even to find somewhere 5-10 miles inland, at 20 elevation or higher, would be better.",0.028,0.913,0.059,0.6137,POS
"with storm surge the ocean will just be that much higher. So if Milton goes slightly north and we see that 15 ft surge, you will be waist deep in water and unable to open your door to get out. It doesn’t really matter if you’re one or two miles in if you’re that low.",0.037,0.938,0.025,-0.1796,NEG
"evacuate
",0.0,1.0,0.0,0.0,NEU
"if predicted surge is 12-15 ft, it could be more or less than that height. That is just the water rise.... you STILL have crashing waves on TOP of that. It's an absolutely nightmare when you are in the path of the eye AND have surge. You had best get out.",0.0,0.879,0.121,0.7739,POS
depending on where you live - street flooding from the rain that has no where to go? So much storm water is routed to the Bay.,0.084,0.916,0.0,-0.296,NEG
"We live in Bradenton, after the shift back north this morning and the projected strength of now being a cat 4, we are headed to Miami.",0.0,0.882,0.118,0.4939,POS
" I left for Miami last night; took me 7 hours so bring your patience, water and good music. It’s sunny here today. Stay safe!",0.0,0.681,0.319,0.8356,POS
"Where are you going there? I'm only seeing sold out when I search hotels? We're in Duette, not in an evacuation area but considering leaving.",0.0,1.0,0.0,0.0,NEU
what about Valdosta or Macon GA. Smaller towns may have availability. Same trip in hours. Just a thought.,0.0,1.0,0.0,0.0,NEU
I was considering doing that too ,0.0,1.0,0.0,0.0,NEU
I live in Valrico and i have been at my parents house in Miami since yesterday. It been raining on and off here but right now the sun is out. Have a safe drive ,0.0,0.886,0.114,0.5927,POS
Lakewood ranch here.thinking of leaving last minute now that it's a 4. Miami or panhandle???,0.0,1.0,0.0,0.0,NEU
do you know how far inland in Bradenton the storm surge expected to go? My brother lives about 5.5 miles in off of Cortez. He and his family are not evacuating. I’ve said all I can to convince them.,0.0,0.949,0.051,0.25,POS
were thinking of Miami also,0.0,1.0,0.0,0.0,NEU
 Welcome to Miami! We're extremely lucky!,0.0,0.375,0.625,0.7702,POS
sending a prayer your way. God speed,0.0,0.704,0.296,0.2732,POS
"Thank you so much, to you and your great team for working tirelessly and keeping us all up to date and/or informed with the latest track. My family and I greatly appreciate it. Blessings to you and your staff and families as well.",0.0,0.705,0.295,0.9377,POS
"Where is the best place to find wind speed forecasts like these surge maps?
We live in Bay Crest and we're very worried about all the debris from Helene that is still sitting in our streets. Our hurricane boards were soaked in flood water so we threw them out with plans to replace. Projectiles everywhere!!",0.04,0.842,0.118,0.6995,POS
" nhc.noaa.gov has most of the map, graphs etc he is showing.",0.0,1.0,0.0,0.0,NEU
You are all doing a great job !! I know y’all are worn out. Thanks for what you do. Where do we send our cases of Dr Pepper!! Stay safe . God bless!,0.052,0.569,0.379,0.9296,POS
make sure it’s diet ,0.0,0.566,0.434,0.3182,POS
Can you show a larger picture for those of us down by Sarasota. Please and thank you very much,0.0,0.769,0.231,0.5859,POS
"Yes, please talk about Sarasota/Venice area.",0.0,0.444,0.556,0.6124,POS
"yes, this is what I’m looking for! My mother was unable to evacuate.",0.0,0.8,0.2,0.4574,POS
Can you show us another hour by hour overnight with windfield. You showed it last night and I'm sure it would help greatly for those who are preparing for this storm.,0.0,0.853,0.147,0.6124,POS
you can find it on nhc website!,0.0,1.0,0.0,0.0,NEU
 I mentioned following Denis Phillips when speaking to Matt yesterday. He is the best!!,0.0,0.715,0.285,0.6988,POS
stay safe Rika! Thinking of you and all my Tampa Bay friends. I remember Denis Phillips bringing a hurricane awareness seminar to Nielsen the year I moved to Tampa. ,0.0,0.792,0.208,0.7424,POS
yes he is the best..,0.0,0.597,0.403,0.4019,POS
PLEASE keep manatee n Sarasota county in your updates. Obviously we need it,0.0,0.784,0.216,0.4648,POS
"Following from WA state Sheree and hoping you and your family of people, Goldens, and elderly horses are safe",0.0,0.749,0.251,0.6908,POS
This sounds so selfish and I deeply apologize… but what are the chances the cold trough push it further south? Is that still a “push” factor or has it stopped “pushing” the storm?,0.147,0.791,0.062,-0.4598,NEG
it’s heading right at our house currently.,0.0,1.0,0.0,0.0,NEU
How will anclote be for surge? I live East of 19 and 2.7 miles from the Gulf and fortunately got nothing from Helene,0.0,1.0,0.0,0.0,NEU
"Don't have any questions , just want to say THANK YOU to you and your team! Your knowledge and sacrifice are so appreciated... Even when people ask a million questions.",0.0,0.843,0.157,0.5893,POS
Is there one for the sarasota area,0.0,1.0,0.0,0.0,NEU
"We are close to Oldsmar, I couldn't get better news this morning, I prepped like crazy , did everything in my control, but so much out of our control. Thank you for your updates, I always wonder when does this guy sleep?",0.08,0.802,0.118,0.3812,POS
"Is there a map of some kind that shows the wind speed that is similar to the maps that show the water levels, like the map above?",0.0,0.803,0.197,0.7096,POS
"Thank you so much Denis for keeping us well informed. I truly appreciate how much you put yourself and your feelings into these posts. You care about us all. We’re not freaking out, but we’re as prepared as we can be",0.0,0.714,0.286,0.8487,POS
"Denis, thank you for posting. You've been more than helpful, but also driving out the panic and fear.",0.33,0.528,0.143,-0.7882,NEG
you good over there Boo?,0.0,0.58,0.42,0.4404,POS
We are at my brother’s house in Land O’ Lakes and he doesn’t have cable. I am glued to your facebook posts. Again thank you so very much for these update posts. I don’t know what we would do without you. Thank you Denis.,0.047,0.897,0.056,0.1002,POS
"Can you show the map of manatee and Sarasota counties too please.
",0.0,0.827,0.173,0.3182,POS
Where can I find something like this for Manatee?,0.0,0.737,0.263,0.3612,POS
Where is Pasco/ NPR evacuation zone c?,0.0,1.0,0.0,0.0,NEU
Pasco Zone C is mandatory evacuation. Be safe,0.0,0.543,0.457,0.4939,POS
Why does the radar look like it's much closer much earlier than anticipated ***my opinion,0.0,0.848,0.152,0.3612,POS
 Its likely some of the outer bands in the outflow coming north of the center. The center is still more than 12 hours away,0.0,1.0,0.0,0.0,NEU
You guys are doing a great job Dennis. I live in Plantcity how are we looking for this storm ?,0.0,0.796,0.204,0.6249,POS
Can concrete residential apartment buildings in Downtown Tampa sustain winds of Cat 4?,0.0,1.0,0.0,0.0,NEU
How do you measure ground level? Everyone is on different topography.. isnt surge based on sea level?,0.0,1.0,0.0,0.0,NEU
I just wanted to know what to expect for Orlando as I don't see much of anyone talking about it.,0.0,1.0,0.0,0.0,NEU
cat 1 winds and rain most likely,0.0,1.0,0.0,0.0,NEU
Denis Phillips can you please share the link to where we can see that same map and data south cities like Bradenton ? ,0.0,0.731,0.269,0.7184,POS
Can we have that map for the Sarasota area?,0.0,1.0,0.0,0.0,NEU
Where can we access this website?,0.0,1.0,0.0,0.0,NEU
Thanks Gents,0.0,0.256,0.744,0.4404,POS
Can we get this map for Sarasota county?,0.0,1.0,0.0,0.0,NEU
Anyone know when we will begin getting wind from this?,0.0,1.0,0.0,0.0,NEU
Can anyone explain to me why if it wobbles North the numbers go down but if it wobbles South the numbers go up?,0.0,1.0,0.0,0.0,NEU
I think I wrote it wrong haha. Either way why does that shift happen ?,0.193,0.621,0.186,-0.0258,NEU
"the eye and south of it bring the most surge. a wobble north and we are closer to a direct hit, more surge. a wobble south means we will get more of the north east side of the storm, which will pull the water out, less surge. we want to be as far north of the eye as possible! hurricanes rotate counterclockwise so you can see the movement of water in and out if you look at how it spins",0.0,0.983,0.017,0.0845,POS
you read that wrong. South wobble our numbers go down.,0.256,0.744,0.0,-0.4767,NEG
"Hmmm time will tell , we can’t predict the Mother Nature …but we keep update as much as we can …. It might shift a little bit south or north hopefully it’s not as strong , everyone stay safe ",0.065,0.799,0.136,0.4401,POS
"Can you ""hide"" safely from the winds in a powerful CAT4? Would it be possible to show us the possible winds in each area again? Now that the projected path has turned back north a bit?",0.0,0.83,0.17,0.7608,POS
Is stpete going to get allot of the storm? Nobody mentions stpete and yet we are so close to Tampa,0.0,1.0,0.0,0.0,NEU
 the map shows saint Pete. It says greater than 3 feet above ground level,0.0,0.828,0.172,0.3612,POS
"Denis Phillips do you ever sleep? Granted, we are ALL grateful for your updates and rely HEAVILY on them, but sleep is also a necessity. Side note, I do take advantage of your updates 🫣. Stay safe!",0.0,0.753,0.247,0.8459,POS
Denis Phillips can you give eye miles wide and hurricane force wind band miles wide like you did a few days ago. Was 5 eye and 25 out….please and thank you!,0.0,0.836,0.164,0.6476,POS
 the wobble tracker on WFLA keeps showing the storm in real time including the eye drifting east of the NHC line keeping it more south. Are you all seeing that?,0.0,1.0,0.0,0.0,NEU
are you watching in the app?,0.0,1.0,0.0,0.0,NEU
do we still hide from the wind in a cat 4 if we are in a non evac zone? (Fishhawk),0.096,0.904,0.0,-0.1779,NEG
did you end up staying?,0.0,1.0,0.0,0.0,NEU
"can you explain to people just because they aren’t in an evacuation zone doesn’t mean they don’t need to leave?
People don’t understand what 140+ mph sustained winds will do to their houses if they stay.",0.033,0.967,0.0,-0.0516,NEG
" I thought, please 🙏 correct me if I'm wrong, but I thought the strongest winds would be 30 to 50 miles from the eye at landfall. And we don't know exactly where landfall will be so our winds shouldn't be 140 right here in our area, or am I wrong? I guess I'm confused, worried, petrified to say the least",0.238,0.684,0.078,-0.9042,NEG
this sustained winds your talking about is not for polk county? I'm nervous wreck and at this point want to leave. I see no post about polk county I saw his live yesterday but that was when they still thought it was going to make land fall as a 3 which I never honestly believed it would,0.167,0.813,0.02,-0.7407,NEG
"hide from wind, run from water. If they are not in an evacuation zone it is nobody’s business if they stay or leave.",0.121,0.879,0.0,-0.2263,NEG
Does this take into account the rivers like little manatee in ruskin,0.0,0.815,0.185,0.3612,POS
so the life threatening surge 10-15 ft is not a treat anymore? why the forecasts keep showing up to 10ft ? i’m confused ,0.323,0.677,0.0,-0.8216,NEG
our house might still be there after this storm passes!,0.0,1.0,0.0,0.0,NEU
"Hi there Denis, watched you on Facebook yesterday and I remember you saying most likely wobbles would be to the South. Has this changed now to the North?",0.0,1.0,0.0,0.0,NEU
"unfortunately he was wrong on that one! Last night at bedtime he did say that it was highly unlikely it would turn back North and obviously when we woke up this morning at 5:00 a.m. it had turned back North and it has also had another turn up north. So, that was wrong on his part. And it strengthened and he did not expect that either",0.121,0.841,0.038,-0.7263,NEG
"Denis, you are the best!",0.0,0.471,0.529,0.6696,POS
Surge question: how long after Helene passes will the surges start & last? Hours? Days?,0.0,1.0,0.0,0.0,NEU
No but I will add him to my list. Thank you for this. I have been following Mike’s Weather Page. We are tracking all reports that we can. Praying for the lower surges and a weakening storm. How are you feeling about your condo in Naples? Is the elevation higher than the possible surge?,0.121,0.738,0.141,0.3094,POS
yes…it will be the wind and possibility of 🌪️,0.0,1.0,0.0,0.0,NEU
"How far inland does the surge go?
I'm a mile inland in south Venice.",0.0,1.0,0.0,0.0,NEU
I'd like to know too! I thought you were in Venice East,0.0,0.782,0.218,0.4199,POS
Do you have one for Charlotte Harbor?,0.0,1.0,0.0,0.0,NEU
So stronger will bring it more north ?,0.0,0.675,0.325,0.4391,POS
Why so much weight on global models?,0.0,1.0,0.0,0.0,NEU
Ya'll are doing a great job Denis. I am thankful for you and your team.,0.0,0.585,0.415,0.8316,POS
Can someone tell me the name of their news app please?,0.0,0.813,0.187,0.3182,POS
use abc action news App,0.0,1.0,0.0,0.0,NEU
Thank you so much for your support to the community to your followers. I…we appreciate and respect your efforts in helping us with the most accurate information possible. You guys take care and stay safe as well! Keep praying 🙏🏼 and united we can get through this together!! God bless everyone ,0.0,0.546,0.454,0.9826,POS
"Good news for Oldsmar, which is still piled with Helene debris",0.0,0.775,0.225,0.4404,POS
"As we prepare for the storm, let’s come together as a community and support each other. Helping neighbors with final preparations can ease the burden and bring a sense of calm during stressful times. Remember, everyone is feeling anxious or scared, so let’s be patient and kind, offering assistance where we can. Together, we can weather the storm and get through this.",0.147,0.661,0.193,0.3612,POS
Improved for Tampa Bay!,0.0,0.469,0.531,0.5255,POS
This map is very helpful. Thank you for posing it.,0.0,0.577,0.423,0.707,POS
"Ugh
I evacuated one of my dogs and my horse from Dover to Ocala world equestrian center. I’m praying for TS winds here at most.
My husband and son are still in Dover with the 3 cats and 2 additional dogs ready to roll if they need to",0.056,0.843,0.1,0.296,POS
Surge In pasco please?? NPR??,0.0,0.551,0.449,0.504,POS
"My daughter, grandson who is autistic, my granddaughter, son-in-law and their pet did not evacuate from New Port Richey. They are taking the necessary precautions, they have not been able to find shelter to buy... supermarkets without water, emergency food, toilet paper. Gas stations without fuel. The decision to make is very delicate, it can be dangerous to go out and be on the road without fuel, what is happening is very devastating... for those with more limited financial means it is difficult to leave, it can be more dangerous. I ask for prayers for all the families.",0.114,0.851,0.035,-0.8134,NEG
Can anyone give me thoughts on Wesley Chapel with the latest changes? We were planning on staying but now having second thoughts.,0.0,1.0,0.0,0.0,NEU
Is there a better map somewhere?,0.0,0.58,0.42,0.4404,POS
"Thank You so much to all of you!! I am sure you want to be home with your families, like us, so double appreciation for all of you!!",0.0,0.622,0.378,0.9071,POS
New Port Richey?,0.0,1.0,0.0,0.0,NEU
Zoom Earth is a great app to use.,0.0,0.594,0.406,0.6249,POS
"Yes, thank you to the whole team. We evacuated from Wimauma to West Palm. I assume the 2 year old house will be fine just no electricity. Hope everyone stays safe.",0.058,0.605,0.337,0.8625,POS
What about Bradenton and Sarasota,0.0,1.0,0.0,0.0,NEU
""" and the SLOSH model forecast for surge in the Bay increased from 3ft. to over 6ft in some cases in eastern and southern Hillsborough County ""
This meant to say west hillsborough, right?
I know we're not talking about SURGE in east hillsborough????",0.0,0.929,0.071,0.4696,POS
 West Hillsborough is up by the airport and Westchase.,0.0,1.0,0.0,0.0,NEU
is flooding like from the road up idk if im asking it the correct way,0.083,0.769,0.148,0.2732,POS
Thank you for mentioning Oldsmar!!! We need that information.,0.0,0.703,0.297,0.5229,POS
Can this JOG right into Hernando county?,0.0,1.0,0.0,0.0,NEU
"it could. Yes. You’re only like 45 minutes from Tampa. It’s not supposed to hit until about 2am Thursday morning… if it keeps going north, essentially it could. I hope it doesn’t.",0.0,0.776,0.224,0.7964,POS
Thank you Denis and your whole team. We are so very grateful for you and all of your hard work!!,0.056,0.678,0.266,0.7396,POS
"What time is landfall
",0.0,1.0,0.0,0.0,NEU
" Hi my friend! How are you guys?? Are you staying? I believe it will be “around” 2am-ish. The girls and I left Monday. Praying for you all, and for our little community!",0.0,0.804,0.196,0.7798,POS
pray!!! Later today into tomorrow morning,0.0,0.612,0.388,0.4898,POS
"We are in Windsor Island Resort, Are we definitely going 2 be ok here? We haven't been asked to evacuate 😪 we are here on holiday with our family & 3 young kids I'm so scared. Are we 💯 going 2 be ok? ",0.082,0.697,0.221,0.6618,POS
Why is Hurricane Center still saying 8-12 surge in Tampa Bay as Milton south of Bay???,0.0,1.0,0.0,0.0,NEU
"There's a website called Ventusky that shows Milton smacking right into Tampa Bay at the last minute. Don't know much about that website, they were watching it at work yesterday. Anyone else ever heard of it?
Really hope he keeps wobbling away from us like Irma did!",0.0,0.88,0.12,0.7171,POS
What’s Anna Maria Island in for?,0.0,1.0,0.0,0.0,NEU
"can’t believe how hard that area has been hit one of our favorite places The Rod and Real looks bad I hope you’re place is spared ,we are getting really strong winds right now with this storm ,we have to watch the storm surge ",0.094,0.725,0.181,0.6801,POS
Thank you so much Denis Phillips for keeping us calm and updated. The entire crew were amazing,0.0,0.619,0.381,0.8225,POS
"every time you say ""wobble"" we're supposed to drink, ya know? Let's try to find another adjective or we're going to be just as sloshed as Milton.",0.0,1.0,0.0,0.0,NEU
Surge in Hudson please,0.0,0.566,0.434,0.3182,POS
"My family is in port charlotte!!!!
Do they have time to get out",0.0,1.0,0.0,0.0,NEU
The water is already high in town n country.,0.0,1.0,0.0,0.0,NEU
Thank you Denis for all you do for us. You’ll never know how much you’re appreciated. Be safe.,0.0,0.633,0.367,0.8271,POS
"The one thing I gather when reading past posts in this forum is that there is less compassion for us in Sarasota County. Although I understand that no one wants it coming their way, we definitely have had our fair share this way and still trying to rebuild from Ian. We're all in this together and will stay strong no matter who is in its path. Just please don't wish it one way or another coz ultimately we're all going to be affected, some of us worse than others. Praying that everyone stays safe!!!",0.101,0.695,0.204,0.8891,POS
What happened with the next hurricane after that one? Any news already??,0.0,1.0,0.0,0.0,NEU
"Radar shows it's a 4 currently, is this accurate?",0.0,1.0,0.0,0.0,NEU
"yes just updated but it’s 155, so strong 4.",0.0,0.476,0.524,0.8277,POS
 Any way you can provide a view or link for those of us south of the skyway?,0.0,1.0,0.0,0.0,NEU
 not sure if you follow him but he updates often,0.141,0.859,0.0,-0.1232,NEG
I do ! My heart hurts for what’s about to happen.,0.298,0.702,0.0,-0.5255,NEG
Thank you May GOD bless you and team . Be safe ,0.0,0.352,0.648,0.876,POS
What's the latest prediction on where the eye will come in through?,0.0,1.0,0.0,0.0,NEU
We love you Denis Phillips. Thank you for all you do!,0.0,0.563,0.437,0.7901,POS
We love you Denis. Thank you! We will get through this,0.0,0.563,0.437,0.7901,POS
People in the comments are saying it’s going to be a 4. Did I miss something? Isn’t it still projected to be a 3 on landfall?,0.085,0.915,0.0,-0.2406,NEG
 has been upgraded to land as cat 4 ,0.0,1.0,0.0,0.0,NEU
no as of right now it's a 4 at landfall at 2am,0.196,0.804,0.0,-0.296,NEG
So West Pinellas has almost no surge?????,0.323,0.677,0.0,-0.4342,NEG
Praying for everyone there!,0.0,0.518,0.482,0.4199,POS
When will we start discussing the storm that is on Milton’s heels? I think it’s like 5-7 days post Milton,0.0,0.878,0.122,0.3612,POS
 can we just get through Milton first please???? ,0.0,1.0,0.0,0.0,NEU
I like to be prepared,0.0,0.312,0.688,0.5267,POS
Stop. One storm at a time!! Geez. Be safe!,0.184,0.501,0.315,0.3769,POS
"Good morning all.. I’m in Pasco county.. Land O Lakes,
Lake Padgett East a none zone area
What should I expect? I’m seeing / hearing very little about this community. ",0.0,0.896,0.104,0.4404,POS
