Comments,NEG,NEU,POS,Compound,Sentiment
"I thought drop in pressure is bad, high pressure would mean good. Why did someone like your comment- so confused now! lol",0.382,0.374,0.244,-0.5886,NEG
When is the at shear gonna do its magic ?,0.0,1.0,0.0,0.0,NEU
hopefully soon,0.0,0.27,0.73,0.4019,POS
Denis this FB post is amazing and so helpful. My Mom told me to follow on FB. You are an amazing resource. Including myself I am sure many people can say that,0.0,0.675,0.325,0.9184,POS
Thanks I’m only watching your updates!,0.0,0.61,0.39,0.4926,POS
I’ve just been watching the noaa43 on flight radar! Unreal seeing that,0.0,1.0,0.0,0.0,NEU
Did it hit the yucatan yet,0.0,1.0,0.0,0.0,NEU
 Looks like it’s there now according to “My Radar” app,0.0,0.783,0.217,0.3612,POS
Thoughts please on winds in Winter Haven area. Roof is my concern,0.0,0.827,0.173,0.3182,POS
read info yesterday about how closing every interior door takes pressure off roof,0.155,0.845,0.0,-0.296,NEG
"My son is home with me on the East Coast, but I am sick to my stomach thinking about this thing going to USF Tampa. I know they have evacuated, but it breaks my heart.",0.122,0.878,0.0,-0.6652,NEG
"I usually don’t evacuate but my old roof, I just don’t trust it. Me the dogs and the baby are headed to East coast",0.0,0.825,0.175,0.6652,POS
