Comments,NEG,NEU,POS,Compound,Sentiment
"I hope you, your family and your work team all stay safe. ",0.0,0.608,0.392,0.7003,POS
"Soooo, no beer can island today???",0.354,0.646,0.0,-0.4098,NEG
"Does anyone know of a good resource for specific info on Sarasota?? We pretty much only follow Denis for hurricanes, but right now we really wish we had a Denis here for this kind of info he’s giving for the Tampa area",0.0,0.758,0.242,0.8885,POS
 is this some small glimmer of hope that you won’t flood? Am I reading this correctly?,0.0,0.811,0.189,0.504,POS
 a glimmer. A glisten.,0.0,1.0,0.0,0.0,NEU
"Love what you do. You're without a doubt the best forecaster anywhere.
Shouldn't there be a report on Key West?",0.136,0.608,0.256,0.4482,POS
We are located in Clearwater and we already lost power,0.204,0.796,0.0,-0.3182,NEG
you and your team are the BEST!!!! Thank you,0.0,0.686,0.314,0.5673,POS
"Thank you for posting this, and please keep posting the SLOSH as updates happen.",0.0,0.714,0.286,0.5859,POS
Did the wind shear thing happen already or is it a continuous thing?,0.0,1.0,0.0,0.0,NEU
no and it's not going to because it's strengthened,0.183,0.583,0.233,0.1531,POS
Thanks Denis. I appreciate your comments. Now can you tell my husband to calm down,0.0,0.582,0.418,0.7845,POS
Thank you for these excellent updates!!,0.0,0.371,0.629,0.7772,POS
"Getting information about the surge is SO helpful, not because we're deciding to stay or not - we gone! It's helpful to know what to expect to see in our home when we get back (Davis Islands 1950s build).If the home is still there, how much water will be in it, and will our prep to bring everything above waist heigh be helpful. The data about water above ground level is especially helpful as it is hard to research on our own. Thank you!",0.014,0.796,0.19,0.9583,POS
Hiding in Lake St George,0.355,0.645,0.0,-0.296,NEG
Thank you. I trust only you. Stay safe everyone,0.0,0.365,0.635,0.8271,POS
"I was born and lived in St. Petersburg for 75 years now. This is indeed an usual, nail biting, ulcer producing storm. Now we just wait and see.",0.0,1.0,0.0,0.0,NEU
Thank you and your team for the excellent info and coverage. Be safe! God bless!,0.0,0.407,0.593,0.9272,POS
"Dennis, we are focused on storm surge for Tampa, but if Wesley Chapel ( for example) may see a foot of rain, all the water heads towards the ocean? Aren’t we going to see a lot of water also heading towards the gulf? I assume all this water in the retention ponds will head to the rivers?",0.0,0.957,0.043,0.327,POS
We live in Northeast FL with all our family in the Tampa Bay Area! So thankful for all your updates and coverage of this storm. Stay safe Tampa Bay!! 🙏🏼,0.0,0.783,0.217,0.8303,POS
What about Manatee Co???,0.0,1.0,0.0,0.0,NEU
My hubby went down to help my dad in valrico. They arein zone x. I don't know anything about evacuations other than a and b. Can anyone give me some info? Thank you.,0.0,0.848,0.152,0.6369,POS
Brandon here and we're outside of evacuation zones. Strong wind up to 100 mph and lots of rain being on the northern eyewall will be our worries.,0.09,0.804,0.106,0.128,POS
I'm in X in Dunedin. That is a non evacuation zone.,0.0,1.0,0.0,0.0,NEU
Thank you for all your hard work in keeping us informed. What does it look like for Pompano Beach area please. Stay safe.,0.047,0.608,0.345,0.8316,POS
All this wobbling is making me sick.,0.355,0.645,0.0,-0.5106,NEG
Can anyone else see mother nature's silhouette with peace ✌️ sign 🙏in that picture ...look at the black portion,0.0,0.837,0.163,0.5423,POS
