Comments,NEG,NEU,POS,Compound,Sentiment
That’s a longgggg time to be a 2 in warm gulf waters. Are we sure this won’t be a direct hit from a cat 3? Our area can’t handle more water,0.0,0.851,0.149,0.4939,POS
Thank you Denis Phillips for all you do. God bless you and your family and all in this storm's path ,0.0,0.697,0.303,0.7506,POS
This area can’t take another hit this soon. Be safe and smart.,0.0,0.641,0.359,0.6808,POS
"Just saw this, didn’t realize it was from a week ago at first, my heart dropped and I was about to start crying! Then I saw the date… so freaking tired of it all",0.267,0.733,0.0,-0.8803,NEG
"Storms form in the gulf now?! When we learned about hurricanes in school growing up they taught about the path they go on, they don’t come from there ",0.0,0.931,0.069,0.2481,POS
started in pacific hopped over Mexico and into hot Gulf. Always a worry,0.209,0.791,0.0,-0.4404,NEG
"Will this hit Pinellas county, or will it be north?",0.0,1.0,0.0,0.0,NEU
What’s this ones possible name?,0.0,1.0,0.0,0.0,NEU
milton i think i saw.,0.0,1.0,0.0,0.0,NEU
So my friend has a Disney World vacation booked starting next Saturday. Things should be okay by then? Thanks,0.0,0.644,0.356,0.8062,POS
How confident are we that it will be a Cat 2 or even possibly a 3 and not jump to a Cat 4?,0.0,0.842,0.158,0.4939,POS
I’m sick to my stomach,0.452,0.548,0.0,-0.5106,NEG
Does SE FL have to worry as much? Is it projected to exit on the east as a Hurricane? I’m in Palm Beach County.,0.129,0.871,0.0,-0.504,NEG
"Denis Phillips, it's crazy how this projected landfall location posted 5 days out, turned out to be spot on.",0.124,0.876,0.0,-0.34,NEG
