Comments,NEG,NEU,POS,Compound,Sentiment
"Thank you, Dennis. I love your common sense advice.",0.0,0.472,0.528,0.7717,POS
"Denis I always wait to listen to you before I panic, you are very good at explaining what is going to happen and what to expect. Thank you Denis, you have no idea how much you are appreciated , God bless. Ann Cain, Bradenton Florida.",0.101,0.643,0.255,0.8122,POS
Thank you Denis! We appreciate you!,0.0,0.409,0.591,0.6988,POS
Thanks for watching and updating us … very nervous in Hernando county,0.167,0.63,0.203,0.1298,POS
Denis Phillips - due to fly to NY Monday and return Tuesday night. Any idea of the winds during this period? Debating on going or staying based on the track. Thank you!!!,0.0,0.899,0.101,0.5229,POS
I live in Sebring should we board up our house?,0.0,1.0,0.0,0.0,NEU
better safe than sorry,0.16,0.123,0.716,0.6705,POS
Thank you Denis Phillips ,0.0,0.545,0.455,0.3612,POS
"As always, we thank you Denis Phillips for you unending calming, wise, educated words. *** even though my nerves are completely shot already.",0.049,0.662,0.289,0.7845,POS
"I am thinking of all these piles of debris piled up in the streets, those are going to be tossed around everywhere in another storm",0.0,1.0,0.0,0.0,NEU
they will all become missiles. I don’t know what we can do-I’m shot they won’t be picked up.,0.0,1.0,0.0,0.0,NEU
"Thank you. My neighbor said to follow you, so here I am. We appreciate the important work you do.",0.0,0.682,0.318,0.7184,POS
He’s the best my friend Please call if you need help. We’re right down the road.,0.0,0.492,0.508,0.9081,POS
Center line has shifted several times since yesterday. What is likelihood drier air would shift centerline further south?,0.0,1.0,0.0,0.0,NEU
come up to pa I love you brother. We have a spare room with a blow up bed if y’all need somewhere.,0.0,0.811,0.189,0.6369,POS
"Hoosier here: if a cat 3 hits Tampa directly, would going further inland like Zephryhills matter or finding a more solid structure in a non-flood zone be better? I live in a mobile home park.
We also considered driving to Port St Lucie ride it out.",0.0,0.811,0.189,0.7501,POS
Would it be too late to leave Tuesday morning by car?,0.107,0.893,0.0,-0.0516,NEG
Thank you for keeping us informed. It really helps to know what’s coming.,0.0,0.671,0.329,0.659,POS
The local stations need to be covering this instead of sports!!,0.0,1.0,0.0,0.0,NEU
"I'm in the Keys, and it's already pouring, we are going to be under water.",0.0,1.0,0.0,0.0,NEU
If track confirms what would it look like for Hernando County?,0.0,0.8,0.2,0.3612,POS
"Thank you so much for your responsible, thorough coverage. Can you say anything on east coast impacts?",0.0,0.758,0.242,0.5859,POS
Flying out of Orlando into AC. Tuesday at 8pm. No reasonable way to change it.Could that flight be affected,0.183,0.817,0.0,-0.4215,NEG
cancel your flight,0.5,0.5,0.0,-0.25,NEG
Flying out of fort myers on Wednesday…thinking might not make it out ??,0.0,1.0,0.0,0.0,NEU
