Comments,NEG,NEU,POS,Compound,Sentiment
"Hi, from a veterinary professional, please add the following for pet owners!
* stock up on needed pet medicine and food. Be aware your local vet clinic will be swamped with similar requests so DO NOT wait til the last minute! ESPECIALLY be sure to fill up on fear-free / anti anxiety meds if your pet needs them!
* make sure your pets' medical records INCLUDING RABIES TAGS are in your ""go bag"" in case you have to evacuate. If you are assigned to a temporary shelter such as a high school or civic center, many such places *will not let any animal in* if the owner can't provide proof of rabies vaccination on the spot. Your vet clinic will be closed by then so a phone call won't be able to clear anything up. Have DOCUMENTATION on hand!!
* get your cat carrier down out of the attic and clean it NOW. Get your dog's leash and harness ready and check them for fraying and appropriate fit. If you are in an emergency shelter, you will be expected to keep your animals appropriately controlled/ contained. You may be told they cannot be in the shelter with you any more if your animals are making other evacuees feel unsafe. It's not wrong or shameful to own and use a muzzle for your dog if they need it around strangers and scary situations. ❤
* if your pet has never been microchipped, consider having a microchip placed. If they are chipped, reach out to the chip monitoring company to make sure they have your up to date contact information. As a former shelter worker in FL, after every hurricane we would get an influx of lost pets. Many were unchipped or unregistered. We would hold for awhile in case an owner came looking - then up for adoption they would go! If your pet is separated from you in a storm, a microchip is BY FAR the best hope of your getting them back. If you know your pet's chip# but aren't sure if they're registered, here is a tool I use as a vet tech to look it up. It will tell you if the number is registered anywhere, then you can just reach out to the registry company to get your info up to date. (They will charge you a membership fee.) ",0.022,0.89,0.088,0.9644,POS
Also once the water freezes put in a cooler if have one to reduce the temp as the water jug thaw switch it for a frozen one. Keep switching as long as you possibly can.,0.033,0.967,0.0,-0.0258,NEU
Keep some cash on hand in case internet goes down and cards are not usable… We found those out in WNC last week.,0.0,0.873,0.127,0.4939,POS
Thank you for always keeping us updated !,0.0,0.682,0.318,0.4199,POS
here's the list!,0.0,1.0,0.0,0.0,NEU
"I saw someone post putting cold water in your top loader washer and put any bottled water or drinks to keep cold, or sealed food.",0.0,0.927,0.073,0.2023,POS
the list.,0.0,1.0,0.0,0.0,NEU
his is an awesome list thank you!!,0.0,0.41,0.59,0.8011,POS
Just fyi Walmart has or had battery operated fans. Wish I'd bought two.,0.0,0.71,0.29,0.5423,POS
Wow! This is A LOT. I’m so glad I’m not a Floridian. Be safe Ash! And prepare. Love you!,0.085,0.462,0.453,0.9069,POS
I'm preparing now boarding up and hunkering down if it gets to sketchy I'll head out if I have time with the kids,0.0,1.0,0.0,0.0,NEU
"Patiently waiting for you, Dennis. Need to see your face on a live. Give us an update, please",0.0,0.874,0.126,0.3182,POS
"Denis Phillips , is the legend of weathermen!!",0.0,1.0,0.0,0.0,NEU
Thank you for you great reporting. We are head back to CO Tuesday morning. Be safe.,0.0,0.578,0.422,0.8591,POS
Very helpful and many things I didn’t know or think of to do!,0.0,0.765,0.235,0.5244,POS
"good advice here, stay safe everyone",0.0,0.408,0.592,0.7003,POS
here is the list! Stay safe!,0.0,0.589,0.411,0.5399,POS
 you might want to share this list - so good!,0.0,0.443,0.557,0.7603,POS
All really good advice!,0.0,0.463,0.537,0.54,POS
I can't imagine not being able to flush... ugh,0.286,0.714,0.0,-0.4215,NEG
This is great info!,0.0,0.406,0.594,0.6588,POS
