Comments,NEG,NEU,POS,Compound,Sentiment
"Are you new here or something?They say it all the time, these are predictions! Nobody can tell you for certain. It’s a storm, not a person. It’s your job to make your own decision based of what they can predict will happen. You won’t find a better weather man.",0.0,0.893,0.107,0.6476,POS
"I know it's frustrating, but they can only track patterns and make an educated guess. Sadly, we won't know the real deal until it's a few miles from land.",0.184,0.816,0.0,-0.6858,NEG
 this storm has been different. Since it formed. How about showing grace for a man who is living through this right along side you? You want someone to blame but Denis isnt it.,0.05,0.859,0.09,0.09,POS
"the very word prediction indicates a level of uncertainty. Weather has a mind of its own and meteorologists do the best the can considering everything from historical data, real time conditions, to prediction models. We’ve known for days this storm would impact this general area. We’re all scared, but it’s hardly the time for pointing fingers. Denis is as transparent and as accurate as it gets. Please don’t shoot the messenger, he’s been here for us close to 24/7, giving up time with his own family, for us. Stay safe. Be kind.",0.064,0.775,0.162,0.9072,POS
"being a weather reporter is not easy! Nature is unpredictable!!! Just listen to the warnings!
Give them a break!!! And be grateful we have knowledge of up coming storms!!",0.176,0.732,0.092,-0.4164,NEG
make $100 million a year being right 50% time at baseball it’s all perspective,0.0,1.0,0.0,0.0,NEU
"National Hurricane center is what I check for updates. They only update every 3 hours or so, but like any other weather pattern, things change constantly. Stay safe.",0.0,0.761,0.239,0.8185,POS
"This morning it all hit me and I lost it crying 😢. My husband is amazing and did his best to comfort me. Today is the day.... I'm praying for everyone's safety. I live in Bradenton in a mobile home. We are leaving to head to shelter at 9am this morning. Unfortunately it's in Sarasota but it's in a strong concrete building that we stayed in during Ian.
This is all very emotional",0.066,0.723,0.211,0.8954,POS
"If you’re not driving, try not to look out the window. I was fine doing the prep work over the weekend, Monday night, & loading the truck on Tuesday morning. I lost it while my husband was driving us out of the neighborhood when I saw all the boarded up houses. The lamps on the interstate light poles had been lowered & I cried again.",0.101,0.87,0.028,-0.5574,NEG
I'm in Sarasota and I keep crying too. The stress is affecting me mentally and physically as I've had open heart.. we must all pray for each other. ,0.183,0.745,0.071,-0.5574,NEG
"I wish I could give you a hug right now! I had my meltdown Sunday, getting it out of the way so I can be levelheaded when this hits. I grew up here and my heart is just broken over our town will be affected. We will be ok, it will take some time though.",0.082,0.772,0.145,0.5562,POS
 sending you a hug. Crying is good. My son is a deputy and I lost it and have bouts of crying. I’m glad you evacuated and you have a wonderful husband. Praying for you,0.186,0.481,0.333,0.7717,POS
Drive safe please. I hope you get everything you need and get your family out soon.,0.0,0.597,0.403,0.7964,POS
prayers for your safety and that your home has no damages. I know how it is to leave your home not knowing what you will return to. Sending love.,0.174,0.634,0.193,0.4019,POS
 this breaks my heart. Sending you the strength to get thru this and hopeful you have no damage,0.208,0.541,0.251,0.2732,POS
