"Hurricane Debby's Eastern eyewall is making landfall North of Cedar Key. Winds are still 80 mph in a small area. Fortunately,  the storm never rapidly intensified in the very warm Gulf water.",Pos,Neu,Neg,Compound,Overall Sentiment
Denis do you ever sleep 😭,0.0,1.0,0.0,0.0,NEU
Denis Phillips in denis we trust 🙌🏻,0.355,0.645,0.0,0.5106,POS
Denis Phillips Thank you for your constant support to Tampa Bay and surrounding areas.,0.302,0.698,0.0,0.6369,POS
"Denis Phillips you put our minds at ease, had you on my app as we sat in the closet for the two tornado warnings here in Lakewood Ranch, can’t thank you enough!!",0.152,0.788,0.06,0.5242,POS
Denis Phillips Not sleeping tonight either. Exact repeat of Idalia. Waiting for the water to rise even higher.,0.0,1.0,0.0,0.0,NEU
Denis Phillips Thank you!,0.482,0.518,0.0,0.4199,POS
Denis Phillips thank you!,0.482,0.518,0.0,0.4199,POS
"Denis Phillips you're like our weather guys in Oklahoma during tornado season and like them, you're all business when the chips are down. It's much appreciated.",0.265,0.735,0.0,0.8074,POS
where are you?,0.0,1.0,0.0,0.0,NEU
only Dec 1st thru May 31st!,0.0,1.0,0.0,0.0,NEU
"Denis Phillips is a MACHINE...",0.0,1.0,0.0,0.0,NEU
It’s so nasty here in Fort White right now🙈 the wind is crazy and nonstop rain since yesterday😔 I pray HE covers us all with HIS protection🙏🏻,0.073,0.728,0.199,-0.6115,NEG
"that has been my mantra through all this. "" The Lord will protect me "" ( live alone ). Pinellas County got slammed good hours and hours ago and still dealing with rain bands, wind and tornadoes. It's making landfall at 80mph. This
"" tropical storm "" covering the whole state. My prayers are with everyone.",0.099,0.865,0.036,0.5423,POS
"idk sounds like he covered you with a hurricane ¯\_(ツ)_/¯",0.229,0.642,0.128,0.2732,POS
yep seems that way,0.423,0.577,0.0,0.296,POS
"we just moved from ft white to Ocala!
Stay safe .. & yes, HE has got us all!!🙏🏽",0.302,0.698,0.0,0.7562,POS
🙏🛐🛐🙏 Praying in agreement with you sister. 🙏🛐🛐🙏,0.487,0.513,0.0,0.6908,POS
we are supposed to go to Fort White today from Sarasota. We got over 18 inches of rain here. I'm curious how the Sante fe river is going to hold without flooding the area where we are supposed to go,0.056,0.944,0.0,0.3182,POS
"I’m pretty sure it’s already risen, but the real flooding will be in the next couple of days🤦🏻‍♀️",0.19,0.81,0.0,0.4118,POS
that's what I'm thinking. I bought trip insurance through air bnb and I hope they allow this as a reason. Don't want to sit around a flooded area!,0.186,0.769,0.045,0.5954,POS
Jake from State Farm?,0.0,1.0,0.0,0.0,NEU
"I agree with you in prayer 🙏",0.385,0.615,0.0,0.3612,POS
"Gulfport had it bad, my friends on Boca Ciega lost many vessels, their homes.
And a dear friend who had just helped another friend, drowned
When his sailboat sunk.
The community is hurting.
It was awful on the water.",0.214,0.513,0.273,-0.5106,NEG
"Praying for our coastal people. Cedar Key gets those sustained winds and rain bands with the surge as the eye comes in above them.
We're a close knit Tri-County with many family and friends in Levy, Dixie, and Gilchrist. We're awake everywhere praying, especially for Cedar Key, Suwannee, Horseshoe, and Steinhatchee.",0.147,0.853,0.0,0.7964,POS
Praying too,0.714,0.286,0.0,0.3612,POS
standing with you in prayer….,0.0,1.0,0.0,0.0,NEU
cedar key is under water again from surge,0.0,1.0,0.0,0.0,NEU
"Getting some wind gusts and reported power outages in Lakeland. Nothing like Ian and Irma though, thankfully.
Praying for the Coast and especially Cedar Key. I swear they get knocked with a big one more often than not. 🙁",0.13,0.783,0.087,0.4071,POS
our power was out in the Kathleen area for about 45 minutes and is back on. Definitely nothing intense out there but the gusts have been making me pay attention haha,0.165,0.759,0.076,0.6296,POS
"ours is still out in Highland Fairways, near Kathleen!",0.0,1.0,0.0,0.0,NEU
"I'm by Socrum Loop and still have power right now, thankfully! The windows aren't rattling as bad with these gusts like any of the storms I've been through. My pup is definitely confused though lol.",0.308,0.641,0.051,0.892,POS
"Any information on the flooding in the cove K golf course at Bayshore Drive, Clearwater?",0.0,1.0,0.0,0.0,NEU
"Still going in Lakewood Ranch 😞Hopefully, she stops soon.",0.0,0.833,0.167,-0.1531,NEG
"I have to drive there from Bradenton for work at 7, so scared hope it slows down",0.152,0.669,0.179,-0.1438,NEG
"be safe!",0.761,0.239,0.0,0.4926,POS
"the streets in my LWR community are flooded, good luck and be careful",0.429,0.571,0.0,0.7579,POS
whiich one?,0.0,1.0,0.0,0.0,NEU
Central Park,0.0,1.0,0.0,0.0,NEU
In the Carrollwood/Northdale area and we’ve had more rain from Debby than from the last two hurricanes.,0.0,1.0,0.0,0.0,NEU
Same in Keystone!!!,0.0,1.0,0.0,0.0,NEU
Cypress preserve in our backyard in Northdale,0.0,1.0,0.0,0.0,NEU
"I will never, ever again say, “Meh, it ‘just’ a Tropical Storm”. I’ve lived here 30 years and I haven’t seen that much rain in such a short period of time.
Denis - thank you for all you do. Rule #7",0.067,0.933,0.0,0.3612,POS
"Years ago we had a tropical storm that did as much damage as a hurricane! The ""No Name Storm""!!!",0.0,0.695,0.305,-0.7627,NEG
"March 14, 1993 I believe.",0.0,1.0,0.0,0.0,NEU
absolutely the same here! this one was a serious rain maker!,0.0,0.827,0.173,-0.2225,NEG
we sure made up for such a dry summer last year!,0.224,0.776,0.0,0.3802,POS
Where are you?,0.0,1.0,0.0,0.0,NEU
South Clearwater bordering Largo,0.0,1.0,0.0,0.0,NEU
"I agree. I was expecting much less. This TS shot my nerves.",0.21,0.672,0.118,0.2732,POS
You're a wise woman. Tropical Storms and Cat 1's can cause a LOT of flooding.,0.205,0.795,0.0,0.4767,POS
"Water hasn't come over our seawall yet, but our kids really want to try walking on our dock ramp lol",0.237,0.763,0.0,0.6798,POS
let them use it as a Slip-n-slide,0.0,1.0,0.0,0.0,NEU
"Ohmigerd",0.0,1.0,0.0,0.0,NEU
Still pouring in Parrish & wild wind!,0.0,1.0,0.0,0.0,NEU
I downloaded an app that says we have had 7.11 inches so far. I don’t believe it. It seems so much worse than that,0.0,0.861,0.139,-0.5233,NEG
"same here in Sun City Center.",0.0,1.0,0.0,0.0,NEU
"We have over 12"" in Bradenton.",0.0,1.0,0.0,0.0,NEU
"it’s been intense, hasn’t it ? I thought we would get little breaks. Nope",0.106,0.894,0.0,0.0772,POS
No hurricane is good but a cat one with winds of 80 miles a hour is a whole lot better then a cat 5.,0.238,0.697,0.066,0.6369,POS
"I keep saying, “here we go again” every time I hear the rain hit my house. It just keeps going.🥲",0.0,1.0,0.0,0.0,NEU
"same. The noise for sure shot my nerves.",0.237,0.619,0.144,0.2263,POS
"Thank you for your coverage. Appreciate it.",0.51,0.49,0.0,0.6369,POS
"My parking lot is flooded 🤗✨",0.0,1.0,0.0,0.0,NEU
How is it in St Pete?,0.0,1.0,0.0,0.0,NEU
flooding in parts of St pete,0.0,1.0,0.0,0.0,NEU
"just got another tornado warning. Still raining, still wind gusts. I'm about 5 miles north of Tropicana Field. Take care if DOT says don't drive in this DON'T.",0.105,0.817,0.078,0.2023,POS
"we are good in St Pete but we are on higher ground",0.151,0.849,0.0,0.2382,POS
"The flooding is incredible in some of the pictures in Pinellas, places flooded that I have never seen flooding before since I have moved here in 83. People going out today, check your route to make sure you can even get where you are going, There are abandon cars in the floodwaters blocking roads.",0.04,0.863,0.097,-0.4939,NEG
"no thanks to over building, cementing everything in, nonstop building, etc. where is water supposed to go besides the surge? The ripping up of every inch of land. It's only going to get worse.",0.074,0.791,0.135,-0.34,NEG
yes!,1.0,0.0,0.0,0.4574,POS
"This has been a beast of a storm . I’m glad it didn’t rapidly intensify",0.214,0.786,0.0,0.4588,POS
"Non stop rain and very very windy in Sarasota",0.0,0.784,0.216,-0.296,NEG
"same in Nokomis.",0.0,1.0,0.0,0.0,NEU
"thought I was going to go to work today but, I’m not chancing my car stalling out on flooded roadways or hydroplaning. Going to stay home and enjoy this very windy and rainy day and be safe.",0.184,0.724,0.092,0.7273,POS
"Yes. Heavy rain, lightning, thunder and tornado watch still in Nokomis",0.213,0.787,0.0,0.4019,POS
Sarasota winds blowing! RAIN!!Lightening and distant thunder. Is the inland stream flooding over?,0.0,1.0,0.0,0.0,NEU
"I honestly don’t know. I know that the entrance to my condo is flooded and, all its surrounding streets are as well. I live near the old greyhound racing track and, the airport.",0.154,0.846,0.0,0.6249,POS
"Dennis, why on earth the constant notifications of flash flash flooding for Spring hill last night What are we supposed to do get in our canoes and paddle? Created so much anxiety for situation that nothing could be done in.",0.048,0.905,0.047,0.0056,NEU
it's so you stay IN or take precautions if necessary.,0.0,1.0,0.0,0.0,NEU
for your safety,0.583,0.417,0.0,0.4215,POS
Can't swim in the dark 2 feet of water get real!,0.0,1.0,0.0,0.0,NEU
Thank you Dennis! Really appreciate your updates!,0.549,0.451,0.0,0.725,POS
"Absolutely crazy rain in Bradenton!",0.0,0.573,0.427,-0.4561,NEG
"Yes! It has not let up. As others have said, I don't ever remember this much rain for just a tropical storm. It's windy right now also.",0.111,0.889,0.0,0.4574,POS
"Rain finally letting up, after 24+ hours, here in Sarasota👍",0.0,1.0,0.0,0.0,NEU
it's still pretty windy and still raining in my area of Sarasota,0.225,0.775,0.0,0.4939,POS
"still raining and windy in Port Charlotte but not as bad",0.274,0.726,0.0,0.5824,POS
"everytime I say that it hits again.",0.0,1.0,0.0,0.0,NEU
Just woken up by thunder and lightning here in Sun City Center. So much rain and wind from this. Much more than Idalia.,0.0,1.0,0.0,0.0,NEU
What made it turn? Did it wobble?,0.0,1.0,0.0,0.0,NEU
"yes, it wobbled all over Madeira Beach… While The eye may not have gone over us , right next to the eye went over us🙏4 All.",0.101,0.899,0.0,0.4019,POS
"Raining again here about 5 miles inland from AMI. But I did see where the new ""ponds"" have receded some. I believe we are to get another inch or two of rain today.",0.0,1.0,0.0,0.0,NEU
Anyone in South Tampa/Port Tampa?,0.0,1.0,0.0,0.0,NEU
"davis islands, water is super high and many islanders do not have power",0.245,0.755,0.0,0.5994,POS
bayshore by Inman is flooding - that’s the view looking towards tgh,0.0,1.0,0.0,0.0,NEU
"yup typical Bayshore",0.0,1.0,0.0,0.0,NEU
"Can't sleep",0.0,1.0,0.0,0.0,NEU
"s Tampa Davis Islands made out ok
Bayshore flooded as usual but mostly receded this am when I left 0600 for work",0.078,0.922,0.0,0.1531,POS
"yes. Dry here but I do have a tree down",0.209,0.791,0.0,0.2144,POS
"yup",0.0,1.0,0.0,0.0,NEU
very wet here,0.0,1.0,0.0,0.0,NEU
I am dry,0.0,1.0,0.0,0.0,NEU
Great job Dennis Phillips❤️,0.577,0.423,0.0,0.6249,POS
"How are things in Tallahassee? My daughter is at FSU all alone.",0.0,0.846,0.154,-0.25,NEG
"Johnny is there too🙏🏻",0.0,1.0,0.0,0.0,NEU
Really heavy rain and some wind and lightning in Ocala. Prayers for all and stay safe,0.162,0.838,0.0,0.4404,POS
yes it is windy as can be here in Ocala. Rain hasn't really stopped since about 1 pm yesterday. Praying now that the eye is going into land this mess hurries up and calms down.,0.227,0.703,0.07,0.6713,POS
"John T. is out in Paris right now too, so he'll see things when arriving back !!",0.0,1.0,0.0,0.0,NEU
it’s equally scary in Gainesville. I have horses and I’m very upset WEC didn’t offer us evacuation. This is far worse than Idalia for us.,0.0,0.696,0.304,-0.8479,NEG
are you ok? Are the horses?,0.339,0.661,0.0,0.3736,POS
not sure as they live 15 minutes from me and I can’t get to them til morning. Praying they are okay.,0.188,0.728,0.084,0.3481,POS
"they will be ok... i have horses and they are smarter in this
weather... Better than humans",0.296,0.704,0.0,0.7096,POS
Anyone been or heard about downtown Tampa? Are we flooded or ok to drive in?,0.155,0.845,0.0,0.3736,POS
"Craziest storm I've ever seen. Still pouring in valrico",0.0,0.87,0.13,-0.0516,NEG
"what county is Valicro in?",0.0,1.0,0.0,0.0,NEU
"Hillsborough",0.0,1.0,0.0,0.0,NEU
Currently in the Disney bubble and woke up with rain water inside the room. The wind is so hard it pushed water in.,0.0,0.922,0.078,-0.2183,NEG
"It hasn’t stopped raining here in East Lake since yesterday at 10am. Wow. 😮",0.228,0.659,0.114,0.4404,POS
"any idea how east lake rd is looking- flooding?",0.0,1.0,0.0,0.0,NEU
no. I haven’t been on the road since yesterday around 4-5pm.,0.0,0.804,0.196,-0.296,NEG
I have to get from lakeland to brandon( Bloomingdale) going down 60 for work. How is it over there because the wind sounds awful here?!,0.0,0.875,0.125,-0.5093,NEG
"same as there",0.0,1.0,0.0,0.0,NEU
"Brandon is rain and more rain, not to worry.",0.231,0.769,0.0,0.3412,POS
"Rain bands & thunder still coming through Tampa. I’m in Tampa Heights 5 min north of downtown Tampa off Florida Ave.
No power loss here",0.0,0.824,0.176,-0.5423,NEG
Debby has definitely overstayed her welcome here in Weeki Wachee. Geesh! Move along.,0.353,0.647,0.0,0.7177,POS
she sure has. How are you doing?,0.277,0.723,0.0,0.3182,POS
How is it in Port Richey??,0.0,1.0,0.0,0.0,NEU
The tide is supposed to be about halfway to low tide right now and there’s water in the road at the storm drains so the rest of today will be the possible surge event. Rain has stopped right now but logged almost 15” since yesterday morning. Wind was steady but never got over 42ish. Average was around 30 most of the time.,0.0,0.952,0.048,-0.25,NEG
Anyone on Anna Maria island? How is it there?,0.0,1.0,0.0,0.0,NEU
Thank you,0.714,0.286,0.0,0.3612,POS
"flooded everywhere, still raining and windy",0.0,1.0,0.0,0.0,NEU
How are things in appalachicola?,0.0,1.0,0.0,0.0,NEU
"Anyone in Deltona? How is it there?",0.0,1.0,0.0,0.0,NEU
Our power has been out for 10 hrs here in Dunedin. Its still down pouring rain. Yard is pretty flooded. This is the first time in 4 years we’ve had water close to the front and back doors.,0.082,0.918,0.0,0.4939,POS
"where are you in Dunedin? We are south of downtown, just off of Edgewater. We were without power for 6 hours yesterday and the rain was relentless. Flooding in your area?",0.051,0.949,0.0,0.1431,POS
we are off San Salvador backing up towards hammock park,0.109,0.891,0.0,0.0258,NEU
still no power or eta,0.0,0.645,0.355,-0.296,NEG
"So sorry to hear no ETA 😩",0.0,0.513,0.487,-0.4201,NEG
same here 😓,0.0,1.0,0.0,0.0,NEU
Why do these storms seem to come at night??,0.0,1.0,0.0,0.0,NEU
"It does seems this way doesn’t it? I’ve been through every South Florida Hurricane since Andrew. Charley was the only one I can remember hitting in broad daylight.
Update; I think Wilma hit at daybreak.",0.0,1.0,0.0,0.0,NEU
Jean hit during the day too but I agree most of the time it happens in the night and I hate that part.,0.119,0.696,0.185,-0.4215,NEG
"I remember Jeanne well. I’m in the Southern part of the state and some of it hit us in the early morning hours when it was still dark. I drove home at daybreak in the eye of the storm. One of the creepiest experiences ever. The wind was calm and I could see blue sky directly above, with the swirling clouds in the distance. My drive home was 13 miles and no cops were on the road. Needless to say, I drove triple digit speeds to beat the second half. About 20 minutes after I got home, it started up again.",0.044,0.934,0.022,0.296,POS
"I grew up in Ohio, I thought the same thing sitting in the basement at night for tornado warnings. It sure messes with the anxiety 😬. Been here since the mid 80’s, this storm has been crazy.",0.058,0.783,0.159,-0.4588,NEG
I said the same thing.,0.0,1.0,0.0,0.0,NEU
i want to know too!,0.347,0.653,0.0,0.1511,POS
"Thank you, as always. Unfortunately, my dog never heard of rule #7 and hasn’t eaten and refuses to go outside.",0.109,0.786,0.105,0.0258,NEU
I always keep wee wee pads in the bathroom because my pup is so scared of storms he won’t go outside either. He is hiding under the blanket now.,0.0,0.814,0.186,-0.7133,NEG
"the last hurricane I had a baby pool in dirt & sod on my back porch and neither of them would even go in it. She is just too nervous and senses so much. The other one is 10 and he has been great and just went outside and I think he went potty for about three minutes straight, but she will not go out.",0.062,0.887,0.051,0.1901,POS
that’s sounds like my pups. I have one who is 15 and he is not phased by the storms because he can’t hear them I believe and he will go outside if I let him but my 5 year old pup is so scared. He always knows when it’s going to storm before I hear it.,0.031,0.877,0.092,-0.6555,NEG
Currently in the Disney bubble and woke up with rain water inside the room. The wind is so hard it pushed water in.,0.0,0.922,0.078,-0.2183,NEG
I was just getting ready to order a foldable baby/pet pool for next time. My pup isn’t really afraid- I hope she will use it. She has never used pads.,0.185,0.815,0.0,0.6887,POS
"oh no poor baby",0.0,0.274,0.726,-0.6486,NEG
thank goodness we had a successful potty break for both in between bands! Whew!,0.497,0.503,0.0,0.8715,POS
"Thanks for letting us know, I’m sure you’re getting exhausted with this one Denis❗️⛈️ and here we go again today☔️💦 😝 this is the most rain I’ve seen in one storm in 22 years‼️ ",0.138,0.796,0.066,0.4019,POS
How are people expected to get to work this morning? We’re still in the middle of this storm and warnings. Too dangerous to be on the roads.,0.0,0.825,0.175,-0.6486,NEG
yep crazy. My bf delivers things across florida. Thinking of every delivery driver out there today. Be safe y'all,0.217,0.681,0.102,0.4019,POS
"I wonder the same thing. Hillsborough county had teachers drive to work today even without students. Multiple other counties closed.
It’s terrible for so many!",0.0,0.871,0.129,-0.5255,NEG
I agree and am one of those people. Have to drive at 7 and I’m scared,0.144,0.69,0.167,-0.1027,NEG
my hubby just left too he delivers CO2 I’m so worried about him driving right now 🙏🙏,0.0,0.848,0.152,-0.4341,NEG
my husbands a driver and is supposed to head to Jax. I forbid him to go!!,0.0,0.818,0.182,-0.4374,NEG
😞 Sorry.,0.0,0.0,1.0,-0.0772,NEG
so don’t go in.,0.0,1.0,0.0,0.0,NEU
I think they will understand. Frankly if they don’t you are working in the wrong place.,0.0,0.819,0.181,-0.4767,NEG
"I’m here at work because I’m a team player. 🤩
Original post was really intended to express concern for others (like my son) who have long commutes across bridges or cars that are low to the ground because of the flooding. Stay safe all!",0.118,0.837,0.045,0.5255,POS
Go away Debby. You’re not welcome here anymore.,0.0,0.738,0.262,-0.357,NEG
Eleventy billion inches of rain at my house.. East Manatee,0.0,1.0,0.0,0.0,NEU
that’s a lot! 😂 Hope you are doing well.,0.514,0.486,0.0,0.6476,POS
for realz!! Hope your well too 🥰,0.583,0.417,0.0,0.6792,POS
"A bit waterlogged for sure, but all good otherwise.",0.478,0.522,0.0,0.6705,POS
This storm was way more than I expected. These winds and rain are pretty intense and they have been going on for hours on end. Almost scared to see what it will look like in daylight hours. 😱,0.168,0.769,0.063,0.5256,POS
I really dislike when they come through a night. This has been a long storm though so it was day and night.,0.0,0.862,0.138,-0.4391,NEG
agree. It’s been horrific here in treasure island and continues. this storm is relentless,0.291,0.493,0.217,-0.128,NEG
"I have a small lake in my yard",0.0,1.0,0.0,0.0,NEU
"I feel the same ! It’s been intense .",0.242,0.758,0.0,0.1511,POS
So far 2 potted trees down and two panels off the pool cage at 2:30 am. S Bradenton.,0.0,1.0,0.0,0.0,NEU
same here in New Port Richey,0.0,1.0,0.0,0.0,NEU
"In Sarasota this makes Ian look like a stroll in the park on a Sunday afternoon. I’m shocked at how relentless this “Tropical Storm” is. The lightning, intense rain, tornado warnings, flash flooding and insane wind is nothing I’ve experienced in my 20 years of living here. The dirty side of this storm is NO JOKE! How is this not a category 2 or 3??? I’m exhausted too and all I did was stay home 🤷‍♀️",0.093,0.715,0.192,-0.8567,NEG
"agreed. Felt just as bad as Ian for us in St Petersburg. Still going, too",0.113,0.699,0.188,-0.34,NEG
I so agree. Very stressful to me. And STILL going. I let water out of my pool 3x.,0.135,0.678,0.187,-0.2648,NEG
"Hurricane Categories
Category 1 Winds 74 to 95 mph
Category 2 Winds 96 to 110 mph.
Category 3 Winds 111 to 130 mph
Category 4Winds 131 to 155 mph
Category 5 Winds greater than 155 mph",0.075,0.925,0.0,0.3612,POS
"rainfall has no factor in determining category, it is windspeed",0.0,0.804,0.196,-0.296,NEG
"I'm in Englewood and still getting rain, wind, and lightening. This is one heck of a tropical storm.",0.0,1.0,0.0,0.0,NEU
it’s a hurricane now.,0.0,1.0,0.0,0.0,NEU
yes I am surprised at all the comments about how bad it is seeing as it's not expected to go past a cat one and it's not yet made landfall. Take care out there!,0.204,0.707,0.088,0.5562,POS
"It’s a hurricane now.",0.0,1.0,0.0,0.0,NEU
in Sarasota too husband left to work in his truck at 3am said he almost didn’t make it and had to rescue a lady stuck in flooding water also trying to make it to work. This is the worst I’ve ever seen been here since 2017,0.064,0.817,0.119,-0.4215,NEG
I just LOST. my tree to the storm. Northdale. County said we are THE 12th.,0.0,0.811,0.189,-0.4648,NEG
Whew... amazing the crazy bands of wind and rain were still getting way down in Charlotte County!,0.19,0.698,0.112,0.4003,POS
Anyone know or think any flights will be flying into Tampa airport this evening?,0.0,1.0,0.0,0.0,NEU
My daughter is in largo with her boyfriend .What is the best time for her to come home across the Gandy we are in plant city ?,0.144,0.856,0.0,0.6369,POS
24 hours ago.,0.0,1.0,0.0,0.0,NEU
It was BAD ! I have to say the worse I’ve seen since moving here in 2010 . That wind and rain 😳. Pete and I hardly slept . ✌️❤️🇺🇸,0.0,0.751,0.249,-0.8236,NEG
"How is it in temple terrace
I got a dr appt there this morning",0.0,1.0,0.0,0.0,NEU
"it's fine. Raining, but no other problems. You should be able to keep your doctor appointment with no problem.",0.05,0.498,0.452,-0.9062,NEG
"i heard its on a path towards Greenville SC with lots of rain",0.0,1.0,0.0,0.0,NEU
Looks like Suwannee is taking the hit.,0.294,0.706,0.0,0.3612,POS
"The western edge of St Pete (1 block from the inland water) has intermittent wind gusts. Not raining at the moment. We have power, thankfully.",0.098,0.801,0.101,-0.0258,NEU
Any reports of storm surge in Treasure Island?,0.239,0.761,0.0,0.296,POS
"I'm in Jungle Terrace on the other side of the inland water.",0.0,1.0,0.0,0.0,NEU
