Amazing how models will agree when there's actually a center to track!  This is a Big Bend storm. Our coastal areas will get pretty gusty tomorrow with much less rain and wind inland. I'll give updated thoughts after the 11pm NHC update.,Pos,Neu,Neg,Compound,Overall Sentiment
Thanks as always for the updates. I hope everyone in Big Bend area is safe.,0.442,0.558,0.0,0.8271,POS
"in other news, I like your surname!",0.358,0.642,0.0,0.4199,POS
I’m predicting not much rain tomorrow as we head to church,0.0,1.0,0.0,0.0,NEU
"Only a little over 11 months since Idalia tore up Cedar Key and much of the Big Bend area. I hope they don't get a big storm surge and severe flooding, they're still rebuilding from last year.",0.077,0.853,0.069,0.0772,POS
I know they are still rebuilding from last August. I have been up there. I really hope this is not bad for them.,0.251,0.749,0.0,0.7221,POS
praying for Cedar Key! Love it there!,0.593,0.407,0.0,0.8065,POS
we were just there as my parent's have a place right on the water there. Fingers crossed they get through unscathed.,0.0,1.0,0.0,0.0,NEU
praying for Cedar Key! Love it there! Hope your parents place will be ok!,0.559,0.441,0.0,0.9131,POS
I think this one will be a huge rainmaker. Guess it saw what Debby did and is going to”have ld my beer”.,0.108,0.892,0.0,0.3182,POS
we just finished our house last month here in Yankeetown 😞,0.0,1.0,0.0,0.0,NEU
So it's missing Tampa completely now?,0.0,0.669,0.331,-0.3566,NEG
all of Florida will feel effects from this storm. We are on the dirty side of the storm.,0.0,0.854,0.146,-0.4404,NEG
"it Always was, but there’s still wind and rain to deal with…",0.0,1.0,0.0,0.0,NEU
you are under a tropical storm warning. Time to learn the basics.,0.0,0.806,0.194,-0.34,NEG
Time to learn to just scroll on by and not condescend.,0.0,1.0,0.0,0.0,NEU
just trying to help!,0.499,0.501,0.0,0.4574,POS
"..it’s not always what you say..but how you say it.
Peace.",0.259,0.741,0.0,0.5423,POS
"Good! So everyone west of Panama City can relax! We’re good and that’s that in a 🐚 shell. No more hoping, wishing, I’ve been, I’m from, this and that, etc. it’s going to Georgia/ Carolina, Lmao.",0.387,0.567,0.046,0.9456,POS
Love that drunken blue model track.,0.457,0.543,0.0,0.6369,POS
"Good morning Dennis. Thank you for all you do keeping us aware of the weather at all times. Working diligently to let us know when storms will be an issue. I am wondering if airports will close because of Debby? PIE and TPA? I remember storm last year in Sept. 2023 closed PIE, TPA and Orlando also.",0.098,0.902,0.0,0.6966,POS
"I used to live norfolk virginia and this will cause
issues there.",0.0,1.0,0.0,0.0,NEU
Do we know an approximate distance between the storm and the coast Denis? Approx.,0.0,1.0,0.0,0.0,NEU
about 100 miles west of Pinellas if current track holds,0.0,1.0,0.0,0.0,NEU
thank you. We are in Pasco. You stay safe.,0.435,0.565,0.0,0.6597,POS
"me too , thanks for asking that question",0.326,0.674,0.0,0.4404,POS
"I thought I heard Dennis say tomorrow we were going to have like a typical afternoon thunderstorm, but it’s gonna last for 12 hours with a lot of rain but then did he just say that we’re going to get less rain that was only like an hour ago",0.104,0.896,0.0,0.6124,POS
he saying inland will have much less wind and rain than those of us on the coast. That’s been said all along.,0.0,1.0,0.0,0.0,NEU
no he said that the coastal areas will have much more gusty winds with less rain is how I read it and then it’s something with 2nd inland?,0.0,0.922,0.078,-0.296,NEG
"he says “less rain and wind inland”. The 2 is a typo. Two separate things in one sentence. Maybe he should have made it two sentences, but it is grammatically correct.",0.077,0.923,0.0,0.0644,POS
Well watch the 11PM update now.,0.296,0.704,0.0,0.2732,POS
"it's Denis",0.0,1.0,0.0,0.0,NEU
Yea and? That's why he updates as much as he does because predictions change with new information.,0.0,1.0,0.0,0.0,NEU
the storm was still changing- this is the most current update,0.0,1.0,0.0,0.0,NEU
I’m not calling Dennis a liar or anything. I’m just saying this was like less than an hour ago. I heard this he had a 90 second video.,0.184,0.816,0.0,0.6372,POS
You misunderstood him.,0.0,0.455,0.545,-0.34,NEG
"Coconut Creek, Florida",0.0,1.0,0.0,0.0,NEU
"It’s okay now. It went directly from still to storming and the sky looked “different.”",0.119,0.881,0.0,0.2263,POS
That sounds good for Tampa.,0.42,0.58,0.0,0.4404,POS
We are just trying to recover from last years 😔,0.0,1.0,0.0,0.0,NEU
We had no rain. I was hopeful!,0.367,0.408,0.225,0.3382,POS
"we have had tons here in Cortez",0.0,1.0,0.0,0.0,NEU
lucky,1.0,0.0,0.0,0.4215,POS
"Tons of rain n Polk in frostproof so far",0.0,1.0,0.0,0.0,NEU
Thank you for the continual updates! Take care of yourself and try to get some rest!!,0.32,0.68,0.0,0.7633,POS
"Hey Denis! I’m in Sarasota and Sarasota County Government just issued a statement saying we’ll get 6-12 inches west of 75, with 18 inches in some locations, and cited the NWS as their updated source. Thoughts? This surprised me and I wanted to get your feedback. Thank you! 😍",0.102,0.898,0.0,0.6103,POS
"Go to the NOAA website. www.weather.gov and do a search for your city and at the bottom of the forecast, look at the forecast details.",0.0,1.0,0.0,0.0,NEU
"Well, that if that area has the sandy color on the drought map it won't for much longer. Hope everyone stays safe.",0.294,0.706,0.0,0.7845,POS
Thanks for your continued updates to keep us informed! We appreciate your dedication.,0.349,0.651,0.0,0.7088,POS
"Oh no, almost the same track as Hurricane Idalia last year.",0.0,0.82,0.18,-0.296,NEG
"That's what I was thinking, however I can't remember where Idalia went after making landfall on Horseshoe Beach. Do you remember? I live in Volusia county and I don't remember dealing with any outer rain bands or the possibility of spin up tornadoes or being told we are on the right side of the storm with Idalia at ALL. I'm on the East Coast of Florida not far from Daytona Beach.",0.0,1.0,0.0,0.0,NEU
Thanks for all you do to keep us informed!!! Hope you're enjoying the Little Debbie's,0.456,0.544,0.0,0.8772,POS
Love the oddball track with the loop de loop and sends over us in Pensacola.,0.231,0.769,0.0,0.6369,POS
So we are safe to eat our lil Debbie snacks now! Yay!,0.417,0.583,0.0,0.7991,POS
comment of the day,0.0,1.0,0.0,0.0,NEU
"I see that one headed to Mississippi!",0.0,1.0,0.0,0.0,NEU
What is that black blob next to Pinellas?,0.0,1.0,0.0,0.0,NEU
It's all the 24's because that's where all the models are in tight agreement on where it will be in 24 hours.,0.132,0.868,0.0,0.4939,POS
ty,1.0,0.0,0.0,0.3818,POS
that part,0.0,1.0,0.0,0.0,NEU
Keep us up to date on the Tally area please!,0.224,0.776,0.0,0.3802,POS
looks like we’re screwed… again,0.385,0.615,0.0,0.3612,POS
I thinks it's looking that way,0.0,1.0,0.0,0.0,NEU
My very pregnant daughter and her husband just moved yesterday to Beaufort s.c. he's a marine. Is this storm going right to them?,0.0,1.0,0.0,0.0,NEU
More to west again,0.0,1.0,0.0,0.0,NEU
the latest hurricane center cone moved east,0.0,1.0,0.0,0.0,NEU
Very little rain in Pinellas park,0.0,1.0,0.0,0.0,NEU
it wont be close to us until tomorrow.,0.0,1.0,0.0,0.0,NEU
maybe tomorrow idk,0.0,0.588,0.412,-0.1027,NEG
We gonna get less rain than predicted now,0.0,1.0,0.0,0.0,NEU
"Thank you, Dennis for the updates.",0.333,0.667,0.0,0.3612,POS
Thank you for the update,0.385,0.615,0.0,0.3612,POS
"any thoughts on what Gainesville, FL can expect?",0.0,1.0,0.0,0.0,NEU
yes please. If you go to AccuWeather there is a Debby tracker,0.357,0.643,0.0,0.6124,POS
Thanks for the update Denis!,0.444,0.556,0.0,0.4926,POS
I was hoping for more than wind.,0.359,0.641,0.0,0.4215,POS
you like death and property destruction?,0.191,0.229,0.58,-0.7269,NEG
"I'm not a Florida native, and I'm new to Pasco county, up from Lee county.
I'm not sure if Pasco county, more specifically Hudson Florida is part of the Big Bend area.
I live one mile off of U.S. 19, on the side furthest from the water.
Is that a dangerous area in terms of flooding and wind?",0.0,0.913,0.087,-0.6202,NEG
"You are not in the Big Bend area. It is way north of you, near the Panhandle. Hope this helps.",0.247,0.753,0.0,0.7096,POS
So appreciated! 🥰,0.795,0.205,0.0,0.5974,POS
you should be fine 😊,0.375,0.625,0.0,0.2023,POS
"Hudson is not part of Big Bend. Big Bend is essentially where the Panhandle and the peninsula meet, near Tallahassee area.",0.0,1.0,0.0,0.0,NEU
Thank you so much! 🥰,0.482,0.518,0.0,0.4199,POS
"if you look at the map the big bend is where you can actually see the “bend” of the state. Kinda like where the Gulf/land turns west along our coast into panhandle. You should be ok from storm surge from gulf but if you have a lake, canal think about that. Google for local flood zone maps.",0.056,0.944,0.0,0.2967,POS
"Good to know, thank you! 🥰",0.655,0.345,0.0,0.69,POS
Central Florida we have dodged another bullet!,0.0,1.0,0.0,0.0,NEU
Sure hope so.,0.839,0.161,0.0,0.6369,POS
Thank you for all you do! 🙏🏻❤️💦☔️,0.318,0.682,0.0,0.4199,POS
Thanks for keeping us calmly informed. Our family only follows your forecasts. Rule #7 rules!😊,0.297,0.703,0.0,0.6696,POS
"I just got an alert for flooding in Palm Beach County.",0.196,0.804,0.0,0.296,POS
What are the black squiggly things?,0.0,1.0,0.0,0.0,NEU
It like like a bump to the east,0.5,0.5,0.0,0.6124,POS
Little Debby party here 🥰,0.447,0.553,0.0,0.3446,POS
the best! 😂,0.818,0.182,0.0,0.6696,POS
Time to start eating those snacks 😋,0.0,1.0,0.0,0.0,NEU
Never seen a hurricane model like hwrf be so drunk lol,0.355,0.446,0.199,0.3532,POS
Thank you!,0.736,0.264,0.0,0.4199,POS
Stay safe My family and friends,0.6,0.4,0.0,0.7184,POS
"Thank you Denis Phillips for always keeping us updated",0.238,0.762,0.0,0.3612,POS
Be safe!,0.761,0.239,0.0,0.4926,POS
ugh! Wish it would gtfo! 🤣,0.297,0.33,0.373,-0.1739,NEG
you should have come further south to our house. 😎,0.0,1.0,0.0,0.0,NEU
be careful what you wish for!,0.534,0.466,0.0,0.5562,POS
honky tonk beach style !,0.0,1.0,0.0,0.0,NEU
interesting! I’m on alert !!! Would like some rain but not floods !!😳,0.389,0.611,0.0,0.6562,POS
"twinsies, I was literally reading this post",0.0,1.0,0.0,0.0,NEU
Prayers for us all in the path of this storm!🙏🙏🙏,0.0,1.0,0.0,0.0,NEU
Thank you Denis.,0.556,0.444,0.0,0.3612,POS
Thanks Denis Phillips for the updates!,0.39,0.61,0.0,0.4926,POS
Thank you Denis.,0.556,0.444,0.0,0.3612,POS
Thank you,0.714,0.286,0.0,0.3612,POS
Thanks!,1.0,0.0,0.0,0.4926,POS
